A1: Fresno Daily Warehouse Report
A2: v. 2.10 | B2: Thurs. | C2: Fri. | D2: Sat. | E2: Sun | F2: Mon. | G2: Tue | H2: Wed | I2: Thu | J2: Fri | K2: Sat | L2: Sun | M2: Mon | N2: Tue | O2: Wed | P2: Thu | Q2: Fri | R2: Sat | S2: Sun | T2: Mon | U2: Tue | V2: Wed | W2: Thu | X2: Fri | Y2: Sat | Z2: Sun | AA2: Mon | AB2: Tue | AC2: Wed | AD2: Thu | AE2: Fri | AF2: Sat | AG2: Sun | AH2: Mon | AI2: Tue | AJ2: Wed | AK2: Thu | AL2: Fri | AM2: Sat | AN2: Sun | AO2: Mon | AP2: Sat | AQ2: Sun | AR2: Mon | AS2: Tue | AT2: Wed | AU2: Thu | AV2: Fri | AW2: Sat | AX2: Sun | AY2: Mon | AZ2: Tue | BA2: Wed | BB2: Thu | BC2: Fri | BD2: Sat | BE2: Sun | BF2: Mon | BG2: Tue | BH2: Wed | BI2: Thu | BJ2: Fri | BK2: Sat | BL2: Sun | BM2: Mon | BN2: Tue | BO2: Wed | BP2: Thu | BQ2: Fri | BR2: Sat | BS2: Sun | BT2: Mon | BU2: Tue | BV2: Wed | BW2: Thu | BX2: Fri | BY2: Sat | BZ2: Sun | CA2: Mon | CB2: Tue | CC2: Wed | CD2: Thu | CE2: Fri | CF2: Sat | CG2: Sun | CH2: Mon | CI2: Tue | CJ2: Wed | CK2: Thu | CL2: Fri | CM2: Sat | CN2: Sun | CO2: Mon | CP2: Tue | CQ2: Wed | CR2: Thu | CS2: Fri | CT2: Sat | CU2: Sun | CV2: Mon | CW2: Tue | CX2: Wed | CY2: Thu | CZ2: Fri | DA2: Sat | DB2: Sun | DC2: Mon | DD2: Tue | DE2: Wed | DF2: Thu | DG2: Fri | DH2: Sat | DI2: Sun | DJ2: Mon | DK2: Tue | DL2: Wed | DM2: Thu | DN2: Fri | DO2: Sat | DP2: Sun | DQ2: Mon | DR2: Tue | DS2: Wed | DT2: Thu | DU2: Fri | DV2: Sat | DW2: Sun | DX2: Mon | DY2: Tue | DZ2: Wed | EA2: Thu | EB2: Fri | EC2: Sat | ED2: Sun | EE2: Mon | EF2: Tue | EG2: Wed | EH2: Thu | EI2: Fri | EJ2: Sat | EK2: Sun | EL2: Mon | EM2: Tue | EN2: Wed | EO2: Thu
B3: 37091 | C3: 37092 | D3: 37093 | E3: 37094 | F3: 37095 | G3: 37096 | H3: 37097 | I3: 37098 | J3: 37099 | K3: 37100 | L3: 37101 | M3: 37102 | N3: 37103 | O3: 37104 | P3: 37105 | Q3: 37106 | R3: 37107 | S3: 37108 | T3: 37109 | U3: 37110 | V3: 37111 | W3: 37112 | X3: 37113 | Y3: 37114 | Z3: 37115 | AA3: 37116 | AB3: 37117 | AC3: 37118 | AD3: 37119 | AE3: 37120 | AF3: 37121 | AG3: 37122 | AH3: 37123 | AI3: 37124 | AJ3: 37125 | AK3: 37126 | AL3: 37127 | AM3: 37128 | AN3: 37129 | AO3: 37130 | AP3: 37156 | AQ3: 37157 | AR3: 37158 | AS3: 37159 | AT3: 37160 | AU3: 37161 | AV3: 37162 | AW3: 37163 | AX3: 37164 | AY3: 37165 | AZ3: 37166 | BA3: 37167 | BB3: 37168 | BC3: 37169 | BD3: 37170 | BE3: 37171 | BF3: 37172 | BG3: 37173 | BH3: 37174 | BI3: 37175 | BJ3: 37176 | BK3: 37177 | BL3: 37178 | BM3: 37179 | BN3: 37180 | BO3: 37181 | BP3: 37182 | BQ3: 37183 | BR3: 37184 | BS3: 37185 | BT3: 37186 | BU3: 37187 | BV3: 37188 | BW3: 37189 | BX3: 37190 | BY3: 37191 | BZ3: 37192 | CA3: 37193 | CB3: 37194 | CC3: 37195 | CD3: 37196 | CE3: 37197 | CF3: 37198 | CG3: 37199 | CH3: 37200 | CI3: 37201 | CJ3: 37202 | CK3: 37203 | CL3: 37204 | CM3: 37205 | CN3: 37206 | CO3: 37207 | CP3: 37208 | CQ3: 37209 | CR3: 37210 | CS3: 37211 | CT3: 37212 | CU3: 37213 | CV3: 37214 | CW3: 37215 | CX3: 37216 | CY3: 37217 | CZ3: 37218 | DA3: 37219 | DB3: 37220 | DC3: 37221 | DD3: 37222 | DE3: 37223 | DF3: 37224 | DG3: 37225 | DH3: 37226 | DI3: 37227 | DJ3: 37228 | DK3: 37229 | DL3: 37230 | DM3: 37231 | DN3: 37232 | DO3: 37233 | DP3: 37234 | DQ3: 37235 | DR3: 37236 | DS3: 37237 | DT3: 37238 | DU3: 37239 | DV3: 37240 | DW3: 37241 | DX3: 37242 | DY3: 37243 | DZ3: 37244 | EA3: 37245 | EB3: 37246 | EC3: 37247 | ED3: 37248 | EE3: 37249 | EF3: 37250 | EG3: 37251 | EH3: 37252 | EI3: 37253 | EJ3: 37254 | EK3: 37255 | EL3: 37256 | EM3: 37257 | EN3: 37258 | EO3: 37259
A4: WHmen Hours (not WC) | B4: =8.75+8+7.98+8.68 -> 33.41 | C4: =8.5+8.2+7.2+7.7 -> 31.60 | D4: =8.58+6.68+8.4+8.43 -> 32.09 | E4: 0.00 | F4: =8.67+9.5+9.5+8 -> 35.67 | G4: 40.87 | H4: 43.03 | I4: 44.42 | J4: 48.82 | K4: 30.42 | L4: 13.00 | M4: 51.88 | N4: 49.03 | O4: 56.80 | P4: 45.72 | Q4: 47.65 | R4: 41.00 | S4: 18.00 | T4: 42.48 | U4: 42.58 | V4: 40.20 | W4: 37.67 | X4: 38.13 | Y4: 35.87 | Z4: 0.00 | AA4: 35.67 | AB4: 39.42 | AC4: 45.80 | AD4: 50.07 | AE4: 33.95 | AF4: 31.72 | AG4: 0.00 | AH4: 28.55 | AI4: 42.32 | AJ4: 34.55 | AK4: 36.63 | AL4: 40.98 | AM4: 36.97 | AN4: 22.40 | AO4: 38.93 | AP4: 31.18 | AQ4: 24.80 | AR4: 32.63 | AS4: 25.30 | AT4: 24.75 | AU4: 34.33 | AV4: 34.17 | AW4: 24.75 | AX4: 18.50 | AY4: 29.03 | AZ4: 28.75 | BA4: 36.68 | BB4: 36.05 | BC4: 38.00 | BD4: 15.50 | BE4: 15.50 | BF4: 15.50 | BG4: 15.50 | BH4: 15.50 | BI4: 15.50 | BJ4: 15.50 | BK4: 18.00 | BL4: 14.00 | BM4: 26.00 | BN4: 46.67 | BO4: 42.25 | BP4: 38.50 | BQ4: 28.25 | BR4: 7.00 | BS4: 19.42 | BT4: 31.05 | BU4: 38.50 | BV4: 35.50 | BW4: 26.58 | BX4: 29.02 | BY4: 0.00 | BZ4: 0.00 | CA4: 16.58 | CB4: 18.25 | CC4: 19.17 | CD4: 16.00 | CE4: 19.00 | CF4: 7.00 | CG4: 0.00 | CH4: 15.25 | CI4: 16.00 | CJ4: 24.25 | CK4: 24.67 | CL4: 24.58 | CM4: 0.00 | CN4: 0.00 | CO4: 24.25 | CP4: 25.75 | CQ4: 25.00 | CR4: 24.50 | CS4: 29.00 | CT4: 16.00 | CU4: 15.00 | CV4: 24.50 | CW4: 37.50 | CX4: 35.50 | CY4: 0.00 | CZ4: 22.00 | DA4: 21.00 | DB4: 13.00 | DC4: 37.67 | DD4: 36.75 | DE4: 37.00 | DF4: 24.83 | DG4: 27.00 | DH4: 16.00 | DI4: 17.00 | DJ4: 25.00 | DK4: 25.20 | DL4: 30.50 | DM4: 17.00 | DN4: 18.17 | DO4: 12.00 | DP4: 13.00 | DQ4: 26.00 | DR4: 23.17 | DS4: 24.00 | DT4: 17.75 | DU4: 15.50 | DV4: 17.00 | DW4: 13.00 | DX4: 24.00 | DY4: 24.00 | DZ4: 24.00 | EA4: 16.00 | EB4: 16.00 | EC4: 14.00 | ED4: 16.00 | EE4: 0.00 | EF4: 0.00 | EG4: 26.25 | EH4: 27.50 | EI4: 16.00
A5: WH Hours on WC[3] | BK5: 0.00 | BL5: 0.00 | BM5: 0.00 | BN5: 0.00 | BO5: 8.00 | BP5: 8.00 | BQ5: 8.00 | BR5: 0.00 | BS5: 0.00 | BT5: 14.50 | BU5: 11.00 | BV5: 16.00 | BW5: 7.00 | BX5: 8.00 | BY5: 0.00 | BZ5: 0.00 | CA5: 8.00 | CB5: 6.50 | CC5: 8.00 | CD5: 8.00 | CE5: 8.00 | CF5: 0.00 | CG5: 0.00 | CH5: 8.00 | CI5: 6.25 | CJ5: 8.00 | CK5: 8.00 | CL5: 0.00 | CM5: 0.00 | CN5: 0.00 | CO5: 8.00 | CP5: 8.00 | CQ5: 8.00 | CR5: 8.00 | CS5: 8.00 | CT5: 0.00 | CU5: 0.00 | CV5: 0.00 | CW5: 0.00 | CX5: 0.00 | CY5: 0.00 | CZ5: 0.00 | DA5: 0.00 | DB5: 0.00 | DC5: 0.00 | DD5: 0.00 | DE5: 0.00 | DF5: 0.00 | DG5: 0.00 | DH5: 0.00 | DI5: 0.00 | DJ5: 8.00 | DK5: 8.75 | DL5: 0.00 | DM5: 8.75 | DN5: 8.00 | DO5: 0.00 | DP5: 0.00 | DQ5: 8.33 | DR5: 8.25 | DS5: 8.17 | DT5: 8.00 | DU5: 8.00 | DV5: 0.00 | DW5: 0.00 | DX5: 8.00 | DY5: 8.00 | DZ5: 8.50 | EA5: 9.00 | EB5: 8.00 | EC5: 0.00 | ED5: 0.00 | EE5: 0.00 | EF5: 0.00 | EG5: 8.25 | EH5: 9.00 | EI5: 8.00
A6: Outside Labor Hours | BK6: 0.00 | BL6: 0.00 | BM6: 12.00 | BN6: 13.00 | BO6: 16.00 | BP6: 16.00 | BQ6: 24.00 | BR6: 0.00 | BS6: 0.00 | BT6: 18.00 | BU6: 0.00 | BV6: 16.00 | BW6: 12.00 | BX6: 0.00 | BY6: 0.00 | BZ6: 0.00 | CA6: 0.00 | CB6: 20.50 | CC6: 8.00 | CD6: 20.00 | CE6: 22.40 | CF6: 0.00 | CG6: 0.00 | CH6: 14.00 | CI6: 9.00 | CJ6: 8.00 | CK6: 16.00 | CL6: 15.00 | CM6: 0.00 | CN6: 0.00 | CO6: 15.00 | CP6: 0.00 | CQ6: 0.00 | CR6: 16.00 | CS6: 15.00 | CT6: 0.00 | CU6: 0.00 | CV6: 16.00 | CW6: 0.00 | CX6: 0.00 | CY6: 0.00 | CZ6: 0.00 | DA6: 0.00 | DB6: 0.00 | DC6: 0.00 | DD6: 0.00 | DE6: 18.00 | DF6: 16.00 | DG6: 0.00 | DH6: 0.00 | DI6: 0.00 | DJ6: 16.00 | DK6: 16.00 | DL6: 32.00 | DM6: 20.00 | DN6: 4.00 | DO6: 0.00 | DP6: 0.00 | DQ6: 18.00 | DR6: 16.00 | DS6: 16.00 | DT6: 18.00 | DU6: 0.00 | DV6: 0.00 | DW6: 0.00 | DX6: 0.00 | DY6: 0.00 | DZ6: 0.00 | EA6: 0.00 | EB6: 0.00 | EC6: 0.00 | ED6: 0.00 | EE6: 0.00 | EF6: 0.00 | EG6: 0.00 | EH6: 0.00 | EI6: 0.00
A7: Driver Hours in WH | D7: 0.00 | E7: 0.00 | F7: =(110+225)/60 -> 5.583333333333333 | G7: =39/60 -> 00.65 | H7: =31/60 -> 0.51666666666666672 | I7: 0.00 | J7: =(85+75)/60 -> 2.6666666666666665 | K7: =(75+45)/60 -> 2.00 | L7: 2.75 | M7: =165/60 -> 2.75 | N7: 0.00 | O7: =40/60 -> 0.66666666666666663 | P7: 0.00 | Q7: 0.00 | R7: =(600+78+90+75+65)/60 -> 15.133333333333333 | S7: 0.00 | T7: =(480+105)/60 -> 9.75 | U7: =(45+35+240)/60 -> 5.333333333333333 | V7: =(50+118)/60 -> 2.80 | W7: =(100+70)/60 -> 2.8333333333333335 | X7: =465/60 -> 7.75 | Y7: 0.00 | Z7: 0.00 | AA7: =465/60 -> 7.75 | AB7: =(330+269)/60 -> 9.9833333333333325 | AC7: =720/60 -> 12.00 | AD7: =(32+600+110)/60 -> 12.366666666666667 | AE7: =0 -> 0.00 | AF7: 0.00 | AG7: 0.00 | AH7: 0.00 | AI7: =630/60 -> 10.50 | AJ7: 0.00 | AK7: =570/60 -> 9.50 | AL7: =780/60 -> 13.00 | AP7: 0.00 | AQ7: 0.00 | AR7: 0.00 | AS7: 0.00 | AT7: 0.00 | AU7: 0.00 | AV7: 0.00 | AW7: 0.00 | AX7: 0.00 | AY7: 0.00 | AZ7: 1.20 | BA7: 1.50 | BB7: 0.00 | BC7: 2.20 | BD7: 11.70 | BE7: 8.80 | BF7: 11.70 | BG7: 10.80 | BH7: 10.80 | BI7: 10.80 | BJ7: 0.00 | BK7: 00.9 | BL7: 4.00 | BM7: 8.00 | BN7: 0.00 | BO7: 0.00 | BP7: 0.00 | BQ7: 0.00 | BR7: 3.00 | BS7: 4.20 | BT7: 24.00 | BU7: 6.50 | BV7: 17.90 | BW7: 14.90 | BX7: 20.30 | BY7: 2.20 | BZ7: 0.00 | CA7: 18.90 | CB7: 16.00 | CC7: 2.60 | CD7: 17.50 | CE7: 10.50 | CF7: 3.30 | CG7: 0.00 | CH7: 10.30 | CI7: 16.90 | CJ7: 15.70 | CK7: 13.80 | CL7: 12.50 | CM7: 0.00 | CN7: 00.3 | CO7: 20.50 | CP7: 6.90 | CQ7: 2.60 | CR7: 9.40 | CS7: 15.00 | CT7: 6.00 | CU7: 1.20 | CV7: 15.20 | CW7: 12.00 | CX7: 8.50 | CY7: 0.00 | CZ7: 2.10 | DA7: 0.00 | DB7: 1.20 | DC7: 00.2 | DD7: 3.80 | DE7: 13.40 | DF7: 10.50 | DG7: 3.80 | DH7: 5.50 | DI7: 3.60 | DJ7: 21.80 | DK7: 13.50 | DL7: 18.70 | DM7: 8.90 | DN7: 24.90 | DO7: 3.10 | DP7: 2.80 | DQ7: 23.40 | DR7: 10.50 | DS7: 10.70 | DT7: 11.50 | DU7: 1.50 | DV7: 1.60 | DW7: 4.16 | DX7: 0.75 | DY7: 4.28 | DZ7: 5.90 | EA7: 1.16 | EB7: 2.25 | EC7: 5.68 | ED7: 8.58 | EE7: 0.00 | EF7: 0.00 | EG7: 4.56 | EH7: 3.00 | EI7: 2.67
A8: Total WH Hours | B8: =B4+B7 -> 33.41 | C8: =C4+C7 -> 31.60 | D8: =D4+D7 -> 32.09 | E8: =E4+E7 -> 0.00 | F8: =F4+F7 -> 41.253333333333337 | G8: =G4+G7 -> 41.52 | H8: =H4+H7 -> 43.546666666666667 | I8: =I4+I7 -> 44.42 | J8: =J4+J7 -> 51.486666666666665 | K8: =K4+K7 -> 32.42 | L8: =L4+L7 -> 15.75 | M8: =M4+M7 -> 54.63 | N8: =N4+N7 -> 49.03 | O8: =O4+O7 -> 57.466666666666661 | P8: =P4+P7 -> 45.72 | Q8: =Q4+Q7 -> 47.65 | R8: =R4+R7 -> 56.133333333333333 | S8: =S4+S7 -> 18.00 | T8: =T4+T7 -> 52.23 | U8: =U4+U7 -> 47.913333333333334 | V8: =V4+V7 -> 43.00 | W8: =W4+W7 -> 40.503333333333337 | X8: =X4+X7 -> 45.88 | Y8: =Y4+Y7 -> 35.87 | Z8: =Z4+Z7 -> 0.00 | AA8: =AA4+AA7 -> 43.42 | AB8: =AB4+AB7 -> 49.403333333333336 | AC8: =AC4+AC7 -> 57.80 | AD8: =AD4+AD7 -> 62.436666666666667 | AE8: =AE4+AE7 -> 33.95 | AF8: =AF4+AF7 -> 31.72 | AG8: =AG4+AG7 -> 0.00 | AH8: =AH4+AH7 -> 28.55 | AI8: =AI4+AI7 -> 52.82 | AJ8: =AJ4+AJ7 -> 34.55 | AK8: =AK4+AK7 -> 46.13 | AL8: =AL4+AL7 -> 53.98 | AM8: =AM4+AM7 -> 36.97 | AN8: =AN4+AN7 -> 22.40 | AO8: =AO4+AO7 -> 38.93 | AP8: =AP4+AP7 -> 31.18 | AQ8: =AQ4+AQ7 -> 24.80 | AR8: =AR4+AR7 -> 32.63 | AS8: =AS4+AS7 -> 25.30 | AT8: =AT4+AT7 -> 24.75 | AU8: =AU4+AU7 -> 34.33 | AV8: =AV4+AV7 -> 34.17 | AW8: =AW4+AW7 -> 24.75 | AX8: =AX4+AX7 -> 18.50 | AY8: =AY4+AY7 -> 29.03 | AZ8: =AZ4+AZ7 -> 29.95 | BA8: =BA4+BA7 -> 38.18 | BB8: =BB4+BB7 -> 36.05 | BC8: =BC4+BC7 -> 40.20 | BD8: =BD4+BD7 -> 27.20 | BE8: =BE4+BE7 -> 24.30 | BF8: =BF4+BF7 -> 27.20 | BG8: =BG4+BG7 -> 26.30 | BH8: =BH4+BH7 -> 26.30 | BI8: =BI4+BI7 -> 26.30 | BJ8: =BJ4+BJ7 -> 15.50 | BK8: =BK4+BK6+BK7 -> 18.90 | BL8: =BL4+BL6+BL7 -> 18.00 | BM8: =BM4+BM6+BM7 -> 46.00 | BN8: =BN4+BN6+BN7 -> 59.67 | BO8: =BO4+BO6+BO7 -> 58.25 | BP8: =BP4+BP6+BP7 -> 54.50 | BQ8: =BQ4+BQ6+BQ7 -> 52.25 | BR8: =BR4+BR6+BR7 -> 10.00 | BS8: =BS4+BS6+BS7 -> 23.62 | BT8: =BT4+BT6+BT7 -> 73.05 | BU8: =BU4+BU6+BU7 -> 45.00 | BV8: =BV4+BV6+BV7 -> 69.40 | BW8: =BW4+BW6+BW7 -> 53.48 | BX8: =BX4+BX6+BX7 -> 49.32 | BY8: =BY4+BY6+BY7 -> 2.20 | BZ8: =BZ4+BZ6+BZ7 -> 0.00 | CA8: =CA4+CA6+CA7 -> 35.48 | CB8: =CB4+CB6+CB7 -> 54.75 | CC8: =CC4+CC6+CC7 -> 29.77 | CD8: =CD4+CD6+CD7 -> 53.50 | CE8: =CE4+CE6+CE7 -> 51.90 | CF8: =CF4+CF6+CF7 -> 10.30 | CG8: =CG4+CG6+CG7 -> 0.00 | CH8: =CH4+CH6+CH7 -> 39.55 | CI8: =CI4+CI6+CI7 -> 41.90 | CJ8: =CJ4+CJ6+CJ7 -> 47.95 | CK8: =CK4+CK6+CK7 -> 54.47 | CL8: =CL4+CL6+CL7 -> 52.08 | CM8: =CM4+CM6+CM7 -> 0.00 | CN8: =CN4+CN6+CN7 -> 00.3 | CO8: =CO4+CO6+CO7 -> 59.75 | CP8: =CP4+CP6+CP7 -> 32.65 | CQ8: =CQ4+CQ6+CQ7 -> 27.60 | CR8: =CR4+CR6+CR7 -> 49.90 | CS8: =CS4+CS6+CS7 -> 59.00 | CT8: =CT4+CT6+CT7 -> 22.00 | CU8: =CU4+CU6+CU7 -> 16.20 | CV8: =CV4+CV6+CV7 -> 55.70 | CW8: =CW4+CW6+CW7 -> 49.50 | CX8: =CX4+CX6+CX7 -> 44.00 | CY8: =CY4+CY6+CY7 -> 0.00 | CZ8: =CZ4+CZ6+CZ7 -> 24.10 | DA8: =DA4+DA6+DA7 -> 21.00 | DB8: =DB4+DB6+DB7 -> 14.20 | DC8: =DC4+DC6+DC7 -> 37.87 | DD8: =DD4+DD6+DD7 -> 40.55 | DE8: =DE4+DE6+DE7 -> 68.40 | DF8: =DF4+DF6+DF7 -> 51.33 | DG8: =DG4+DG6+DG7 -> 30.80 | DH8: =DH4+DH6+DH7 -> 21.50 | DI8: =DI4+DI6+DI7 -> 20.60 | DJ8: =DJ4+DJ6+DJ7 -> 62.80 | DK8: =DK4+DK6+DK7 -> 54.70 | DL8: =DL4+DL6+DL7 -> 81.20 | DM8: =DM4+DM6+DM7 -> 45.90 | DN8: =DN4+DN6+DN7 -> 47.07 | DO8: =DO4+DO6+DO7 -> 15.10 | DP8: =DP4+DP6+DP7 -> 15.80 | DQ8: =DQ4+DQ6+DQ7 -> 67.40 | DR8: =DR4+DR6+DR7 -> 49.67 | DS8: =DS4+DS6+DS7 -> 50.70 | DT8: =DT4+DT6+DT7 -> 47.25 | DU8: =DU4+DU6+DU7 -> 17.00 | DV8: =DV4+DV6+DV7 -> 18.60 | DW8: =DW4+DW6+DW7 -> 17.16 | DX8: =DX4+DX6+DX7 -> 24.75 | DY8: =DY4+DY6+DY7 -> 28.28 | DZ8: =DZ4+DZ6+DZ7 -> 29.90 | EA8: =EA4+EA6+EA7 -> 17.16 | EB8: =EB4+EB6+EB7 -> 18.25 | EC8: =EC4+EC6+EC7 -> 19.68 | ED8: =ED4+ED6+ED7 -> 24.58 | EE8: =EE4+EE6+EE7 -> 0.00 | EF8: =EF4+EF6+EF7 -> 0.00 | EG8: =EG4+EG6+EG7 -> 30.81 | EH8: =EH4+EH6+EH7 -> 30.50 | EI8: =EI4+EI6+EI7 -> 18.67 | EJ8: =EJ4+EJ6+EJ7 -> 0.00 | EK8: =EK4+EK6+EK7 -> 0.00 | EL8: =EL4+EL6+EL7 -> 0.00 | EM8: =EM4+EM6+EM7 -> 0.00 | EN8: =EN4+EN6+EN7 -> 0.00 | EO8: =EO4+EO6+EO7 -> 0.00
A10: Inbound Drums | B10: 2 | C10: 0 | D10: 1 | E10: 0 | F10: 0 | G10: 0 | H10: 0 | I10: 0 | J10: 2 | K10: 0 | L10: 0 | M10: 2 | N10: 2 | O10: 2 | P10: 2 | Q10: 4 | R10: 1 | S10: 0 | T10: 2 | U10: 0 | V10: 0 | W10: 0 | X10: 2 | Y10: 1 | Z10: 0 | AA10: 2 | AB10: 2 | AC10: 4 | AD10: 4 | AE10: 2 | AF10: 2 | AG10: 0 | AH10: 1 | AI10: 5 | AJ10: 0 | AK10: 2 | AL10: 4 | AM10: 2 | AN10: 0 | AO10: 3 | AP10: 2 | AQ10: 3 | AR10: 3 | AS10: 3 | AT10: 3 | AU10: 2 | AV10: 1 | AW10: 1 | AX10: 1 | AY10: 2 | AZ10: 2 | BA10: 0 | BB10: 1 | BC10: 1 | BD10: 1 | BF10: 2 | BG10: 2 | BI10: 1 | BJ10: 0 | BK10: 1 | BL10: 2 | BM10: 2 | BN10: 3 | BO10: 4 | BP10: 4 | BQ10: 4 | BR10: 1 | BS10: 1 | BT10: 4 | BU10: 0 | BV10: 4 | BW10: 0 | BX10: 0 | CA10: 0 | CB10: 4 | CC10: 0 | CD10: 5 | CE10: 5.00 | CF10: 0 | CG10: 0 | CH10: 6 | CI10: 1 | CJ10: 1 | CK10: 5 | CL10: 3 | CM10: 0 | CN10: 0 | CO10: 4 | CP10: 0.00 | CQ10: 0.00 | CR10: 4.00 | CS10: 3.00 | CT10: 0 | CU10: 0 | CV10: 4 | CW10: 0 | CX10: 0 | CY10: 0 | CZ10: 0 | DA10: 0 | DB10: 1 | DC10: 0 | DD10: 0 | DE10: 4 | DF10: 3 | DG10: 0 | DH10: 0 | DI10: 0 | DJ10: 4 | DK10: 4 | DL10: 4 | DM10: 1 | DN10: 2 | DO10: 0 | DP10: 0 | DQ10: 4 | DR10: 3 | DS10: 0 | DT10: 4 | DU10: 0 | DV10: 1 | DW10: 0 | DX10: 0 | DY10: 0 | DZ10: 1 | EA10: 0 | EB10: 1 | EC10: 0 | ED10: 0 | EE10: 0 | EF10: 0 | EG10: 0 | EH10: 0 | EI10: 2 | EJ10: 0 | EK10: 0 | EL10: 0 | EM10: 0 | EN10: 0 | EO10: 0
A11: Inbound Boxes | B11: 0 | C11: 0 | D11: 0 | E11: 0 | F11: 0 | G11: 0 | H11: 0 | I11: 0 | J11: 0 | K11: 0 | L11: 0 | M11: 0 | N11: 0 | O11: 0 | P11: 0 | Q11: 0 | R11: 0 | S11: 0 | T11: 0 | U11: 0 | V11: 0 | W11: 0 | X11: 0 | Y11: 0 | Z11: 0 | AA11: 0 | AB11: 0 | AC11: 0 | AD11: 0 | AE11: 1 | AF11: 0 | AG11: 0 | AH11: 0 | AI11: 0 | AJ11: 0 | AK11: 0 | AL11: 0 | AM11: 0 | AN11: 0 | AO11: 0 | AP11: 0 | AQ11: 0 | AR11: 0 | AS11: 0 | AT11: 0 | AU11: 0 | AV11: 0 | AW11: 0 | AX11: 0 | AY11: 0 | AZ11: 0 | BA11: 0 | BB11: 0 | BC11: 0 | BD11: 0 | BH11: 1 | BI11: 2 | BJ11: 0 | BK11: 0 | BL11: 0 | BM11: 0 | BN11: 0 | BO11: 0 | BP11: 0 | BR11: 2 | BS11: 1 | BT11: 0 | BU11: 0 | BV11: 1 | BW11: 0 | BX11: 1 | CA11: 0 | CB11: 1 | CC11: 1 | CD11: 2 | CE11: 1.00 | CF11: 0 | CG11: 0 | CH11: 0 | CI11: 0 | CJ11: 1 | CL11: 2 | CM11: 0 | CN11: 0 | CO11: 0 | CP11: 0.00 | CQ11: 0.00 | CR11: 0.00 | CS11: 0.00 | CT11: 1 | CU11: 1 | CV11: 1 | CW11: 0 | CX11: 0 | CY11: 0 | CZ11: 0 | DA11: 0 | DB11: 0 | DC11: 0 | DD11: 0 | DE11: 1 | DF11: 1 | DG11: 1 | DH11: 0 | DI11: 1 | DJ11: 0 | DK11: 0 | DL11: 1 | DM11: 1 | DN11: 1 | DO11: 0 | DP11: 0 | DQ11: 0 | DR11: 0 | DS11: 0 | DT11: 2 | DU11: 0 | DV11: 0 | DW11: 0 | DX11: 0 | DY11: 0 | DZ11: 1 | EA11: 0 | EB11: 2 | EC11: 0 | ED11: 0 | EE11: 0 | EF11: 0 | EG11: 0 | EH11: 0 | EI11: 0 | EJ11: 0 | EK11: 0 | EL11: 0 | EM11: 0 | EN11: 0 | EO11: 0
A12: Inbound Raisins | B12: 0 | C12: 0 | D12: 0 | E12: 0 | F12: 0 | G12: 0 | H12: 0 | I12: 0 | J12: 0 | K12: 0 | L12: 0 | M12: 0 | N12: 0 | O12: 0 | P12: 0 | Q12: 0 | R12: 0 | S12: 0 | T12: 0 | U12: 0 | V12: 0 | W12: 0 | X12: 0 | Y12: 0 | Z12: 0 | AA12: 0 | AB12: 0 | AC12: 1 | AD12: 0 | AE12: 0 | AF12: 0 | AG12: 0 | AH12: 0 | AI12: 0 | AJ12: 0 | AK12: 0 | AL12: 0 | AM12: 1 | AN12: 0 | AO12: 1 | AP12: 0 | AQ12: 1 | AR12: 0 | AS12: 0 | AT12: 0 | AU12: 0 | AV12: 0 | AW12: 0 | AX12: 1 | AY12: 0 | AZ12: 0 | BA12: 0 | BB12: 0 | BC12: 0 | BD12: 0 | BE12: 0 | BF12: 0 | BG12: 0 | BH12: 0 | BI12: 0 | BJ12: 0 | BK12: 0 | BL12: 0 | BM12: 0 | BN12: 0 | BO12: 0 | BP12: 1 | BQ12: 0 | BR12: 0 | BS12: 0 | BT12: 0 | BU12: 0 | BV12: 0 | BW12: 0 | BX12: 0 | CA12: 0 | CB12: 0 | CC12: 0 | CD12: 0 | CE12: 0 | CF12: 0 | CG12: 0 | CH12: 0 | CI12: 1 | CJ12: 0 | CK12: 0 | CL12: 0 | CM12: 0 | CN12: 0 | CO12: 1 | CP12: 0 | CQ12: 0 | CR12: 0 | CS12: 0 | CT12: 0 | CU12: 0 | CV12: 0 | CW12: 0 | CX12: 0 | CY12: 0 | CZ12: 0 | DA12: 0 | DB12: 0 | DC12: 0 | DD12: 0 | DE12: 0 | DF12: 0 | DG12: 0 | DH12: 0 | DI12: 0 | DJ12: 0 | DK12: 0 | DL12: 0 | DM12: 0 | DN12: 0 | DO12: 0 | DP12: 0 | DQ12: 0 | DR12: 0 | DS12: 0 | DT12: 0 | DU12: 0 | DV12: 0 | DW12: 0 | DX12: 1 | DY12: 2 | DZ12: 0 | EA12: 2 | EB12: 0 | EC12: 0 | ED12: 0 | EE12: 0 | EF12: 0 | EG12: 0 | EH12: 0 | EI12: 0 | EJ12: 0 | EK12: 0 | EL12: 0 | EM12: 0 | EN12: 0 | EO12: 0
A13: Inbound Subtotal | B13: =SUM(B10:B12) -> 2 | C13: =SUM(C10:C12) -> 0 | D13: =SUM(D10:D12) -> 1 | E13: =SUM(E10:E12) -> 0 | F13: =SUM(F10:F12) -> 0 | G13: =SUM(G10:G12) -> 0 | H13: =SUM(H10:H12) -> 0 | I13: =SUM(I10:I12) -> 0 | J13: =SUM(J10:J12) -> 2 | K13: =SUM(K10:K12) -> 0 | L13: =SUM(L10:L12) -> 0 | M13: =SUM(M10:M12) -> 2 | N13: =SUM(N10:N12) -> 2 | O13: =SUM(O10:O12) -> 2 | P13: =SUM(P10:P12) -> 2 | Q13: =SUM(Q10:Q12) -> 4 | R13: =SUM(R10:R12) -> 1 | S13: =SUM(S10:S12) -> 0 | T13: =SUM(T10:T12) -> 2 | U13: =SUM(U10:U12) -> 0 | V13: =SUM(V10:V12) -> 0 | W13: =SUM(W10:W12) -> 0 | X13: =SUM(X10:X12) -> 2 | Y13: =SUM(Y10:Y12) -> 1 | Z13: =SUM(Z10:Z12) -> 0 | AA13: =SUM(AA10:AA12) -> 2 | AB13: =SUM(AB10:AB12) -> 2 | AC13: =SUM(AC10:AC12) -> 5 | AD13: =SUM(AD10:AD12) -> 4 | AE13: =SUM(AE10:AE12) -> 3 | AF13: =SUM(AF10:AF12) -> 2 | AG13: =SUM(AG10:AG12) -> 0 | AH13: =SUM(AH10:AH12) -> 1 | AI13: =SUM(AI10:AI12) -> 5 | AJ13: =SUM(AJ10:AJ12) -> 0 | AK13: =SUM(AK10:AK12) -> 2 | AL13: =SUM(AL10:AL12) -> 4 | AM13: =SUM(AM10:AM12) -> 3 | AN13: =SUM(AN10:AN12) -> 0 | AO13: =SUM(AO10:AO12) -> 4 | AP13: =SUM(AP10:AP12) -> 2 | AQ13: =SUM(AQ10:AQ12) -> 4 | AR13: =SUM(AR10:AR12) -> 3 | AS13: =SUM(AS10:AS12) -> 3 | AT13: =SUM(AT10:AT12) -> 3 | AU13: =SUM(AU10:AU12) -> 2 | AV13: =SUM(AV10:AV12) -> 1 | AW13: =SUM(AW10:AW12) -> 1 | AX13: =SUM(AX10:AX12) -> 2 | AY13: =SUM(AY10:AY12) -> 2 | AZ13: =SUM(AZ10:AZ12) -> 2 | BA13: =SUM(BA10:BA12) -> 0 | BB13: =SUM(BB10:BB12) -> 1 | BC13: =SUM(BC10:BC12) -> 1 | BD13: =SUM(BD10:BD12) -> 1 | BE13: =SUM(BE10:BE12) -> 0 | BF13: =SUM(BF10:BF12) -> 2 | BG13: =SUM(BG10:BG12) -> 2 | BH13: =SUM(BH10:BH12) -> 1 | BI13: =SUM(BI10:BI12) -> 3 | BJ13: =SUM(BJ10:BJ12) -> 0 | BK13: =SUM(BK10:BK12) -> 1 | BL13: =SUM(BL10:BL12) -> 2 | BM13: =SUM(BM10:BM12) -> 2 | BN13: =SUM(BN10:BN12) -> 3 | BO13: =SUM(BO10:BO12) -> 4 | BP13: =SUM(BP10:BP12) -> 5 | BQ13: =SUM(BQ10:BQ12) -> 4 | BR13: =SUM(BR10:BR12) -> 3 | BS13: =SUM(BS10:BS12) -> 2 | BT13: =SUM(BT10:BT12) -> 4 | BU13: =SUM(BU10:BU12) -> 0 | BV13: =SUM(BV10:BV12) -> 5 | BW13: =SUM(BW10:BW12) -> 0 | BX13: =SUM(BX10:BX12) -> 1 | BY13: =SUM(BY10:BY12) -> 0 | BZ13: =SUM(BZ10:BZ12) -> 0 | CA13: =SUM(CA10:CA12) -> 0 | CB13: =SUM(CB10:CB12) -> 5 | CC13: =SUM(CC10:CC12) -> 1 | CD13: =SUM(CD10:CD12) -> 7 | CE13: =SUM(CE10:CE12) -> 6 | CF13: =SUM(CF10:CF12) -> 0 | CG13: =SUM(CG10:CG12) -> 0 | CH13: =SUM(CH10:CH12) -> 6 | CI13: =SUM(CI10:CI12) -> 2 | CJ13: =SUM(CJ10:CJ12) -> 2 | CK13: =SUM(CK10:CK12) -> 5 | CL13: =SUM(CL10:CL12) -> 5 | CM13: =SUM(CM10:CM12) -> 0 | CN13: =SUM(CN10:CN12) -> 0 | CO13: =SUM(CO10:CO12) -> 5 | CP13: =SUM(CP10:CP12) -> 0 | CQ13: =SUM(CQ10:CQ12) -> 0 | CR13: =SUM(CR10:CR12) -> 4 | CS13: =SUM(CS10:CS12) -> 3 | CT13: =SUM(CT10:CT12) -> 1 | CU13: =SUM(CU10:CU12) -> 1 | CV13: =SUM(CV10:CV12) -> 5 | CW13: =SUM(CW10:CW12) -> 0 | CX13: =SUM(CX10:CX12) -> 0 | CY13: =SUM(CY10:CY12) -> 0 | CZ13: =SUM(CZ10:CZ12) -> 0 | DA13: =SUM(DA10:DA12) -> 0 | DB13: =SUM(DB10:DB12) -> 1 | DC13: =SUM(DC10:DC12) -> 0 | DD13: =SUM(DD10:DD12) -> 0 | DE13: =SUM(DE10:DE12) -> 5 | DF13: =SUM(DF10:DF12) -> 4 | DG13: =SUM(DG10:DG12) -> 1 | DH13: =SUM(DH10:DH12) -> 0 | DI13: =SUM(DI10:DI12) -> 1 | DJ13: =SUM(DJ10:DJ12) -> 4 | DK13: =SUM(DK10:DK12) -> 4 | DL13: =SUM(DL10:DL12) -> 5 | DM13: =SUM(DM10:DM12) -> 2 | DN13: =SUM(DN10:DN12) -> 3 | DO13: =SUM(DO10:DO12) -> 0 | DP13: =SUM(DP10:DP12) -> 0 | DQ13: =SUM(DQ10:DQ12) -> 4 | DR13: =SUM(DR10:DR12) -> 3 | DS13: =SUM(DS10:DS12) -> 0 | DT13: =SUM(DT10:DT12) -> 6 | DU13: =SUM(DU10:DU12) -> 0 | DV13: =SUM(DV10:DV12) -> 1 | DW13: =SUM(DW10:DW12) -> 0 | DX13: =SUM(DX10:DX12) -> 1 | DY13: =SUM(DY10:DY12) -> 2 | DZ13: =SUM(DZ10:DZ12) -> 2 | EA13: =SUM(EA10:EA12) -> 2 | EB13: =SUM(EB10:EB12) -> 3 | EC13: =SUM(EC10:EC12) -> 0 | ED13: =SUM(ED10:ED12) -> 0 | EE13: =SUM(EE10:EE12) -> 0 | EF13: =SUM(EF10:EF12) -> 0 | EG13: =SUM(EG10:EG12) -> 0 | EH13: =SUM(EH10:EH12) -> 0 | EI13: =SUM(EI10:EI12) -> 2 | EJ13: =SUM(EJ10:EJ12) -> 0 | EK13: =SUM(EK10:EK12) -> 0 | EL13: =SUM(EL10:EL12) -> 0 | EM13: =SUM(EM10:EM12) -> 0 | EN13: =SUM(EN10:EN12) -> 0 | EO13: =SUM(EO10:EO12) -> 0
A15: Outbound Drums | B15: 2 | C15: 2 | D15: 2 | E15: 0 | F15: 3 | G15: 1 | H15: 1 | I15: 2 | J15: 3 | K15: 3 | L15: 0 | M15: 3 | N15: 4 | O15: 2 | P15: 4 | Q15: 2 | R15: 4 | S15: 2 | T15: 2 | U15: 4 | V15: 4 | W15: 3 | X15: 2 | Y15: 3 | Z15: 0 | AA15: 3 | AB15: 2 | AC15: 1 | AD15: 2 | AE15: 4 | AF15: 2 | AG15: 0 | AH15: 3 | AI15: 3 | AJ15: 2 | AK15: 1 | AL15: 3 | AM15: 3 | AN15: 3 | AO15: 2 | AP15: 2 | AQ15: 0 | AR15: 1 | AS15: 0 | AT15: 0 | AU15: 1 | AV15: 2 | AW15: 1 | AX15: 1 | AY15: 0 | AZ15: 0 | BA15: 2 | BB15: 1 | BC15: 0 | BD15: 0 | BE15: 3 | BF15: 1 | BG15: 1 | BH15: 2 | BI15: 0 | BJ15: 2 | BK15: 0 | BL15: 1 | BM15: 0 | BN15: 1 | BO15: 1 | BP15: 1 | BR15: 0 | BS15: 1 | BT15: 1 | BU15: 0 | BV15: 0 | BW15: 2 | BX15: 2 | CA15: 3 | CB15: 1 | CC15: 3 | CD15: 0 | CE15: 0 | CF15: 0 | CG15: 0 | CH15: 0 | CI15: 1 | CJ15: 1 | CK15: 0 | CL15: 0 | CM15: 0 | CN15: 0 | CO15: 0 | CP15: 1 | CQ15: 3 | CR15: 2 | CS15: 2 | CT15: 1.5 | CU15: 1.5 | CV15: 1 | CW15: 1 | CX15: 3 | CY15: 0 | CZ15: 3 | DA15: 2 | DB15: 0 | DC15: 3 | DD15: 1 | DE15: 2 | DF15: 1 | DG15: 2 | DH15: 1 | DI15: 2 | DJ15: 1 | DK15: 3 | DL15: 1 | DM15: 2 | DN15: 2 | DO15: 2 | DP15: 1 | DQ15: 2 | DR15: 2 | DS15: 1 | DT15: 2 | DU15: 2 | DV15: 1 | DW15: 2 | DX15: 2 | DY15: 1 | DZ15: 2 | EA15: 1 | EB15: 1 | EC15: 2 | ED15: 2 | EE15: 0 | EF15: 0 | EG15: 2 | EH15: 5 | EI15: 2
A16: Outbound Boxes | B16: 0 | C16: 1 | D16: 0 | E16: 0 | F16: 1 | G16: 2 | H16: 2 | I16: 1 | J16: 2 | K16: 0 | L16: 0 | M16: 1 | N16: 1 | O16: 2 | P16: 0 | Q16: 1 | R16: 0 | S16: 0 | T16: 1 | U16: 0 | V16: 0 | W16: 1 | X16: 2 | Y16: 1 | Z16: 0 | AA16: 0 | AB16: 1 | AC16: 1 | AD16: 2 | AE16: 0 | AF16: 1 | AG16: 0 | AH16: 1 | AI16: 1 | AJ16: 2 | AK16: 2 | AL16: 1 | AM16: 1 | AN16: 0 | AO16: 2 | AP16: 0 | AQ16: 0 | AR16: 0 | AS16: 0 | AT16: 0 | AU16: 0 | AV16: 0 | AW16: 0 | AX16: 0 | AY16: 0 | AZ16: 0 | BA16: 2 | BB16: 1 | BC16: 1 | BD16: 0 | BG16: 1 | BH16: 2 | BI16: 0 | BN16: 1 | BO16: 1 | BP16: 0 | BQ16: 1 | BR16: 0 | BS16: 0 | BT16: 0 | BU16: 2 | BV16: 2 | BW16: 0 | BX16: 1 | CA16: 0 | CB16: 0 | CC16: 1 | CD16: 0 | CE16: 0 | CF16: 0 | CG16: 0 | CH16: 0 | CI16: 1 | CJ16: 1 | CK16: 2 | CL16: 0 | CM16: 0 | CN16: 0 | CO16: 1 | CP16: 3 | CQ16: 1 | CR16: 0 | CS16: 1 | CT16: 0 | CU16: 0 | CV16: 0 | CW16: 2 | CX16: 1 | CY16: 0 | CZ16: 0 | DA16: 1 | DB16: 0 | DC16: 0 | DD16: 2 | DE16: 1 | DF16: 2 | DG16: 0 | DH16: 0 | DI16: 0 | DJ16: 0 | DK16: 1 | DL16: 1 | DM16: 1 | DN16: 1 | DO16: 0 | DP16: 0 | DQ16: 1 | DR16: 1 | DS16: 1 | DT16: 0 | DU16: 1 | DV16: 1 | DW16: 0 | DX16: 0 | DY16: 1 | DZ16: 0 | EA16: 1 | EB16: 0 | EC16: 0 | ED16: 2 | EE16: 0 | EF16: 0 | EG16: 2 | EH16: 0 | EI16: 0
A17: Outbound Raisins | B17: 0 | C17: 0 | D17: 1 | E17: 0 | F17: 0 | G17: 0 | H17: 0 | I17: 0 | J17: 0 | K17: 0 | L17: 0 | M17: 0 | N17: 0 | O17: 0 | P17: 0 | Q17: 0 | R17: 2 | S17: 0 | T17: 1 | U17: 0 | V17: 1 | W17: 1 | X17: 0 | Y17: 0 | Z17: 0 | AA17: 1 | AB17: 1 | AC17: 0 | AD17: 0 | AE17: 0 | AF17: 0 | AG17: 0 | AH17: 0 | AI17: 0 | AJ17: 0 | AK17: 0 | AL17: 0 | AM17: 1 | AN17: 1 | AO17: 0 | AP17: 0 | AQ17: 0 | AR17: 0 | AS17: 0 | AT17: 0 | AU17: 1 | AV17: 1 | AW17: 0 | AX17: 0 | AY17: 1 | AZ17: 0 | BA17: 0 | BB17: 1 | BC17: 1 | BD17: 1 | BE17: 0 | BF17: 0 | BG17: 0 | BH17: 0 | BI17: 0 | BJ17: 0 | BK17: 2 | BL17: 0 | BM17: 1 | BN17: 1 | BO17: 1 | BP17: 1 | BQ17: 1 | BR17: 0 | BS17: 0 | BT17: 1 | BU17: 1 | BV17: 0 | BW17: 0 | BX17: 0 | CA17: 0 | CB17: 0 | CC17: 0 | CD17: 0 | CE17: 0 | CF17: 0 | CG17: 0 | CH17: 0 | CI17: 0 | CJ17: 0 | CK17: 0 | CL17: 0 | CM17: 0 | CN17: 0 | CO17: 0 | CP17: 0 | CQ17: 0 | CR17: 0 | CS17: 0 | CT17: 0 | CU17: 0 | CV17: 0 | CW17: 1 | CX17: 0 | CY17: 0 | CZ17: 0 | DA17: 0 | DB17: 0 | DC17: 2 | DD17: 2 | DE17: 1 | DF17: 0 | DG17: 00.3 | DH17: 00.6 | DI17: 0 | DJ17: 0 | DK17: 0 | DL17: 0 | DM17: 0 | DN17: 1 | DO17: 0 | DP17: 0 | DQ17: 0 | DR17: 0 | DS17: 0 | DT17: 0 | DU17: 0 | DV17: 0 | DW17: 0 | DX17: 0 | DY17: 0 | DZ17: 0 | EA17: 0 | EB17: 0 | EC17: 0 | ED17: 0 | EE17: 0 | EF17: 0 | EG17: 0 | EH17: 0 | EI17: 0
A18: Outbound Subtotal | B18: =SUM(B15:B17) -> 2 | C18: =SUM(C15:C17) -> 3 | D18: =SUM(D15:D17) -> 3 | E18: =SUM(E15:E17) -> 0 | F18: =SUM(F15:F17) -> 4 | G18: =SUM(G15:G17) -> 3 | H18: =SUM(H15:H17) -> 3 | I18: =SUM(I15:I17) -> 3 | J18: =SUM(J15:J17) -> 5 | K18: =SUM(K15:K17) -> 3 | L18: =SUM(L15:L17) -> 0 | M18: =SUM(M15:M17) -> 4 | N18: =SUM(N15:N17) -> 5 | O18: =SUM(O15:O17) -> 4 | P18: =SUM(P15:P17) -> 4 | Q18: =SUM(Q15:Q17) -> 3 | R18: =SUM(R15:R17) -> 6 | S18: =SUM(S15:S17) -> 2 | T18: =SUM(T15:T17) -> 4 | U18: =SUM(U15:U17) -> 4 | V18: =SUM(V15:V17) -> 5 | W18: =SUM(W15:W17) -> 5 | X18: =SUM(X15:X17) -> 4 | Y18: =SUM(Y15:Y17) -> 4 | Z18: =SUM(Z15:Z17) -> 0 | AA18: =SUM(AA15:AA17) -> 4 | AB18: =SUM(AB15:AB17) -> 4 | AC18: =SUM(AC15:AC17) -> 2 | AD18: =SUM(AD15:AD17) -> 4 | AE18: =SUM(AE15:AE17) -> 4 | AF18: =SUM(AF15:AF17) -> 3 | AG18: =SUM(AG15:AG17) -> 0 | AH18: =SUM(AH15:AH17) -> 4 | AI18: =SUM(AI15:AI17) -> 4 | AJ18: =SUM(AJ15:AJ17) -> 4 | AK18: =SUM(AK15:AK17) -> 3 | AL18: =SUM(AL15:AL17) -> 4 | AM18: =SUM(AM15:AM17) -> 5 | AN18: =SUM(AN15:AN17) -> 4 | AO18: =SUM(AO15:AO17) -> 4 | AP18: =SUM(AP15:AP17) -> 2 | AQ18: =SUM(AQ15:AQ17) -> 0 | AR18: =SUM(AR15:AR17) -> 1 | AS18: =SUM(AS15:AS17) -> 0 | AT18: =SUM(AT15:AT17) -> 0 | AU18: =SUM(AU15:AU17) -> 2 | AV18: =SUM(AV15:AV17) -> 3 | AW18: =SUM(AW15:AW17) -> 1 | AX18: =SUM(AX15:AX17) -> 1 | AY18: =SUM(AY15:AY17) -> 1 | AZ18: =SUM(AZ15:AZ17) -> 0 | BA18: =SUM(BA15:BA17) -> 4 | BB18: =SUM(BB15:BB17) -> 3 | BC18: =SUM(BC15:BC17) -> 2 | BD18: =SUM(BD15:BD17) -> 1 | BE18: =SUM(BE15:BE17) -> 3 | BF18: =SUM(BF15:BF17) -> 1 | BG18: =SUM(BG15:BG17) -> 2 | BH18: =SUM(BH15:BH17) -> 4 | BI18: =SUM(BI15:BI17) -> 0 | BJ18: =SUM(BJ15:BJ17) -> 2 | BK18: =SUM(BK15:BK17) -> 2 | BL18: =SUM(BL15:BL17) -> 1 | BM18: =SUM(BM15:BM17) -> 1 | BN18: =SUM(BN15:BN17) -> 3 | BO18: =SUM(BO15:BO17) -> 3 | BP18: =SUM(BP15:BP17) -> 2 | BQ18: =SUM(BQ15:BQ17) -> 2 | BR18: =SUM(BR15:BR17) -> 0 | BS18: =SUM(BS15:BS17) -> 1 | BT18: =SUM(BT15:BT17) -> 2 | BU18: =SUM(BU15:BU17) -> 3 | BV18: =SUM(BV15:BV17) -> 2 | BW18: =SUM(BW15:BW17) -> 2 | BX18: =SUM(BX15:BX17) -> 3 | BY18: =SUM(BY15:BY17) -> 0 | BZ18: =SUM(BZ15:BZ17) -> 0 | CA18: =SUM(CA15:CA17) -> 3 | CB18: =SUM(CB15:CB17) -> 1 | CC18: =SUM(CC15:CC17) -> 4 | CD18: =SUM(CD15:CD17) -> 0 | CE18: =SUM(CE15:CE17) -> 0 | CF18: =SUM(CF15:CF17) -> 0 | CG18: =SUM(CG15:CG17) -> 0 | CH18: =SUM(CH15:CH17) -> 0 | CI18: =SUM(CI15:CI17) -> 2 | CJ18: =SUM(CJ15:CJ17) -> 2 | CK18: =SUM(CK15:CK17) -> 2 | CL18: =SUM(CL15:CL17) -> 0 | CM18: =SUM(CM15:CM17) -> 0 | CN18: =SUM(CN15:CN17) -> 0 | CO18: =SUM(CO15:CO17) -> 1 | CP18: =SUM(CP15:CP17) -> 4 | CQ18: =SUM(CQ15:CQ17) -> 4 | CR18: =SUM(CR15:CR17) -> 2 | CS18: =SUM(CS15:CS17) -> 3 | CT18: =SUM(CT15:CT17) -> 1.5 | CU18: =SUM(CU15:CU17) -> 1.5 | CV18: =SUM(CV15:CV17) -> 1 | CW18: =SUM(CW15:CW17) -> 4 | CX18: =SUM(CX15:CX17) -> 4 | CY18: =SUM(CY15:CY17) -> 0 | CZ18: =SUM(CZ15:CZ17) -> 3 | DA18: =SUM(DA15:DA17) -> 3 | DB18: =SUM(DB15:DB17) -> 0 | DC18: =SUM(DC15:DC17) -> 5 | DD18: =SUM(DD15:DD17) -> 5 | DE18: =SUM(DE15:DE17) -> 4 | DF18: =SUM(DF15:DF17) -> 3 | DG18: =SUM(DG15:DG17) -> 2.3 | DH18: =SUM(DH15:DH17) -> 1.6 | DI18: =SUM(DI15:DI17) -> 2 | DJ18: =SUM(DJ15:DJ17) -> 1 | DK18: =SUM(DK15:DK17) -> 4 | DL18: =SUM(DL15:DL17) -> 2 | DM18: =SUM(DM15:DM17) -> 3 | DN18: =SUM(DN15:DN17) -> 4 | DO18: =SUM(DO15:DO17) -> 2 | DP18: =SUM(DP15:DP17) -> 1 | DQ18: =SUM(DQ15:DQ17) -> 3 | DR18: =SUM(DR15:DR17) -> 3 | DS18: =SUM(DS15:DS17) -> 2 | DT18: =SUM(DT15:DT17) -> 2 | DU18: =SUM(DU15:DU17) -> 3 | DV18: =SUM(DV15:DV17) -> 2 | DW18: =SUM(DW15:DW17) -> 2 | DX18: =SUM(DX15:DX17) -> 2 | DY18: =SUM(DY15:DY17) -> 2 | DZ18: =SUM(DZ15:DZ17) -> 2 | EA18: =SUM(EA15:EA17) -> 2 | EB18: =SUM(EB15:EB17) -> 1 | EC18: =SUM(EC15:EC17) -> 2 | ED18: =SUM(ED15:ED17) -> 4 | EE18: =SUM(EE15:EE17) -> 0 | EF18: =SUM(EF15:EF17) -> 0 | EG18: =SUM(EG15:EG17) -> 4 | EH18: =SUM(EH15:EH17) -> 5 | EI18: =SUM(EI15:EI17) -> 2 | EJ18: =SUM(EJ15:EJ17) -> 0 | EK18: =SUM(EK15:EK17) -> 0 | EL18: =SUM(EL15:EL17) -> 0 | EM18: =SUM(EM15:EM17) -> 0 | EN18: =SUM(EN15:EN17) -> 0 | EO18: =SUM(EO15:EO17) -> 0
A19: Total Railcars | B19: =B18+B13 -> 4 | C19: =C18+C13 -> 3 | D19: =D18+D13 -> 4 | E19: =E18+E13 -> 0 | F19: =F18+F13 -> 4 | G19: =G18+G13 -> 3 | H19: =H18+H13 -> 3 | I19: =I18+I13 -> 3 | J19: =J18+J13 -> 7 | K19: =K18+K13 -> 3 | L19: =L18+L13 -> 0 | M19: =M18+M13 -> 6 | N19: =N18+N13 -> 7 | O19: =O18+O13 -> 6 | P19: =P18+P13 -> 6 | Q19: =Q18+Q13 -> 7 | R19: =R18+R13 -> 7 | S19: =S18+S13 -> 2 | T19: =T18+T13 -> 6 | U19: =U18+U13 -> 4 | V19: =V18+V13 -> 5 | W19: =W18+W13 -> 5 | X19: =X18+X13 -> 6 | Y19: =Y18+Y13 -> 5 | Z19: =Z18+Z13 -> 0 | AA19: =AA18+AA13 -> 6 | AB19: =AB18+AB13 -> 6 | AC19: =AC18+AC13 -> 7 | AD19: =AD18+AD13 -> 8 | AE19: =AE18+AE13 -> 7 | AF19: =AF18+AF13 -> 5 | AG19: =AG18+AG13 -> 0 | AH19: =AH18+AH13 -> 5 | AI19: =AI18+AI13 -> 9 | AJ19: =AJ18+AJ13 -> 4 | AK19: =AK18+AK13 -> 5 | AL19: =AL18+AL13 -> 8 | AM19: =AM18+AM13 -> 8 | AN19: =AN18+AN13 -> 4 | AO19: =AO18+AO13 -> 8 | AP19: =AP18+AP13 -> 4 | AQ19: =AQ18+AQ13 -> 4 | AR19: =AR18+AR13 -> 4 | AS19: =AS18+AS13 -> 3 | AT19: =AT18+AT13 -> 3 | AU19: =AU18+AU13 -> 4 | AV19: =AV18+AV13 -> 4 | AW19: =AW18+AW13 -> 2 | AX19: =AX18+AX13 -> 3 | AY19: =AY18+AY13 -> 3 | AZ19: =AZ18+AZ13 -> 2 | BA19: =BA18+BA13 -> 4 | BB19: =BB18+BB13 -> 4 | BC19: =BC18+BC13 -> 3 | BD19: 3 | BE19: =BE18+BE13 -> 3 | BF19: 3 | BG19: =BG18+BG13 -> 4 | BH19: =BH18+BH13 -> 5 | BI19: =BI18+BI13 -> 3 | BJ19: =BJ18+BJ13 -> 2 | BK19: =BK18+BK13 -> 3 | BL19: =BL18+BL13 -> 3 | BM19: =BM18+BM13 -> 3 | BN19: =BN18+BN13 -> 6 | BO19: =BO18+BO13 -> 7 | BP19: =BP18+BP13 -> 7 | BQ19: =BQ18+BQ13 -> 6 | BR19: =BR18+BR13 -> 3 | BS19: =BS18+BS13 -> 3 | BT19: =BT18+BT13 -> 6 | BU19: =BU18+BU13 -> 3 | BV19: =BV18+BV13 -> 7 | BW19: =BW18+BW13 -> 2 | BX19: =BX18+BX13 -> 4 | BY19: =BY18+BY13 -> 0 | BZ19: =BZ18+BZ13 -> 0 | CA19: =CA18+CA13 -> 3 | CB19: =CB18+CB13 -> 6 | CC19: =CC18+CC13 -> 5 | CD19: =CD18+CD13 -> 7 | CE19: =CE18+CE13 -> 6 | CF19: =CF18+CF13 -> 0 | CG19: =CG18+CG13 -> 0 | CH19: =CH18+CH13 -> 6 | CI19: =CI18+CI13 -> 4 | CJ19: =CJ18+CJ13 -> 4 | CK19: =CK18+CK13 -> 7 | CL19: =CL18+CL13 -> 5 | CM19: =CM18+CM13 -> 0 | CN19: =CN18+CN13 -> 0 | CO19: =CO18+CO13 -> 6 | CP19: =CP18+CP13 -> 4 | CQ19: =CQ18+CQ13 -> 4 | CR19: =CR18+CR13 -> 6 | CS19: =CS18+CS13 -> 6 | CT19: =CT18+CT13 -> 2.5 | CU19: =CU18+CU13 -> 2.5 | CV19: =CV18+CV13 -> 6 | CW19: =CW18+CW13 -> 4 | CX19: =CX18+CX13 -> 4 | CY19: =CY18+CY13 -> 0 | CZ19: =CZ18+CZ13 -> 3 | DA19: =DA18+DA13 -> 3 | DB19: =DB18+DB13 -> 1 | DC19: =DC18+DC13 -> 5 | DD19: =DD18+DD13 -> 5 | DE19: =DE18+DE13 -> 9 | DF19: =DF18+DF13 -> 7 | DG19: =DG18+DG13 -> 3.3 | DH19: =DH18+DH13 -> 1.6 | DI19: =DI18+DI13 -> 3 | DJ19: =DJ18+DJ13 -> 5 | DK19: =DK18+DK13 -> 8 | DL19: =DL18+DL13 -> 7 | DM19: =DM18+DM13 -> 5 | DN19: =DN18+DN13 -> 7 | DO19: =DO18+DO13 -> 2 | DP19: =DP18+DP13 -> 1 | DQ19: =DQ18+DQ13 -> 7 | DR19: =DR18+DR13 -> 6 | DS19: =DS18+DS13 -> 2 | DT19: =DT18+DT13 -> 8 | DU19: =DU18+DU13 -> 3 | DV19: =DV18+DV13 -> 3 | DW19: =DW18+DW13 -> 2 | DX19: =DX18+DX13 -> 3 | DY19: =DY18+DY13 -> 4 | DZ19: =DZ18+DZ13 -> 4 | EA19: =EA18+EA13 -> 4 | EB19: =EB18+EB13 -> 4 | EC19: =EC18+EC13 -> 2 | ED19: =ED18+ED13 -> 4 | EE19: =EE18+EE13 -> 0 | EF19: =EF18+EF13 -> 0 | EG19: =EG18+EG13 -> 4 | EH19: =EH18+EH13 -> 5 | EI19: =EI18+EI13 -> 4 | EJ19: =EJ18+EJ13 -> 0 | EK19: =EK18+EK13 -> 0 | EL19: =EL18+EL13 -> 0 | EM19: =EM18+EM13 -> 0 | EN19: =EN18+EN13 -> 0 | EO19: =EO18+EO13 -> 0
A21: Ave. Man Hours per Railcar | B21: =IF(OR(B8=0,B19=0),"NA",B8/B19) -> 8.3524999999999991 | C21: =IF(OR(C8=0,C19=0),"NA",C8/C19) -> 10.533333333333333 | D21: =IF(OR(D8=0,D19=0),"NA",D8/D19) -> 8.0225000000000009 | E21: =IF(OR(E8=0,E19=0),"NA",E8/E19) -> NA | F21: =IF(OR(F8=0,F19=0),"NA",F8/F19) -> 10.313333333333334 | G21: =IF(OR(G8=0,G19=0),"NA",G8/G19) -> 13.84 | H21: =IF(OR(H8=0,H19=0),"NA",H8/H19) -> 14.515555555555556 | I21: =IF(OR(I8=0,I19=0),"NA",I8/I19) -> 14.806666666666667 | J21: =IF(OR(J8=0,J19=0),"NA",J8/J19) -> 7.3552380952380947 | K21: =IF(OR(K8=0,K19=0),"NA",K8/K19) -> 10.806666666666667 | L21: =IF(OR(L8=0,L19=0),"NA",L8/L19) -> NA | M21: =IF(OR(M8=0,M19=0),"NA",M8/M19) -> 9.1050000000000004 | N21: =IF(OR(N8=0,N19=0),"NA",N8/N19) -> 7.0042857142857144 | O21: =IF(OR(O8=0,O19=0),"NA",O8/O19) -> 9.5777777777777775 | P21: =IF(OR(P8=0,P19=0),"NA",P8/P19) -> 7.62 | Q21: =IF(OR(Q8=0,Q19=0),"NA",Q8/Q19) -> 6.8071428571428569 | R21: =IF(OR(R8=0,R19=0),"NA",R8/R19) -> 8.019047619047619 | S21: =IF(OR(S8=0,S19=0),"NA",S8/S19) -> 9 | T21: =IF(OR(T8=0,T19=0),"NA",T8/T19) -> 8.7050000000000001 | U21: =IF(OR(U8=0,U19=0),"NA",U8/U19) -> 11.978333333333333 | V21: =IF(OR(V8=0,V19=0),"NA",V8/V19) -> 8.6 | W21: =IF(OR(W8=0,W19=0),"NA",W8/W19) -> 8.1006666666666671 | X21: =IF(OR(X8=0,X19=0),"NA",X8/X19) -> 7.6466666666666674 | Y21: =IF(OR(Y8=0,Y19=0),"NA",Y8/Y19) -> 7.1739999999999995 | Z21: =IF(OR(Z8=0,Z19=0),"NA",Z8/Z19) -> NA | AA21: =IF(OR(AA8=0,AA19=0),"NA",AA8/AA19) -> 7.2366666666666672 | AB21: =IF(OR(AB8=0,AB19=0),"NA",AB8/AB19) -> 8.2338888888888899 | AC21: =IF(OR(AC8=0,AC19=0),"NA",AC8/AC19) -> 8.2571428571428562 | AD21: =IF(OR(AD8=0,AD19=0),"NA",AD8/AD19) -> 7.8045833333333334 | AE21: =IF(OR(AE8=0,AE19=0),"NA",AE8/AE19) -> 4.85 | AF21: =IF(OR(AF8=0,AF19=0),"NA",AF8/AF19) -> 6.3439999999999994 | AG21: =IF(OR(AG8=0,AG19=0),"NA",AG8/AG19) -> NA | AH21: =IF(OR(AH8=0,AH19=0),"NA",AH8/AH19) -> 5.71 | AI21: =IF(OR(AI8=0,AI19=0),"NA",AI8/AI19) -> 5.8688888888888888 | AJ21: =IF(OR(AJ8=0,AJ19=0),"NA",AJ8/AJ19) -> 8.6374999999999993 | AK21: =IF(OR(AK8=0,AK19=0),"NA",AK8/AK19) -> 9.2260000000000009 | AL21: =IF(OR(AL8=0,AL19=0),"NA",AL8/AL19) -> 6.7474999999999996 | AM21: =IF(OR(AM8=0,AM19=0),"NA",AM8/AM19) -> 4.6212499999999999 | AN21: =IF(OR(AN8=0,AN19=0),"NA",AN8/AN19) -> 5.6 | AO21: =IF(OR(AO8=0,AO19=0),"NA",AO8/AO19) -> 4.86625 | AP21: =IF(OR(AP8=0,AP19=0),"NA",AP8/AP19) -> 7.7949999999999999 | AQ21: =IF(OR(AQ8=0,AQ19=0),"NA",AQ8/AQ19) -> 6.2 | AR21: =IF(OR(AR8=0,AR19=0),"NA",AR8/AR19) -> 8.1575000000000006 | AS21: =IF(OR(AS8=0,AS19=0),"NA",AS8/AS19) -> 8.4333333333333336 | AT21: =IF(OR(AT8=0,AT19=0),"NA",AT8/AT19) -> 8.25 | AU21: =IF(OR(AU8=0,AU19=0),"NA",AU8/AU19) -> 8.5824999999999996 | AV21: =IF(OR(AV8=0,AV19=0),"NA",AV8/AV19) -> 8.5425000000000004 | AW21: =IF(OR(AW8=0,AW19=0),"NA",AW8/AW19) -> 12.375 | AX21: =IF(OR(AX8=0,AX19=0),"NA",AX8/AX19) -> 6.166666666666667 | AY21: =IF(OR(AY8=0,AY19=0),"NA",AY8/AY19) -> 9.6766666666666676 | AZ21: =IF(OR(AZ8=0,AZ19=0),"NA",AZ8/AZ19) -> 14.975 | BA21: =IF(OR(BA8=0,BA19=0),"NA",BA8/BA19) -> 9.5449999999999999 | BB21: =IF(OR(BB8=0,BB19=0),"NA",BB8/BB19) -> 9.0124999999999993 | BC21: =IF(OR(BC8=0,BC19=0),"NA",BC8/BC19) -> 13.4 | BD21: =IF(OR(BD8=0,BD19=0),"NA",BD8/BD19) -> 9.0666666666666664 | BE21: =IF(OR(BE8=0,BE19=0),"NA",BE8/BE19) -> 8.1 | BF21: =IF(OR(BF8=0,BF19=0),"NA",BF8/BF19) -> 9.0666666666666664 | BG21: =IF(OR(BG8=0,BG19=0),"NA",BG8/BG19) -> 6.5750000000000002 | BH21: =IF(OR(BH8=0,BH19=0),"NA",BH8/BH19) -> 5.26 | BI21: =IF(OR(BI8=0,BI19=0),"NA",BI8/BI19) -> 8.7666666666666675 | BJ21: =IF(OR(BJ8=0,BJ19=0),"NA",BJ8/BJ19) -> 7.75 | BK21: =IF(OR(BK8=0,BK19=0),"NA",BK8/BK19) -> 6.3 | BL21: =IF(OR(BL8=0,BL19=0),"NA",BL8/BL19) -> 6 | BM21: =IF(OR(BM8=0,BM19=0),"NA",BM8/BM19) -> 15.333333333333334 | BN21: =IF(OR(BN8=0,BN19=0),"NA",BN8/BN19) -> 9.9450000000000003 | BO21: =IF(OR(BO8=0,BO19=0),"NA",BO8/BO19) -> 8.3214285714285712 | BP21: =IF(OR(BP8=0,BP19=0),"NA",BP8/BP19) -> 7.7857142857142856 | BQ21: =IF(OR(BQ8=0,BQ19=0),"NA",BQ8/BQ19) -> 8.7083333333333339 | BR21: =IF(OR(BR8=0,BR19=0),"NA",BR8/BR19) -> 3.3333333333333335 | BS21: =IF(OR(BS8=0,BS19=0),"NA",BS8/BS19) -> 7.873333333333334 | BT21: =IF(OR(BT8=0,BT19=0),"NA",BT8/BT19) -> 12.175000000000001 | BU21: =IF(OR(BU8=0,BU19=0),"NA",BU8/BU19) -> 15 | BV21: =IF(OR(BV8=0,BV19=0),"NA",BV8/BV19) -> 9.9142857142857146 | BW21: =IF(OR(BW8=0,BW19=0),"NA",BW8/BW19) -> 26.74 | BX21: =IF(OR(BX8=0,BX19=0),"NA",BX8/BX19) -> 12.33 | BY21: =IF(OR(BY8=0,BY19=0),"NA",BY8/BY19) -> NA | BZ21: =IF(OR(BZ8=0,BZ19=0),"NA",BZ8/BZ19) -> NA | CA21: =IF(OR(CA8=0,CA19=0),"NA",CA8/CA19) -> 11.826666666666666 | CB21: =IF(OR(CB8=0,CB19=0),"NA",CB8/CB19) -> 9.125 | CC21: =IF(OR(CC8=0,CC19=0),"NA",CC8/CC19) -> 5.9540000000000006 | CD21: =IF(OR(CD8=0,CD19=0),"NA",CD8/CD19) -> 7.6428571428571432 | CE21: =IF(OR(CE8=0,CE19=0),"NA",CE8/CE19) -> 8.65 | CF21: =IF(OR(CF8=0,CF19=0),"NA",CF8/CF19) -> NA | CG21: =IF(OR(CG8=0,CG19=0),"NA",CG8/CG19) -> NA | CH21: =IF(OR(CH8=0,CH19=0),"NA",CH8/CH19) -> 6.5916666666666659 | CI21: =IF(OR(CI8=0,CI19=0),"NA",CI8/CI19) -> 10.475 | CJ21: =IF(OR(CJ8=0,CJ19=0),"NA",CJ8/CJ19) -> 11.987500000000001 | CK21: =IF(OR(CK8=0,CK19=0),"NA",CK8/CK19) -> 7.7814285714285711 | CL21: =IF(OR(CL8=0,CL19=0),"NA",CL8/CL19) -> 10.416 | CM21: =IF(OR(CM8=0,CM19=0),"NA",CM8/CM19) -> NA | CN21: =IF(OR(CN8=0,CN19=0),"NA",CN8/CN19) -> NA | CO21: =IF(OR(CO8=0,CO19=0),"NA",CO8/CO19) -> 9.9583333333333339 | CP21: =IF(OR(CP8=0,CP19=0),"NA",CP8/CP19) -> 8.1624999999999996 | CQ21: =IF(OR(CQ8=0,CQ19=0),"NA",CQ8/CQ19) -> 6.9 | CR21: =IF(OR(CR8=0,CR19=0),"NA",CR8/CR19) -> 8.3166666666666664 | CS21: =IF(OR(CS8=0,CS19=0),"NA",CS8/CS19) -> 9.8333333333333339 | CT21: =IF(OR(CT8=0,CT19=0),"NA",CT8/CT19) -> 8.8 | CU21: =IF(OR(CU8=0,CU19=0),"NA",CU8/CU19) -> 6.48 | CV21: =IF(OR(CV8=0,CV19=0),"NA",CV8/CV19) -> 9.2833333333333332 | CW21: =IF(OR(CW8=0,CW19=0),"NA",CW8/CW19) -> 12.375 | CX21: =IF(OR(CX8=0,CX19=0),"NA",CX8/CX19) -> 11 | CY21: =IF(OR(CY8=0,CY19=0),"NA",CY8/CY19) -> NA | CZ21: =IF(OR(CZ8=0,CZ19=0),"NA",CZ8/CZ19) -> 8.0333333333333332 | DA21: =IF(OR(DA8=0,DA19=0),"NA",DA8/DA19) -> 7 | DB21: =IF(OR(DB8=0,DB19=0),"NA",DB8/DB19) -> 14.2 | DC21: =IF(OR(DC8=0,DC19=0),"NA",(DC8-DC5)/DC19) -> 7.5740000000000007 | DD21: =IF(OR(DD8=0,DD19=0),"NA",(DD8-DD5)/DD19) -> 8.11 | DE21: =IF(OR(DE8=0,DE19=0),"NA",(DE8-DE5)/DE19) -> 7.6 | DF21: =IF(OR(DF8=0,DF19=0),"NA",(DF8-DF5)/DF19) -> 7.3328571428571427 | DG21: =IF(OR(DG8=0,DG19=0),"NA",(DG8-DG5)/DG19) -> 9.3333333333333339 | DH21: =IF(OR(DH8=0,DH19=0),"NA",(DH8-DH5)/DH19) -> 13.4375 | DI21: =IF(OR(DI8=0,DI19=0),"NA",(DI8-DI5)/DI19) -> 6.8666666666666671 | DJ21: =IF(OR(DJ8=0,DJ19=0),"NA",(DJ8-DJ5)/DJ19) -> 10.96 | DK21: =IF(OR(DK8=0,DK19=0),"NA",(DK8-DK5)/DK19) -> 5.7437500000000004 | DL21: =IF(OR(DL8=0,DL19=0),"NA",(DL8-DL5)/DL19) -> 11.6 | DM21: =IF(OR(DM8=0,DM19=0),"NA",(DM8-DM5)/DM19) -> 7.43 | DN21: =IF(OR(DN8=0,DN19=0),"NA",(DN8-DN5)/DN19) -> 5.5814285714285718 | DO21: =IF(OR(DO8=0,DO19=0),"NA",(DO8-DO5)/DO19) -> 7.55 | DP21: =IF(OR(DP8=0,DP19=0),"NA",(DP8-DP5)/DP19) -> 15.8 | DQ21: =IF(OR(DQ8=0,DQ19=0),"NA",(DQ8-DQ5)/DQ19) -> 8.4385714285714304 | DR21: =IF(OR(DR8=0,DR19=0),"NA",(DR8-DR5)/DR19) -> 6.9033333333333333 | DS21: =IF(OR(DS8=0,DS19=0),"NA",(DS8-DS5)/DS19) -> 21.265000000000001 | DT21: =IF(OR(DT8=0,DT19=0),"NA",(DT8-DT5)/DT19) -> 4.90625 | DU21: =IF(OR(DU8=0,DU19=0),"NA",(DU8-DU5)/DU19) -> 3 | DV21: =IF(OR(DV8=0,DV19=0),"NA",(DV8-DV5)/DV19) -> 6.2 | DW21: =IF(OR(DW8=0,DW19=0),"NA",(DW8-DW5)/DW19) -> 8.58 | DX21: =IF(OR(DX8=0,DX19=0),"NA",(DX8-DX5)/DX19) -> 5.583333333333333 | DY21: =IF(OR(DY8=0,DY19=0),"NA",(DY8-DY5)/DY19) -> 5.07 | DZ21: =IF(OR(DZ8=0,DZ19=0),"NA",(DZ8-DZ5)/DZ19) -> 5.35 | EA21: =IF(OR(EA8=0,EA19=0),"NA",(EA8-EA5)/EA19) -> 2.04 | EB21: =IF(OR(EB8=0,EB19=0),"NA",(EB8-EB5)/EB19) -> 2.5625 | EC21: =IF(OR(EC8=0,EC19=0),"NA",(EC8-EC5)/EC19) -> 9.84 | ED21: =IF(OR(ED8=0,ED19=0),"NA",(ED8-ED5)/ED19) -> 6.1449999999999996 | EE21: =IF(OR(EE8=0,EE19=0),"NA",(EE8-EE5)/EE19) -> NA | EF21: =IF(OR(EF8=0,EF19=0),"NA",(EF8-EF5)/EF19) -> NA | EG21: =IF(OR(EG8=0,EG19=0),"NA",(EG8-EG5)/EG19) -> 5.64 | EH21: =IF(OR(EH8=0,EH19=0),"NA",(EH8-EH5)/EH19) -> 4.3 | EI21: =IF(OR(EI8=0,EI19=0),"NA",(EI8-EI5)/EI19) -> 2.6675 | EJ21: =IF(OR(EJ8=0,EJ19=0),"NA",(EJ8-EJ5)/EJ19) -> NA | EK21: =IF(OR(EK8=0,EK19=0),"NA",(EK8-EK5)/EK19) -> NA | EL21: =IF(OR(EL8=0,EL19=0),"NA",(EL8-EL5)/EL19) -> NA | EM21: =IF(OR(EM8=0,EM19=0),"NA",(EM8-EM5)/EM19) -> NA | EN21: =IF(OR(EN8=0,EN19=0),"NA",(EN8-EN5)/EN19) -> NA | EO21: =IF(OR(EO8=0,EO19=0),"NA",(EO8-EO5)/EO19) -> NA
A22: Total WHmen (excl. WC) | D22: 4 | E22: 0 | F22: 4 | G22: 4 | H22: 5 | I22: 5 | J22: 5 | K22: 4 | L22: 3 | M22: 5 | N22: 5 | O22: 5 | P22: 5 | Q22: 5 | T22: 5 | U22: 5 | V22: 5 | W22: 5 | X22: 5 | Y22: 4 | Z22: 0 | AA22: 4 | AB22: 4 | AC22: 4 | AD22: 4 | AE22: 4 | AF22: 4 | AG22: 0 | AH22: 4 | AI22: 4 | AJ22: 4 | AK22: 4 | AL22: 4 | AM22: 4 | AN22: 4 | AO22: 4 | AP22: 5 | AQ22: 4 | AR22: 4 | AS22: 4 | AT22: 4 | AU22: 5 | AV22: 5 | AW22: 5 | AX22: 4 | AY22: 4 | AZ22: 4 | BA22: 4 | BB22: 5 | BC22: 5 | BD22: 2 | BE22: =BE23-BE24+BE25 -> 3 | BF22: 3 | BG22: 2 | BH22: 3 | BI22: 2 | BJ22: 2 | BK22: =BK23+BK25 -> 2 | BL22: =BL23+BL25 -> 2 | BM22: =BM23+BM25 -> 6 | BN22: =BN23+BN25 -> 6 | BO22: =BO23+BO25 -> 6 | BP22: =BP23+BP25 -> 6 | BQ22: =BQ23+BQ25 -> 6 | BR22: =BR23+BR25 -> 1 | BS22: =BS23+BS25 -> 2 | BT22: =BT23+BT25 -> 5 | BU22: =BU23+BU25 -> 4 | BV22: =BV23+BV25 -> 6 | BW22: =BW23+BW25 -> 6 | BX22: =BX23+BX25 -> 3 | CA22: =CA23+CA25 -> 2 | CB22: =CB23+CB25 -> 5 | CC22: =CC23+CC25 -> 3 | CD22: =CD23+CD25 -> 5 | CE22: =CE23+CE25 -> 5 | CF22: =CF23+CF25 -> 1 | CG22: =CG23+CG25 -> 0 | CH22: =CH23+CH25 -> 4 | CI22: =CI23+CI25 -> 3 | CJ22: =CJ23+CJ25 -> 5 | CK22: =CK23+CK25 -> 5 | CL22: =CL23+CL25 -> 5 | CM22: =CM23+CM25 -> 0 | CN22: =CN23+CN25 -> 0 | CO22: =CO23+CO25 -> 5 | CP22: =CP23+CP25 -> 3 | CQ22: =CQ23+CQ25 -> 3 | CR22: =CR23+CR25 -> 5 | CS22: =CS23+CS25 -> 5 | CT22: =CT23+CT25 -> 2 | CU22: =CU23+CU25 -> 2 | CV22: =CV23+CV25 -> 4 | CW22: =CW23+CW25 -> 3 | CX22: =CX23+CX25 -> 3 | CY22: =CY23+CY25 -> 0 | CZ22: =CZ23+CZ25 -> 2 | DA22: =DA23+DA25 -> 2 | DB22: =DB23+DB25 -> 2 | DC22: =DC23+DC25 -> 3 | DD22: =DD23+DD25 -> 3 | DE22: =DE23+DE25 -> 5 | DF22: =DF23+DF25 -> 4 | DG22: =DG23+DG25 -> 2 | DH22: =DH23+DH25 -> 2 | DI22: =DI23+DI25 -> 2 | DJ22: =DJ23+DJ25 -> 5 | DK22: =DK23+DK25 -> 5 | DL22: =DL23+DL25 -> 7 | DM22: =DM23+DM25 -> 5 | DN22: =DN23+DN25 -> 3 | DO22: =DO23+DO25 -> 2 | DP22: =DP23+DP25 -> 2 | DQ22: =DQ23+DQ25 -> 5 | DR22: =DR23+DR25 -> 5 | DS22: =DS23+DS25 -> 5 | DT22: =DT23+DT25 -> 4 | DU22: =DU23+DU25 -> 2 | DV22: =DV23+DV25 -> 2 | DW22: =DW23+DW25 -> 2 | DX22: =DX23+DX25 -> 3 | DY22: =DY23+DY25 -> 3 | DZ22: =DZ23+DZ25 -> 3 | EA22: =EA23+EA25 -> 2 | EB22: =EB23+EB25 -> 2 | EC22: =EC23+EC25 -> 2 | ED22: =ED23+ED25 -> 2 | EE22: =EE23+EE25 -> 0 | EF22: =EF23+EF25 -> 0 | EG22: =EG23+EG25 -> 3 | EH22: =EH23+EH25 -> 3 | EI22: =EI23+EI25 -> 2 | EJ22: =EJ23+EJ25 -> 0 | EK22: =EK23+EK25 -> 0 | EL22: =EL23+EL25 -> 0 | EM22: =EM23+EM25 -> 0 | EN22: =EN23+EN25 -> 0 | EO22: =EO23+EO25 -> 0
A23: Budway WHmen | D23: 4 | E23: 0 | F23: 4 | G23: 4 | H23: 5 | I23: 5 | J23: 5 | K23: 4 | L23: 3 | M23: 5 | N23: 5 | O23: 5 | P23: 5 | Q23: 5 | T23: 5 | U23: 5 | V23: 5 | W23: 5 | X23: 5 | Y23: 4 | Z23: 0 | AA23: 4 | AB23: 4 | AC23: 4 | AD23: 4 | AE23: 4 | AF23: 4 | AG23: 0 | AH23: 4 | AI23: 4 | AJ23: 4 | AK23: 4 | AL23: 4 | AM23: 4 | AN23: 4 | AO23: 4 | AP23: 5 | AQ23: 4 | AR23: 4 | AS23: 4 | AT23: 4 | AU23: 5 | AV23: 5 | AW23: 5 | AX23: 4 | AY23: 4 | AZ23: 4 | BA23: 4 | BB23: 5 | BC23: 5 | BD23: 2 | BE23: 3 | BF23: 3 | BG23: 2 | BH23: 3 | BI23: 2 | BJ23: 2 | BK23: 2 | BL23: 2 | BM23: 4 | BN23: 4 | BO23: 4 | BP23: 4 | BQ23: 3 | BR23: 1 | BS23: 2 | BT23: 3 | BU23: 4 | BV23: 4 | BW23: 4 | BX23: 3 | CA23: 2 | CB23: 2 | CC23: 2 | CD23: 2 | CE23: 2 | CF23: 1 | CG23: 0 | CH23: 2 | CI23: 2 | CJ23: 3 | CK23: 3 | CL23: 3 | CM23: 0 | CN23: 0 | CO23: 3 | CP23: 3 | CQ23: 3 | CR23: 3 | CS23: 3 | CT23: 2 | CU23: 2 | CV23: 2 | CW23: 3 | CX23: 3 | CY23: 0 | CZ23: 2 | DA23: 2 | DB23: 2 | DC23: 3 | DD23: 3 | DE23: 3 | DF23: 2 | DG23: 2 | DH23: 2 | DI23: 2 | DJ23: 3 | DK23: 3 | DL23: 3 | DM23: 2 | DN23: 2 | DO23: 2 | DP23: 2 | DQ23: 3 | DR23: 3 | DS23: 3 | DT23: 2 | DU23: 2 | DV23: 2 | DW23: 2 | DX23: 3 | DY23: 3 | DZ23: 3 | EA23: 2 | EB23: 2 | EC23: 2 | ED23: 2 | EE23: 0 | EF23: 0 | EG23: 3 | EH23: 3 | EI23: 2
A24: Budway WHmen on WC | BK24: 0 | BL24: 0 | BM24: 0 | BN24: 0 | BO24: 1 | BP24: 1 | BQ24: 1 | BR24: 0 | BS24: 0 | BT24: 2 | BU24: 2 | BV24: 2 | BW24: 2 | BX24: 1 | CA24: 1 | CB24: 1 | CC24: 1 | CD24: 1 | CE24: 1 | CF24: 0 | CG24: 0 | CH24: 1 | CI24: 1 | CJ24: 1 | CK24: 1 | CL24: 0 | CM24: 0 | CN24: 0 | CO24: 1 | CP24: 1 | CQ24: 1 | CR24: 1 | CS24: 1 | CT24: 0 | CU24: 0 | CV24: 0 | CW24: 0 | CX24: 0 | CY24: 0 | CZ24: 0 | DA24: 0 | DB24: 0 | DC24: 0 | DD24: 0 | DE24: 0 | DF24: 0 | DG24: 0 | DH24: 0 | DI24: 0 | DJ24: 1 | DK24: 1 | DL24: 0 | DM24: 1 | DN24: 1 | DO24: 0 | DP24: 0 | DQ24: 1 | DR24: 1 | DS24: 1 | DT24: 1 | DU24: 1 | DV24: 0 | DW24: 0 | DX24: 1 | DY24: 1 | DZ24: 1 | EA24: 1 | EB24: 1 | EC24: 0 | ED24: 0 | EE24: 0 | EF24: 0 | EG24: 1 | EH24: 1 | EI24: 1
A25: Outside Labor | BK25: 0 | BL25: 0 | BM25: 2 | BN25: 2 | BO25: 2 | BP25: 2 | BQ25: 3 | BR25: 0 | BS25: 0 | BT25: 2 | BU25: 0 | BV25: 2 | BW25: 2 | BX25: 0 | CA25: 0 | CB25: 3 | CC25: 1 | CD25: 3 | CE25: 3 | CF25: 0 | CG25: 0 | CH25: 2 | CI25: 1 | CJ25: 2 | CK25: 2 | CL25: 2 | CM25: 0 | CN25: 0 | CO25: 2 | CP25: 0 | CQ25: 0 | CR25: 2 | CS25: 2 | CT25: 0 | CU25: 0 | CV25: 2 | CW25: 0 | CX25: 0 | CY25: 0 | CZ25: 0 | DA25: 0 | DB25: 0 | DC25: 0 | DD25: 0 | DE25: 2 | DF25: 2 | DG25: 0 | DH25: 0 | DI25: 0 | DJ25: 2 | DK25: 2 | DL25: 4 | DM25: 3 | DN25: 1 | DO25: 0 | DP25: 0 | DQ25: 2 | DR25: 2 | DS25: 2 | DT25: 2 | DU25: 0 | DV25: 0 | DW25: 0 | DX25: 0 | DY25: 0 | DZ25: 0 | EA25: 0 | EB25: 0 | EC25: 0 | ED25: 0 | EE25: 0 | EF25: 0 | EG25: 0 | EH25: 0 | EI25: 0
A26: Total Overtime Hours | D26: 1.42 | E26: 0.00 | F26: 3.67 | G26: 6.87 | H26: 3.03 | I26: 4.42 | J26: 8.93 | K26: 2.02 | L26: 0.00 | M26: 11.88 | N26: 10.52 | O26: 16.80 | P26: 5.72 | Q26: 11.37 | R26: 9.00 | S26: 0.00 | T26: 10.48 | U26: 10.58 | V26: 8.20 | W26: 5.67 | X26: 6.13 | Y26: 3.87 | Z26: 0.00 | AA26: 3.67 | AB26: 7.42 | AC26: 13.80 | AD26: 18.07 | AE26: 1.98 | AF26: 1.13 | AG26: 0.00 | AH26: 0.50 | AI26: 10.32 | AJ26: 2.55 | AK26: 4.63 | AL26: 8.98 | AM26: 4.97 | AN26: 0.00 | AO26: 6.93 | AP26: 1.68 | AQ26: 00.8 | AR26: 00.63 | AS26: 1.30 | AT26: 0.75 | AU26: 2.33 | AV26: 2.17 | AW26: 0.00 | AX26: 0.00 | AY26: 5.03 | AZ26: 4.75 | BA26: 4.68 | BB26: 4.05 | BC26: 6.00 | BD26: 0.50 | BE26: 0.00 | BF26: 0.00 | BG26: 3.00 | BH26: 10.50 | BI26: 0.00 | BJ26: 6.00 | BK26: 2.00 | BL26: 0.00 | BM26: 0.00 | BN26: 14.67 | BO26: 10.25 | BP26: 7.25 | BQ26: 4.25 | BR26: 0.00 | BS26: 3.42 | BT26: 7.05 | BU26: 6.50 | BV26: 5.50 | BW26: 1.58 | BX26: 5.02 | BY26: 0.00 | BZ26: 0.00 | CA26: 00.58 | CB26: 2.25 | CC26: 3.17 | CD26: 0.00 | CE26: 3.00 | CF26: 0.00 | CG26: 0.00 | CH26: 0.75 | CI26: 0.00 | CJ26: 0.25 | CK26: 00.67 | CL26: 00.58 | CM26: 0.00 | CN26: 0.00 | CO26: 0.25 | CP26: 1.75 | CQ26: 1.00 | CR26: 0.50 | CS26: 5.00 | CT26: 0.00 | CU26: 0.00 | CV26: 0.50 | CW26: 5.50 | CX26: 3.50 | CY26: 0.00 | CZ26: 0.00 | DA26: 5.00 | DB26: 0.00 | DC26: 5.67 | DD26: 4.75 | DE26: 5.00 | DF26: 1.67 | DG26: 3.00 | DH26: 0.00 | DI26: 1.00 | DJ26: 1.00 | DK26: 1.50 | DL26: 6.50 | DM26: 1.00 | DN26: 2.17 | DO26: 0.00 | DP26: 0.00 | DQ26: 2.00 | DR26: 00.17 | DS26: 0.00 | DT26: 1.75 | DU26: 0.00 | DV26: 1.00 | DW26: 0.00 | DX26: 0.00 | DY26: 0.00 | DZ26: 0.00 | EA26: 0.00 | EB26: 0.00 | EC26: 0.00 | ED26: 0.00 | EE26: 0.00 | EF26: 0.00 | EG26: 2.25 | EH26: 3.50 | EI26: 0.00
A28: Hours Budgeted MTD | AY28: =35 -> 35 | AZ28: =AY28+IF(OR(AZ2="sat",AZ2="sun"),28,35) -> 70 | BA28: =AZ28+IF(OR(BA2="sat",BA2="sun"),28,35) -> 105 | BB28: =BA28+IF(OR(BB2="sat",BB2="sun"),28,35) -> 140 | BC28: =BB28+IF(OR(BC2="sat",BC2="sun"),28,35) -> 175 | BD28: =BC28+IF(OR(BD2="sat",BD2="sun"),28,35) -> 203 | BE28: =BD28+IF(OR(BE2="sat",BE2="sun"),28,35) -> 231 | BF28: =BE28+IF(OR(BF2="sat",BF2="sun"),28,35) -> 266 | BG28: =BF28+IF(OR(BG2="sat",BG2="sun"),28,35) -> 301 | BH28: =BG28+IF(OR(BH2="sat",BH2="sun"),28,35) -> 336 | BI28: =BH28+IF(OR(BI2="sat",BI2="sun"),28,35) -> 371 | BJ28: =BI28+IF(OR(BJ2="sat",BJ2="sun"),28,35) -> 406 | BK28: =BJ28+IF(OR(BK2="sat",BK2="sun"),28,35) -> 434 | BL28: =BK28+IF(OR(BL2="sat",BL2="sun"),28,35) -> 462 | BM28: =BL28+IF(OR(BM2="sat",BM2="sun"),28,35) -> 497 | BN28: =BM28+IF(OR(BN2="sat",BN2="sun"),28,35) -> 532 | BO28: =BN28+IF(OR(BO2="sat",BO2="sun"),28,35) -> 567 | BP28: =BO28+IF(OR(BP2="sat",BP2="sun"),28,35) -> 602 | BQ28: =BP28+IF(OR(BQ2="sat",BQ2="sun"),28,35) -> 637 | BR28: =BQ28+IF(OR(BR2="sat",BR2="sun"),28,35) -> 665 | BS28: =BR28+IF(OR(BS2="sat",BS2="sun"),28,35) -> 693 | BT28: =BS28+IF(OR(BT2="sat",BT2="sun"),28,35) -> 728 | BU28: =BT28+IF(OR(BU2="sat",BU2="sun"),28,35) -> 763 | BV28: =BU28+IF(OR(BV2="sat",BV2="sun"),28,35) -> 798 | BW28: =BV28+IF(OR(BW2="sat",BW2="sun"),28,35) -> 833 | BX28: =BW28+IF(OR(BX2="sat",BX2="sun"),28,35) -> 868 | BY28: =BX28+IF(OR(BY2="sat",BY2="sun"),28,35) -> 896 | BZ28: =BY28+IF(OR(BZ2="sat",BZ2="sun"),28,35) -> 924 | CA28: =BZ28+IF(OR(CA2="sat",CA2="sun"),28,35) -> 959 | CB28: =CA28+IF(OR(CB2="sat",CB2="sun"),28,35) -> 994 | CC28: =CB28+IF(OR(CC2="sat",CC2="sun"),28,35) -> 1029 | CD28: =35 -> 35 | CE28: =CD28+IF(OR(CE2="sat",CE2="sun"),28,35) -> 70 | CF28: =CE28+IF(OR(CF2="sat",CF2="sun"),28,35) -> 98 | CG28: =CF28+IF(OR(CG2="sat",CG2="sun"),28,35) -> 126 | CH28: =CG28+IF(OR(CH2="sat",CH2="sun"),28,35) -> 161 | CI28: =CH28+IF(OR(CI2="sat",CI2="sun"),28,35) -> 196 | CJ28: =CI28+IF(OR(CJ2="sat",CJ2="sun"),28,35) -> 231 | CK28: =CJ28+IF(OR(CK2="sat",CK2="sun"),28,35) -> 266 | CL28: =CK28+IF(OR(CL2="sat",CL2="sun"),28,35) -> 301 | CM28: =CL28+IF(OR(CM2="sat",CM2="sun"),28,35) -> 329 | CN28: =CM28+IF(OR(CN2="sat",CN2="sun"),28,35) -> 357 | CO28: =CN28+IF(OR(CO2="sat",CO2="sun"),28,35) -> 392 | CP28: =CO28+IF(OR(CP2="sat",CP2="sun"),28,35) -> 427 | CQ28: =CP28+IF(OR(CQ2="sat",CQ2="sun"),28,35) -> 462 | CR28: =CQ28+IF(OR(CR2="sat",CR2="sun"),28,35) -> 497 | CS28: =CR28+IF(OR(CS2="sat",CS2="sun"),28,35) -> 532 | CT28: =CS28+IF(OR(CT2="sat",CT2="sun"),28,35) -> 560 | CU28: =CT28+IF(OR(CU2="sat",CU2="sun"),28,35) -> 588 | CV28: =CU28+IF(OR(CV2="sat",CV2="sun"),28,35) -> 623 | CW28: =CV28+IF(OR(CW2="sat",CW2="sun"),28,35) -> 658 | CX28: =CW28+IF(OR(CX2="sat",CX2="sun"),28,35) -> 693 | CY28: =CX28+IF(OR(CY2="sat",CY2="sun"),28,35) -> 728 | CZ28: =CY28+IF(OR(CZ2="sat",CZ2="sun"),28,35) -> 763 | DA28: =CZ28+IF(OR(DA2="sat",DA2="sun"),28,35) -> 791 | DB28: =DA28+IF(OR(DB2="sat",DB2="sun"),28,35) -> 819 | DC28: =IF(AND(DAY(DC3)=1,OR(DC2="sat",DC2="sun")),28,IF(DAY(DC3)=1,35,DB28+IF(OR(DC2="sat",DC2="sun"),28,35))) -> 854 | DD28: =IF(AND(DAY(DD3)=1,OR(DD2="sat",DD2="sun")),28,IF(DAY(DD3)=1,35,DC28+IF(OR(DD2="sat",DD2="sun"),28,35))) -> 889 | DE28: =IF(AND(DAY(DE3)=1,OR(DE2="sat",DE2="sun")),28,IF(DAY(DE3)=1,35,DD28+IF(OR(DE2="sat",DE2="sun"),28,35))) -> 924 | DF28: =IF(AND(DAY(DF3)=1,OR(DF2="sat",DF2="sun")),28,IF(DAY(DF3)=1,35,DE28+IF(OR(DF2="sat",DF2="sun"),28,35))) -> 959 | DG28: =IF(AND(DAY(DG3)=1,OR(DG2="sat",DG2="sun")),28,IF(DAY(DG3)=1,35,DF28+IF(OR(DG2="sat",DG2="sun"),28,35))) -> 994 | DH28: =IF(AND(DAY(DH3)=1,OR(DH2="sat",DH2="sun")),28,IF(DAY(DH3)=1,35,DG28+IF(OR(DH2="sat",DH2="sun"),28,35))) -> 28 | DI28: =IF(AND(DAY(DI3)=1,OR(DI2="sat",DI2="sun")),28,IF(DAY(DI3)=1,35,DH28+IF(OR(DI2="sat",DI2="sun"),28,35))) -> 56 | DJ28: =IF(AND(DAY(DJ3)=1,OR(DJ2="sat",DJ2="sun")),28,IF(DAY(DJ3)=1,35,DI28+IF(OR(DJ2="sat",DJ2="sun"),28,35))) -> 91 | DK28: =IF(AND(DAY(DK3)=1,OR(DK2="sat",DK2="sun")),28,IF(DAY(DK3)=1,35,DJ28+IF(OR(DK2="sat",DK2="sun"),28,35))) -> 126 | DL28: =IF(AND(DAY(DL3)=1,OR(DL2="sat",DL2="sun")),28,IF(DAY(DL3)=1,35,DK28+IF(OR(DL2="sat",DL2="sun"),28,35))) -> 161 | DM28: =IF(AND(DAY(DM3)=1,OR(DM2="sat",DM2="sun")),28,IF(DAY(DM3)=1,35,DL28+IF(OR(DM2="sat",DM2="sun"),28,35))) -> 196 | DN28: =IF(AND(DAY(DN3)=1,OR(DN2="sat",DN2="sun")),28,IF(DAY(DN3)=1,35,DM28+IF(OR(DN2="sat",DN2="sun"),28,35))) -> 231 | DO28: =IF(AND(DAY(DO3)=1,OR(DO2="sat",DO2="sun")),28,IF(DAY(DO3)=1,35,DN28+IF(OR(DO2="sat",DO2="sun"),28,35))) -> 259 | DP28: =IF(AND(DAY(DP3)=1,OR(DP2="sat",DP2="sun")),28,IF(DAY(DP3)=1,35,DO28+IF(OR(DP2="sat",DP2="sun"),28,35))) -> 287 | DQ28: =IF(AND(DAY(DQ3)=1,OR(DQ2="sat",DQ2="sun")),28,IF(DAY(DQ3)=1,35,DP28+IF(OR(DQ2="sat",DQ2="sun"),28,35))) -> 322 | DR28: =IF(AND(DAY(DR3)=1,OR(DR2="sat",DR2="sun")),28,IF(DAY(DR3)=1,35,DQ28+IF(OR(DR2="sat",DR2="sun"),28,35))) -> 357 | DS28: =IF(AND(DAY(DS3)=1,OR(DS2="sat",DS2="sun")),28,IF(DAY(DS3)=1,35,DR28+IF(OR(DS2="sat",DS2="sun"),28,35))) -> 392 | DT28: =IF(AND(DAY(DT3)=1,OR(DT2="sat",DT2="sun")),28,IF(DAY(DT3)=1,35,DS28+IF(OR(DT2="sat",DT2="sun"),28,35))) -> 427 | DU28: =IF(AND(DAY(DU3)=1,OR(DU2="sat",DU2="sun")),28,IF(DAY(DU3)=1,35,DT28+IF(OR(DU2="sat",DU2="sun"),28,35))) -> 462 | DV28: =IF(AND(DAY(DV3)=1,OR(DV2="sat",DV2="sun")),28,IF(DAY(DV3)=1,35,DU28+IF(OR(DV2="sat",DV2="sun"),28,35))) -> 490 | DW28: =IF(AND(DAY(DW3)=1,OR(DW2="sat",DW2="sun")),28,IF(DAY(DW3)=1,35,DV28+IF(OR(DW2="sat",DW2="sun"),28,35))) -> 518 | DX28: =IF(AND(DAY(DX3)=1,OR(DX2="sat",DX2="sun")),28,IF(DAY(DX3)=1,35,DW28+IF(OR(DX2="sat",DX2="sun"),28,35))) -> 553 | DY28: =IF(AND(DAY(DY3)=1,OR(DY2="sat",DY2="sun")),28,IF(DAY(DY3)=1,35,DX28+IF(OR(DY2="sat",DY2="sun"),28,35))) -> 588 | DZ28: =IF(AND(DAY(DZ3)=1,OR(DZ2="sat",DZ2="sun")),28,IF(DAY(DZ3)=1,35,DY28+IF(OR(DZ2="sat",DZ2="sun"),28,35))) -> 623 | EA28: =IF(AND(DAY(EA3)=1,OR(EA2="sat",EA2="sun")),28,IF(DAY(EA3)=1,35,DZ28+IF(OR(EA2="sat",EA2="sun"),28,35))) -> 658 | EB28: =IF(AND(DAY(EB3)=1,OR(EB2="sat",EB2="sun")),28,IF(DAY(EB3)=1,35,EA28+IF(OR(EB2="sat",EB2="sun"),28,35))) -> 693 | EC28: =IF(AND(DAY(EC3)=1,OR(EC2="sat",EC2="sun")),28,IF(DAY(EC3)=1,35,EB28+IF(OR(EC2="sat",EC2="sun"),28,35))) -> 721 | ED28: =IF(AND(DAY(ED3)=1,OR(ED2="sat",ED2="sun")),28,IF(DAY(ED3)=1,35,EC28+IF(OR(ED2="sat",ED2="sun"),28,35))) -> 749 | EE28: =IF(AND(DAY(EE3)=1,OR(EE2="sat",EE2="sun")),28,IF(DAY(EE3)=1,35,ED28+IF(OR(EE2="sat",EE2="sun"),28,35))) -> 784 | EF28: =IF(AND(DAY(EF3)=1,OR(EF2="sat",EF2="sun")),28,IF(DAY(EF3)=1,35,EE28+IF(OR(EF2="sat",EF2="sun"),28,35))) -> 819 | EG28: =IF(AND(DAY(EG3)=1,OR(EG2="sat",EG2="sun")),28,IF(DAY(EG3)=1,35,EF28+IF(OR(EG2="sat",EG2="sun"),28,35))) -> 854 | EH28: =IF(AND(DAY(EH3)=1,OR(EH2="sat",EH2="sun")),28,IF(DAY(EH3)=1,35,EG28+IF(OR(EH2="sat",EH2="sun"),28,35))) -> 889 | EI28: =IF(AND(DAY(EI3)=1,OR(EI2="sat",EI2="sun")),28,IF(DAY(EI3)=1,35,EH28+IF(OR(EI2="sat",EI2="sun"),28,35))) -> 924 | EK28: 952
A29: Hours Used MTD | AY29: =AY4+AY6+AY26/2 -> 31.545000000000002 | AZ29: =AZ4+AZ6+AY29+AZ26/2 -> 62.67 | BA29: =BA4+BA6+AZ29+BA26/2 -> 101.69 | BB29: =BB4+BB6+BA29+BB26/2 -> 139.76499999999999 | BC29: =BC4+BC6+BB29+BC26/2 -> 180.76499999999999 | BD29: =BD4+BD6+BC29+BD26/2 -> 196.51499999999999 | BE29: =BE4+BE6+BD29+BE26/2 -> 212.01499999999999 | BF29: =BF4+BF6+BE29+BF26/2 -> 227.51499999999999 | BG29: =BG4+BG6+BF29+BG26/2 -> 244.51499999999999 | BH29: =BH4+BH6+BG29+BH26/2 -> 265.26499999999999 | BI29: =BI4+BI6+BH29+BI26/2 -> 280.76499999999999 | BJ29: =BJ4+BJ6+BI29+BJ26/2 -> 299.26499999999999 | BK29: =BK4+BK6+BJ29+BK26/2 -> 318.26499999999999 | BL29: =BL4+BL6+BK29+BL26/2 -> 332.26499999999999 | BM29: =BM4+BM6+BL29+BM26/2 -> 370.26499999999999 | BN29: =BN4+BN6+BM29+BN26/2 -> 437.27 | BO29: =BO4+BO6+BN29+BO26/2 -> 500.64499999999998 | BP29: =BP4+BP6+BO29+BP26/2 -> 558.77 | BQ29: =BQ4+BQ6+BP29+BQ26/2 -> 613.14499999999998 | BR29: =BR4+BR6+BQ29+BR26/2 -> 620.14499999999998 | BS29: =BS4+BS6+BR29+BS26/2 -> 641.27499999999998 | BT29: =BT4+BT6+BS29+BT26/2 -> 693.85 | BU29: =BU4+BU6+BT29+BU26/2 -> 735.60 | BV29: =BV4+BV6+BU29+BV26/2 -> 789.85 | BW29: =BW4+BW6+BV29+BW26/2 -> 829.22 | BX29: =BX4+BX6+BW29+BX26/2 -> 860.75 | BY29: =BY4+BY6+BX29+BY26/2 -> 860.75 | BZ29: =BZ4+BZ6+BY29+BZ26/2 -> 860.75 | CA29: =CA4+CA6+BZ29+CA26/2 -> 877.62 | CB29: =CB4+CB6+CA29+CB26/2 -> 917.495 | CC29: =CC4+CC6+CB29+CC26/2 -> 946.25 | CD29: =CD4+CD6+CD26/2 -> 36.00 | CE29: =CE4+CE6+CD29+CE26/2 -> 78.90 | CF29: =CF4+CF6+CE29+CF26/2 -> 85.90 | CG29: =CG4+CG6+CF29+CG26/2 -> 85.90 | CH29: =CH4+CH6+CG29+CH26/2 -> 115.52500000000001 | CI29: =CI4+CI6+CH29+CI26/2 -> 140.52500000000001 | CJ29: =CJ4+CJ6+CI29+CJ26/2 -> 172.90 | CK29: =CK4+CK6+CJ29+CK26/2 -> 213.905 | CL29: =CL4+CL6+CK29+CL26/2 -> 253.77500000000001 | CM29: =CM4+CM6+CL29+CM26/2 -> 253.77500000000001 | CN29: =CN4+CN6+CM29+CN26/2 -> 253.77500000000001 | CO29: =CO4+CO6+CN29+CO26/2 -> 293.15 | CP29: =CP4+CP6+CO29+CP26/2 -> 319.77499999999998 | CQ29: =CQ4+CQ6+CP29+CQ26/2 -> 345.27499999999998 | CR29: =CR4+CR6+CQ29+CR26/2 -> 386.02499999999998 | CS29: =CS4+CS6+CR29+CS26/2 -> 432.52499999999998 | CT29: =CT4+CT6+CS29+CT26/2 -> 448.52499999999998 | CU29: =CU4+CU6+CT29+CU26/2 -> 463.52499999999998 | CV29: =CV4+CV6+CU29+CV26/2 -> 504.27499999999998 | CW29: =CW4+CW6+CV29+CW26/2 -> 544.52499999999998 | CX29: =CX4+CX6+CW29+CX26/2 -> 581.77499999999998 | CY29: =CY4+CY6+CX29+CY26/2 -> 581.77499999999998 | CZ29: =CZ4+CZ6+CY29+CZ26/2 -> 603.77499999999998 | DA29: =DA4+DA6+CZ29+DA26/2 -> 627.27499999999998 | DB29: =DB4+DB6+DA29+DB26/2 -> 640.27499999999998 | DC29: =IF(DAY(DC3)=1,0,DB29)+DC4+DC6+DC26/2 -> 680.78 | DD29: =IF(DAY(DD3)=1,0,DC29)+DD4+DD6+DD26/2 -> 719.90499999999997 | DE29: =IF(DAY(DE3)=1,0,DD29)+DE4+DE6+DE26/2 -> 777.40499999999997 | DF29: =IF(DAY(DF3)=1,0,DE29)+DF4+DF6+DF26/2 -> 819.07 | DG29: =IF(DAY(DG3)=1,0,DF29)+DG4+DG6+DG26/2 -> 847.57 | DH29: =IF(DAY(DH3)=1,0,DG29)+DH4+DH6+DH26/2 -> 16 | DI29: =IF(DAY(DI3)=1,0,DH29)+DI4+DI6+DI26/2 -> 33.5 | DJ29: =IF(DAY(DJ3)=1,0,DI29)+DJ4+DJ6+DJ26/2 -> 75 | DK29: =IF(DAY(DK3)=1,0,DJ29)+DK4+DK6+DK26/2 -> 116.95 | DL29: =IF(DAY(DL3)=1,0,DK29)+DL4+DL6+DL26/2 -> 182.7 | DM29: =IF(DAY(DM3)=1,0,DL29)+DM4+DM6+DM26/2 -> 220.2 | DN29: =IF(DAY(DN3)=1,0,DM29)+DN4+DN6+DN26/2 -> 243.45500000000001 | DO29: =IF(DAY(DO3)=1,0,DN29)+DO4+DO6+DO26/2 -> 255.45500000000001 | DP29: =IF(DAY(DP3)=1,0,DO29)+DP4+DP6+DP26/2 -> 268.45499999999998 | DQ29: =IF(DAY(DQ3)=1,0,DP29)+DQ4+DQ6+DQ26/2 -> 313.45499999999998 | DR29: =IF(DAY(DR3)=1,0,DQ29)+DR4+DR6+DR26/2 -> 352.71 | DS29: =IF(DAY(DS3)=1,0,DR29)+DS4+DS6+DS26/2 -> 392.71 | DT29: =IF(DAY(DT3)=1,0,DS29)+DT4+DT6+DT26/2 -> 429.33499999999998 | DU29: =IF(DAY(DU3)=1,0,DT29)+DU4+DU6+DU26/2 -> 444.83499999999998 | DV29: =IF(DAY(DV3)=1,0,DU29)+DV4+DV6+DV26/2 -> 462.33499999999998 | DW29: =IF(DAY(DW3)=1,0,DV29)+DW4+DW6+DW26/2 -> 475.33499999999998 | DX29: =IF(DAY(DX3)=1,0,DW29)+DX4+DX6+DX26/2 -> 499.33499999999998 | DY29: =IF(DAY(DY3)=1,0,DX29)+DY4+DY6+DY26/2 -> 523.33500000000004 | DZ29: =IF(DAY(DZ3)=1,0,DY29)+DZ4+DZ6+DZ26/2 -> 547.33500000000004 | EA29: =IF(DAY(EA3)=1,0,DZ29)+EA4+EA6+EA26/2 -> 563.33500000000004 | EB29: =IF(DAY(EB3)=1,0,EA29)+EB4+EB6+EB26/2 -> 579.33500000000004 | EC29: =IF(DAY(EC3)=1,0,EB29)+EC4+EC6+EC26/2 -> 593.33500000000004 | ED29: =IF(DAY(ED3)=1,0,EC29)+ED4+ED6+ED26/2 -> 609.33500000000004 | EE29: =IF(DAY(EE3)=1,0,ED29)+EE4+EE6+EE26/2 -> 609.33500000000004 | EF29: =IF(DAY(EF3)=1,0,EE29)+EF4+EF6+EF26/2 -> 609.33500000000004 | EG29: =IF(DAY(EG3)=1,0,EF29)+EG4+EG6+EG26/2 -> 636.71 | EH29: =IF(DAY(EH3)=1,0,EG29)+EH4+EH6+EH26/2 -> 665.96 | EI29: =IF(DAY(EI3)=1,0,EH29)+EI4+EI6+EI26/2 -> 681.96 | EK29: 822.96
A30: Balance MTD | AY30: =AY28-AY29 -> 3.4550000000000001 | AZ30: =AZ28-AZ29 -> 7.33 | BA30: =BA28-BA29 -> 3.31 | BB30: =BB28-BB29 -> 0.23499999999998522 | BC30: =BC28-BC29 -> -5.7650000000000148 | BD30: =BD28-BD29 -> 6.4849999999999852 | BE30: =BE28-BE29 -> 18.984999999999999 | BF30: =BF28-BF29 -> 38.484999999999999 | BG30: =BG28-BG29 -> 56.484999999999999 | BH30: =BH28-BH29 -> 70.734999999999999 | BI30: =BI28-BI29 -> 90.234999999999999 | BJ30: =BJ28-BJ29 -> 106.735 | BK30: =BK28-BK29 -> 115.735 | BL30: =BL28-BL29 -> 129.73500000000001 | BM30: =BM28-BM29 -> 126.735 | BN30: =BN28-BN29 -> 94.73 | BO30: =BO28-BO29 -> 66.355000000000004 | BP30: =BP28-BP29 -> 43.23 | BQ30: =BQ28-BQ29 -> 23.855 | BR30: =BR28-BR29 -> 44.854999999999997 | BS30: =BS28-BS29 -> 51.725000000000001 | BT30: =BT28-BT29 -> 34.150000000000091 | BU30: =BU28-BU29 -> 27.400000000000091 | BV30: =BV28-BV29 -> 8.1500000000000909 | BW30: =BW28-BW29 -> 3.7800000000000864 | BX30: =BX28-BX29 -> 7.2500000000001137 | BY30: =BY28-BY29 -> 35.250000000000114 | BZ30: =BZ28-BZ29 -> 63.250000000000114 | CA30: =CA28-CA29 -> 81.380000000000109 | CB30: =CB28-CB29 -> 76.505000000000109 | CC30: =CC28-CC29 -> 82.750000000000114 | CD30: =CD28-CD29 -> -1.00 | CE30: =CE28-CE29 -> -8.9000000000000057 | CF30: =CF28-CF29 -> 12.10 | CG30: =CG28-CG29 -> 40.10 | CH30: =CH28-CH29 -> 45.475000000000001 | CI30: =CI28-CI29 -> 55.475000000000001 | CJ30: =CJ28-CJ29 -> 58.10 | CK30: =CK28-CK29 -> 52.094999999999999 | CL30: =CL28-CL29 -> 47.225000000000001 | CM30: =CM28-CM29 -> 75.224999999999994 | CN30: =CN28-CN29 -> 103.22499999999999 | CO30: =CO28-CO29 -> 98.85 | CP30: =CP28-CP29 -> 107.22499999999999 | CQ30: =CQ28-CQ29 -> 116.72499999999999 | CR30: =CR28-CR29 -> 110.97499999999999 | CS30: =CS28-CS29 -> 99.474999999999994 | CT30: =CT28-CT29 -> 111.47499999999999 | CU30: =CU28-CU29 -> 124.47499999999999 | CV30: =CV28-CV29 -> 118.72499999999999 | CW30: =CW28-CW29 -> 113.47499999999999 | CX30: =CX28-CX29 -> 111.22499999999999 | CY30: =CY28-CY29 -> 146.22499999999999 | CZ30: =CZ28-CZ29 -> 159.22499999999999 | DA30: =DA28-DA29 -> 163.72499999999999 | DB30: =DB28-DB29 -> 178.72499999999999 | DC30: =DC28-DC29 -> 173.22 | DD30: =DD28-DD29 -> 169.095 | DE30: =DE28-DE29 -> 146.595 | DF30: =DF28-DF29 -> 139.93 | DG30: =DG28-DG29 -> 146.43 | DH30: =DH28-DH29 -> 12 | DI30: =DI28-DI29 -> 22.5 | DJ30: =DJ28-DJ29 -> 16 | DK30: =DK28-DK29 -> 9.05 | DL30: =DL28-DL29 -> -21.7 | DM30: =DM28-DM29 -> -24.2 | DN30: =DN28-DN29 -> -12.455 | DO30: =DO28-DO29 -> 3.5449999999999875 | DP30: =DP28-DP29 -> 18.545000000000002 | DQ30: =DQ28-DQ29 -> 8.5449999999999591 | DR30: =DR28-DR29 -> 4.2899999999999636 | DS30: =DS28-DS29 -> -0.71000000000003638 | DT30: =DT28-DT29 -> -2.3350000000000364 | DU30: =DU28-DU29 -> 17.164999999999999 | DV30: =DV28-DV29 -> 27.664999999999999 | DW30: =DW28-DW29 -> 42.664999999999999 | DX30: =DX28-DX29 -> 53.664999999999999 | DY30: =DY28-DY29 -> 64.665000000000006 | DZ30: =DZ28-DZ29 -> 75.665000000000006 | EA30: =EA28-EA29 -> 94.665000000000006 | EB30: =EB28-EB29 -> 113.66500000000001 | EC30: =EC28-EC29 -> 127.66500000000001 | ED30: =ED28-ED29 -> 139.66499999999999 | EE30: =EE28-EE29 -> 174.66499999999999 | EF30: =EF28-EF29 -> 209.66499999999999 | EG30: =EG28-EG29 -> 217.29 | EH30: =EH28-EH29 -> 223.04 | EI30: =EI28-EI29 -> 242.04 | EK30: 129.04
A32: Total Hours/Car MTD | AY32: =AY33/AY34 -> 9.6766666666666676 | AZ32: =AZ33/AZ34 -> 11.796000000000001 | BA32: =BA33/BA34 -> 10.795555555555556 | BB32: =BB33/BB34 -> 10.246923076923075 | BC32: =BC33/BC34 -> 10.838125 | BD32: =BD33/BD34 -> 10.558421052631576 | BE32: =BE33/BE34 -> 10.223181818181816 | BF32: =BF33/BF34 -> 10.084399999999999 | BG32: =BG33/BG34 -> 9.6003448275862056 | BH32: =BH33/BH34 -> 8.9620588235294107 | BI32: =BI33/BI34 -> 8.9462162162162162 | BJ32: =BJ33/BJ34 -> 8.8848717948717955 | BK32: =BK33/BK34 -> 8.7002380952380953 | BL32: =BL33/BL34 -> 8.5202222222222215 | BM32: =BM33/BM34 -> 8.946041666666666 | BN32: =BN33/BN34 -> 9.0570370370370359 | BO32: =BO33/BO34 -> 8.9726229508196713 | BP32: =BP33/BP34 -> 8.8504411764705875 | BQ32: =BQ33/BQ34 -> 8.8389189189189175 | BR32: =BR33/BR34 -> 8.6244155844155834 | BS32: =BS33/BS34 -> 8.5962499999999995 | BT32: =BT33/BT34 -> 8.845930232558139 | BU32: =BU33/BU34 -> 9.0533707865168527 | BV32: =BV33/BV34 -> 9.1161458333333325 | BW32: =BW33/BW34 -> 9.4758163265306106 | BX32: =BX33/BX34 -> 9.5877450980392158 | BY32: =BY33/BY34 -> 9.6093137254901961 | BZ32: =BZ33/BZ34 -> 9.6093137254901961 | CA32: =CA33/CA34 -> 9.6726666666666663 | CB32: =CB33/CB34 -> 9.6430630630630638 | CC32: =CC33/CC34 -> 9.484051724137931 | CD32: =CD33/CD34 -> 7.6428571428571432 | CE32: =CE33/CE34 -> 8.1076923076923073 | CF32: =CF33/CF34 -> 8.90 | CG32: =CG33/CG34 -> 8.90 | CH32: =CH33/CH34 -> 8.1710526315789469 | CI32: =CI33/CI34 -> 8.5717391304347821 | CJ32: =CJ33/CJ34 -> 9.0777777777777793 | CK32: =CK33/CK34 -> 8.8108823529411779 | CL32: =CL33/CL34 -> 9.0166666666666675 | CM32: =CM33/CM34 -> 9.0166666666666675 | CN32: =CN33/CN34 -> 9.0243589743589752 | CO32: =CO33/CO34 -> 9.1488888888888891 | CP32: =CP33/CP34 -> 9.0683673469387767 | CQ32: =CQ33/CQ34 -> 8.9047169811320757 | CR32: =CR33/CR34 -> 8.8449152542372893 | CS32: =CS33/CS34 -> 8.9361538461538466 | CT32: =CT33/CT34 -> 8.931111111111111 | CU32: =CU33/CU34 -> 8.8435714285714297 | CV32: =CV33/CV34 -> 8.8782894736842124 | CW32: =CW33/CW34 -> 9.0531249999999996 | CX32: =CX33/CX34 -> 9.1458333333333339 | CY32: =CY33/CY34 -> 9.1458333333333339 | CZ32: =CZ33/CZ34 -> 9.1074712643678168 | DA32: =DA33/DA34 -> 9.0372222222222245 | DB32: =DB33/DB34 -> 9.0939560439560463 | DC32: =DC33/DC34 -> 9.0147916666666692 | DD32: =DD33/DD34 -> 8.97 | DE32: =DE33/DE34 -> 8.8579090909090912 | DF32: =DF33/DF34 -> 8.7666666666666675 | DG32: =DG33/DG34 -> 8.7822111388196173 | DH32: =DH33/DH34 -> 13.4375 | DI32: =DI33/DI34 -> 9.1521739130434785 | DJ32: =DJ33/DJ34 -> 10.927083333333334 | DK32: =DK33/DK34 -> 9.0681818181818183 | DL32: =DL33/DL34 -> 9.7886178861788622 | DM32: =DM33/DM34 -> 9.6858108108108105 | DN32: =DN33/DN34 -> 9.1193989071038235 | DO32: =DO33/DO34 -> 9.0380829015544037 | DP32: =DP33/DP34 -> 9.2088383838383834 | DQ32: =DQ33/DQ34 -> 9.2718884120171676 | DR32: =DR33/DR34 -> 9.1585551330798491 | DS32: =DS33/DS34 -> 9.7516483516483525 | DT32: =DT33/DT34 -> 9.2602236421725248 | DU32: =DU33/DU34 -> 9.095884146341465 | DV32: =DV33/DV34 -> 8.96924198250729 | DW32: =DW33/DW34 -> 8.9582152974504261 | DX32: =DX33/DX34 -> 8.929347826086957 | DY32: =DY33/DY34 -> 8.8335051546391767 | DZ32: =DZ33/DZ34 -> 8.766911764705883 | EA32: =EA33/EA34 -> 8.5577102803738327 | EB32: =EB33/EB34 -> 8.3793526785714292 | EC32: =EC33/EC34 -> 8.4112445414847166 | ED32: =ED33/ED34 -> 8.31642259414226 | EE32: =EE33/EE34 -> 8.31642259414226 | EF32: =EF33/EF34 -> 8.31642259414226 | EG32: =EG33/EG34 -> 8.2917670682730922 | EH32: =EH33/EH34 -> 8.1869980879541107 | EI32: =EI33/EI34 -> 8.0573664825046034 | EK32: 8.0573664825046034
A33: Total Hours | AY33: =AY8 -> 29.03 | AZ33: =AZ8+AY33 -> 58.98 | BA33: =BA8+AZ33 -> 97.16 | BB33: =BB8+BA33 -> 133.21 | BC33: =BC8+BB33 -> 173.41 | BD33: =BD8+BC33 -> 200.61 | BE33: =BE8+BD33 -> 224.91 | BF33: =BF8+BE33 -> 252.11 | BG33: =BG8+BF33 -> 278.41 | BH33: =BH8+BG33 -> 304.71 | BI33: =BI8+BH33 -> 331.01 | BJ33: =BJ8+BI33 -> 346.51 | BK33: =BK8+BJ33 -> 365.41 | BL33: =BL8+BK33 -> 383.41 | BM33: =BM8+BL33 -> 429.41 | BN33: =BN8+BM33 -> 489.08 | BO33: =BO8+BN33 -> 547.33 | BP33: =BP8+BO33 -> 601.83 | BQ33: =BQ8+BP33 -> 654.08 | BR33: =BR8+BQ33 -> 664.08 | BS33: =BS8+BR33 -> 687.70 | BT33: =BT8+BS33 -> 760.75 | BU33: =BU8+BT33 -> 805.75 | BV33: =BV8+BU33 -> 875.15 | BW33: =BW8+BV33 -> 928.63 | BX33: =BX8+BW33 -> 977.95 | BY33: =BY8+BX33 -> 980.15 | BZ33: =BZ8+BY33 -> 980.15 | CA33: =CA8+BZ33 -> 1015.63 | CB33: =CB8+CA33 -> 1070.38 | CC33: =CC8+CB33 -> 1100.15 | CD33: =CD8 -> 53.50 | CE33: =CE8+CD33 -> 105.40 | CF33: =CF8+CE33 -> 115.70 | CG33: =CG8+CF33 -> 115.70 | CH33: =CH8+CG33 -> 155.25 | CI33: =CI8+CH33 -> 197.15 | CJ33: =CJ8+CI33 -> 245.10 | CK33: =CK8+CJ33 -> 299.57 | CL33: =CL8+CK33 -> 351.65 | CM33: =CM8+CL33 -> 351.65 | CN33: =CN8+CM33 -> 351.95 | CO33: =CO8+CN33 -> 411.70 | CP33: =CP8+CO33 -> 444.35 | CQ33: =CQ8+CP33 -> 471.95 | CR33: =CR8+CQ33 -> 521.85 | CS33: =CS8+CR33 -> 580.85 | CT33: =CT8+CS33 -> 602.85 | CU33: =CU8+CT33 -> 619.05 | CV33: =CV8+CU33 -> 674.75 | CW33: =CW8+CV33 -> 724.25 | CX33: =CX8+CW33 -> 768.25 | CY33: =CY8+CX33 -> 768.25 | CZ33: =CZ8+CY33 -> 792.35 | DA33: =DA8+CZ33 -> 813.35 | DB33: =DB8+DA33 -> 827.55 | DC33: =IF(DAY(DC3)=1,DC8-DC5,DC8-DC5+DB33) -> 865.42 | DD33: =IF(DAY(DD3)=1,DD8-DD5,DD8-DD5+DC33) -> 905.97 | DE33: =IF(DAY(DE3)=1,DE8-DE5,DE8-DE5+DD33) -> 974.37 | DF33: =IF(DAY(DF3)=1,DF8-DF5,DF8-DF5+DE33) -> 1025.70 | DG33: =IF(DAY(DG3)=1,DG8-DG5,DG8-DG5+DF33) -> 1056.50 | DH33: =IF(DAY(DH3)=1,DH8,DH8+DG33) -> 21.50 | DI33: =IF(DAY(DI3)=1,DI8,DI8+DH33) -> 42.10 | DJ33: =IF(DAY(DJ3)=1,DJ8,DJ8+DI33) -> 104.90 | DK33: =IF(DAY(DK3)=1,DK8,DK8+DJ33) -> 159.60 | DL33: =IF(DAY(DL3)=1,DL8,DL8+DK33) -> 240.80 | DM33: =IF(DAY(DM3)=1,DM8,DM8+DL33) -> 286.70 | DN33: =IF(DAY(DN3)=1,DN8,DN8+DM33) -> 333.77 | DO33: =IF(DAY(DO3)=1,DO8,DO8+DN33) -> 348.87 | DP33: =IF(DAY(DP3)=1,DP8,DP8+DO33) -> 364.67 | DQ33: =IF(DAY(DQ3)=1,DQ8,DQ8+DP33) -> 432.07 | DR33: =IF(DAY(DR3)=1,DR8,DR8+DQ33) -> 481.74 | DS33: =IF(DAY(DS3)=1,DS8,DS8+DR33) -> 532.44 | DT33: =IF(DAY(DT3)=1,DT8,DT8+DS33) -> 579.69 | DU33: =IF(DAY(DU3)=1,DU8,DU8+DT33) -> 596.69 | DV33: =IF(DAY(DV3)=1,DV8,DV8+DU33) -> 615.29 | DW33: =IF(DAY(DW3)=1,DW8,DW8+DV33) -> 632.45 | DX33: =IF(DAY(DX3)=1,DX8,DX8+DW33) -> 657.20 | DY33: =IF(DAY(DY3)=1,DY8,DY8+DX33) -> 685.48 | DZ33: =IF(DAY(DZ3)=1,DZ8,DZ8+DY33) -> 715.38 | EA33: =IF(DAY(EA3)=1,EA8,EA8+DZ33) -> 732.54 | EB33: =IF(DAY(EB3)=1,EB8,EB8+EA33) -> 750.79 | EC33: =IF(DAY(EC3)=1,EC8,EC8+EB33) -> 770.47 | ED33: =IF(DAY(ED3)=1,ED8,ED8+EC33) -> 795.05 | EE33: =IF(DAY(EE3)=1,EE8,EE8+ED33) -> 795.05 | EF33: =IF(DAY(EF3)=1,EF8,EF8+EE33) -> 795.05 | EG33: =IF(DAY(EG3)=1,EG8,EG8+EF33) -> 825.86 | EH33: =IF(DAY(EH3)=1,EH8,EH8+EG33) -> 856.36 | EI33: =IF(DAY(EI3)=1,EI8,EI8+EH33) -> 875.03 | EK33: 875.03
A34: Total Cars | AY34: =AY19 -> 3 | AZ34: =AZ19+AY34 -> 5 | BA34: =BA19+AZ34 -> 9 | BB34: =BB19+BA34 -> 13 | BC34: =BC19+BB34 -> 16 | BD34: =BD19+BC34 -> 19 | BE34: =BE19+BD34 -> 22 | BF34: =BF19+BE34 -> 25 | BG34: =BG19+BF34 -> 29 | BH34: =BH19+BG34 -> 34 | BI34: =BI19+BH34 -> 37 | BJ34: =BJ19+BI34 -> 39 | BK34: =BK19+BJ34 -> 42 | BL34: =BL19+BK34 -> 45 | BM34: =BM19+BL34 -> 48 | BN34: =BN19+BM34 -> 54 | BO34: =BO19+BN34 -> 61 | BP34: =BP19+BO34 -> 68 | BQ34: =BQ19+BP34 -> 74 | BR34: =BR19+BQ34 -> 77 | BS34: =BS19+BR34 -> 80 | BT34: =BT19+BS34 -> 86 | BU34: =BU19+BT34 -> 89 | BV34: =BV19+BU34 -> 96 | BW34: =BW19+BV34 -> 98 | BX34: =BX19+BW34 -> 102 | BY34: =BY19+BX34 -> 102 | BZ34: =BZ19+BY34 -> 102 | CA34: =CA19+BZ34 -> 105 | CB34: =CB19+CA34 -> 111 | CC34: =CC19+CB34 -> 116 | CD34: =CD19 -> 7 | CE34: =CE19+CD34 -> 13 | CF34: =CF19+CE34 -> 13 | CG34: =CG19+CF34 -> 13 | CH34: =CH19+CG34 -> 19 | CI34: =CI19+CH34 -> 23 | CJ34: =CJ19+CI34 -> 27 | CK34: =CK19+CJ34 -> 34 | CL34: =CL19+CK34 -> 39 | CM34: =CM19+CL34 -> 39 | CN34: =CN19+CM34 -> 39 | CO34: =CO19+CN34 -> 45 | CP34: =CP19+CO34 -> 49 | CQ34: =CQ19+CP34 -> 53 | CR34: =CR19+CQ34 -> 59 | CS34: =CS19+CR34 -> 65 | CT34: =CT19+CS34 -> 67.5 | CU34: =CU19+CT34 -> 70 | CV34: =CV19+CU34 -> 76 | CW34: =CW19+CV34 -> 80 | CX34: =CX19+CW34 -> 84 | CY34: =CY19+CX34 -> 84 | CZ34: =CZ19+CY34 -> 87 | DA34: =DA19+CZ34 -> 90 | DB34: =DB19+DA34 -> 91 | DC34: =IF(DAY(DC3)=1,DC19,DC19+DB34) -> 96.00 | DD34: =IF(DAY(DD3)=1,DD19,DD19+DC34) -> 101.00 | DE34: =IF(DAY(DE3)=1,DE19,DE19+DD34) -> 110.00 | DF34: =IF(DAY(DF3)=1,DF19,DF19+DE34) -> 117.00 | DG34: =IF(DAY(DG3)=1,DG19,DG19+DF34) -> 120.30 | DH34: =IF(DAY(DH3)=1,DH19,DH19+DG34) -> 1.60 | DI34: =IF(DAY(DI3)=1,DI19,DI19+DH34) -> 4.60 | DJ34: =IF(DAY(DJ3)=1,DJ19,DJ19+DI34) -> 9.60 | DK34: =IF(DAY(DK3)=1,DK19,DK19+DJ34) -> 17.60 | DL34: =IF(DAY(DL3)=1,DL19,DL19+DK34) -> 24.60 | DM34: =IF(DAY(DM3)=1,DM19,DM19+DL34) -> 29.60 | DN34: =IF(DAY(DN3)=1,DN19,DN19+DM34) -> 36.60 | DO34: =IF(DAY(DO3)=1,DO19,DO19+DN34) -> 38.60 | DP34: =IF(DAY(DP3)=1,DP19,DP19+DO34) -> 39.60 | DQ34: =IF(DAY(DQ3)=1,DQ19,DQ19+DP34) -> 46.60 | DR34: =IF(DAY(DR3)=1,DR19,DR19+DQ34) -> 52.60 | DS34: =IF(DAY(DS3)=1,DS19,DS19+DR34) -> 54.60 | DT34: =IF(DAY(DT3)=1,DT19,DT19+DS34) -> 62.60 | DU34: =IF(DAY(DU3)=1,DU19,DU19+DT34) -> 65.60 | DV34: =IF(DAY(DV3)=1,DV19,DV19+DU34) -> 68.60 | DW34: =IF(DAY(DW3)=1,DW19,DW19+DV34) -> 70.60 | DX34: =IF(DAY(DX3)=1,DX19,DX19+DW34) -> 73.60 | DY34: =IF(DAY(DY3)=1,DY19,DY19+DX34) -> 77.60 | DZ34: =IF(DAY(DZ3)=1,DZ19,DZ19+DY34) -> 81.60 | EA34: =IF(DAY(EA3)=1,EA19,EA19+DZ34) -> 85.60 | EB34: =IF(DAY(EB3)=1,EB19,EB19+EA34) -> 89.60 | EC34: =IF(DAY(EC3)=1,EC19,EC19+EB34) -> 91.60 | ED34: =IF(DAY(ED3)=1,ED19,ED19+EC34) -> 95.60 | EE34: =IF(DAY(EE3)=1,EE19,EE19+ED34) -> 95.60 | EF34: =IF(DAY(EF3)=1,EF19,EF19+EE34) -> 95.60 | EG34: =IF(DAY(EG3)=1,EG19,EG19+EF34) -> 99.60 | EH34: =IF(DAY(EH3)=1,EH19,EH19+EG34) -> 104.60 | EI34: =IF(DAY(EI3)=1,EI19,EI19+EH34) -> 108.60 | EK34: 108.6