A1: Fresno Fuel Consumption
A2: v. 2.20
B3: Tractors--Cardlock | G3: Trailers--Cardlock | L3: Tractors--Silva | Q3: Trailers--Silva | V3: Combined
A4: Date | B4: Gallons | C4: Cost | D4: Total | E4: Running Total | G4: Gallons | H4: Cost | I4: Total | J4: Running Total | L4: Gallons | M4: Cost | N4: Total | O4: Running Total | Q4: Gallons | R4: Cost | S4: Total | T4: Running Total | V4: Daily Fuel | W4: Running Total (Combined)
A5: 37987 | B5: 0 | C5: 0 | D5: =IF($A5<>"",B5*C5,"") -> 0 | E5: =IF($A5<>"",D5,"") -> 0 | G5: 0 | H5: 0 | I5: =IF($A5<>"",G5*H5,"") -> 0 | J5: =IF($A5<>"",I5,"") -> 0 | L5: 0 | M5: 0 | N5: =IF($A5<>"",L5*M5,"") -> 0 | O5: =IF($A5<>"",N5,"") -> 0 | Q5: 0 | R5: 0 | S5: =IF(A5<>"",Q5*R5,"") -> 0 | T5: =IF($A5<>"",S5,"") -> 0 | V5: =IF($A5<>"",D5+I5+N5+S5,"") -> 0 | W5: =IF($A5<>"",V5,"") -> 0
A6: 37988 | B6: 83 | C6: 1.69 | D6: =IF($A6<>"",B6*C6,"") -> 140.27 | E6: =IF($A6<>"",E5+D6,"") -> 140.27 | G6: 0 | H6: 0 | I6: =IF($A6<>"",G6*H6,"") -> 0 | J6: =IF($A6<>"",J5+I6,"") -> 0 | L6: 0 | M6: 0 | N6: =IF($A6<>"",L6*M6,"") -> 0 | O6: =IF($A6<>"",O5+N6,"") -> 0 | Q6: 0 | R6: 0 | S6: =IF(A6<>"",Q6*R6,"") -> 0 | T6: =IF($A6<>"",T5+S6,"") -> 0 | V6: =IF($A6<>"",D6+I6+N6+S6,"") -> 140.27 | W6: =IF($A6<>"",V6+W5,"") -> 140.27
A7: 37989 | B7: 60 | C7: 1.69 | D7: =IF($A7<>"",B7*C7,"") -> 101.4 | E7: =IF($A7<>"",E6+D7,"") -> 241.67 | G7: 73 | H7: 1.69 | I7: =IF($A7<>"",G7*H7,"") -> 123.37 | J7: =IF($A7<>"",J6+I7,"") -> 123.37 | L7: 0 | M7: 0 | N7: =IF($A7<>"",L7*M7,"") -> 0 | O7: =IF($A7<>"",O6+N7,"") -> 0 | Q7: 0 | R7: 0 | S7: =IF(A7<>"",Q7*R7,"") -> 0 | T7: =IF($A7<>"",T6+S7,"") -> 0 | V7: =IF($A7<>"",D7+I7+N7+S7,"") -> 224.77 | W7: =IF($A7<>"",V7+W6,"") -> 365.04
A8: 37990 | B8: 64 | C8: 1.69 | D8: =IF($A8<>"",B8*C8,"") -> 108.16 | E8: =IF($A8<>"",E7+D8,"") -> 349.83 | G8: 46 | H8: 1.69 | I8: =IF($A8<>"",G8*H8,"") -> 77.74 | J8: =IF($A8<>"",J7+I8,"") -> 201.11 | L8: 0 | M8: 0 | N8: =IF($A8<>"",L8*M8,"") -> 0 | O8: =IF($A8<>"",O7+N8,"") -> 0 | Q8: 0 | R8: 0 | S8: =IF(A8<>"",Q8*R8,"") -> 0 | T8: =IF($A8<>"",T7+S8,"") -> 0 | V8: =IF($A8<>"",D8+I8+N8+S8,"") -> 185.9 | W8: =IF($A8<>"",V8+W7,"") -> 550.94
A9: 37991 | B9: 323 | C9: 1.69 | D9: =IF($A9<>"",B9*C9,"") -> 545.87 | E9: =IF($A9<>"",E8+D9,"") -> 895.7 | G9: 0 | H9: 0 | I9: =IF($A9<>"",G9*H9,"") -> 0 | J9: =IF($A9<>"",J8+I9,"") -> 201.11 | L9: 0 | M9: 0 | N9: =IF($A9<>"",L9*M9,"") -> 0 | O9: =IF($A9<>"",O8+N9,"") -> 0 | Q9: 0 | R9: 0 | S9: =IF(A9<>"",Q9*R9,"") -> 0 | T9: =IF($A9<>"",T8+S9,"") -> 0 | V9: =IF($A9<>"",D9+I9+N9+S9,"") -> 545.87 | W9: =IF($A9<>"",V9+W8,"") -> 1096.81
A10: 37992 | B10: 125 | C10: 1.69 | D10: =IF($A10<>"",B10*C10,"") -> 211.25 | E10: =IF($A10<>"",E9+D10,"") -> 1106.95 | G10: 12 | H10: 1.69 | I10: =IF($A10<>"",G10*H10,"") -> 20.28 | J10: =IF($A10<>"",J9+I10,"") -> 221.39 | L10: 0 | M10: 0 | N10: =IF($A10<>"",L10*M10,"") -> 0 | O10: =IF($A10<>"",O9+N10,"") -> 0 | Q10: 0 | R10: 0 | S10: =IF(A10<>"",Q10*R10,"") -> 0 | T10: =IF($A10<>"",T9+S10,"") -> 0 | V10: =IF($A10<>"",D10+I10+N10+S10,"") -> 231.53 | W10: =IF($A10<>"",V10+W9,"") -> 1328.34
A11: 37993 | B11: 342 | C11: 1.69 | D11: =IF($A11<>"",B11*C11,"") -> 577.98 | E11: =IF($A11<>"",E10+D11,"") -> 1684.93 | G11: 28 | H11: 1.69 | I11: =IF($A11<>"",G11*H11,"") -> 47.32 | J11: =IF($A11<>"",J10+I11,"") -> 268.71 | L11: 0 | M11: 0 | N11: =IF($A11<>"",L11*M11,"") -> 0 | O11: =IF($A11<>"",O10+N11,"") -> 0 | Q11: 0 | R11: 0 | S11: =IF(A11<>"",Q11*R11,"") -> 0 | T11: =IF($A11<>"",T10+S11,"") -> 0 | V11: =IF($A11<>"",D11+I11+N11+S11,"") -> 625.3 | W11: =IF($A11<>"",V11+W10,"") -> 1953.64
A12: 37994 | B12: 97 | C12: 1.69 | D12: =IF($A12<>"",B12*C12,"") -> 163.93 | E12: =IF($A12<>"",E11+D12,"") -> 1848.86 | G12: 0 | H12: 0 | I12: =IF($A12<>"",G12*H12,"") -> 0 | J12: =IF($A12<>"",J11+I12,"") -> 268.71 | L12: 0 | M12: 0 | N12: =IF($A12<>"",L12*M12,"") -> 0 | O12: =IF($A12<>"",O11+N12,"") -> 0 | Q12: 0 | R12: 0 | S12: =IF(A12<>"",Q12*R12,"") -> 0 | T12: =IF($A12<>"",T11+S12,"") -> 0 | V12: =IF($A12<>"",D12+I12+N12+S12,"") -> 163.93 | W12: =IF($A12<>"",V12+W11,"") -> 2117.57
A13: 37995 | B13: 0 | C13: 0 | D13: =IF($A13<>"",B13*C13,"") -> 0 | E13: =IF($A13<>"",E12+D13,"") -> 1848.86 | G13: 0 | H13: 0 | I13: =IF($A13<>"",G13*H13,"") -> 0 | J13: =IF($A13<>"",J12+I13,"") -> 268.71 | L13: 0 | M13: 0 | N13: =IF($A13<>"",L13*M13,"") -> 0 | O13: =IF($A13<>"",O12+N13,"") -> 0 | Q13: 0 | R13: 0 | S13: =IF(A13<>"",Q13*R13,"") -> 0 | T13: =IF($A13<>"",T12+S13,"") -> 0 | V13: =IF($A13<>"",D13+I13+N13+S13,"") -> 0 | W13: =IF($A13<>"",V13+W12,"") -> 2117.57
A14: 37996 | B14: 139 | C14: 1.69 | D14: =IF($A14<>"",B14*C14,"") -> 234.91 | E14: =IF($A14<>"",E13+D14,"") -> 2083.77 | G14: 78 | H14: 1.69 | I14: =IF($A14<>"",G14*H14,"") -> 131.82 | J14: =IF($A14<>"",J13+I14,"") -> 400.53 | L14: 0 | M14: 0 | N14: =IF($A14<>"",L14*M14,"") -> 0 | O14: =IF($A14<>"",O13+N14,"") -> 0 | Q14: 0 | R14: 0 | S14: =IF(A14<>"",Q14*R14,"") -> 0 | T14: =IF($A14<>"",T13+S14,"") -> 0 | V14: =IF($A14<>"",D14+I14+N14+S14,"") -> 366.73 | W14: =IF($A14<>"",V14+W13,"") -> 2484.3
A15: 37997 | B15: 208 | C15: 1.69 | D15: =IF($A15<>"",B15*C15,"") -> 351.52 | E15: =IF($A15<>"",E14+D15,"") -> 2435.29 | G15: 0 | H15: 0 | I15: =IF($A15<>"",G15*H15,"") -> 0 | J15: =IF($A15<>"",J14+I15,"") -> 400.53 | L15: 0 | M15: 0 | N15: =IF($A15<>"",L15*M15,"") -> 0 | O15: =IF($A15<>"",O14+N15,"") -> 0 | Q15: 0 | R15: 0 | S15: =IF(A15<>"",Q15*R15,"") -> 0 | T15: =IF($A15<>"",T14+S15,"") -> 0 | V15: =IF($A15<>"",D15+I15+N15+S15,"") -> 351.52 | W15: =IF($A15<>"",V15+W14,"") -> 2835.82
A16: 37998 | B16: 229 | C16: 1.69 | D16: =IF($A16<>"",B16*C16,"") -> 387.01 | E16: =IF($A16<>"",E15+D16,"") -> 2822.3 | G16: 36 | H16: 1.69 | I16: =IF($A16<>"",G16*H16,"") -> 60.84 | J16: =IF($A16<>"",J15+I16,"") -> 461.37 | L16: 0 | M16: 0 | N16: =IF($A16<>"",L16*M16,"") -> 0 | O16: =IF($A16<>"",O15+N16,"") -> 0 | Q16: 0 | R16: 0 | S16: =IF(A16<>"",Q16*R16,"") -> 0 | T16: =IF($A16<>"",T15+S16,"") -> 0 | V16: =IF($A16<>"",D16+I16+N16+S16,"") -> 447.85 | W16: =IF($A16<>"",V16+W15,"") -> 3283.67
A17: 37999 | B17: 320 | C17: 1.69 | D17: =IF($A17<>"",B17*C17,"") -> 540.8 | E17: =IF($A17<>"",E16+D17,"") -> 3363.1 | G17: 57 | H17: 1.69 | I17: =IF($A17<>"",G17*H17,"") -> 96.33 | J17: =IF($A17<>"",J16+I17,"") -> 557.7 | L17: 0 | M17: 0 | N17: =IF($A17<>"",L17*M17,"") -> 0 | O17: =IF($A17<>"",O16+N17,"") -> 0 | Q17: 0 | R17: 0 | S17: =IF(A17<>"",Q17*R17,"") -> 0 | T17: =IF($A17<>"",T16+S17,"") -> 0 | V17: =IF($A17<>"",D17+I17+N17+S17,"") -> 637.13 | W17: =IF($A17<>"",V17+W16,"") -> 3920.8
A18: 38000 | B18: 226 | C18: 1.69 | D18: =IF($A18<>"",B18*C18,"") -> 381.94 | E18: =IF($A18<>"",E17+D18,"") -> 3745.04 | G18: 0 | H18: 0 | I18: =IF($A18<>"",G18*H18,"") -> 0 | J18: =IF($A18<>"",J17+I18,"") -> 557.7 | L18: 0 | M18: 0 | N18: =IF($A18<>"",L18*M18,"") -> 0 | O18: =IF($A18<>"",O17+N18,"") -> 0 | Q18: 0 | R18: 0 | S18: =IF(A18<>"",Q18*R18,"") -> 0 | T18: =IF($A18<>"",T17+S18,"") -> 0 | V18: =IF($A18<>"",D18+I18+N18+S18,"") -> 381.94 | W18: =IF($A18<>"",V18+W17,"") -> 4302.74
A19: 38001 | B19: 119 | C19: 1.69 | D19: =IF($A19<>"",B19*C19,"") -> 201.11 | E19: =IF($A19<>"",E18+D19,"") -> 3946.15 | G19: 41 | H19: 1.69 | I19: =IF($A19<>"",G19*H19,"") -> 69.29 | J19: =IF($A19<>"",J18+I19,"") -> 626.99 | L19: 0 | M19: 0 | N19: =IF($A19<>"",L19*M19,"") -> 0 | O19: =IF($A19<>"",O18+N19,"") -> 0 | Q19: 0 | R19: 0 | S19: =IF(A19<>"",Q19*R19,"") -> 0 | T19: =IF($A19<>"",T18+S19,"") -> 0 | V19: =IF($A19<>"",D19+I19+N19+S19,"") -> 270.4 | W19: =IF($A19<>"",V19+W18,"") -> 4573.14
A20: 38002 | B20: 161 | C20: 1.69 | D20: =IF($A20<>"",B20*C20,"") -> 272.09 | E20: =IF($A20<>"",E19+D20,"") -> 4218.24 | G20: 58 | H20: 1.69 | I20: =IF($A20<>"",G20*H20,"") -> 98.02 | J20: =IF($A20<>"",J19+I20,"") -> 725.01 | L20: 0 | M20: 0 | N20: =IF($A20<>"",L20*M20,"") -> 0 | O20: =IF($A20<>"",O19+N20,"") -> 0 | Q20: 0 | R20: 0 | S20: =IF(A20<>"",Q20*R20,"") -> 0 | T20: =IF($A20<>"",T19+S20,"") -> 0 | V20: =IF($A20<>"",D20+I20+N20+S20,"") -> 370.11 | W20: =IF($A20<>"",V20+W19,"") -> 4943.25
A21: 38003 | B21: 154 | C21: 1.69 | D21: =IF($A21<>"",B21*C21,"") -> 260.26 | E21: =IF($A21<>"",E20+D21,"") -> 4478.5 | G21: 0 | H21: 0 | I21: =IF($A21<>"",G21*H21,"") -> 0 | J21: =IF($A21<>"",J20+I21,"") -> 725.01 | L21: 0 | M21: 0 | N21: =IF($A21<>"",L21*M21,"") -> 0 | O21: =IF($A21<>"",O20+N21,"") -> 0 | Q21: 0 | R21: 0 | S21: =IF(A21<>"",Q21*R21,"") -> 0 | T21: =IF($A21<>"",T20+S21,"") -> 0 | V21: =IF($A21<>"",D21+I21+N21+S21,"") -> 260.26 | W21: =IF($A21<>"",V21+W20,"") -> 5203.51
A22: 38004 | B22: 61 | C22: 1.69 | D22: =IF($A22<>"",B22*C22,"") -> 103.09 | E22: =IF($A22<>"",E21+D22,"") -> 4581.59 | G22: 11 | H22: 1.69 | I22: =IF($A22<>"",G22*H22,"") -> 18.59 | J22: =IF($A22<>"",J21+I22,"") -> 743.6 | L22: 0 | M22: 0 | N22: =IF($A22<>"",L22*M22,"") -> 0 | O22: =IF($A22<>"",O21+N22,"") -> 0 | Q22: 0 | R22: 0 | S22: =IF(A22<>"",Q22*R22,"") -> 0 | T22: =IF($A22<>"",T21+S22,"") -> 0 | V22: =IF($A22<>"",D22+I22+N22+S22,"") -> 121.68 | W22: =IF($A22<>"",V22+W21,"") -> 5325.19
A23: 38005 | B23: 252 | C23: 1.69 | D23: =IF($A23<>"",B23*C23,"") -> 425.88 | E23: =IF($A23<>"",E22+D23,"") -> 5007.47 | G23: 0 | H23: 0 | I23: =IF($A23<>"",G23*H23,"") -> 0 | J23: =IF($A23<>"",J22+I23,"") -> 743.6 | L23: 0 | M23: 0 | N23: =IF($A23<>"",L23*M23,"") -> 0 | O23: =IF($A23<>"",O22+N23,"") -> 0 | Q23: 0 | R23: 0 | S23: =IF(A23<>"",Q23*R23,"") -> 0 | T23: =IF($A23<>"",T22+S23,"") -> 0 | V23: =IF($A23<>"",D23+I23+N23+S23,"") -> 425.88 | W23: =IF($A23<>"",V23+W22,"") -> 5751.07
A24: 38006 | B24: 212 | C24: 1.69 | D24: =IF($A24<>"",B24*C24,"") -> 358.28 | E24: =IF($A24<>"",E23+D24,"") -> 5365.75 | G24: 0 | H24: 0 | I24: =IF($A24<>"",G24*H24,"") -> 0 | J24: =IF($A24<>"",J23+I24,"") -> 743.6 | L24: 0 | M24: 0 | N24: =IF($A24<>"",L24*M24,"") -> 0 | O24: =IF($A24<>"",O23+N24,"") -> 0 | Q24: 0 | R24: 0 | S24: =IF(A24<>"",Q24*R24,"") -> 0 | T24: =IF($A24<>"",T23+S24,"") -> 0 | V24: =IF($A24<>"",D24+I24+N24+S24,"") -> 358.28 | W24: =IF($A24<>"",V24+W23,"") -> 6109.35
A25: 38007 | B25: 0 | C25: 0 | D25: =IF($A25<>"",B25*C25,"") -> 0 | E25: =IF($A25<>"",E24+D25,"") -> 5365.75 | G25: 58 | H25: 1.69 | I25: =IF($A25<>"",G25*H25,"") -> 98.02 | J25: =IF($A25<>"",J24+I25,"") -> 841.62 | L25: 0 | M25: 0 | N25: =IF($A25<>"",L25*M25,"") -> 0 | O25: =IF($A25<>"",O24+N25,"") -> 0 | Q25: 0 | R25: 0 | S25: =IF(A25<>"",Q25*R25,"") -> 0 | T25: =IF($A25<>"",T24+S25,"") -> 0 | V25: =IF($A25<>"",D25+I25+N25+S25,"") -> 98.02 | W25: =IF($A25<>"",V25+W24,"") -> 6207.37
A26: 38008 | B26: 0 | C26: 0 | D26: =IF($A26<>"",B26*C26,"") -> 0 | E26: =IF($A26<>"",E25+D26,"") -> 5365.75 | G26: 0 | H26: 0 | I26: =IF($A26<>"",G26*H26,"") -> 0 | J26: =IF($A26<>"",J25+I26,"") -> 841.62 | L26: 0 | M26: 0 | N26: =IF($A26<>"",L26*M26,"") -> 0 | O26: =IF($A26<>"",O25+N26,"") -> 0 | Q26: 0 | R26: 0 | S26: =IF(A26<>"",Q26*R26,"") -> 0 | T26: =IF($A26<>"",T25+S26,"") -> 0 | V26: =IF($A26<>"",D26+I26+N26+S26,"") -> 0 | W26: =IF($A26<>"",V26+W25,"") -> 6207.37
A27: 38009 | B27: 286 | C27: 1.69 | D27: =IF($A27<>"",B27*C27,"") -> 483.34 | E27: =IF($A27<>"",E26+D27,"") -> 5849.09 | G27: 0 | H27: 0 | I27: =IF($A27<>"",G27*H27,"") -> 0 | J27: =IF($A27<>"",J26+I27,"") -> 841.62 | L27: 0 | M27: 0 | N27: =IF($A27<>"",L27*M27,"") -> 0 | O27: =IF($A27<>"",O26+N27,"") -> 0 | Q27: 0 | R27: 0 | S27: =IF(A27<>"",Q27*R27,"") -> 0 | T27: =IF($A27<>"",T26+S27,"") -> 0 | V27: =IF($A27<>"",D27+I27+N27+S27,"") -> 483.34 | W27: =IF($A27<>"",V27+W26,"") -> 6690.71
A28: 38010 | B28: 72 | C28: 1.69 | D28: =IF($A28<>"",B28*C28,"") -> 121.68 | E28: =IF($A28<>"",E27+D28,"") -> 5970.77 | G28: 31 | H28: 1.69 | I28: =IF($A28<>"",G28*H28,"") -> 52.39 | J28: =IF($A28<>"",J27+I28,"") -> 894.01 | L28: 0 | M28: 0 | N28: =IF($A28<>"",L28*M28,"") -> 0 | O28: =IF($A28<>"",O27+N28,"") -> 0 | Q28: 0 | R28: 0 | S28: =IF(A28<>"",Q28*R28,"") -> 0 | T28: =IF($A28<>"",T27+S28,"") -> 0 | V28: =IF($A28<>"",D28+I28+N28+S28,"") -> 174.07 | W28: =IF($A28<>"",V28+W27,"") -> 6864.78
A29: 38011 | B29: 43 | C29: 1.69 | D29: =IF($A29<>"",B29*C29,"") -> 72.67 | E29: =IF($A29<>"",E28+D29,"") -> 6043.44 | G29: 30 | H29: 1.69 | I29: =IF($A29<>"",G29*H29,"") -> 50.7 | J29: =IF($A29<>"",J28+I29,"") -> 944.71 | L29: 0 | M29: 0 | N29: =IF($A29<>"",L29*M29,"") -> 0 | O29: =IF($A29<>"",O28+N29,"") -> 0 | Q29: 0 | R29: 0 | S29: =IF(A29<>"",Q29*R29,"") -> 0 | T29: =IF($A29<>"",T28+S29,"") -> 0 | V29: =IF($A29<>"",D29+I29+N29+S29,"") -> 123.37 | W29: =IF($A29<>"",V29+W28,"") -> 6988.15
A30: 38012 | D30: =IF($A30<>"",B30*C30,"") -> 0 | E30: =IF($A30<>"",E29+D30,"") -> 6043.44 | I30: =IF($A30<>"",G30*H30,"") -> 0 | J30: =IF($A30<>"",J29+I30,"") -> 944.71 | L30: 0 | M30: 0 | N30: =IF($A30<>"",L30*M30,"") -> 0 | O30: =IF($A30<>"",O29+N30,"") -> 0 | Q30: 0 | R30: 0 | S30: =IF(A30<>"",Q30*R30,"") -> 0 | T30: =IF($A30<>"",T29+S30,"") -> 0 | V30: =IF($A30<>"",D30+I30+N30+S30,"") -> 0 | W30: =IF($A30<>"",V30+W29,"") -> 6988.15
A31: 38013 | D31: =IF($A31<>"",B31*C31,"") -> 0 | E31: =IF($A31<>"",E30+D31,"") -> 6043.44 | I31: =IF($A31<>"",G31*H31,"") -> 0 | J31: =IF($A31<>"",J30+I31,"") -> 944.71 | L31: 0 | M31: 0 | N31: =IF($A31<>"",L31*M31,"") -> 0 | O31: =IF($A31<>"",O30+N31,"") -> 0 | Q31: 0 | R31: 0 | S31: =IF(A31<>"",Q31*R31,"") -> 0 | T31: =IF($A31<>"",T30+S31,"") -> 0 | V31: =IF($A31<>"",D31+I31+N31+S31,"") -> 0 | W31: =IF($A31<>"",V31+W30,"") -> 6988.15
A32: 38014 | D32: =IF($A32<>"",B32*C32,"") -> 0 | E32: =IF($A32<>"",E31+D32,"") -> 6043.44 | I32: =IF($A32<>"",G32*H32,"") -> 0 | J32: =IF($A32<>"",J31+I32,"") -> 944.71 | L32: 0 | M32: 0 | N32: =IF($A32<>"",L32*M32,"") -> 0 | O32: =IF($A32<>"",O31+N32,"") -> 0 | Q32: 0 | R32: 0 | S32: =IF(A32<>"",Q32*R32,"") -> 0 | T32: =IF($A32<>"",T31+S32,"") -> 0 | V32: =IF($A32<>"",D32+I32+N32+S32,"") -> 0 | W32: =IF($A32<>"",V32+W31,"") -> 6988.15
A33: 38015 | D33: =IF($A33<>"",B33*C33,"") -> 0 | E33: =IF($A33<>"",E32+D33,"") -> 6043.44 | I33: =IF($A33<>"",G33*H33,"") -> 0 | J33: =IF($A33<>"",J32+I33,"") -> 944.71 | L33: 0 | M33: 0 | N33: =IF($A33<>"",L33*M33,"") -> 0 | O33: =IF($A33<>"",O32+N33,"") -> 0 | Q33: 0 | R33: 0 | S33: =IF(A33<>"",Q33*R33,"") -> 0 | T33: =IF($A33<>"",T32+S33,"") -> 0 | V33: =IF($A33<>"",D33+I33+N33+S33,"") -> 0 | W33: =IF($A33<>"",V33+W32,"") -> 6988.15
A34: 38016 | D34: =IF($A34<>"",B34*C34,"") -> 0 | E34: =IF($A34<>"",E33+D34,"") -> 6043.44 | I34: =IF($A34<>"",G34*H34,"") -> 0 | J34: =IF($A34<>"",J33+I34,"") -> 944.71 | L34: 0 | M34: 0 | N34: =IF($A34<>"",L34*M34,"") -> 0 | O34: =IF($A34<>"",O33+N34,"") -> 0 | Q34: 0 | R34: 0 | S34: =IF(A34<>"",Q34*R34,"") -> 0 | T34: =IF($A34<>"",T33+S34,"") -> 0 | V34: =IF($A34<>"",D34+I34+N34+S34,"") -> 0 | W34: =IF($A34<>"",V34+W33,"") -> 6988.15
A35: 38017 | D35: =IF(A35<>"",B35*C35,"") -> 0 | E35: =IF(A35<>"",D35+E34,"") -> 6043.44 | I35: =IF($A35<>"",G35*H35,"") -> 0 | J35: =IF($A35<>"",J34+I35,"") -> 944.71 | L35: 0 | M35: 0 | N35: =IF(A35<>"",L35*M35,"") -> 0 | O35: =IF(A35<>"",N35+O34,"") -> 0 | Q35: 0 | R35: 0 | S35: =IF(A35<>"",Q35*R35,"") -> 0 | T35: =IF(A35<>"",S35+T34,"") -> 0 | V35: =IF($A35<>"",D35+I35+N35+S35,"") -> 0 | W35: =IF(A35<>"",V35+W34,"") -> 6988.15