A1: Fresno Weekly Workload Schedule
A2: v. 3.10 | B2: Sat | C2: Sun | D2: Mon | E2: Tues | F2: Wed | G2: Thurs | H2: Fri | I2: Sat | J2: Sun | K2: Total
B3: 37996 | C3: 37997 | D3: 37998 | E3: 37999 | F3: 38000 | G3: 38001 | H3: 38002 | I3: 38003 | J3: 38004
A5: Pickup Cheese Drums
A6: KRAFT - Tulare | K6: =SUM(D6:J6) -> 0
A7: KRAFT - Hilmar | K7: =SUM(D7:J7) -> 0
A8: Hilmar Cheese - Hilmar | D8: 4 | E8: 4 | F8: 4 | H8: 4 | K8: =SUM(D8:J8) -> 16
A9: Hilmar Cheese - Americold Turlock | K9: =SUM(D9:J9) -> 0
A10: Subtotal | B10: =SUM(B6:B9) -> 0 | C10: =SUM(C6:C9) -> 0 | D10: =SUM(D6:D9) -> 4 | E10: =SUM(E6:E9) -> 4 | F10: =SUM(F6:F9) -> 4 | G10: =SUM(G6:G9) -> 0 | H10: =SUM(H6:H9) -> 4 | I10: =SUM(I6:I9) -> 0 | J10: =SUM(J6:J9) -> 0 | K10: =SUM(K6:K9) -> 16 | L10: (Mon-Sun)
A12: Pickup Cheese Boxes
A13: KRAFT - Hilmar | K13: =SUM(D13:J13) -> 0
A14: KRAFT - DCCA Tulare | K14: =SUM(D14:J14) -> 0
A15: Hilmar Cheese - Turlock HCC #2 | K15: =SUM(D15:J15) -> 0
A16: Hilmar Cheese - Hilmar | K16: =SUM(D16:J16) -> 0
A17: Subtotal | B17: =SUM(B13:B16) -> 0 | C17: =SUM(C13:C16) -> 0 | D17: =SUM(D13:D16) -> 0 | E17: =SUM(E13:E16) -> 0 | F17: =SUM(F13:F16) -> 0 | G17: =SUM(G13:G16) -> 0 | H17: =SUM(H13:H16) -> 0 | I17: =SUM(I13:I16) -> 0 | J17: =SUM(J13:J16) -> 0 | K17: =SUM(K13:K16) -> 0 | L17: (Mon-Sun)
A19: Pickup Whey Powder
A20: Kraft-Tulare -Jacoby | B20: 3 | F20: 2 | G20: 1 | K20: =SUM(D20:J20) -> 3
K21: =SUM(D21:J21) -> 0
A22: Subtotal | B22: =SUM(B20:B21) -> 3 | C22: =SUM(C20:C21) -> 0 | D22: =SUM(D20:D21) -> 0 | E22: =SUM(E20:E21) -> 0 | F22: =SUM(F20:F21) -> 2 | G22: =SUM(G20:G21) -> 1 | H22: =SUM(H20:H21) -> 0 | I22: =SUM(I20:I21) -> 0 | J22: =SUM(J20:J21) -> 0 | K22: =SUM(K20:K21) -> 3 | L22: (Mon-Sun)
A24: Pickup Cheese Cases
A25: LEPRINO-LEMOORE EAST | B25: 12 | C25: 12 | D25: 8 | E25: 8 | G25: 8 | H25: 8 | I25: 12 | J25: 12 | K25: =SUM(D25:J25) -> 56
A26: LEPRINO-LEMOORE WEST | E26: 4 | F26: 8 | G26: 4 | K26: =SUM(D26:J26) -> 16
A27: Subtotal | B27: =SUM(B25:B26) -> 12 | C27: =SUM(C25:C26) -> 12 | D27: =SUM(D25:D26) -> 8 | E27: =SUM(E25:E26) -> 12 | F27: =SUM(F25:F26) -> 8 | G27: =SUM(G25:G26) -> 12 | H27: =SUM(H25:H26) -> 8 | I27: =SUM(I25:I26) -> 12 | J27: =SUM(J25:J26) -> 12 | K27: =SUM(K25:K26) -> 72 | L27: (Mon-Sun)
A29: Pickup Raisin Totes
A30: Sunmaid Raisins | F30: 3 | H30: 3 | K30: =SUM(D30:J30) -> 6
A31: Subtotal | B31: =B30 -> 0 | C31: =C30 -> 0 | D31: =D30 -> 0 | E31: =E30 -> 0 | F31: =F30 -> 3 | G31: =G30 -> 0 | H31: =H30 -> 3 | I31: =I30 -> 0 | J31: =J30 -> 0 | K31: =K30 -> 6 | L31: (Mon-Sun)
A33: Pickup Cheese cases
A34: Leprino- Tracy- being delivered | F34: 4 | K34: =SUM(D34:J34) -> 4
K35: =SUM(D35:J35) -> 0
A36: Subtotal | B36: =SUM(B34:B35) -> 0 | C36: =SUM(C34:C35) -> 0 | D36: =SUM(D34:D35) -> 0 | E36: =SUM(E34:E35) -> 0 | F36: =SUM(F34:F35) -> 4 | G36: =SUM(G34:G35) -> 0 | H36: =SUM(H34:H35) -> 0 | I36: =SUM(I34:I35) -> 0 | J36: =SUM(J34:J35) -> 0 | K36: =SUM(K34:K35) -> 4 | L36: (Mon-Sun)
A38: Pickup Other | K38: =SUM(D38:J38) -> 0
A40: Total Pickup Truckloads | B40: =B10+B17+B22+B27+B31+B36+B38 -> 15 | C40: =C10+C17+C22+C27+C31+C36+C38 -> 12 | D40: =D10+D17+D22+D27+D31+D36+D38 -> 12 | E40: =E10+E17+E22+E27+E31+E36+E38 -> 16 | F40: =F10+F17+F22+F27+F31+F36+F38 -> 21 | G40: =G10+G17+G22+G27+G31+G36+G38 -> 13 | H40: =H10+H17+H22+H27+H31+H36+H38 -> 15 | I40: =I10+I17+I22+I27+I31+I36+I38 -> 12 | J40: =J10+J17+J22+J27+J31+J36+J38 -> 12 | K40: =K10+K17+K22+K27+K31+K36+K38 -> 101 | L40: (Mon-Sun)
A42: Delivering Truckloads
A43: KRAFT - Tulare (192 drums) | K43: =SUM(D43:J43) -> 0
A44: Golden Valley - Tulare (192 drums) | K44: =SUM(D44:J44) -> 0
A45: Hilmar Cheese - Hilmar (192 drums) | K45: =SUM(D45:J45) -> 0
A46: Hilmar Cheese - Hilmar (360 box pieces) | D46: 1 | E46: 2 | F46: 1 | K46: =SUM(D46:J46) -> 4
A47: Sunmaid - Kingsburg (169 boxes) | K47: =SUM(D47:J47) -> 0
A48: DCCA - Tulare (360 boxes) | K48: =SUM(D48:J48) -> 0
A49: Total Delivering Truckloads | B49: =SUM(B43:B48) -> 0 | C49: =SUM(C43:C48) -> 0 | D49: =SUM(D43:D48) -> 1 | E49: =SUM(E43:E48) -> 2 | F49: =SUM(F43:F48) -> 1 | G49: =SUM(G43:G48) -> 0 | H49: =SUM(H43:H48) -> 0 | I49: =SUM(I43:I48) -> 0 | J49: =SUM(J43:J48) -> 0 | K49: =SUM(K43:K48) -> 4 | L49: (Mon-Sun)
A51: Est. Inbound Railcars to Remain Even | B51: =(B43+B44+B45)/3+B46+B48+B47/2.5 -> 0.0 | C51: =(C43+C44+C45)/3+C46+C48+C47/2.5 -> 0.0 | D51: =(D43+D44+D45)/3+D46+D48+D47/2.5 -> 1.0 | E51: =(E43+E44+E45)/3+E46+E48+E47/2.5 -> 2.0 | F51: =(F43+F44+F45)/3+F46+F48+F47/2.5 -> 1.0 | G51: =(G43+G44+G45)/3+G46+G48+G47/2.5 -> 0.0 | H51: =(H43+H44+H45)/3+H46+H48+H47/2.5 -> 0.0 | I51: =(I43+I44+I45)/3+I46+I48+I47/2.5 -> 0.0 | J51: =(J43+J44+J45)/3+J46+J48+J47/2.5 -> 0.0 | K51: =SUM(D51:J51) -> 4.0 | L51: (Mon-Sun)
A53: Total Pickup and Delivering Truckloads | B53: =B40+B49 -> 15 | C53: =C40+C49 -> 12 | D53: =D40+D49 -> 13 | E53: =E40+E49 -> 18 | F53: =F40+F49 -> 22 | G53: =G40+G49 -> 13 | H53: =H40+H49 -> 15 | I53: =I40+I49 -> 12 | J53: =J40+J49 -> 12 | K53: =SUM(D53:J53) -> 105 | L53: (Mon-Sun)
A55: Inbound Railcars (Empty Drums/Boxes) | B55: 0.0 | C55: 0.0 | D55: 0.0 | E55: 0.0 | F55: 0.0 | G55: 0.0 | H55: 0.0 | I55: 0.0 | J55: 0.0 | K55: =SUM(D55:J55) -> 0.0 | L55: (Mon-Sun)
A56: Estimated Outbound Railcars | B56: =B40/3 -> 5.0 | C56: =C40/3 -> 4.0 | D56: =D40/3 -> 4.0 | E56: =E40/3 -> 5.333333333333333 | F56: =F40/3 -> 7.0 | G56: =G40/3 -> 4.333333333333333 | H56: =H40/3 -> 5.0 | I56: =I40/3 -> 4.0 | J56: =J40/3 -> 4.0 | K56: =K40/3 -> 33.666666666666664 | L56: (Mon-Sun)
A57: Total Railcars | B57: =B55+B56 -> 5.0 | C57: =C55+C56 -> 4.0 | D57: =D55+D56 -> 4.0 | E57: =E55+E56 -> 5.333333333333333 | F57: =F55+F56 -> 7.0 | G57: =G55+G56 -> 4.333333333333333 | H57: =H55+H56 -> 5.0 | I57: =I55+I56 -> 4.0 | J57: =J55+J56 -> 4.0 | K57: =K55+K56 -> 33.666666666666664 | L57: (Mon-Sun)
A60: WAREHOUSE LABOR REQUIREMENTS
A61: Hours Allowed | B61: =B57*8 -> 40.00 | C61: =C57*8 -> 32.00 | D61: =D57*8 -> 32.00 | E61: =E57*8 -> 42.666666666666664 | F61: =F57*8 -> 56.00 | G61: =G57*8 -> 34.666666666666664 | H61: =H57*8 -> 40.00 | I61: =I57*8 -> 32.00 | J61: =J57*8 -> 32.00 | K61: =K57*8 -> 269.33333333333331
A62: Number of Warehousemen Needed | B62: =ROUND(B61/8,0) -> 5 | C62: =ROUND(C61/8,0) -> 4 | D62: =ROUND(D61/8,0) -> 4 | E62: =ROUND(E61/8,0) -> 5 | F62: =ROUND(F61/8,0) -> 7 | G62: =ROUND(G61/8,0) -> 4 | H62: =ROUND(H61/8,0) -> 5 | I62: =ROUND(I61/8,0) -> 4 | J62: =ROUND(J61/8,0) -> 4 | K62: =SUM(D62:J62) -> 33
A63: Schedule to Use | B63: =IF(B56>=5,"5 a.m. & 8 a.m.","8 a.m. only") -> 5 a.m. & 8 a.m. | C63: =IF(C56>=5,"5 a.m. & 8 a.m.","8 a.m. only") -> 8 a.m. only | D63: =IF(D56>=5,"5 a.m. & 8 a.m.","8 a.m. only") -> 8 a.m. only | E63: =IF(E56>=5,"5 a.m. & 8 a.m.","8 a.m. only") -> 5 a.m. & 8 a.m. | F63: =IF(F56>=5,"5 a.m. & 8 a.m.","8 a.m. only") -> 5 a.m. & 8 a.m. | G63: =IF(G56>=5,"5 a.m. & 8 a.m.","8 a.m. only") -> 8 a.m. only | H63: =IF(H56>=5,"5 a.m. & 8 a.m.","8 a.m. only") -> 5 a.m. & 8 a.m. | I63: =IF(I56>=5,"5 a.m. & 8 a.m.","8 a.m. only") -> 8 a.m. only | J63: =IF(J56>=5,"5 a.m. & 8 a.m.","8 a.m. only") -> 8 a.m. only