A1: Overtime Hours 2005
B3: Week Ending | F3: Week Ending | J3: Week Ending | N3: Week Ending
B4: 38359 | C4: 38366 | D4: 38373 | E4: 38380 | F4: 38387 | G4: 38394 | H4: 38401 | I4: 38408 | J4: 38415 | K4: 38422 | L4: 38429 | M4: 38436 | N4: 38443 | O4: 38450 | P4: 38457 | Q4: 38464 | R4: 38471
A5: Fontana Warehouse
A6: First Shift
A7: Alexander, Dwan | C7: 4.00 | D7: 5.00 | E7: 2.00 | F7: 1.75 | G7: 0.25 | H7: 0.00 | I7: 0.25 | J7: 1.00 | K7: 1.00 | L7: 0.00 | M7: 2.50 | N7: 8.00 | O7: 0.00
A8: Asta, Walter | B8: 3.00 | C8: 18.50 | D8: 11.00 | E8: 5.50 | F8: 9.50 | G8: 15.75 | H8: 10.75 | I8: 1.25 | J8: 2.50 | K8: 2.50 | L8: 2.50 | M8: 2.25 | N8: 3.50 | O8: 5.00
A9: Castillo, Carlos | B9: 8.50 | C9: 12.50 | D9: 2.75 | E9: 10.50 | F9: 3.75 | G9: 7.25 | H9: 0.00 | I9: 4.50 | J9: 2.25 | K9: 1.00 | L9: 1.25 | M9: 5.00 | N9: 4.00 | O9: 2.25
A10: Fraijo, Christina | B10: 11.50 | C10: 21.75 | D10: 17.50 | E10: 4.00 | F10: 1.00 | G10: 9.00 | H10: 3.00 | I10: 3.00 | J10: 0.25 | K10: 1.50 | L10: 1.75 | M10: 0.25 | N10: 1.50 | O10: 0.00
A11: Golden, Anthony | B11: 5.50 | C11: 5.25
A12: Pedroza, Frank | B12: 2.25 | C12: 0.50 | D12: 16.00 | E12: 4.00 | F12: 0.00 | G12: 5.25 | H12: 3.00 | I12: 2.00 | J12: 3.75 | K12: 3.25 | L12: 0.75 | M12: 0.75 | N12: 1.00 | O12: 0.00
A13: Soloman, Ryan | B13: 12.50 | C13: 5.75 | D13: 5.00 | E13: 5.00 | F13: 3.50 | G13: 4.50 | H13: 0.25 | I13: 0.00 | J13: 0.25 | K13: 0.75 | L13: 0.25 | M13: 0.00 | N13: 0.25 | O13: 3.00
A14: Vindiola, Edward | B14: 12.00 | C14: 10.00 | D14: 10.50 | E14: 5.50 | F14: 15.00 | G14: 14.25 | H14: 9.00 | I14: 22.00 | J14: 7.50 | K14: 10.50 | L14: 8.50 | M14: 5.00 | N14: 9.50 | O14: 7.25
A15: Zepeda, Carlos | E15: 0.00
A17: Love, Jim | G17: 2.50 | H17: 2.00 | I17: 0.25
A18: Lucero, Juan | E18: 6.50 | F18: 9.00 | G18: 5.25 | H18: 3.00 | I18: 3.00 | J18: 2.75 | K18: 1.00
A19: Perez, Daniel | J19: 2.25 | K19: 1.25
A20: Silva, Anthony | B20: 0.00 | C20: 2.75 | D20: 1.25 | E20: 7.75 | F20: 8.25 | G20: 11.00
A22: Second Shift
A23: Lewis, Micheal | E23: 14.25 | F23: 8.75 | G23: 1.25 | H23: 2.25 | I23: 5.25 | J23: 1.50 | K23: 1.25
A24: Asta, Louis | B24: 11.25 | C24: 5.00 | D24: 10.00 | E24: 7.25 | F24: 15.50 | G24: 10.00 | H24: 11.00 | I24: 14.00 | J24: 9.25 | K24: 10.50 | L24: 10.75 | M24: 10.00 | N24: 12.00 | O24: 9.50
A25: Loredo, Richard | B25: 10.25 | C25: 0.50 | D25: 6.00 | E25: 9.00 | F25: 15.00 | G25: 10.25 | H25: 1.00 | I25: 4.00 | J25: 9.00 | K25: 0.25 | L25: 2.50 | M25: 0.75 | N25: 3.50 | O25: 1.25
A26: Oseguera, Benjamin | B26: 7.50 | C26: 6.25 | D26: 6.75 | E26: 9.50 | F26: 10.00 | G26: 12.50 | H26: 4.50 | I26: 19.00 | J26: 2.75 | K26: 5.00 | L26: 2.75 | M26: 1.00 | N26: 3.50 | O26: 1.25
A27: Perez, Jesse | E27: 0.00 | F27: 3.25 | G27: 7.25 | H27: 2.00 | I27: 5.00 | J27: 0.75 | K27: 1.25 | L27: 1.00 | M27: 1.00 | N27: 4.25 | O27: 0.00
A28: Rangel, Juan | B28: 0.75 | C28: 0.25 | D28: 5.50 | E28: 8.00 | F28: 9.00 | G28: 8.25 | H28: 2.25 | I28: 13.00 | J28: 1.25 | K28: 1.75 | L28: 1.50 | M28: 0.50 | N28: 2.25 | O28: 0.25
A30: TOTAL | B30: =SUM(B6:B28) -> 85.00 | C30: =SUM(C6:C28) -> 93.00 | D30: =SUM(D6:D28) -> 97.25 | E30: =SUM(E6:E28) -> 98.75 | F30: =SUM(F6:F28) -> 113.25 | G30: =SUM(G6:G28) -> 124.50 | H30: =SUM(H6:H28) -> 54.00 | I30: =SUM(I6:I28) -> 96.50 | J30: =SUM(J6:J28) -> 47.00 | K30: =SUM(K6:K28) -> 42.75 | L30: =SUM(L6:L28) -> 33.50 | M30: =SUM(M6:M28) -> 29.00 | N30: =SUM(N6:N28) -> 53.25 | O30: =SUM(O6:O28) -> 29.75
A31: AVERAGE | B31: =B30/COUNT(B6:B28) -> 7.083333333333333 | C31: =C30/COUNT(C6:C28) -> 7.1538461538461542 | D31: =D30/COUNT(D6:D28) -> 8.1041666666666661 | E31: =E30/COUNT(E6:E28) -> 6.171875 | F31: =F30/COUNT(F6:F28) -> 7.55 | G31: =G30/COUNT(G6:G28) -> 7.78125 | H31: =H30/COUNT(H6:H28) -> 3.60 | I31: =I30/COUNT(I6:I28) -> 6.4333333333333336 | J31: =J30/COUNT(J6:J28) -> 3.1333333333333333 | K31: =K30/COUNT(K6:K28) -> 2.85 | L31: =L30/COUNT(L6:L28) -> 2.7916666666666665 | M31: =M30/COUNT(M6:M28) -> 2.4166666666666665 | N31: =N30/COUNT(N6:N28) -> 4.4375 | O31: =O30/COUNT(O6:O28) -> 2.4791666666666665
A33: Joplin, Paul | B33: 4.50 | C33: 4.00 | D33: 14.00 | E33: 8.25 | F33: 3.75 | G33: 1.50 | H33: 4.00 | I33: 1.25 | J33: 0.00 | K33: 3.50 | L33: 4.00 | M33: 2.50 | N33: 4.00 | O33: 6.50
A34: Soto, Gustavo | B34: 4.50 | C34: 4.00 | D34: 14.00 | E34: 8.50 | F34: 3.50 | G34: 9.75 | H34: 4.00 | I34: 1.25 | J34: 0.75 | K34: 3.50 | L34: 4.00 | M34: 2.50 | N34: 4.00 | O34: 8.25
A36: Hurley, Cheryl | B36: 0.00 | C36: 17.00 | D36: 20.00 | E36: 13.50 | F36: 18.50 | G36: 7.25 | H36: 16.50 | I36: 11.75 | J36: 12.00 | K36: 11.50 | L36: 11.00 | M36: 7.50 | N36: 10.25 | O36: 11.00
A37: Keding, Matt | B37: 8.75 | C37: 16.00 | D37: 13.25 | E37: 11.50 | F37: 12.50 | G37: 8.25 | H37: 11.50 | I37: 11.00 | J37: 11.00 | K37: 10.25 | L37: 8.00 | M37: 4.50 | N37: 8.00 | O37: 12.00
A38: Miranda, Michael | B38: 18.00 | C38: 11.50 | D38: 9.50 | E38: 8.75 | F38: 9.50 | G38: 15.50 | H38: 8.25 | I38: 4.25 | J38: 1.50 | K38: 1.25 | L38: 4.00 | M38: 3.00
A39: Mulligan, Martha | B39: 5.25 | C39: 10.25 | D39: 3.00 | E39: 1.00 | F39: 0.00 | G39: 0.25 | H39: 1.00 | I39: 5.50 | J39: 7.00 | K39: 12.50 | L39: 9.75 | M39: 7.50 | N39: 8.00 | O39: 6.00
A40: Wilson, Cassandra | B40: 5.00 | C40: 17.75 | D40: 7.75 | E40: 6.00 | F40: 6.75 | G40: 4.00 | H40: 7.00 | I40: 7.50