A1: Richmond Daily Labor Report
A2: v. 4.10 | B2: =CHOOSE(WEEKDAY(B3,2),"Mon","Tue","Wed","Thur","Fri","Sat","Su") -> Sat | C2: =CHOOSE(WEEKDAY(C3,2),"Mon","Tue","Wed","Thur","Fri","Sat","Su") -> Su | D2: =CHOOSE(WEEKDAY(D3,2),"Mon","Tue","Wed","Thur","Fri","Sat","Su") -> Mon | E2: =CHOOSE(WEEKDAY(E3,2),"Mon","Tue","Wed","Thur","Fri","Sat","Su") -> Tue | F2: =CHOOSE(WEEKDAY(F3,2),"Mon","Tue","Wed","Thur","Fri","Sat","Su") -> Wed | G2: =CHOOSE(WEEKDAY(G3,2),"Mon","Tue","Wed","Thur","Fri","Sat","Su") -> Thur | H2: =CHOOSE(WEEKDAY(H3,2),"Mon","Tue","Wed","Thur","Fri","Sat","Su") -> Fri | I2: =CHOOSE(WEEKDAY(I3,2),"Mon","Tue","Wed","Thur","Fri","Sat","Su") -> Sat | J2: =CHOOSE(WEEKDAY(J3,2),"Mon","Tue","Wed","Thur","Fri","Sat","Su") -> Su | K2: =CHOOSE(WEEKDAY(K3,2),"Mon","Tue","Wed","Thur","Fri","Sat","Su") -> Mon | L2: =CHOOSE(WEEKDAY(L3,2),"Mon","Tue","Wed","Thur","Fri","Sat","Su") -> Tue | M2: =CHOOSE(WEEKDAY(M3,2),"Mon","Tue","Wed","Thur","Fri","Sat","Su") -> Wed | N2: =CHOOSE(WEEKDAY(N3,2),"Mon","Tue","Wed","Thur","Fri","Sat","Su") -> Thur | O2: =CHOOSE(WEEKDAY(O3,2),"Mon","Tue","Wed","Thur","Fri","Sat","Su") -> Fri | P2: =CHOOSE(WEEKDAY(P3,2),"Mon","Tue","Wed","Thur","Fri","Sat","Su") -> Sat | Q2: =CHOOSE(WEEKDAY(Q3,2),"Mon","Tue","Wed","Thur","Fri","Sat","Su") -> Su | R2: =CHOOSE(WEEKDAY(R3,2),"Mon","Tue","Wed","Thur","Fri","Sat","Su") -> Mon | S2: =CHOOSE(WEEKDAY(S3,2),"Mon","Tue","Wed","Thur","Fri","Sat","Su") -> Tue | T2: =CHOOSE(WEEKDAY(T3,2),"Mon","Tue","Wed","Thur","Fri","Sat","Su") -> Wed | U2: =CHOOSE(WEEKDAY(U3,2),"Mon","Tue","Wed","Thur","Fri","Sat","Su") -> Thur | V2: =CHOOSE(WEEKDAY(V3,2),"Mon","Tue","Wed","Thur","Fri","Sat","Su") -> Fri | W2: =CHOOSE(WEEKDAY(W3,2),"Mon","Tue","Wed","Thur","Fri","Sat","Su") -> Sat | X2: =CHOOSE(WEEKDAY(X3,2),"Mon","Tue","Wed","Thur","Fri","Sat","Su") -> Su | Y2: =CHOOSE(WEEKDAY(Y3,2),"Mon","Tue","Wed","Thur","Fri","Sat","Su") -> Mon | Z2: =CHOOSE(WEEKDAY(Z3,2),"Mon","Tue","Wed","Thur","Fri","Sat","Su") -> Tue | AA2: =CHOOSE(WEEKDAY(AA3,2),"Mon","Tue","Wed","Thur","Fri","Sat","Su") -> Wed | AB2: =CHOOSE(WEEKDAY(AB3,2),"Mon","Tue","Wed","Thur","Fri","Sat","Su") -> Thur | AC2: =CHOOSE(WEEKDAY(AC3,2),"Mon","Tue","Wed","Thur","Fri","Sat","Su") -> Fri | AD2: =CHOOSE(WEEKDAY(AD3,2),"Mon","Tue","Wed","Thur","Fri","Sat","Su") -> Sat | AE2: =CHOOSE(WEEKDAY(AE3,2),"Mon","Tue","Wed","Thur","Fri","Sat","Su") -> Su | AF2: =CHOOSE(WEEKDAY(AF3,2),"Mon","Tue","Wed","Thur","Fri","Sat","Su") -> Mon | AG2: =CHOOSE(WEEKDAY(AG3,2),"Mon","Tue","Wed","Thur","Fri","Sat","Sun") -> Tue | AH2: =CHOOSE(WEEKDAY(AH3,2),"Mon","Tue","Wed","Thur","Fri","Sat","Sun") -> Wed | AI2: =CHOOSE(WEEKDAY(AI3,2),"Mon","Tue","Wed","Thur","Fri","Sat","Sun") -> Thur | AJ2: =CHOOSE(WEEKDAY(AJ3,2),"Mon","Tue","Wed","Thur","Fri","Sat","Sun") -> Fri | AK2: =CHOOSE(WEEKDAY(AK3,2),"Mon","Tue","Wed","Thur","Fri","Sat","Sun") -> Sat | AL2: =CHOOSE(WEEKDAY(AL3,2),"Mon","Tue","Wed","Thur","Fri","Sat","Sun") -> Sun | AM2: =CHOOSE(WEEKDAY(AM3,2),"Mon","Tue","Wed","Thur","Fri","Sat","Sun") -> Mon | AN2: =CHOOSE(WEEKDAY(AN3,2),"Mon","Tue","Wed","Thur","Fri","Sat","Sun") -> Tue | AO2: =CHOOSE(WEEKDAY(AO3,2),"Mon","Tue","Wed","Thur","Fri","Sat","Sun") -> Wed | AP2: =CHOOSE(WEEKDAY(AP3,2),"Mon","Tue","Wed","Thur","Fri","Sat","Sun") -> Thur | AQ2: =CHOOSE(WEEKDAY(AQ3,2),"Mon","Tue","Wed","Thur","Fri","Sat","Sun") -> Fri | AR2: =CHOOSE(WEEKDAY(AR3,2),"Mon","Tue","Wed","Thur","Fri","Sat","Sun") -> Sat | AS2: =CHOOSE(WEEKDAY(AS3,2),"Mon","Tue","Wed","Thur","Fri","Sat","Sun") -> Sun | AT2: =CHOOSE(WEEKDAY(AT3,2),"Mon","Tue","Wed","Thur","Fri","Sat","Sun") -> Mon | AU2: =CHOOSE(WEEKDAY(AU3,2),"Mon","Tue","Wed","Thur","Fri","Sat","Sun") -> Tue | AV2: =CHOOSE(WEEKDAY(AV3,2),"Mon","Tue","Wed","Thur","Fri","Sat","Sun") -> Wed | AW2: =CHOOSE(WEEKDAY(AW3,2),"Mon","Tue","Wed","Thur","Fri","Sat","Sun") -> Thur | AX2: =CHOOSE(WEEKDAY(AX3,2),"Mon","Tue","Wed","Thur","Fri","Sat","Sun") -> Fri | AY2: =CHOOSE(WEEKDAY(AY3,2),"Mon","Tue","Wed","Thur","Fri","Sat","Sun") -> Sat | AZ2: =CHOOSE(WEEKDAY(AZ3,2),"Mon","Tue","Wed","Thur","Fri","Sat","Sun") -> Sun | BA2: =CHOOSE(WEEKDAY(BA3,2),"Mon","Tue","Wed","Thur","Fri","Sat","Sun") -> Mon | BB2: =CHOOSE(WEEKDAY(BB3,2),"Mon","Tue","Wed","Thur","Fri","Sat","Sun") -> Tue | BC2: =CHOOSE(WEEKDAY(BC3,2),"Mon","Tue","Wed","Thur","Fri","Sat","Sun") -> Wed | BD2: =CHOOSE(WEEKDAY(BD3,2),"Mon","Tue","Wed","Thur","Fri","Sat","Sun") -> Thur | BE2: =CHOOSE(WEEKDAY(BE3,2),"Mon","Tue","Wed","Thur","Fri","Sat","Sun") -> Fri | BF2: =CHOOSE(WEEKDAY(BF3,2),"Mon","Tue","Wed","Thur","Fri","Sat","Sun") -> Sat | BG2: =CHOOSE(WEEKDAY(BG3,2),"Mon","Tue","Wed","Thur","Fri","Sat","Sun") -> Sun | BH2: =CHOOSE(WEEKDAY(BH3,2),"Mon","Tue","Wed","Thur","Fri","Sat","Sun") -> Mon | BI2: =CHOOSE(WEEKDAY(BI3,2),"Mon","Tue","Wed","Thur","Fri","Sat","Sun") -> Tue | BJ2: =CHOOSE(WEEKDAY(BJ3,2),"Mon","Tue","Wed","Thur","Fri","Sat","Sun") -> Wed | BK2: =CHOOSE(WEEKDAY(BK3,2),"Mon","Tue","Wed","Thur","Fri","Sat","Sun") -> Thur | BL2: =CHOOSE(WEEKDAY(BL3,2),"Mon","Tue","Wed","Thur","Fri","Sat","Sun") -> Fri | BM2: =CHOOSE(WEEKDAY(BM3,2),"Mon","Tue","Wed","Thur","Fri","Sat","Sun") -> Sat | BN2: =CHOOSE(WEEKDAY(BN3,2),"Mon","Tue","Wed","Thur","Fri","Sat","Sun") -> Sun | BO2: =CHOOSE(WEEKDAY(BO3,2),"Mon","Tue","Wed","Thur","Fri","Sat","Sun") -> Mon | BP2: =CHOOSE(WEEKDAY(BP3,2),"Mon","Tue","Wed","Thur","Fri","Sat","Sun") -> Tue | BQ2: =CHOOSE(WEEKDAY(BQ3,2),"Mon","Tue","Wed","Thur","Fri","Sat","Sun") -> Wed | BR2: =CHOOSE(WEEKDAY(BR3,2),"Mon","Tue","Wed","Thur","Fri","Sat","Sun") -> Thur | BS2: =CHOOSE(WEEKDAY(BS3,2),"Mon","Tue","Wed","Thur","Fri","Sat","Sun") -> Fri | BT2: =CHOOSE(WEEKDAY(BT3,2),"Mon","Tue","Wed","Thur","Fri","Sat","Sun") -> Sat | BU2: =CHOOSE(WEEKDAY(BU3,2),"Mon","Tue","Wed","Thur","Fri","Sat","Sun") -> Sun | BV2: =CHOOSE(WEEKDAY(BV3,2),"Mon","Tue","Wed","Thur","Fri","Sat","Sun") -> Mon | BW2: =CHOOSE(WEEKDAY(BW3,2),"Mon","Tue","Wed","Thur","Fri","Sat","Sun") -> Tue | BX2: =CHOOSE(WEEKDAY(BX3,2),"Mon","Tue","Wed","Thur","Fri","Sat","Sun") -> Wed | BY2: =CHOOSE(WEEKDAY(BY3,2),"Mon","Tue","Wed","Thur","Fri","Sat","Sun") -> Thur | BZ2: =CHOOSE(WEEKDAY(BZ3,2),"Mon","Tue","Wed","Thur","Fri","Sat","Sun") -> Fri | CA2: =CHOOSE(WEEKDAY(CA3,2),"Mon","Tue","Wed","Thur","Fri","Sat","Sun") -> Sat | CB2: =CHOOSE(WEEKDAY(CB3,2),"Mon","Tue","Wed","Thur","Fri","Sat","Sun") -> Sun | CC2: =CHOOSE(WEEKDAY(CC3,2),"Mon","Tue","Wed","Thur","Fri","Sat","Sun") -> Mon | CD2: =CHOOSE(WEEKDAY(CD3,2),"Mon","Tue","Wed","Thur","Fri","Sat","Sun") -> Tue | CE2: =CHOOSE(WEEKDAY(CE3,2),"Mon","Tue","Wed","Thur","Fri","Sat","Sun") -> Wed | CF2: =CHOOSE(WEEKDAY(CF3,2),"Mon","Tue","Wed","Thur","Fri","Sat","Sun") -> Thur | CG2: =CHOOSE(WEEKDAY(CG3,2),"Mon","Tue","Wed","Thur","Fri","Sat","Sun") -> Fri | CH2: =CHOOSE(WEEKDAY(CH3,2),"Mon","Tue","Wed","Thur","Fri","Sat","Sun") -> Sat | CI2: =CHOOSE(WEEKDAY(CI3,2),"Mon","Tue","Wed","Thur","Fri","Sat","Sun") -> Sun | CJ2: =CHOOSE(WEEKDAY(CJ3,2),"Mon","Tue","Wed","Thur","Fri","Sat","Sun") -> Mon | CK2: =CHOOSE(WEEKDAY(CK3,2),"Mon","Tue","Wed","Thur","Fri","Sat","Sun") -> Tue | CL2: =CHOOSE(WEEKDAY(CL3,2),"Mon","Tue","Wed","Thur","Fri","Sat","Sun") -> Wed | CM2: =CHOOSE(WEEKDAY(CM3,2),"Mon","Tue","Wed","Thur","Fri","Sat","Sun") -> Thur | CN2: =CHOOSE(WEEKDAY(CN3,2),"Mon","Tue","Wed","Thur","Fri","Sat","Sun") -> Fri | CO2: =CHOOSE(WEEKDAY(CO3,2),"Mon","Tue","Wed","Thur","Fri","Sat","Sun") -> Sat | CP2: =CHOOSE(WEEKDAY(CP3,2),"Mon","Tue","Wed","Thur","Fri","Sat","Sun") -> Sun | CQ2: =CHOOSE(WEEKDAY(CQ3,2),"Mon","Tue","Wed","Thur","Fri","Sat","Sun") -> Mon | CR2: =CHOOSE(WEEKDAY(CR3,2),"Mon","Tue","Wed","Thur","Fri","Sat","Sun") -> Tue | CS2: =CHOOSE(WEEKDAY(CS3,2),"Mon","Tue","Wed","Thur","Fri","Sat","Sun") -> Wed | CT2: =CHOOSE(WEEKDAY(CT3,2),"Mon","Tue","Wed","Thur","Fri","Sat","Sun") -> Thur | CU2: =CHOOSE(WEEKDAY(CU3,2),"Mon","Tue","Wed","Thur","Fri","Sat","Sun") -> Fri | CV2: =CHOOSE(WEEKDAY(CV3,2),"Mon","Tue","Wed","Thur","Fri","Sat","Sun") -> Sat | CW2: =CHOOSE(WEEKDAY(CW3,2),"Mon","Tue","Wed","Thur","Fri","Sat","Sun") -> Sun | CX2: =CHOOSE(WEEKDAY(CX3,2),"Mon","Tue","Wed","Thur","Fri","Sat","Sun") -> Mon | CY2: =CHOOSE(WEEKDAY(CY3,2),"Mon","Tue","Wed","Thur","Fri","Sat","Sun") -> Tue | CZ2: =CHOOSE(WEEKDAY(CZ3,2),"Mon","Tue","Wed","Thur","Fri","Sat","Sun") -> Wed | DA2: =CHOOSE(WEEKDAY(DA3,2),"Mon","Tue","Wed","Thur","Fri","Sat","Sun") -> Thur | DB2: =CHOOSE(WEEKDAY(DB3,2),"Mon","Tue","Wed","Thur","Fri","Sat","Sun") -> Fri | DC2: =CHOOSE(WEEKDAY(DC3,2),"Mon","Tue","Wed","Thur","Fri","Sat","Sun") -> Sat | DD2: =CHOOSE(WEEKDAY(DD3,2),"Mon","Tue","Wed","Thur","Fri","Sat","Sun") -> Sun | DE2: =CHOOSE(WEEKDAY(DE3,2),"Mon","Tue","Wed","Thur","Fri","Sat","Sun") -> Mon | DF2: =CHOOSE(WEEKDAY(DF3,2),"Mon","Tue","Wed","Thur","Fri","Sat","Sun") -> Tue | DG2: =CHOOSE(WEEKDAY(DG3,2),"Mon","Tue","Wed","Thur","Fri","Sat","Sun") -> Wed | DH2: =CHOOSE(WEEKDAY(DH3,2),"Mon","Tue","Wed","Thur","Fri","Sat","Sun") -> Thur | DI2: =CHOOSE(WEEKDAY(DI3,2),"Mon","Tue","Wed","Thur","Fri","Sat","Sun") -> Fri | DJ2: =CHOOSE(WEEKDAY(DJ3,2),"Mon","Tue","Wed","Thur","Fri","Sat","Sun") -> Sat | DK2: =CHOOSE(WEEKDAY(DK3,2),"Mon","Tue","Wed","Thur","Fri","Sat","Sun") -> Sun | DL2: =CHOOSE(WEEKDAY(DL3,2),"Mon","Tue","Wed","Thur","Fri","Sat","Sun") -> Mon | DM2: =CHOOSE(WEEKDAY(DM3,2),"Mon","Tue","Wed","Thur","Fri","Sat","Sun") -> Tue | DN2: =CHOOSE(WEEKDAY(DN3,2),"Mon","Tue","Wed","Thur","Fri","Sat","Sun") -> Wed | DO2: =CHOOSE(WEEKDAY(DO3,2),"Mon","Tue","Wed","Thur","Fri","Sat","Sun") -> Thur | DP2: =CHOOSE(WEEKDAY(DP3,2),"Mon","Tue","Wed","Thur","Fri","Sat","Sun") -> Fri | DQ2: =CHOOSE(WEEKDAY(DQ3,2),"Mon","Tue","Wed","Thur","Fri","Sat","Sun") -> Sat | DR2: =CHOOSE(WEEKDAY(DR3,2),"Mon","Tue","Wed","Thur","Fri","Sat","Sun") -> Sun | DS2: =CHOOSE(WEEKDAY(DS3,2),"Mon","Tue","Wed","Thur","Fri","Sat","Sun") -> Mon | DT2: =CHOOSE(WEEKDAY(DT3,2),"Mon","Tue","Wed","Thur","Fri","Sat","Sun") -> Tue | DU2: =CHOOSE(WEEKDAY(DU3,2),"Mon","Tue","Wed","Thur","Fri","Sat","Sun") -> Wed | DV2: =CHOOSE(WEEKDAY(DV3,2),"Mon","Tue","Wed","Thur","Fri","Sat","Sun") -> Thur | DW2: =CHOOSE(WEEKDAY(DW3,2),"Mon","Tue","Wed","Thur","Fri","Sat","Sun") -> Fri | DX2: =CHOOSE(WEEKDAY(DX3,2),"Mon","Tue","Wed","Thur","Fri","Sat","Sun") -> Sat | DY2: =CHOOSE(WEEKDAY(DY3,2),"Mon","Tue","Wed","Thur","Fri","Sat","Sun") -> Sun | DZ2: =CHOOSE(WEEKDAY(DZ3,2),"Mon","Tue","Wed","Thur","Fri","Sat","Sun") -> Mon | EA2: =CHOOSE(WEEKDAY(EA3,2),"Mon","Tue","Wed","Thur","Fri","Sat","Sun") -> Tue | EB2: =CHOOSE(WEEKDAY(EB3,2),"Mon","Tue","Wed","Thur","Fri","Sat","Sun") -> Wed | EC2: =CHOOSE(WEEKDAY(EC3,2),"Mon","Tue","Wed","Thur","Fri","Sat","Sun") -> Thur | ED2: =CHOOSE(WEEKDAY(ED3,2),"Mon","Tue","Wed","Thur","Fri","Sat","Sun") -> Fri | EE2: =CHOOSE(WEEKDAY(EE3,2),"Mon","Tue","Wed","Thur","Fri","Sat","Sun") -> Sat | EF2: =CHOOSE(WEEKDAY(EF3,2),"Mon","Tue","Wed","Thur","Fri","Sat","Sun") -> Sun | EG2: =CHOOSE(WEEKDAY(EG3,2),"Mon","Tue","Wed","Thur","Fri","Sat","Sun") -> Mon | EH2: =CHOOSE(WEEKDAY(EH3,2),"Mon","Tue","Wed","Thur","Fri","Sat","Sun") -> Tue | EI2: =CHOOSE(WEEKDAY(EI3,2),"Mon","Tue","Wed","Thur","Fri","Sat","Sun") -> Wed | EJ2: =CHOOSE(WEEKDAY(EJ3,2),"Mon","Tue","Wed","Thur","Fri","Sat","Sun") -> Thur | EK2: =CHOOSE(WEEKDAY(EK3,2),"Mon","Tue","Wed","Thur","Fri","Sat","Sun") -> Fri | EL2: =CHOOSE(WEEKDAY(EL3,2),"Mon","Tue","Wed","Thur","Fri","Sat","Sun") -> Sat | EM2: =CHOOSE(WEEKDAY(EM3,2),"Mon","Tue","Wed","Thur","Fri","Sat","Sun") -> Sun | EN2: =CHOOSE(WEEKDAY(EN3,2),"Mon","Tue","Wed","Thur","Fri","Sat","Sun") -> Mon | EO2: =CHOOSE(WEEKDAY(EO3,2),"Mon","Tue","Wed","Thur","Fri","Sat","Sun") -> Tue | EP2: =CHOOSE(WEEKDAY(EP3,2),"Mon","Tue","Wed","Thur","Fri","Sat","Sun") -> Wed | EQ2: =CHOOSE(WEEKDAY(EQ3,2),"Mon","Tue","Wed","Thur","Fri","Sat","Sun") -> Thur | ER2: =CHOOSE(WEEKDAY(ER3,2),"Mon","Tue","Wed","Thur","Fri","Sat","Sun") -> Fri | ES2: =CHOOSE(WEEKDAY(ES3,2),"Mon","Tue","Wed","Thur","Fri","Sat","Sun") -> Sat | ET2: =CHOOSE(WEEKDAY(ET3,2),"Mon","Tue","Wed","Thur","Fri","Sat","Sun") -> Sun | EU2: =CHOOSE(WEEKDAY(EU3,2),"Mon","Tue","Wed","Thur","Fri","Sat","Sun") -> Mon | EV2: =CHOOSE(WEEKDAY(EV3,2),"Mon","Tue","Wed","Thur","Fri","Sat","Sun") -> Tue | EW2: =CHOOSE(WEEKDAY(EW3,2),"Mon","Tue","Wed","Thur","Fri","Sat","Sun") -> Wed | EX2: =CHOOSE(WEEKDAY(EX3,2),"Mon","Tue","Wed","Thur","Fri","Sat","Sun") -> Thur | EY2: =CHOOSE(WEEKDAY(EY3,2),"Mon","Tue","Wed","Thur","Fri","Sat","Sun") -> Fri | EZ2: =CHOOSE(WEEKDAY(EZ3,2),"Mon","Tue","Wed","Thur","Fri","Sat","Sun") -> Sat | FA2: =CHOOSE(WEEKDAY(FA3,2),"Mon","Tue","Wed","Thur","Fri","Sat","Sun") -> Sun | FB2: =CHOOSE(WEEKDAY(FB3,2),"Mon","Tue","Wed","Thur","Fri","Sat","Sun") -> Mon | FC2: =CHOOSE(WEEKDAY(FC3,2),"Mon","Tue","Wed","Thur","Fri","Sat","Sun") -> Tue | FD2: =CHOOSE(WEEKDAY(FD3,2),"Mon","Tue","Wed","Thur","Fri","Sat","Sun") -> Wed | FE2: =CHOOSE(WEEKDAY(FE3,2),"Mon","Tue","Wed","Thur","Fri","Sat","Sun") -> Thur | FF2: =CHOOSE(WEEKDAY(FF3,2),"Mon","Tue","Wed","Thur","Fri","Sat","Sun") -> Fri | FG2: =CHOOSE(WEEKDAY(FG3,2),"Mon","Tue","Wed","Thur","Fri","Sat","Sun") -> Sat | FH2: =CHOOSE(WEEKDAY(FH3,2),"Mon","Tue","Wed","Thur","Fri","Sat","Sun") -> Sun | FI2: =CHOOSE(WEEKDAY(FI3,2),"Mon","Tue","Wed","Thur","Fri","Sat","Sun") -> Mon | FJ2: =CHOOSE(WEEKDAY(FJ3,2),"Mon","Tue","Wed","Thur","Fri","Sat","Sun") -> Tue | FK2: =CHOOSE(WEEKDAY(FK3,2),"Mon","Tue","Wed","Thur","Fri","Sat","Sun") -> Wed | FL2: =CHOOSE(WEEKDAY(FL3,2),"Mon","Tue","Wed","Thur","Fri","Sat","Sun") -> Thur | FM2: =CHOOSE(WEEKDAY(FM3,2),"Mon","Tue","Wed","Thur","Fri","Sat","Sun") -> Fri | FN2: =CHOOSE(WEEKDAY(FN3,2),"Mon","Tue","Wed","Thur","Fri","Sat","Sun") -> Sat | FO2: =CHOOSE(WEEKDAY(FO3,2),"Mon","Tue","Wed","Thur","Fri","Sat","Sun") -> Sun | FP2: =CHOOSE(WEEKDAY(FP3,2),"Mon","Tue","Wed","Thur","Fri","Sat","Sun") -> Mon | FQ2: =CHOOSE(WEEKDAY(FQ3,2),"Mon","Tue","Wed","Thur","Fri","Sat","Sun") -> Tue | FR2: =CHOOSE(WEEKDAY(FR3,2),"Mon","Tue","Wed","Thur","Fri","Sat","Sun") -> Wed | FS2: =CHOOSE(WEEKDAY(FS3,2),"Mon","Tue","Wed","Thur","Fri","Sat","Sun") -> Thur | FT2: =CHOOSE(WEEKDAY(FT3,2),"Mon","Tue","Wed","Thur","Fri","Sat","Sun") -> Fri | FU2: =CHOOSE(WEEKDAY(FU3,2),"Mon","Tue","Wed","Thur","Fri","Sat","Sun") -> Sat | FV2: =CHOOSE(WEEKDAY(FV3,2),"Mon","Tue","Wed","Thur","Fri","Sat","Sun") -> Sun | FW2: =CHOOSE(WEEKDAY(FW3,2),"Mon","Tue","Wed","Thur","Fri","Sat","Sun") -> Mon | FX2: =CHOOSE(WEEKDAY(FX3,2),"Mon","Tue","Wed","Thur","Fri","Sat","Sun") -> Tue | FY2: =CHOOSE(WEEKDAY(FY3,2),"Mon","Tue","Wed","Thur","Fri","Sat","Sun") -> Wed | FZ2: =CHOOSE(WEEKDAY(FZ3,2),"Mon","Tue","Wed","Thur","Fri","Sat","Sun") -> Thur | GA2: =CHOOSE(WEEKDAY(GA3,2),"Mon","Tue","Wed","Thur","Fri","Sat","Sun") -> Fri | GB2: =CHOOSE(WEEKDAY(GB3,2),"Mon","Tue","Wed","Thur","Fri","Sat","Sun") -> Sat | GC2: =CHOOSE(WEEKDAY(GC3,2),"Mon","Tue","Wed","Thur","Fri","Sat","Sun") -> Sun | GD2: =CHOOSE(WEEKDAY(GD3,2),"Mon","Tue","Wed","Thur","Fri","Sat","Sun") -> Mon | GE2: =CHOOSE(WEEKDAY(GE3,2),"Mon","Tue","Wed","Thur","Fri","Sat","Sun") -> Tue | GF2: =CHOOSE(WEEKDAY(GF3,2),"Mon","Tue","Wed","Thur","Fri","Sat","Sun") -> Wed | GG2: =CHOOSE(WEEKDAY(GG3,2),"Mon","Tue","Wed","Thur","Fri","Sat","Sun") -> Thur | GH2: =CHOOSE(WEEKDAY(GH3,2),"Mon","Tue","Wed","Thur","Fri","Sat","Sun") -> Fri | GI2: =CHOOSE(WEEKDAY(GI3,2),"Mon","Tue","Wed","Thur","Fri","Sat","Sun") -> Sat | GJ2: =CHOOSE(WEEKDAY(GJ3,2),"Mon","Tue","Wed","Thur","Fri","Sat","Sun") -> Sun | GK2: =CHOOSE(WEEKDAY(GK3,2),"Mon","Tue","Wed","Thur","Fri","Sat","Sun") -> Mon | GL2: =CHOOSE(WEEKDAY(GL3,2),"Mon","Tue","Wed","Thur","Fri","Sat","Sun") -> Tue | GM2: =CHOOSE(WEEKDAY(GM3,2),"Mon","Tue","Wed","Thur","Fri","Sat","Sun") -> Wed | GN2: =CHOOSE(WEEKDAY(GN3,2),"Mon","Tue","Wed","Thur","Fri","Sat","Sun") -> Thur | GO2: =CHOOSE(WEEKDAY(GO3,2),"Mon","Tue","Wed","Thur","Fri","Sat","Sun") -> Fri | GP2: =CHOOSE(WEEKDAY(GP3,2),"Mon","Tue","Wed","Thur","Fri","Sat","Sun") -> Sat | GQ2: =CHOOSE(WEEKDAY(GQ3,2),"Mon","Tue","Wed","Thur","Fri","Sat","Sun") -> Sun | GR2: =CHOOSE(WEEKDAY(GR3,2),"Mon","Tue","Wed","Thur","Fri","Sat","Sun") -> Mon | GS2: =CHOOSE(WEEKDAY(GS3,2),"Mon","Tue","Wed","Thur","Fri","Sat","Sun") -> Tue | GT2: =CHOOSE(WEEKDAY(GT3,2),"Mon","Tue","Wed","Thur","Fri","Sat","Sun") -> Wed | GU2: =CHOOSE(WEEKDAY(GU3,2),"Mon","Tue","Wed","Thur","Fri","Sat","Sun") -> Thur | GV2: =CHOOSE(WEEKDAY(GV3,2),"Mon","Tue","Wed","Thur","Fri","Sat","Sun") -> Fri | GW2: =CHOOSE(WEEKDAY(GW3,2),"Mon","Tue","Wed","Thur","Fri","Sat","Sun") -> Sat | GX2: =CHOOSE(WEEKDAY(GX3,2),"Mon","Tue","Wed","Thur","Fri","Sat","Sun") -> Sun | GY2: =CHOOSE(WEEKDAY(GY3,2),"Mon","Tue","Wed","Thur","Fri","Sat","Sun") -> Mon | GZ2: =CHOOSE(WEEKDAY(GZ3,2),"Mon","Tue","Wed","Thur","Fri","Sat","Sun") -> Tue | HA2: =CHOOSE(WEEKDAY(HA3,2),"Mon","Tue","Wed","Thur","Fri","Sat","Sun") -> Wed | HB2: =CHOOSE(WEEKDAY(HB3,2),"Mon","Tue","Wed","Thur","Fri","Sat","Sun") -> Thur | HC2: =CHOOSE(WEEKDAY(HC3,2),"Mon","Tue","Wed","Thur","Fri","Sat","Sun") -> Fri | HD2: =CHOOSE(WEEKDAY(HD3,2),"Mon","Tue","Wed","Thur","Fri","Sat","Sun") -> Sat | HE2: =CHOOSE(WEEKDAY(HE3,2),"Mon","Tue","Wed","Thur","Fri","Sat","Sun") -> Sun | HF2: =CHOOSE(WEEKDAY(HF3,2),"Mon","Tue","Wed","Thur","Fri","Sat","Sun") -> Mon | HG2: =CHOOSE(WEEKDAY(HG3,2),"Mon","Tue","Wed","Thur","Fri","Sat","Sun") -> Tue | HH2: =CHOOSE(WEEKDAY(HH3,2),"Mon","Tue","Wed","Thur","Fri","Sat","Sun") -> Wed | HI2: =CHOOSE(WEEKDAY(HI3,2),"Mon","Tue","Wed","Thur","Fri","Sat","Sun") -> Thur | HJ2: =CHOOSE(WEEKDAY(HJ3,2),"Mon","Tue","Wed","Thur","Fri","Sat","Sun") -> Fri | HK2: =CHOOSE(WEEKDAY(HK3,2),"Mon","Tue","Wed","Thur","Fri","Sat","Sun") -> Sat | HL2: =CHOOSE(WEEKDAY(HL3,2),"Mon","Tue","Wed","Thur","Fri","Sat","Sun") -> Sun | HM2: =CHOOSE(WEEKDAY(HM3,2),"Mon","Tue","Wed","Thur","Fri","Sat","Sun") -> Mon | HN2: =CHOOSE(WEEKDAY(HN3,2),"Mon","Tue","Wed","Thur","Fri","Sat","Sun") -> Tue | HO2: =CHOOSE(WEEKDAY(HO3,2),"Mon","Tue","Wed","Thur","Fri","Sat","Sun") -> Wed | HP2: =CHOOSE(WEEKDAY(HP3,2),"Mon","Tue","Wed","Thur","Fri","Sat","Sun") -> Thur | HQ2: =CHOOSE(WEEKDAY(HQ3,2),"Mon","Tue","Wed","Thur","Fri","Sat","Sun") -> Fri | HR2: =CHOOSE(WEEKDAY(HR3,2),"Mon","Tue","Wed","Thur","Fri","Sat","Sun") -> Sat | HS2: =CHOOSE(WEEKDAY(HS3,2),"Mon","Tue","Wed","Thur","Fri","Sat","Sun") -> Sun | HT2: =CHOOSE(WEEKDAY(HT3,2),"Mon","Tue","Wed","Thur","Fri","Sat","Sun") -> Mon | HU2: =CHOOSE(WEEKDAY(HU3,2),"Mon","Tue","Wed","Thur","Fri","Sat","Sun") -> Tue | HV2: =CHOOSE(WEEKDAY(HV3,2),"Mon","Tue","Wed","Thur","Fri","Sat","Sun") -> Wed | HW2: =CHOOSE(WEEKDAY(HW3,2),"Mon","Tue","Wed","Thur","Fri","Sat","Sun") -> Thur | HX2: =CHOOSE(WEEKDAY(HX3,2),"Mon","Tue","Wed","Thur","Fri","Sat","Sun") -> Fri | HY2: =CHOOSE(WEEKDAY(HY3,2),"Mon","Tue","Wed","Thur","Fri","Sat","Sun") -> Sat | HZ2: =CHOOSE(WEEKDAY(HZ3,2),"Mon","Tue","Wed","Thur","Fri","Sat","Sun") -> Sun | IA2: =CHOOSE(WEEKDAY(IA3,2),"Mon","Tue","Wed","Thur","Fri","Sat","Sun") -> Mon | IB2: =CHOOSE(WEEKDAY(IB3,2),"Mon","Tue","Wed","Thur","Fri","Sat","Sun") -> Tue | IC2: =CHOOSE(WEEKDAY(IC3,2),"Mon","Tue","Wed","Thur","Fri","Sat","Sun") -> Wed | ID2: =CHOOSE(WEEKDAY(ID3,2),"Mon","Tue","Wed","Thur","Fri","Sat","Sun") -> Thur | IE2: =CHOOSE(WEEKDAY(IE3,2),"Mon","Tue","Wed","Thur","Fri","Sat","Sun") -> Fri | IF2: =CHOOSE(WEEKDAY(IF3,2),"Mon","Tue","Wed","Thur","Fri","Sat","Sun") -> Sat | IG2: =CHOOSE(WEEKDAY(IG3,2),"Mon","Tue","Wed","Thur","Fri","Sat","Sun") -> Sun | IH2: =CHOOSE(WEEKDAY(IH3,2),"Mon","Tue","Wed","Thur","Fri","Sat","Sun") -> Mon | II2: =CHOOSE(WEEKDAY(II3,2),"Mon","Tue","Wed","Thur","Fri","Sat","Sun") -> Tue | IJ2: =CHOOSE(WEEKDAY(IJ3,2),"Mon","Tue","Wed","Thur","Fri","Sat","Sun") -> Wed | IK2: =CHOOSE(WEEKDAY(IK3,2),"Mon","Tue","Wed","Thur","Fri","Sat","Sun") -> Thur | IL2: =CHOOSE(WEEKDAY(IL3,2),"Mon","Tue","Wed","Thur","Fri","Sat","Sun") -> Fri
B3: 37226 | C3: 37227 | D3: 37228 | E3: 37229 | F3: 37230 | G3: 37231 | H3: 37232 | I3: 37233 | J3: 37234 | K3: 37235 | L3: 37236 | M3: 37237 | N3: 37238 | O3: 37239 | P3: 37240 | Q3: 37241 | R3: 37242 | S3: 37243 | T3: 37244 | U3: 37245 | V3: 37246 | W3: 37247 | X3: 37248 | Y3: 37249 | Z3: 37250 | AA3: 37251 | AB3: 37252 | AC3: 37253 | AD3: 37254 | AE3: 37255 | AF3: 37256 | AG3: 37257 | AH3: 37258 | AI3: 37259 | AJ3: 37260 | AK3: 37261 | AL3: 37262 | AM3: 37263 | AN3: 37264 | AO3: 37265 | AP3: 37266 | AQ3: 37267 | AR3: 37268 | AS3: 37269 | AT3: 37270 | AU3: 37271 | AV3: 37272 | AW3: 37273 | AX3: 37274 | AY3: 37275 | AZ3: 37276 | BA3: 37277 | BB3: 37278 | BC3: 37279 | BD3: 37280 | BE3: 37281 | BF3: 37282 | BG3: 37283 | BH3: 37284 | BI3: 37285 | BJ3: 37286 | BK3: 37287 | BL3: 37288 | BM3: 37289 | BN3: 37290 | BO3: 37291 | BP3: 37292 | BQ3: 37293 | BR3: 37294 | BS3: 37295 | BT3: 37296 | BU3: 37297 | BV3: 37298 | BW3: 37299 | BX3: 37300 | BY3: 37301 | BZ3: 37302 | CA3: 37303 | CB3: 37304 | CC3: 37305 | CD3: 37306 | CE3: 37307 | CF3: 37308 | CG3: 37309 | CH3: 37310 | CI3: 37311 | CJ3: 37312 | CK3: 37313 | CL3: 37314 | CM3: 37315 | CN3: 37316 | CO3: 37317 | CP3: 37318 | CQ3: 37319 | CR3: 37320 | CS3: 37321 | CT3: 37322 | CU3: 37323 | CV3: 37324 | CW3: 37325 | CX3: 37326 | CY3: 37327 | CZ3: 37328 | DA3: 37329 | DB3: 37330 | DC3: 37331 | DD3: 37332 | DE3: 37333 | DF3: 37334 | DG3: 37335 | DH3: 37336 | DI3: 37337 | DJ3: 37338 | DK3: 37339 | DL3: 37340 | DM3: 37341 | DN3: 37342 | DO3: 37343 | DP3: 37344 | DQ3: 37345 | DR3: 37346 | DS3: 37347 | DT3: 37348 | DU3: 37349 | DV3: 37350 | DW3: 37351 | DX3: 37352 | DY3: 37353 | DZ3: 37354 | EA3: 37355 | EB3: 37356 | EC3: 37357 | ED3: 37358 | EE3: 37359 | EF3: 37360 | EG3: 37361 | EH3: 37362 | EI3: 37363 | EJ3: 37364 | EK3: 37365 | EL3: 37366 | EM3: 37367 | EN3: 37368 | EO3: 37369 | EP3: 37370 | EQ3: 37371 | ER3: 37372 | ES3: 37373 | ET3: 37374 | EU3: 37375 | EV3: 37376 | EW3: 37377 | EX3: 37378 | EY3: 37379 | EZ3: 37380 | FA3: 37381 | FB3: 37382 | FC3: 37383 | FD3: 37384 | FE3: 37385 | FF3: 37386 | FG3: 37387 | FH3: 37388 | FI3: 37389 | FJ3: 37390 | FK3: 37391 | FL3: 37392 | FM3: 37393 | FN3: 37394 | FO3: 37395 | FP3: 37396 | FQ3: 37397 | FR3: 37398 | FS3: 37399 | FT3: 37400 | FU3: 37401 | FV3: 37402 | FW3: 37403 | FX3: 37404 | FY3: 37405 | FZ3: 37406 | GA3: 37407 | GB3: 37408 | GC3: 37409 | GD3: 37410 | GE3: 37411 | GF3: 37412 | GG3: 37413 | GH3: 37414 | GI3: 37415 | GJ3: 37416 | GK3: 37417 | GL3: 37418 | GM3: 37419 | GN3: 37420 | GO3: 37421 | GP3: 37422 | GQ3: 37423 | GR3: 37424 | GS3: 37425 | GT3: 37426 | GU3: 37427 | GV3: 37428 | GW3: 37429 | GX3: 37430 | GY3: 37431 | GZ3: 37432 | HA3: 37433 | HB3: 37434 | HC3: 37435 | HD3: 37436 | HE3: 37437 | HF3: 37438 | HG3: 37439 | HH3: 37440 | HI3: 37441 | HJ3: 37442 | HK3: 37443 | HL3: 37444 | HM3: 37445 | HN3: 37446 | HO3: 37447 | HP3: 37448 | HQ3: 37449 | HR3: 37450 | HS3: 37451 | HT3: 37452 | HU3: 37453 | HV3: 37454 | HW3: 37455 | HX3: 37456 | HY3: 37457 | HZ3: 37458 | IA3: 37459 | IB3: 37460 | IC3: 37461 | ID3: 37462 | IE3: 37463 | IF3: 37464 | IG3: 37465 | IH3: 37466 | II3: 37467 | IJ3: 37468 | IK3: 37469 | IL3: 37470
A5: WAREHOUSEMEN
A6: # of WHmen Budgeted | B6: 27 | C6: 27 | D6: 27 | E6: 27 | F6: 27 | G6: 27 | H6: 27 | I6: 27 | J6: 27 | K6: 27 | L6: 27 | M6: 27 | N6: 27 | O6: 27 | P6: 27 | Q6: 27 | R6: 27 | S6: 27 | T6: 27 | U6: 27 | V6: 27 | W6: 27 | X6: 27 | Y6: 27 | Z6: 27 | AG6: 4 | AH6: 4 | AI6: 4 | AJ6: 4 | AK6: 4 | AL6: 4 | AM6: 4 | AN6: 4 | AO6: 4 | AP6: 4 | AQ6: 4 | AR6: 4 | AS6: 4 | AT6: 4 | AU6: 4 | AV6: 4 | AW6: 4 | AX6: 4 | AY6: 4 | AZ6: 4 | BA6: 4 | BB6: 4 | BC6: 4 | BD6: 4 | BE6: 4 | BF6: 4 | BG6: 4 | BH6: 4 | BI6: 4 | BJ6: 4 | BK6: 4 | BL6: 3 | BM6: 3 | BN6: 3 | BO6: 3 | BP6: 3 | BQ6: 3 | BR6: 3 | BS6: 3 | BT6: 3 | BU6: 3 | BV6: 3 | BW6: 3 | BX6: 3 | BY6: 3 | BZ6: 3 | CA6: 3 | CB6: 3 | CC6: 3 | CD6: 3 | CE6: 3 | CF6: 3 | CG6: 3 | CH6: 3 | CI6: 3 | CJ6: 3 | CK6: 3 | CL6: 3 | CM6: 3 | CN6: 3 | CO6: 3 | CP6: 3 | CQ6: 3 | CR6: 3 | CS6: 3 | CT6: 3 | CU6: 3 | CV6: 3 | CW6: 3 | CX6: 3 | CY6: 3 | CZ6: 3 | DA6: 3 | DB6: 3 | DC6: 3 | DD6: 3 | DE6: 3 | DF6: 3 | DG6: 3 | DH6: 3 | DI6: 3 | DJ6: 3 | DK6: 3 | DL6: 3 | DM6: 3 | DN6: 3 | DO6: 3 | DP6: 3 | DQ6: 3 | DR6: 3 | DS6: 3 | DT6: 3 | DU6: 3 | DV6: 3 | DW6: 3 | DX6: 3 | DY6: 3 | DZ6: 3 | EA6: 3 | EB6: 3 | EC6: 3 | ED6: 3 | EE6: 3 | EF6: 3 | EG6: 3 | EH6: 3 | EI6: 3 | EJ6: 3 | EK6: 3 | EL6: 3 | EM6: 3 | EN6: 3 | EO6: 3 | EP6: 3 | EQ6: 3 | ER6: 3 | ES6: 3 | ET6: 3 | EU6: 3 | EV6: 3 | EW6: 3 | EX6: 3 | EY6: 3 | EZ6: 3 | FA6: 3 | FB6: 3 | FC6: 3 | FD6: 3 | FE6: 3 | FF6: 3 | FG6: 3 | FH6: 3 | FI6: 3 | FJ6: 3 | FK6: 3 | FL6: 3 | FM6: 3 | FN6: 3 | FO6: 3 | FP6: 3 | FQ6: 3 | FR6: 3 | FS6: 3 | FT6: 3 | FU6: 3 | FV6: 3 | FW6: 3 | FX6: 3 | FY6: 3 | FZ6: 3 | GA6: 3 | GB6: 3 | GC6: 3 | GD6: 3 | GE6: 3 | GF6: 3 | GG6: 3 | GH6: 3 | GI6: 3 | GJ6: 3 | GK6: 3 | GL6: 3 | GM6: 3 | GN6: 3 | GO6: 3 | GP6: 3 | GQ6: 3 | GR6: 3 | GS6: 3 | GT6: 3 | GU6: 3 | GV6: 3 | GW6: 3 | GX6: 3 | GY6: 3 | GZ6: 3 | HA6: 3 | HB6: 3 | HC6: 3 | HD6: 3 | HE6: 3 | HF6: 3 | HG6: 3 | HH6: 3 | HI6: 3 | HJ6: 3 | HK6: 3 | HL6: 3 | HM6: 3 | HN6: 3 | HO6: 3 | HP6: 3 | HQ6: 3 | HR6: 3 | HS6: 3 | HT6: 3 | HU6: 3 | HV6: 3 | HW6: 3 | HX6: 3 | HY6: 3 | HZ6: 3 | IA6: 3 | IB6: 3 | IC6: 3 | ID6: 3 | IE6: 3 | IF6: 3 | IG6: 3 | IH6: 3 | II6: 3 | IJ6: 3 | IK6: 3 | IL6: 3
A7: overtime factor | B7: 27 | C7: 27 | D7: 27 | E7: 27 | F7: 27 | G7: 27 | H7: 27 | I7: 27 | J7: 27 | K7: 27 | L7: 27 | M7: 27 | N7: 27 | O7: 27 | P7: 27 | Q7: 27 | R7: 27 | S7: 27 | T7: 27 | U7: 27 | V7: 27 | W7: 27 | X7: 27 | Y7: 27 | Z7: 27 | AG7: 4 | AH7: 4 | AI7: 4 | AJ7: 4 | AK7: 4 | AL7: 4 | AM7: 4 | AN7: 4 | AO7: 4 | AP7: 4 | AQ7: 4 | AR7: 4 | AS7: 4 | AT7: 4 | AU7: 4 | AV7: 4 | AW7: 4 | AX7: 4 | AY7: 4 | AZ7: 4 | BA7: 4 | BB7: 4 | BC7: 4 | BD7: 4 | BE7: 4 | BF7: 4 | BG7: 4 | BH7: 4 | BI7: 4 | BJ7: 4 | BK7: 0 | BL7: 0 | BM7: 0 | BN7: 0 | BO7: 0 | BP7: 0 | BQ7: 0 | BR7: 0 | BS7: 0 | BT7: 0 | BU7: 0 | BV7: 0 | BW7: 0 | BX7: 0 | BY7: 0 | BZ7: 0 | CA7: 0 | CB7: 0 | CC7: 0 | CD7: 0 | CE7: 0 | CF7: 0 | CG7: 0 | CH7: 0 | CI7: 0 | CJ7: 0 | CK7: 0 | CL7: 0 | CM7: 0 | CN7: 0 | CO7: 0 | CP7: 0 | CQ7: 0 | CR7: 0 | CS7: 0 | CT7: 0 | CU7: 0 | CV7: 0 | CW7: 0 | CX7: 0 | CY7: 0 | CZ7: 0 | DA7: 0 | DB7: 0 | DC7: 0 | DD7: 0 | DE7: 0 | DF7: 0 | DG7: 0 | DH7: 0 | DI7: 0 | DJ7: 0 | DK7: 0 | DL7: 0 | DM7: 0 | DN7: 0 | DO7: 0 | DP7: 0 | DQ7: 0 | DR7: 0 | DS7: 0 | DT7: 0 | DU7: 0 | DV7: 0 | DW7: 0 | DX7: 0 | DY7: 0 | DZ7: 0 | EA7: 0 | EB7: 0 | EC7: 0 | ED7: 0 | EE7: 0 | EF7: 0 | EG7: 0 | EH7: 0 | EI7: 0 | EJ7: 0 | EK7: 0 | EL7: 0 | EM7: 0 | EN7: 0 | EO7: 0 | EP7: 0 | EQ7: 0 | ER7: 0 | ES7: 0 | ET7: 0 | EU7: 0 | EV7: 0 | EW7: 0 | EX7: 0 | EY7: 0 | EZ7: 0 | FA7: 0 | FB7: 0 | FC7: 0 | FD7: 0 | FE7: 0 | FF7: 0 | FG7: 0 | FH7: 0 | FI7: 0 | FJ7: 0 | FK7: 0 | FL7: 0 | FM7: 0 | FN7: 0 | FO7: 0 | FP7: 0 | FQ7: 0 | FR7: 0 | FS7: 0 | FT7: 0 | FU7: 0 | FV7: 0 | FW7: 0 | FX7: 0 | FY7: 0 | FZ7: 0 | GA7: 0 | GB7: 0 | GC7: 0 | GD7: 0 | GE7: 0 | GF7: 0 | GG7: 0 | GH7: 0 | GI7: 0 | GJ7: 0 | GK7: 0 | GL7: 0 | GM7: 0 | GN7: 0 | GO7: 0 | GP7: 0 | GQ7: 0 | GR7: 0 | GS7: 0 | GT7: 0 | GU7: 0 | GV7: 0 | GW7: 0 | GX7: 0 | GY7: 0 | GZ7: 0 | HA7: 0 | HB7: 0 | HC7: 0 | HD7: 0 | HE7: 0 | HF7: 0 | HG7: 0 | HH7: 0 | HI7: 0 | HJ7: 0 | HK7: 0 | HL7: 0 | HM7: 0 | HN7: 0 | HO7: 0 | HP7: 0 | HQ7: 0 | HR7: 0 | HS7: 0 | HT7: 0 | HU7: 0 | HV7: 0 | HW7: 0 | HX7: 0 | HY7: 0 | HZ7: 0 | IA7: 0 | IB7: 0 | IC7: 0 | ID7: 0 | IE7: 0 | IF7: 0 | IG7: 0 | IH7: 0 | II7: 0 | IJ7: 0 | IK7: 0 | IL7: 0
A8: Budgeted Hours MTD | B8: =IF(WEEKDAY(B3,2)<6,32.5,0) -> 0 | C8: =IF(WEEKDAY(C3,2)<6,32.5,0)+IF(DAY(C3)>1,B8,0) -> 0 | D8: =IF(WEEKDAY(D3,2)<6,32.5,0)+IF(DAY(D3)>1,C8,0) -> 32.5 | E8: =IF(WEEKDAY(E3,2)<6,32.5,0)+IF(DAY(E3)>1,D8,0) -> 65 | F8: =IF(WEEKDAY(F3,2)<6,32.5,0)+IF(DAY(F3)>1,E8,0) -> 97.5 | G8: =IF(WEEKDAY(G3,2)<6,32.5,0)+IF(DAY(G3)>1,F8,0) -> 130 | H8: =IF(WEEKDAY(H3,2)<6,32.5,0)+IF(DAY(H3)>1,G8,0) -> 162.5 | I8: =IF(WEEKDAY(I3,2)<6,32.5,0)+IF(DAY(I3)>1,H8,0) -> 162.5 | J8: =IF(WEEKDAY(J3,2)<6,32.5,0)+IF(DAY(J3)>1,I8,0) -> 162.5 | K8: =IF(WEEKDAY(K3,2)<6,32.5,0)+IF(DAY(K3)>1,J8,0) -> 195.0 | L8: =IF(WEEKDAY(L3,2)<6,32.5,0)+IF(DAY(L3)>1,K8,0) -> 227.5 | M8: =IF(WEEKDAY(M3,2)<6,32.5,0)+IF(DAY(M3)>1,L8,0) -> 260.0 | N8: =IF(WEEKDAY(N3,2)<6,32.5,0)+IF(DAY(N3)>1,M8,0) -> 292.5 | O8: =IF(WEEKDAY(O3,2)<6,32.5,0)+IF(DAY(O3)>1,N8,0) -> 325.0 | P8: =IF(WEEKDAY(P3,2)<6,32.5,0)+IF(DAY(P3)>1,O8,0) -> 325.0 | Q8: =IF(WEEKDAY(Q3,2)<6,32.5,0)+IF(DAY(Q3)>1,P8,0) -> 325.0 | R8: =IF(WEEKDAY(R3,2)<6,32.5,0)+IF(DAY(R3)>1,Q8,0) -> 357.5 | S8: =IF(WEEKDAY(S3,2)<6,32.5,0)+IF(DAY(S3)>1,R8,0) -> 390.0 | T8: =IF(WEEKDAY(T3,2)<6,32.5,0)+IF(DAY(T3)>1,S8,0) -> 422.5 | U8: =IF(WEEKDAY(U3,2)<6,32.5,0)+IF(DAY(U3)>1,T8,0) -> 455.0 | V8: =IF(WEEKDAY(V3,2)<6,32.5,0)+IF(DAY(V3)>1,U8,0) -> 487.5 | W8: =IF(WEEKDAY(W3,2)<6,32.5,0)+IF(DAY(W3)>1,V8,0) -> 487.5 | X8: =IF(WEEKDAY(X3,2)<6,32.5,0)+IF(DAY(X3)>1,W8,0) -> 487.5 | Y8: =IF(WEEKDAY(Y3,2)<6,32.5,0)+IF(DAY(Y3)>1,X8,0) -> 520.0 | Z8: =IF(WEEKDAY(Z3,2)<6,32.5,0)+IF(DAY(Z3)>1,Y8,0) -> 552.5 | AA8: =IF(WEEKDAY(AA3,2)<6,32.5,0)+IF(DAY(AA3)>1,Z8,0) -> 585.0 | AB8: =IF(WEEKDAY(AB3,2)<6,32.5,0)+IF(DAY(AB3)>1,AA8,0) -> 617.5 | AC8: =IF(WEEKDAY(AC3,2)<6,32.5,0)+IF(DAY(AC3)>1,AB8,0) -> 650.0 | AD8: =IF(WEEKDAY(AD3,2)<6,32.5,0)+IF(DAY(AD3)>1,AC8,0) -> 650.0 | AE8: =IF(WEEKDAY(AE3,2)<6,32.5,0)+IF(DAY(AE3)>1,AD8,0) -> 650.0 | AF8: =IF(WEEKDAY(AF3,2)<6,32.5,0)+IF(DAY(AF3)>1,AE8,0) -> 682.5 | AG8: =IF(WEEKDAY(AG3,2)<6,AG6*8,0)+IF(DAY(AG3)>1,AF8,0) -> 32.0 | AH8: =IF(WEEKDAY(AH3,2)<6,AH6*8,0)+IF(DAY(AH3)>1,AG8,0) -> 64.0 | AI8: =IF(WEEKDAY(AI3,2)<6,AI6*8,0)+IF(DAY(AI3)>1,AH8,0) -> 96.0 | AJ8: =IF(WEEKDAY(AJ3,2)<6,AJ6*8,0)+IF(DAY(AJ3)>1,AI8,0) -> 128.0 | AK8: =IF(WEEKDAY(AK3,2)<6,AK6*8,0)+IF(DAY(AK3)>1,AJ8,0) -> 128.0 | AL8: =IF(WEEKDAY(AL3,2)<6,AL6*8,0)+IF(DAY(AL3)>1,AK8,0) -> 128.0 | AM8: =IF(WEEKDAY(AM3,2)<6,AM6*8,0)+IF(DAY(AM3)>1,AL8,0) -> 160.0 | AN8: =IF(WEEKDAY(AN3,2)<6,AN6*8,0)+IF(DAY(AN3)>1,AM8,0) -> 192.0 | AO8: =IF(WEEKDAY(AO3,2)<6,AO6*8,0)+IF(DAY(AO3)>1,AN8,0) -> 224.0 | AP8: =IF(WEEKDAY(AP3,2)<6,AP6*8,0)+IF(DAY(AP3)>1,AO8,0) -> 256.0 | AQ8: =IF(WEEKDAY(AQ3,2)<6,AQ6*8,0)+IF(DAY(AQ3)>1,AP8,0) -> 288.0 | AR8: =IF(WEEKDAY(AR3,2)<6,AR6*8,0)+IF(DAY(AR3)>1,AQ8,0) -> 288.0 | AS8: =IF(WEEKDAY(AS3,2)<6,AS6*8,0)+IF(DAY(AS3)>1,AR8,0) -> 288.0 | AT8: =IF(WEEKDAY(AT3,2)<6,AT6*8,0)+IF(DAY(AT3)>1,AS8,0) -> 320.0 | AU8: =IF(WEEKDAY(AU3,2)<6,AU6*8,0)+IF(DAY(AU3)>1,AT8,0) -> 352.0 | AV8: =IF(WEEKDAY(AV3,2)<6,AV6*8,0)+IF(DAY(AV3)>1,AU8,0) -> 384.0 | AW8: =IF(WEEKDAY(AW3,2)<6,AW6*8,0)+IF(DAY(AW3)>1,AV8,0) -> 416.0 | AX8: =IF(WEEKDAY(AX3,2)<6,AX6*8,0)+IF(DAY(AX3)>1,AW8,0) -> 448.0 | AY8: =IF(WEEKDAY(AY3,2)<6,AY6*8,0)+IF(DAY(AY3)>1,AX8,0) -> 448.0 | AZ8: =IF(WEEKDAY(AZ3,2)<6,AZ6*8,0)+IF(DAY(AZ3)>1,AY8,0) -> 448.0 | BA8: =IF(WEEKDAY(BA3,2)<6,BA6*8,0)+IF(DAY(BA3)>1,AZ8,0) -> 480.0 | BB8: =IF(WEEKDAY(BB3,2)<6,BB6*8,0)+IF(DAY(BB3)>1,BA8,0) -> 512.0 | BC8: =IF(WEEKDAY(BC3,2)<6,BC6*8,0)+IF(DAY(BC3)>1,BB8,0) -> 544.0 | BD8: =IF(WEEKDAY(BD3,2)<6,BD6*8,0)+IF(DAY(BD3)>1,BC8,0) -> 576.0 | BE8: =IF(WEEKDAY(BE3,2)<6,BE6*8,0)+IF(DAY(BE3)>1,BD8,0) -> 608.0 | BF8: =IF(WEEKDAY(BF3,2)<6,BF6*8,0)+IF(DAY(BF3)>1,BE8,0) -> 608.0 | BG8: =IF(WEEKDAY(BG3,2)<6,BG6*8,0)+IF(DAY(BG3)>1,BF8,0) -> 608.0 | BH8: =IF(WEEKDAY(BH3,2)<6,BH6*8,0)+IF(DAY(BH3)>1,BG8,0) -> 640.0 | BI8: =IF(WEEKDAY(BI3,2)<6,BI6*8,0)+IF(DAY(BI3)>1,BH8,0) -> 672.0 | BJ8: =IF(WEEKDAY(BJ3,2)<6,BJ6*8,0)+IF(DAY(BJ3)>1,BI8,0) -> 704.0 | BK8: =IF(WEEKDAY(BK3,2)<6,BK6*8,0)+IF(DAY(BK3)>1,BJ8,0) -> 736.0 | BL8: =IF(OR(BL$2="sat",BL$2="sun"),0,BL6*8*(1+BL7))+IF(DAY(BL$3)=1,0,BK8) -> 24.0 | BM8: =IF(OR(BM$2="sat",BM$2="sun"),0,BM6*8*(1+BM7))+IF(DAY(BM$3)=1,0,BL8) -> 24.0 | BN8: =IF(OR(BN$2="sat",BN$2="sun"),0,BN6*8*(1+BN7))+IF(DAY(BN$3)=1,0,BM8) -> 24.0 | BO8: =IF(OR(BO$2="sat",BO$2="sun"),0,BO6*8*(1+BO7))+IF(DAY(BO$3)=1,0,BN8) -> 48.0 | BP8: =IF(OR(BP$2="sat",BP$2="sun"),0,BP6*8*(1+BP7))+IF(DAY(BP$3)=1,0,BO8) -> 72.0 | BQ8: =IF(OR(BQ$2="sat",BQ$2="sun"),0,BQ6*8*(1+BQ7))+IF(DAY(BQ$3)=1,0,BP8) -> 96.0 | BR8: =IF(OR(BR$2="sat",BR$2="sun"),0,BR6*8*(1+BR7))+IF(DAY(BR$3)=1,0,BQ8) -> 120.0 | BS8: =IF(OR(BS$2="sat",BS$2="sun"),0,BS6*8*(1+BS7))+IF(DAY(BS$3)=1,0,BR8) -> 144.0 | BT8: =IF(OR(BT$2="sat",BT$2="sun"),0,BT6*8*(1+BT7))+IF(DAY(BT$3)=1,0,BS8) -> 144.0 | BU8: =IF(OR(BU$2="sat",BU$2="sun"),0,BU6*8*(1+BU7))+IF(DAY(BU$3)=1,0,BT8) -> 144.0 | BV8: =IF(OR(BV$2="sat",BV$2="sun"),0,BV6*8*(1+BV7))+IF(DAY(BV$3)=1,0,BU8) -> 168.0 | BW8: =IF(OR(BW$2="sat",BW$2="sun"),0,BW6*8*(1+BW7))+IF(DAY(BW$3)=1,0,BV8) -> 192.0 | BX8: =IF(OR(BX$2="sat",BX$2="sun"),0,BX6*8*(1+BX7))+IF(DAY(BX$3)=1,0,BW8) -> 216.0 | BY8: =IF(OR(BY$2="sat",BY$2="sun"),0,BY6*8*(1+BY7))+IF(DAY(BY$3)=1,0,BX8) -> 240.0 | BZ8: =IF(OR(BZ$2="sat",BZ$2="sun"),0,BZ6*8*(1+BZ7))+IF(DAY(BZ$3)=1,0,BY8) -> 264.0 | CA8: =IF(OR(CA$2="sat",CA$2="sun"),0,CA6*8*(1+CA7))+IF(DAY(CA$3)=1,0,BZ8) -> 264.0 | CB8: =IF(OR(CB$2="sat",CB$2="sun"),0,CB6*8*(1+CB7))+IF(DAY(CB$3)=1,0,CA8) -> 264.0 | CC8: =IF(OR(CC$2="sat",CC$2="sun"),0,CC6*8*(1+CC7))+IF(DAY(CC$3)=1,0,CB8) -> 288.0 | CD8: =IF(OR(CD$2="sat",CD$2="sun"),0,CD6*8*(1+CD7))+IF(DAY(CD$3)=1,0,CC8) -> 312.0 | CE8: =IF(OR(CE$2="sat",CE$2="sun"),0,CE6*8*(1+CE7))+IF(DAY(CE$3)=1,0,CD8) -> 336.0 | CF8: =IF(OR(CF$2="sat",CF$2="sun"),0,CF6*8*(1+CF7))+IF(DAY(CF$3)=1,0,CE8) -> 360.0 | CG8: =IF(OR(CG$2="sat",CG$2="sun"),0,CG6*8*(1+CG7))+IF(DAY(CG$3)=1,0,CF8) -> 384.0 | CH8: =IF(OR(CH$2="sat",CH$2="sun"),0,CH6*8*(1+CH7))+IF(DAY(CH$3)=1,0,CG8) -> 384.0 | CI8: =IF(OR(CI$2="sat",CI$2="sun"),0,CI6*8*(1+CI7))+IF(DAY(CI$3)=1,0,CH8) -> 384.0 | CJ8: =IF(OR(CJ$2="sat",CJ$2="sun"),0,CJ6*8*(1+CJ7))+IF(DAY(CJ$3)=1,0,CI8) -> 408.0 | CK8: =IF(OR(CK$2="sat",CK$2="sun"),0,CK6*8*(1+CK7))+IF(DAY(CK$3)=1,0,CJ8) -> 432.0 | CL8: =IF(OR(CL$2="sat",CL$2="sun"),0,CL6*8*(1+CL7))+IF(DAY(CL$3)=1,0,CK8) -> 456.0 | CM8: =IF(OR(CM$2="sat",CM$2="sun"),0,CM6*8*(1+CM7))+IF(DAY(CM$3)=1,0,CL8) -> 480.0 | CN8: =IF(OR(CN$2="sat",CN$2="sun"),0,CN6*8*(1+CN7))+IF(DAY(CN$3)=1,0,CM8) -> 24.0 | CO8: =IF(OR(CO$2="sat",CO$2="sun"),0,CO6*8*(1+CO7))+IF(DAY(CO$3)=1,0,CN8) -> 24.0 | CP8: =IF(OR(CP$2="sat",CP$2="sun"),0,CP6*8*(1+CP7))+IF(DAY(CP$3)=1,0,CO8) -> 24.0 | CQ8: =IF(OR(CQ$2="sat",CQ$2="sun"),0,CQ6*8*(1+CQ7))+IF(DAY(CQ$3)=1,0,CP8) -> 48.0 | CR8: =IF(OR(CR$2="sat",CR$2="sun"),0,CR6*8*(1+CR7))+IF(DAY(CR$3)=1,0,CQ8) -> 72.0 | CS8: =IF(OR(CS$2="sat",CS$2="sun"),0,CS6*8*(1+CS7))+IF(DAY(CS$3)=1,0,CR8) -> 96.0 | CT8: =IF(OR(CT$2="sat",CT$2="sun"),0,CT6*8*(1+CT7))+IF(DAY(CT$3)=1,0,CS8) -> 120.0 | CU8: =IF(OR(CU$2="sat",CU$2="sun"),0,CU6*8*(1+CU7))+IF(DAY(CU$3)=1,0,CT8) -> 144.0 | CV8: =IF(OR(CV$2="sat",CV$2="sun"),0,CV6*8*(1+CV7))+IF(DAY(CV$3)=1,0,CU8) -> 144.0 | CW8: =IF(OR(CW$2="sat",CW$2="sun"),0,CW6*8*(1+CW7))+IF(DAY(CW$3)=1,0,CV8) -> 144.0 | CX8: =IF(OR(CX$2="sat",CX$2="sun"),0,CX6*8*(1+CX7))+IF(DAY(CX$3)=1,0,CW8) -> 168.0 | CY8: =IF(OR(CY$2="sat",CY$2="sun"),0,CY6*8*(1+CY7))+IF(DAY(CY$3)=1,0,CX8) -> 192.0 | CZ8: =IF(OR(CZ$2="sat",CZ$2="sun"),0,CZ6*8*(1+CZ7))+IF(DAY(CZ$3)=1,0,CY8) -> 216.0 | DA8: =IF(OR(DA$2="sat",DA$2="sun"),0,DA6*8*(1+DA7))+IF(DAY(DA$3)=1,0,CZ8) -> 240.0 | DB8: =IF(OR(DB$2="sat",DB$2="sun"),0,DB6*8*(1+DB7))+IF(DAY(DB$3)=1,0,DA8) -> 264.0 | DC8: =IF(OR(DC$2="sat",DC$2="sun"),0,DC6*8*(1+DC7))+IF(DAY(DC$3)=1,0,DB8) -> 264.0 | DD8: =IF(OR(DD$2="sat",DD$2="sun"),0,DD6*8*(1+DD7))+IF(DAY(DD$3)=1,0,DC8) -> 264.0 | DE8: =IF(OR(DE$2="sat",DE$2="sun"),0,DE6*8*(1+DE7))+IF(DAY(DE$3)=1,0,DD8) -> 288.0 | DF8: =IF(OR(DF$2="sat",DF$2="sun"),0,DF6*8*(1+DF7))+IF(DAY(DF$3)=1,0,DE8) -> 312.0 | DG8: =IF(OR(DG$2="sat",DG$2="sun"),0,DG6*8*(1+DG7))+IF(DAY(DG$3)=1,0,DF8) -> 336.0 | DH8: =IF(OR(DH$2="sat",DH$2="sun"),0,DH6*8*(1+DH7))+IF(DAY(DH$3)=1,0,DG8) -> 360.0 | DI8: =IF(OR(DI$2="sat",DI$2="sun"),0,DI6*8*(1+DI7))+IF(DAY(DI$3)=1,0,DH8) -> 384.0 | DJ8: =IF(OR(DJ$2="sat",DJ$2="sun"),0,DJ6*8*(1+DJ7))+IF(DAY(DJ$3)=1,0,DI8) -> 384.0 | DK8: =IF(OR(DK$2="sat",DK$2="sun"),0,DK6*8*(1+DK7))+IF(DAY(DK$3)=1,0,DJ8) -> 384.0 | DL8: =IF(OR(DL$2="sat",DL$2="sun"),0,DL6*8*(1+DL7))+IF(DAY(DL$3)=1,0,DK8) -> 408.0 | DM8: =IF(OR(DM$2="sat",DM$2="sun"),0,DM6*8*(1+DM7))+IF(DAY(DM$3)=1,0,DL8) -> 432.0 | DN8: =IF(OR(DN$2="sat",DN$2="sun"),0,DN6*8*(1+DN7))+IF(DAY(DN$3)=1,0,DM8) -> 456.0 | DO8: =IF(OR(DO$2="sat",DO$2="sun"),0,DO6*8*(1+DO7))+IF(DAY(DO$3)=1,0,DN8) -> 480.0 | DP8: =IF(OR(DP$2="sat",DP$2="sun"),0,DP6*8*(1+DP7))+IF(DAY(DP$3)=1,0,DO8) -> 504.0 | DQ8: =IF(OR(DQ$2="sat",DQ$2="sun"),0,DQ6*8*(1+DQ7))+IF(DAY(DQ$3)=1,0,DP8) -> 504.0 | DR8: =IF(OR(DR$2="sat",DR$2="sun"),0,DR6*8*(1+DR7))+IF(DAY(DR$3)=1,0,DQ8) -> 504.0 | DS8: =IF(OR(DS$2="sat",DS$2="sun"),0,DS6*8*(1+DS7))+IF(DAY(DS$3)=1,0,DR8) -> 24.0 | DT8: =IF(OR(DT$2="sat",DT$2="sun"),0,DT6*8*(1+DT7))+IF(DAY(DT$3)=1,0,DS8) -> 48.0 | DU8: =IF(OR(DU$2="sat",DU$2="sun"),0,DU6*8*(1+DU7))+IF(DAY(DU$3)=1,0,DT8) -> 72.0 | DV8: =IF(OR(DV$2="sat",DV$2="sun"),0,DV6*8*(1+DV7))+IF(DAY(DV$3)=1,0,DU8) -> 96.0 | DW8: =IF(OR(DW$2="sat",DW$2="sun"),0,DW6*8*(1+DW7))+IF(DAY(DW$3)=1,0,DV8) -> 120.0 | DX8: =IF(OR(DX$2="sat",DX$2="sun"),0,DX6*8*(1+DX7))+IF(DAY(DX$3)=1,0,DW8) -> 120.0 | DY8: =IF(OR(DY$2="sat",DY$2="sun"),0,DY6*8*(1+DY7))+IF(DAY(DY$3)=1,0,DX8) -> 120.0 | DZ8: =IF(OR(DZ$2="sat",DZ$2="sun"),0,DZ6*8*(1+DZ7))+IF(DAY(DZ$3)=1,0,DY8) -> 144.0 | EA8: =IF(OR(EA$2="sat",EA$2="sun"),0,EA6*8*(1+EA7))+IF(DAY(EA$3)=1,0,DZ8) -> 168.0 | EB8: =IF(OR(EB$2="sat",EB$2="sun"),0,EB6*8*(1+EB7))+IF(DAY(EB$3)=1,0,EA8) -> 192.0 | EC8: =IF(OR(EC$2="sat",EC$2="sun"),0,EC6*8*(1+EC7))+IF(DAY(EC$3)=1,0,EB8) -> 216.0 | ED8: =IF(OR(ED$2="sat",ED$2="sun"),0,ED6*8*(1+ED7))+IF(DAY(ED$3)=1,0,EC8) -> 240.0 | EE8: =IF(OR(EE$2="sat",EE$2="sun"),0,EE6*8*(1+EE7))+IF(DAY(EE$3)=1,0,ED8) -> 240.0 | EF8: =IF(OR(EF$2="sat",EF$2="sun"),0,EF6*8*(1+EF7))+IF(DAY(EF$3)=1,0,EE8) -> 240.0 | EG8: =IF(OR(EG$2="sat",EG$2="sun"),0,EG6*8*(1+EG7))+IF(DAY(EG$3)=1,0,EF8) -> 264.0 | EH8: =IF(OR(EH$2="sat",EH$2="sun"),0,EH6*8*(1+EH7))+IF(DAY(EH$3)=1,0,EG8) -> 288.0 | EI8: =IF(OR(EI$2="sat",EI$2="sun"),0,EI6*8*(1+EI7))+IF(DAY(EI$3)=1,0,EH8) -> 312.0 | EJ8: =IF(OR(EJ$2="sat",EJ$2="sun"),0,EJ6*8*(1+EJ7))+IF(DAY(EJ$3)=1,0,EI8) -> 336.0 | EK8: =IF(OR(EK$2="sat",EK$2="sun"),0,EK6*8*(1+EK7))+IF(DAY(EK$3)=1,0,EJ8) -> 360.0 | EL8: =IF(OR(EL$2="sat",EL$2="sun"),0,EL6*8*(1+EL7))+IF(DAY(EL$3)=1,0,EK8) -> 360.0 | EM8: =IF(OR(EM$2="sat",EM$2="sun"),0,EM6*8*(1+EM7))+IF(DAY(EM$3)=1,0,EL8) -> 360.0 | EN8: =IF(OR(EN$2="sat",EN$2="sun"),0,EN6*8*(1+EN7))+IF(DAY(EN$3)=1,0,EM8) -> 384.0 | EO8: =IF(OR(EO$2="sat",EO$2="sun"),0,EO6*8*(1+EO7))+IF(DAY(EO$3)=1,0,EN8) -> 408.0 | EP8: =IF(OR(EP$2="sat",EP$2="sun"),0,EP6*8*(1+EP7))+IF(DAY(EP$3)=1,0,EO8) -> 432.0 | EQ8: =IF(OR(EQ$2="sat",EQ$2="sun"),0,EQ6*8*(1+EQ7))+IF(DAY(EQ$3)=1,0,EP8) -> 456.0 | ER8: =IF(OR(ER$2="sat",ER$2="sun"),0,ER6*8*(1+ER7))+IF(DAY(ER$3)=1,0,EQ8) -> 480.0 | ES8: =IF(OR(ES$2="sat",ES$2="sun"),0,ES6*8*(1+ES7))+IF(DAY(ES$3)=1,0,ER8) -> 480.0 | ET8: =IF(OR(ET$2="sat",ET$2="sun"),0,ET6*8*(1+ET7))+IF(DAY(ET$3)=1,0,ES8) -> 480.0 | EU8: =IF(OR(EU$2="sat",EU$2="sun"),0,EU6*8*(1+EU7))+IF(DAY(EU$3)=1,0,ET8) -> 504.0 | EV8: =IF(OR(EV$2="sat",EV$2="sun"),0,EV6*8*(1+EV7))+IF(DAY(EV$3)=1,0,EU8) -> 528.0 | EW8: =IF(OR(EW$2="sat",EW$2="sun"),0,EW6*8*(1+EW7))+IF(DAY(EW$3)=1,0,EV8) -> 24.0 | EX8: =IF(OR(EX$2="sat",EX$2="sun"),0,EX6*8*(1+EX7))+IF(DAY(EX$3)=1,0,EW8) -> 48.0 | EY8: =IF(OR(EY$2="sat",EY$2="sun"),0,EY6*8*(1+EY7))+IF(DAY(EY$3)=1,0,EX8) -> 72.0 | EZ8: =IF(OR(EZ$2="sat",EZ$2="sun"),0,EZ6*8*(1+EZ7))+IF(DAY(EZ$3)=1,0,EY8) -> 72.0 | FA8: =IF(OR(FA$2="sat",FA$2="sun"),0,FA6*8*(1+FA7))+IF(DAY(FA$3)=1,0,EZ8) -> 72.0 | FB8: =IF(OR(FB$2="sat",FB$2="sun"),0,FB6*8*(1+FB7))+IF(DAY(FB$3)=1,0,FA8) -> 96.0 | FC8: =IF(OR(FC$2="sat",FC$2="sun"),0,FC6*8*(1+FC7))+IF(DAY(FC$3)=1,0,FB8) -> 120.0 | FD8: =IF(OR(FD$2="sat",FD$2="sun"),0,FD6*8*(1+FD7))+IF(DAY(FD$3)=1,0,FC8) -> 144.0 | FE8: =IF(OR(FE$2="sat",FE$2="sun"),0,FE6*8*(1+FE7))+IF(DAY(FE$3)=1,0,FD8) -> 168.0 | FF8: =IF(OR(FF$2="sat",FF$2="sun"),0,FF6*8*(1+FF7))+IF(DAY(FF$3)=1,0,FE8) -> 192.0 | FG8: =IF(OR(FG$2="sat",FG$2="sun"),0,FG6*8*(1+FG7))+IF(DAY(FG$3)=1,0,FF8) -> 192.0 | FH8: =IF(OR(FH$2="sat",FH$2="sun"),0,FH6*8*(1+FH7))+IF(DAY(FH$3)=1,0,FG8) -> 192.0 | FI8: =IF(OR(FI$2="sat",FI$2="sun"),0,FI6*8*(1+FI7))+IF(DAY(FI$3)=1,0,FH8) -> 216.0 | FJ8: =IF(OR(FJ$2="sat",FJ$2="sun"),0,FJ6*8*(1+FJ7))+IF(DAY(FJ$3)=1,0,FI8) -> 240.0 | FK8: =IF(OR(FK$2="sat",FK$2="sun"),0,FK6*8*(1+FK7))+IF(DAY(FK$3)=1,0,FJ8) -> 264.0 | FL8: =IF(OR(FL$2="sat",FL$2="sun"),0,FL6*8*(1+FL7))+IF(DAY(FL$3)=1,0,FK8) -> 288.0 | FM8: =IF(OR(FM$2="sat",FM$2="sun"),0,FM6*8*(1+FM7))+IF(DAY(FM$3)=1,0,FL8) -> 312.0 | FN8: =IF(OR(FN$2="sat",FN$2="sun"),0,FN6*8*(1+FN7))+IF(DAY(FN$3)=1,0,FM8) -> 312.0 | FO8: =IF(OR(FO$2="sat",FO$2="sun"),0,FO6*8*(1+FO7))+IF(DAY(FO$3)=1,0,FN8) -> 312.0 | FP8: =IF(OR(FP$2="sat",FP$2="sun"),0,FP6*8*(1+FP7))+IF(DAY(FP$3)=1,0,FO8) -> 336.0 | FQ8: =IF(OR(FQ$2="sat",FQ$2="sun"),0,FQ6*8*(1+FQ7))+IF(DAY(FQ$3)=1,0,FP8) -> 360.0 | FR8: =IF(OR(FR$2="sat",FR$2="sun"),0,FR6*8*(1+FR7))+IF(DAY(FR$3)=1,0,FQ8) -> 384.0 | FS8: =IF(OR(FS$2="sat",FS$2="sun"),0,FS6*8*(1+FS7))+IF(DAY(FS$3)=1,0,FR8) -> 408.0 | FT8: =IF(OR(FT$2="sat",FT$2="sun"),0,FT6*8*(1+FT7))+IF(DAY(FT$3)=1,0,FS8) -> 432.0 | FU8: =IF(OR(FU$2="sat",FU$2="sun"),0,FU6*8*(1+FU7))+IF(DAY(FU$3)=1,0,FT8) -> 432.0 | FV8: =IF(OR(FV$2="sat",FV$2="sun"),0,FV6*8*(1+FV7))+IF(DAY(FV$3)=1,0,FU8) -> 432.0 | FW8: =IF(OR(FW$2="sat",FW$2="sun"),0,FW6*8*(1+FW7))+IF(DAY(FW$3)=1,0,FV8) -> 456.0 | FX8: =IF(OR(FX$2="sat",FX$2="sun"),0,FX6*8*(1+FX7))+IF(DAY(FX$3)=1,0,FW8) -> 480.0 | FY8: =IF(OR(FY$2="sat",FY$2="sun"),0,FY6*8*(1+FY7))+IF(DAY(FY$3)=1,0,FX8) -> 504.0 | FZ8: =IF(OR(FZ$2="sat",FZ$2="sun"),0,FZ6*8*(1+FZ7))+IF(DAY(FZ$3)=1,0,FY8) -> 528.0 | GA8: =IF(OR(GA$2="sat",GA$2="sun"),0,GA6*8*(1+GA7))+IF(DAY(GA$3)=1,0,FZ8) -> 552.0 | GB8: =IF(OR(GB$2="sat",GB$2="sun"),0,GB6*8*(1+GB7))+IF(DAY(GB$3)=1,0,GA8) -> 0.0 | GC8: =IF(OR(GC$2="sat",GC$2="sun"),0,GC6*8*(1+GC7))+IF(DAY(GC$3)=1,0,GB8) -> 0.0 | GD8: =IF(OR(GD$2="sat",GD$2="sun"),0,GD6*8*(1+GD7))+IF(DAY(GD$3)=1,0,GC8) -> 24.0 | GE8: =IF(OR(GE$2="sat",GE$2="sun"),0,GE6*8*(1+GE7))+IF(DAY(GE$3)=1,0,GD8) -> 48.0 | GF8: =IF(OR(GF$2="sat",GF$2="sun"),0,GF6*8*(1+GF7))+IF(DAY(GF$3)=1,0,GE8) -> 72.0 | GG8: =IF(OR(GG$2="sat",GG$2="sun"),0,GG6*8*(1+GG7))+IF(DAY(GG$3)=1,0,GF8) -> 96.0 | GH8: =IF(OR(GH$2="sat",GH$2="sun"),0,GH6*8*(1+GH7))+IF(DAY(GH$3)=1,0,GG8) -> 120.0 | GI8: =IF(OR(GI$2="sat",GI$2="sun"),0,GI6*8*(1+GI7))+IF(DAY(GI$3)=1,0,GH8) -> 120.0 | GJ8: =IF(OR(GJ$2="sat",GJ$2="sun"),0,GJ6*8*(1+GJ7))+IF(DAY(GJ$3)=1,0,GI8) -> 120.0 | GK8: =IF(OR(GK$2="sat",GK$2="sun"),0,GK6*8*(1+GK7))+IF(DAY(GK$3)=1,0,GJ8) -> 144.0 | GL8: =IF(OR(GL$2="sat",GL$2="sun"),0,GL6*8*(1+GL7))+IF(DAY(GL$3)=1,0,GK8) -> 168.0 | GM8: =IF(OR(GM$2="sat",GM$2="sun"),0,GM6*8*(1+GM7))+IF(DAY(GM$3)=1,0,GL8) -> 192.0 | GN8: =IF(OR(GN$2="sat",GN$2="sun"),0,GN6*8*(1+GN7))+IF(DAY(GN$3)=1,0,GM8) -> 216.0 | GO8: =IF(OR(GO$2="sat",GO$2="sun"),0,GO6*8*(1+GO7))+IF(DAY(GO$3)=1,0,GN8) -> 240.0 | GP8: =IF(OR(GP$2="sat",GP$2="sun"),0,GP6*8*(1+GP7))+IF(DAY(GP$3)=1,0,GO8) -> 240.0 | GQ8: =IF(OR(GQ$2="sat",GQ$2="sun"),0,GQ6*8*(1+GQ7))+IF(DAY(GQ$3)=1,0,GP8) -> 240.0 | GR8: =IF(OR(GR$2="sat",GR$2="sun"),0,GR6*8*(1+GR7))+IF(DAY(GR$3)=1,0,GQ8) -> 264.0 | GS8: =IF(OR(GS$2="sat",GS$2="sun"),0,GS6*8*(1+GS7))+IF(DAY(GS$3)=1,0,GR8) -> 288.0 | GT8: =IF(OR(GT$2="sat",GT$2="sun"),0,GT6*8*(1+GT7))+IF(DAY(GT$3)=1,0,GS8) -> 312.0 | GU8: =IF(OR(GU$2="sat",GU$2="sun"),0,GU6*8*(1+GU7))+IF(DAY(GU$3)=1,0,GT8) -> 336.0 | GV8: =IF(OR(GV$2="sat",GV$2="sun"),0,GV6*8*(1+GV7))+IF(DAY(GV$3)=1,0,GU8) -> 360.0 | GW8: =IF(OR(GW$2="sat",GW$2="sun"),0,GW6*8*(1+GW7))+IF(DAY(GW$3)=1,0,GV8) -> 360.0 | GX8: =IF(OR(GX$2="sat",GX$2="sun"),0,GX6*8*(1+GX7))+IF(DAY(GX$3)=1,0,GW8) -> 360.0 | GY8: =IF(OR(GY$2="sat",GY$2="sun"),0,GY6*8*(1+GY7))+IF(DAY(GY$3)=1,0,GX8) -> 384.0 | GZ8: =IF(OR(GZ$2="sat",GZ$2="sun"),0,GZ6*8*(1+GZ7))+IF(DAY(GZ$3)=1,0,GY8) -> 408.0 | HA8: =IF(OR(HA$2="sat",HA$2="sun"),0,HA6*8*(1+HA7))+IF(DAY(HA$3)=1,0,GZ8) -> 432.0 | HB8: =IF(OR(HB$2="sat",HB$2="sun"),0,HB6*8*(1+HB7))+IF(DAY(HB$3)=1,0,HA8) -> 456.0 | HC8: =IF(OR(HC$2="sat",HC$2="sun"),0,HC6*8*(1+HC7))+IF(DAY(HC$3)=1,0,HB8) -> 480.0 | HD8: =IF(OR(HD$2="sat",HD$2="sun"),0,HD6*8*(1+HD7))+IF(DAY(HD$3)=1,0,HC8) -> 480.0 | HE8: =IF(OR(HE$2="sat",HE$2="sun"),0,HE6*8*(1+HE7))+IF(DAY(HE$3)=1,0,HD8) -> 480.0 | HF8: =IF(OR(HF$2="sat",HF$2="sun"),0,HF6*8*(1+HF7))+IF(DAY(HF$3)=1,0,HE8) -> 24.0 | HG8: =IF(OR(HG$2="sat",HG$2="sun"),0,HG6*8*(1+HG7))+IF(DAY(HG$3)=1,0,HF8) -> 48.0 | HH8: =IF(OR(HH$2="sat",HH$2="sun"),0,HH6*8*(1+HH7))+IF(DAY(HH$3)=1,0,HG8) -> 72.0 | HI8: =IF(OR(HI$2="sat",HI$2="sun"),0,HI6*8*(1+HI7))+IF(DAY(HI$3)=1,0,HH8) -> 96.0 | HJ8: =IF(OR(HJ$2="sat",HJ$2="sun"),0,HJ6*8*(1+HJ7))+IF(DAY(HJ$3)=1,0,HI8) -> 120.0 | HK8: =IF(OR(HK$2="sat",HK$2="sun"),0,HK6*8*(1+HK7))+IF(DAY(HK$3)=1,0,HJ8) -> 120.0 | HL8: =IF(OR(HL$2="sat",HL$2="sun"),0,HL6*8*(1+HL7))+IF(DAY(HL$3)=1,0,HK8) -> 120.0 | HM8: =IF(OR(HM$2="sat",HM$2="sun"),0,HM6*8*(1+HM7))+IF(DAY(HM$3)=1,0,HL8) -> 144.0 | HN8: =IF(OR(HN$2="sat",HN$2="sun"),0,HN6*8*(1+HN7))+IF(DAY(HN$3)=1,0,HM8) -> 168.0 | HO8: =IF(OR(HO$2="sat",HO$2="sun"),0,HO6*8*(1+HO7))+IF(DAY(HO$3)=1,0,HN8) -> 192.0 | HP8: =IF(OR(HP$2="sat",HP$2="sun"),0,HP6*8*(1+HP7))+IF(DAY(HP$3)=1,0,HO8) -> 216.0 | HQ8: =IF(OR(HQ$2="sat",HQ$2="sun"),0,HQ6*8*(1+HQ7))+IF(DAY(HQ$3)=1,0,HP8) -> 240.0 | HR8: =IF(OR(HR$2="sat",HR$2="sun"),0,HR6*8*(1+HR7))+IF(DAY(HR$3)=1,0,HQ8) -> 240.0 | HS8: =IF(OR(HS$2="sat",HS$2="sun"),0,HS6*8*(1+HS7))+IF(DAY(HS$3)=1,0,HR8) -> 240.0 | HT8: =IF(OR(HT$2="sat",HT$2="sun"),0,HT6*8*(1+HT7))+IF(DAY(HT$3)=1,0,HS8) -> 264.0 | HU8: =IF(OR(HU$2="sat",HU$2="sun"),0,HU6*8*(1+HU7))+IF(DAY(HU$3)=1,0,HT8) -> 288.0 | HV8: =IF(OR(HV$2="sat",HV$2="sun"),0,HV6*8*(1+HV7))+IF(DAY(HV$3)=1,0,HU8) -> 312.0 | HW8: =IF(OR(HW$2="sat",HW$2="sun"),0,HW6*8*(1+HW7))+IF(DAY(HW$3)=1,0,HV8) -> 336.0 | HX8: =IF(OR(HX$2="sat",HX$2="sun"),0,HX6*8*(1+HX7))+IF(DAY(HX$3)=1,0,HW8) -> 360.0 | HY8: =IF(OR(HY$2="sat",HY$2="sun"),0,HY6*8*(1+HY7))+IF(DAY(HY$3)=1,0,HX8) -> 360.0 | HZ8: =IF(OR(HZ$2="sat",HZ$2="sun"),0,HZ6*8*(1+HZ7))+IF(DAY(HZ$3)=1,0,HY8) -> 360.0 | IA8: =IF(OR(IA$2="sat",IA$2="sun"),0,IA6*8*(1+IA7))+IF(DAY(IA$3)=1,0,HZ8) -> 384.0 | IB8: =IF(OR(IB$2="sat",IB$2="sun"),0,IB6*8*(1+IB7))+IF(DAY(IB$3)=1,0,IA8) -> 408.0 | IC8: =IF(OR(IC$2="sat",IC$2="sun"),0,IC6*8*(1+IC7))+IF(DAY(IC$3)=1,0,IB8) -> 432.0 | ID8: =IF(OR(ID$2="sat",ID$2="sun"),0,ID6*8*(1+ID7))+IF(DAY(ID$3)=1,0,IC8) -> 456.0 | IE8: =IF(OR(IE$2="sat",IE$2="sun"),0,IE6*8*(1+IE7))+IF(DAY(IE$3)=1,0,ID8) -> 480.0 | IF8: =IF(OR(IF$2="sat",IF$2="sun"),0,IF6*8*(1+IF7))+IF(DAY(IF$3)=1,0,IE8) -> 480.0 | IG8: =IF(OR(IG$2="sat",IG$2="sun"),0,IG6*8*(1+IG7))+IF(DAY(IG$3)=1,0,IF8) -> 480.0 | IH8: =IF(OR(IH$2="sat",IH$2="sun"),0,IH6*8*(1+IH7))+IF(DAY(IH$3)=1,0,IG8) -> 504.0 | II8: =IF(OR(II$2="sat",II$2="sun"),0,II6*8*(1+II7))+IF(DAY(II$3)=1,0,IH8) -> 528.0 | IJ8: =IF(OR(IJ$2="sat",IJ$2="sun"),0,IJ6*8*(1+IJ7))+IF(DAY(IJ$3)=1,0,II8) -> 552.0 | IK8: =IF(OR(IK$2="sat",IK$2="sun"),0,IK6*8*(1+IK7))+IF(DAY(IK$3)=1,0,IJ8) -> 24.0 | IL8: =IF(OR(IL$2="sat",IL$2="sun"),0,IL6*8*(1+IL7))+IF(DAY(IL$3)=1,0,IK8) -> 48.0
A10: Actual Hours[1] | B10: 0.00 | C10: 0.00 | D10: 30.75 | E10: 34.90 | F10: 34.75 | G10: 32.50 | H10: 35.15 | I10: 0.00 | J10: 0.00 | K10: 32.23 | L10: 32.82 | M10: 35.67 | N10: 37.00 | O10: 42.00 | P10: 0.00 | Q10: 0.00 | R10: 32.73 | S10: 36.98 | T10: 37.75 | U10: 32.45 | V10: 33.00 | W10: 0.00 | X10: 0.00 | Y10: 0.00 | Z10: 0.00 | AA10: 25.50 | AB10: 24.50 | AC10: 24.00 | AD10: 0.00 | AE10: 0.00 | AF10: 21.00 | AG10: 0.00 | AH10: 34.25 | AI10: 34.00 | AJ10: 37.75 | AK10: 0.00 | AL10: 0.00 | AM10: 37.23 | AN10: 32.00 | AO10: 40.25 | AP10: 38.75 | AQ10: 30.75 | AR10: 0.00 | AS10: 0.00 | AT10: 34.00 | AU10: 37.75 | AV10: 37.00 | AW10: 32.25 | AX10: 44.75 | AY10: 3.23 | AZ10: 0.00 | BA10: 40.33 | BB10: 40.50 | BC10: 36.75 | BD10: 41.45 | BE10: 42.75 | BF10: 1.75 | BG10: 0.00 | BH10: =24.5+9.17 -> 33.67 | BI10: =25.25+9.23 -> 34.48 | BJ10: =25.25+7.92 -> 33.17 | BK10: =25+10.5 -> 35.50 | BL10: =23.5+0 -> 23.50 | BM10: 0.00 | BN10: 0.00 | BO10: =25.5+9.8 -> 35.30 | BP10: =25.75+8.7 -> 34.45 | BQ10: =26.5+12.2 -> 38.70 | BR10: =24.5+9.15 -> 33.65 | BS10: =25+8.93 -> 33.93 | BT10: 0.00 | BU10: 0.00 | BV10: =25+9.08 -> 34.08 | BW10: =24.75+13.35 -> 38.10 | BX10: =25.25+8.12 -> 33.37 | BY10: =25+9.38 -> 34.38 | BZ10: =25+9.05 -> 34.05 | CA10: 0.00 | CB10: 0.00 | CC10: =22.75+7.95 -> 30.70 | CD10: =23.75+8.67 -> 32.42 | CE10: =24.25+8.72 -> 32.97 | CF10: =24.5+6.3 -> 30.80 | CG10: =24.75+1.5 -> 26.25 | CH10: 0.00 | CI10: 0.00 | CJ10: 25.75 | CK10: 23.75 | CL10: 24.00 | CM10: 24.00 | CN10: 24.00 | CO10: 0.00 | CP10: 0.00 | CQ10: =24+5.75 -> 29.75 | CR10: =23.25+1.15 -> 24.40 | CS10: =23.5+8 -> 31.50 | CT10: =16.75+6.5 -> 23.25 | CU10: =17+3 -> 20.00 | CV10: 0.00 | CW10: 0.00 | CX10: =23.5+1.75 -> 25.25 | CY10: =23.75+1.75 -> 25.50 | CZ10: =24+1.5 -> 25.50 | DA10: =23.5+1.75 -> 25.25 | DB10: =23.75+6.5 -> 30.25 | DC10: 0.00 | DD10: 0.00 | DE10: =23.5+9.25 -> 32.75 | DF10: =24+6.75 -> 30.75 | DG10: =23.5+4.5 -> 28.00 | DH10: 23.75 | DI10: 15.50 | DJ10: 0.00 | DK10: 0.00 | DL10: 25.75 | DM10: 24.50 | DN10: 21.00 | DO10: 16.75 | DP10: 0.00 | DQ10: 0.00 | DR10: 0.00 | DS10: =26.5+6 -> 32.50 | DT10: =25+2.75 -> 27.75 | DU10: =25.75+7 -> 32.75 | DV10: =24.25+1 -> 25.25 | DW10: 23.00 | DX10: 0.00 | DY10: 0.00 | DZ10: =36.25+2 -> 38.25 | EA10: =25.5+6.08 -> 31.58 | EB10: =16.75+8.4 -> 25.15 | EC10: 26.75 | ED10: =23.25+8.48 -> 31.73 | EE10: 0.00 | EF10: 0.00 | EG10: 25.25 | EH10: 26.75 | EI10: 26.50 | EJ10: 25.50 | EK10: 25.25 | EL10: 0.00 | EM10: 0.00 | EN10: 26.00 | EO10: 25.25 | EP10: 25.50 | EQ10: 25.25 | ER10: 24.75 | ES10: 0.00 | ET10: 0.00 | EU10: 25.50 | EV10: 26.25 | EW10: 26.00 | EX10: 25.25 | EY10: 25.50 | EZ10: 0.00 | FA10: 0.00 | FB10: 18.50 | FC10: 25.00 | FD10: 25.50 | FE10: 25.50 | FF10: 25.50 | FG10: 0.00 | FH10: 0.00 | FI10: 25.75 | FJ10: =26.75+9 -> 35.75 | FK10: =24.25+9.87 -> 34.12 | FL10: 26.00 | FM10: =24.75+2.75 -> 27.50 | FN10: 0.00 | FO10: 0.00 | FP10: =27+9 -> 36.00 | FQ10: =24.25+9.13 -> 33.38 | FR10: =25.5+8.93 -> 34.43 | FS10: =24+9.52 -> 33.52 | FT10: =24.25+9 -> 33.25 | FU10: 0.00 | FV10: 0.00 | FW10: 0.00 | FX10: =24.75+9 -> 33.75 | FY10: =24.5+6.1 -> 30.60 | FZ10: =22.25+9 -> 31.25 | GA10: =24.75+9.5 -> 34.25 | GB10: 0.00 | GC10: 0.00 | GD10: =33.25+9.5 -> 42.75 | GE10: =32.75+9 -> 41.75 | GF10: =25.75+0.17 -> 25.92 | GG10: =35+0.25 -> 35.25 | GH10: =24.75+0.5 -> 25.25 | GI10: 0.00 | GJ10: 0.00 | GK10: 27.25 | GL10: 34.50 | GM10: 23.75 | GN10: 36.25 | GO10: =31.75+9 -> 40.75 | GP10: 0.00 | GQ10: 0.00 | GR10: 24.50 | GS10: 33.00 | GT10: 31.25 | GU10: 25.00 | GV10: 24.75 | GW10: 0.00 | GX10: 0.00 | GY10: 32.25 | GZ10: 23.25 | HA10: 36.25 | HB10: 35.00 | HC10: 39.50 | HD10: 0.00 | HE10: 0.00 | HF10: 19.25 | HG10: 35.75 | HH10: 34.25 | HI10: 0.00 | HJ10: 32.25 | HK10: 0.00 | HL10: 0.00 | HM10: 24.00 | HN10: 16.00 | HO10: 24.50 | HP10: 25.25 | HQ10: 18.75 | HR10: 0.00 | HS10: 0.00 | HT10: 26.50 | HU10: 24.00 | HV10: 25.25 | HW10: 15.50 | HX10: 15.25 | HY10: 0.00 | HZ10: 0.00 | IA10: 15.75 | IB10: 16.00 | IC10: 22.25 | ID10: 21.50 | IE10: 13.82 | IF10: 0.00 | IG10: 0.00 | IH10: 9.00 | II10: 9.00 | IJ10: 9.00 | IK10: =9+5.56 -> 14.56 | IL10: 10.00
A11: Outside Labor | B11: 0.00 | C11: 0.00 | D11: 0.00 | E11: 0.00 | F11: 0.00 | G11: 0.00 | H11: 0.00 | I11: 0.00 | J11: 0.00 | K11: 0.00 | L11: 0.00 | M11: 0.00 | N11: 0.00 | O11: 0.00 | P11: 0.00 | Q11: 0.00 | R11: 0.00 | S11: 0.00 | T11: 0.00 | U11: 0.00 | V11: 0.00 | W11: 0.00 | X11: 0.00 | Y11: 0.00 | Z11: 0.00 | AA11: 0.00 | AB11: 0.00 | AC11: 0.00 | AD11: 0.00 | AE11: 0.00 | AF11: 0.00 | AG11: 0.00 | AH11: 0.00 | AI11: 0.00 | AJ11: 0.00 | AK11: 0.00 | AL11: 0.00 | AM11: 0.00 | AN11: 0.00 | AO11: 0.00 | AP11: 0.00 | AQ11: 0.00 | AR11: 0.00 | AS11: 0.00 | AT11: 0.00 | AU11: 0.00 | AV11: 0.00 | AW11: 0.00 | AX11: 0.00 | AY11: 0.00 | AZ11: 0.00 | BA11: 0.00 | BB11: 0.00 | BC11: 0.00 | BD11: 0.00 | BE11: 0.00 | BF11: 0.00 | BG11: 0.00 | BH11: 0.00 | BI11: 0.00 | BJ11: 0.00 | BK11: 0.00 | BL11: 0.00 | BM11: 0.00 | BN11: 0.00 | BO11: 0.00 | BP11: 0.00 | BQ11: 0.00 | BR11: 0.00 | BS11: 0.00 | BT11: 0.00 | BU11: 0.00 | BV11: 0.00 | BW11: 0.00 | BX11: 0.00 | BY11: 0.00 | BZ11: 0.00 | CA11: 0.00 | CB11: 0.00 | CC11: 0.00 | CD11: 0.00 | CE11: 0.00 | CF11: 0.00 | CG11: 0.00 | CH11: 0.00 | CI11: 0.00 | CJ11: 0.00 | CK11: 0.00 | CL11: 0.00 | CM11: 0.00 | CN11: 0.00 | CO11: 0.00 | CP11: 0.00 | CQ11: 0.00 | CR11: 0.00 | CS11: 0.00 | CT11: 0.00 | CU11: 0.00 | CV11: 0.00 | CW11: 0.00 | CX11: 0.00 | CY11: 0.00 | CZ11: 0.00 | DA11: 0.00 | DB11: 0.00 | DC11: 0.00 | DD11: 0.00 | DE11: 0.00 | DF11: 0.00 | DG11: 0.00 | DH11: 0.00 | DI11: 0.00 | DJ11: 0.00 | DK11: 0.00 | DL11: 0.00 | DM11: 1.00 | DN11: 0.00 | DO11: 0.00 | DP11: 0.00 | DQ11: 0.00 | DR11: 0.00 | DS11: 0.00 | DT11: 0.00 | DU11: 0.00 | DV11: 0.00 | DW11: 0.00 | DX11: 0.00 | DY11: 0.00 | DZ11: 0.00 | EA11: 0.00 | EB11: 0.00 | EC11: 0.00 | ED11: 0.00 | EE11: 0.00 | EF11: 0.00 | EG11: 0.00 | EH11: 0.00 | EI11: 0.00 | EJ11: 0.00 | EK11: 0.00 | EL11: 0.00 | EM11: 0.00 | EN11: 0.00 | EO11: 0.00 | EP11: 0.00 | EQ11: 0.00 | ER11: 0.00 | ES11: 0.00 | ET11: 0.00 | EU11: 0.00 | EV11: 0.00 | EW11: 0.00 | EX11: 0.00 | EY11: 0.00 | EZ11: 0.00 | FA11: 0.00 | FB11: 0.00 | FC11: 0.00 | FD11: 0.00 | FE11: 0.00 | FF11: 0.00 | FG11: 0.00 | FH11: 0.00 | FI11: 0.00 | FJ11: 0.00 | FK11: 0.00 | FL11: 0.00 | FM11: 0.00 | FN11: 0.00 | FO11: 0.00 | FP11: 0.00 | FQ11: 0.00 | FR11: 0.00 | FS11: 0.00 | FT11: 0.00 | FU11: 0.00 | FV11: 0.00 | FW11: 0.00 | FX11: 0.00 | FY11: 0.00 | FZ11: 0.00 | GA11: 0.00 | GB11: 0.00 | GC11: 0.00 | GD11: 0.00 | GE11: 0.00 | GF11: 0.00 | GG11: 0.00 | GH11: 0.00 | GI11: 0.00 | GJ11: 0.00 | GK11: 0.00 | GL11: 0.00 | GM11: 0.00 | GN11: 0.00 | GO11: 0.00 | GP11: 0.00 | GQ11: 0.00 | GR11: 0.00 | GS11: 0.00 | GT11: 0.00 | GU11: 0.00 | GV11: 0.00 | GW11: 0.00 | GX11: 0.00 | GY11: 0.00 | GZ11: 0.00 | HA11: 0.00 | HB11: 0.00 | HC11: 0.00 | HD11: 0.00 | HE11: 0.00 | HF11: 0.00 | HG11: 0.00 | HH11: 0.00 | HI11: 0.00 | HJ11: 0.00 | HK11: 0.00 | HL11: 0.00 | HM11: 0.00 | HN11: 0.00 | HO11: 0.00 | HP11: 0.00 | HQ11: 0.00 | HR11: 0.00 | HS11: 0.00 | HT11: 0.00 | HU11: 0.00 | HV11: 0.00 | HW11: 0.00 | HX11: 0.00 | HY11: 0.00 | HZ11: 0.00 | IA11: 0.00 | IB11: 0.00 | IC11: 0.00 | ID11: 0.00 | IE11: 0.00 | IF11: 0.00 | IG11: 0.00 | IH11: 0.00 | II11: 0.00 | IJ11: 0.00 | IK11: 0.00 | IL11: 0.00
A12: Included OT | B12: 0.00 | C12: 0.00 | D12: 2.50 | E12: 3.00 | F12: 1.50 | G12: 1.50 | H12: 2.50 | I12: 0.00 | J12: 0.00 | K12: 1.25 | L12: 3.50 | M12: 1.75 | N12: 4.25 | O12: 2.00 | P12: 0.00 | Q12: 0.00 | R12: 3.00 | S12: 2.25 | T12: 4.00 | U12: 0.50 | V12: 1.00 | W12: 0.00 | X12: 0.00 | Y12: 0.00 | Z12: 0.00 | AA12: 1.75 | AB12: 1.50 | AC12: 0.00 | AD12: 0.00 | AE12: 0.00 | AF12: 0.50 | AG12: 0.00 | AH12: 1.25 | AI12: 1.75 | AJ12: 1.75 | AK12: 0.00 | AL12: 0.00 | AM12: 1.00 | AN12: 1.00 | AO12: 0.50 | AP12: 1.50 | AQ12: 1.25 | AR12: 0.00 | AS12: 0.00 | AT12: 1.50 | AU12: 2.00 | AV12: 1.75 | AW12: 1.75 | AX12: 0.00 | AY12: 0.00 | AZ12: 0.00 | BA12: 0.50 | BB12: 1.75 | BC12: 2.00 | BD12: 1.25 | BE12: 1.50 | BF12: 0.00 | BG12: 0.00 | BH12: 1.00 | BI12: 1.75 | BJ12: 1.50 | BK12: 1.00 | BL12: 1.00 | BM12: 0.00 | BN12: 0.00 | BO12: 1.75 | BP12: 1.75 | BQ12: 27.50 | BR12: 1.00 | BS12: 1.50 | BT12: 0.00 | BU12: 0.00 | BV12: 1.50 | BW12: 1.25 | BX12: 1.25 | BY12: 1.50 | BZ12: 1.75 | CA12: 0.00 | CB12: 0.00 | CC12: 0.00 | CD12: 0.25 | CE12: 0.75 | CF12: 1.25 | CG12: 1.50 | CH12: 0.00 | CI12: 0.00 | CJ12: 2.00 | CK12: 0.50 | CL12: 0.50 | CM12: 0.25 | CN12: 0.50 | CO12: 0.00 | CP12: 0.00 | CQ12: 0.50 | CR12: 0.00 | CS12: 0.00 | CT12: 0.75 | CU12: 1.00 | CV12: 0.00 | CW12: 0.00 | CX12: 0.00 | CY12: 0.25 | CZ12: 0.50 | DA12: 0.50 | DB12: 0.25 | DC12: 0.00 | DD12: 0.00 | DE12: 0.00 | DF12: 0.50 | DG12: 0.00 | DH12: 0.25 | DI12: 0.00 | DJ12: 0.00 | DK12: 0.00 | DL12: 1.75 | DM12: 1.00 | DN12: 1.00 | DO12: 0.75 | DP12: 0.00 | DQ12: 0.00 | DR12: 0.00 | DS12: 2.50 | DT12: 1.25 | DU12: 1.75 | DV12: 1.00 | DW12: 0.00 | DX12: 0.00 | DY12: 0.00 | DZ12: 4.75 | EA12: 2.00 | EB12: 1.00 | EC12: 3.00 | ED12: 0.25 | EE12: 0.00 | EF12: 0.00 | EG12: 1.75 | EH12: 3.00 | EI12: 3.00 | EJ12: 2.25 | EK12: 1.75 | EL12: 0.00 | EM12: 0.00 | EN12: 2.00 | EO12: 2.00 | EP12: 2.00 | EQ12: 1.75 | ER12: 1.50 | ES12: 0.00 | ET12: 0.00 | EU12: 2.00 | EV12: 2.75 | EW12: 2.50 | EX12: 1.75 | EY12: 2.00 | EZ12: 0.00 | FA12: 0.00 | FB12: 2.50 | FC12: 1.50 | FD12: 2.00 | FE12: 2.00 | FF12: 1.75 | FG12: 0.00 | FH12: 0.00 | FI12: 2.25 | FJ12: 3.00 | FK12: 1.25 | FL12: 2.50 | FM12: 1.50 | FN12: 0.00 | FO12: 0.00 | FP12: 3.00 | FQ12: 1.75 | FR12: 3.00 | FS12: 1.50 | FT12: 1.00 | FU12: 0.00 | FV12: 0.00 | FW12: 0.00 | FX12: 2.50 | FY12: 2.50 | FZ12: 1.50 | GA12: 2.50 | GB12: 0.00 | GC12: 0.00 | GD12: 2.75 | GE12: 2.25 | GF12: 2.50 | GG12: 3.50 | GH12: 2.25 | GI12: 0.00 | GJ12: 0.00 | GK12: 0.00 | GL12: 0.00 | GM12: 1.25 | GN12: 4.50 | GO12: 2.50 | GP12: 0.00 | GQ12: 0.00 | GR12: 2.00 | GS12: 2.50 | GT12: 1.50 | GU12: 1.50 | GV12: 2.25 | GW12: 0.00 | GX12: 0.00 | GY12: 2.00 | GZ12: 1.00 | HA12: 5.50 | HB12: 3.75 | HC12: 9.00 | HD12: 0.00 | HE12: 0.00 | HF12: 3.25 | HG12: 5.25 | HH12: 3.50 | HI12: 0.00 | HJ12: 2.25 | HK12: 0.00 | HL12: 0.00 | HM12: 1.50 | HN12: 1.50 | HO12: 2.25 | HP12: 2.00 | HQ12: 2.75 | HR12: 0.00 | HS12: 0.00 | HT12: 4.25 | HU12: 1.75 | HV12: 3.00 | HW12: 0.00 | HX12: 1.00 | HY12: 0.00 | HZ12: 0.00 | IA12: 1.50 | IB12: 1.00 | IC12: 1.00 | ID12: 1.75 | IE12: 0.00 | IF12: 0.00 | IG12: 0.00 | IH12: 1.00 | II12: 1.00 | IJ12: 1.00 | IK12: 1.00 | IL12: 2.00
A13: Total FTE Hours | B13: =B10+B11+B12*0.5 -> 0 | C13: =C10+C11+C12*0.5 -> 0 | D13: =D10+D11+D12*0.5 -> 32 | E13: =E10+E11+E12*0.5 -> 36.4 | F13: =F10+F11+F12*0.5 -> 35.5 | G13: =G10+G11+G12*0.5 -> 33.25 | H13: =H10+H11+H12*0.5 -> 36.40 | I13: =I10+I11+I12*0.5 -> 0.00 | J13: =J10+J11+J12*0.5 -> 0.00 | K13: =K10+K11+K12*0.5 -> 32.854999999999997 | L13: =L10+L11+L12*0.5 -> 34.57 | M13: =M10+M11+M12*0.5 -> 36.545000000000002 | N13: =N10+N11+N12*0.5 -> 39.125 | O13: =O10+O11+O12*0.5 -> 43.00 | P13: =P10+P11+P12*0.5 -> 0.00 | Q13: =Q10+Q11+Q12*0.5 -> 0.00 | R13: =R10+R11+R12*0.5 -> 34.23 | S13: =S10+S11+S12*0.5 -> 38.104999999999997 | T13: =T10+T11+T12*0.5 -> 39.75 | U13: =U10+U11+U12*0.5 -> 32.70 | V13: =V10+V11+V12*0.5 -> 33.50 | W13: =W10+W11+W12*0.5 -> 0.00 | X13: =X10+X11+X12*0.5 -> 0.00 | Y13: =Y10+Y11+Y12*0.5 -> 0.00 | Z13: =Z10+Z11+Z12*0.5 -> 0.00 | AA13: =AA10+AA11+AA12*0.5 -> 26.375 | AB13: =AB10+AB11+AB12*0.5 -> 25.25 | AC13: =AC10+AC11+AC12*0.5 -> 24.00 | AD13: =AD10+AD11+AD12*0.5 -> 0.00 | AE13: =AE10+AE11+AE12*0.5 -> 0.00 | AF13: =AF10+AF11+AF12*0.5 -> 21.25 | AG13: =AG10+AG11+AG12*0.5 -> 0.00 | AH13: =AH10+AH11+AH12*0.5 -> 34.875 | AI13: =AI10+AI11+AI12*0.5 -> 34.875 | AJ13: =AJ10+AJ11+AJ12*0.5 -> 38.625 | AK13: =AK10+AK11+AK12*0.5 -> 0.00 | AL13: =AL10+AL11+AL12*0.5 -> 0.00 | AM13: =AM10+AM11+AM12*0.5 -> 37.73 | AN13: =AN10+AN11+AN12*0.5 -> 32.50 | AO13: =AO10+AO11+AO12*0.5 -> 40.50 | AP13: =AP10+AP11+AP12*0.5 -> 39.50 | AQ13: =AQ10+AQ11+AQ12*0.5 -> 31.375 | AR13: =AR10+AR11+AR12*0.5 -> 0.00 | AS13: =AS10+AS11+AS12*0.5 -> 0.00 | AT13: =AT10+AT11+AT12*0.5 -> 34.75 | AU13: =AU10+AU11+AU12*0.5 -> 38.75 | AV13: =AV10+AV11+AV12*0.5 -> 37.875 | AW13: =AW10+AW11+AW12*0.5 -> 33.125 | AX13: =AX10+AX11+AX12*0.5 -> 44.75 | AY13: =AY10+AY11+AY12*0.5 -> 3.23 | AZ13: =AZ10+AZ11+AZ12*0.5 -> 0.00 | BA13: =BA10+BA11+BA12*0.5 -> 40.58 | BB13: =BB10+BB11+BB12*0.5 -> 41.375 | BC13: =BC10+BC11+BC12*0.5 -> 37.75 | BD13: =BD10+BD11+BD12*0.5 -> 42.075000000000003 | BE13: =BE10+BE11+BE12*0.5 -> 43.50 | BF13: =BF10+BF11+BF12*0.5 -> 1.75 | BG13: =BG10+BG11+BG12*0.5 -> 0.00 | BH13: =BH10+BH11+BH12*0.5 -> 34.17 | BI13: =BI10+BI11+BI12*0.5 -> 35.354999999999997 | BJ13: =BJ10+BJ11+BJ12*0.5 -> 33.92 | BK13: =BK10+BK11+BK12*0.5 -> 36.00 | BL13: =BL10+BL11+BL12*0.5 -> 24.00 | BM13: =BM10+BM11+BM12*0.5 -> 0.00 | BN13: =BN10+BN11+BN12*0.5 -> 0.00 | BO13: =BO10+BO11+BO12*0.5 -> 36.174999999999997 | BP13: =BP10+BP11+BP12*0.5 -> 35.325000000000003 | BQ13: =BQ10+BQ11+BQ12*0.5 -> 52.45 | BR13: =BR10+BR11+BR12*0.5 -> 34.15 | BS13: =BS10+BS11+BS12*0.5 -> 34.68 | BT13: =BT10+BT11+BT12*0.5 -> 0.00 | BU13: =BU10+BU11+BU12*0.5 -> 0.00 | BV13: =BV10+BV11+BV12*0.5 -> 34.83 | BW13: =BW10+BW11+BW12*0.5 -> 38.725000000000001 | BX13: =BX10+BX11+BX12*0.5 -> 33.994999999999997 | BY13: =BY10+BY11+BY12*0.5 -> 35.13 | BZ13: =BZ10+BZ11+BZ12*0.5 -> 34.924999999999997 | CA13: =CA10+CA11+CA12*0.5 -> 0.00 | CB13: =CB10+CB11+CB12*0.5 -> 0.00 | CC13: =CC10+CC11+CC12*0.5 -> 30.70 | CD13: =CD10+CD11+CD12*0.5 -> 32.545000000000002 | CE13: =CE10+CE11+CE12*0.5 -> 33.344999999999999 | CF13: =CF10+CF11+CF12*0.5 -> 31.425000000000001 | CG13: =CG10+CG11+CG12*0.5 -> 27.00 | CH13: =CH10+CH11+CH12*0.5 -> 0.00 | CI13: =CI10+CI11+CI12*0.5 -> 0.00 | CJ13: =CJ10+CJ11+CJ12*0.5 -> 26.75 | CK13: =CK10+CK11+CK12*0.5 -> 24.00 | CL13: =CL10+CL11+CL12*0.5 -> 24.25 | CM13: =CM10+CM11+CM12*0.5 -> 24.125 | CN13: =CN10+CN11+CN12*0.5 -> 24.25 | CO13: =CO10+CO11+CO12*0.5 -> 0.00 | CP13: =CP10+CP11+CP12*0.5 -> 0.00 | CQ13: =CQ10+CQ11+CQ12*0.5 -> 30.00 | CR13: =CR10+CR11+CR12*0.5 -> 24.40 | CS13: =CS10+CS11+CS12*0.5 -> 31.50 | CT13: =CT10+CT11+CT12*0.5 -> 23.625 | CU13: =CU10+CU11+CU12*0.5 -> 20.50 | CV13: =CV10+CV11+CV12*0.5 -> 0.00 | CW13: =CW10+CW11+CW12*0.5 -> 0.00 | CX13: =CX10+CX11+CX12*0.5 -> 25.25 | CY13: =CY10+CY11+CY12*0.5 -> 25.625 | CZ13: =CZ10+CZ11+CZ12*0.5 -> 25.75 | DA13: =DA10+DA11+DA12*0.5 -> 25.50 | DB13: =DB10+DB11+DB12*0.5 -> 30.375 | DC13: =DC10+DC11+DC12*0.5 -> 0.00 | DD13: =DD10+DD11+DD12*0.5 -> 0.00 | DE13: =DE10+DE11+DE12*0.5 -> 32.75 | DF13: =DF10+DF11+DF12*0.5 -> 31.00 | DG13: =DG10+DG11+DG12*0.5 -> 28.00 | DH13: =DH10+DH11+DH12*0.5 -> 23.875 | DI13: =DI10+DI11+DI12*0.5 -> 15.50 | DJ13: =DJ10+DJ11+DJ12*0.5 -> 0.00 | DK13: =DK10+DK11+DK12*0.5 -> 0.00 | DL13: =DL10+DL11+DL12*0.5 -> 26.625 | DM13: =DM10+DM11+DM12*0.5 -> 26.00 | DN13: =DN10+DN11+DN12*0.5 -> 21.50 | DO13: =DO10+DO11+DO12*0.5 -> 17.125 | DP13: =DP10+DP11+DP12*0.5 -> 0.00 | DQ13: =DQ10+DQ11+DQ12*0.5 -> 0.00 | DR13: =DR10+DR11+DR12*0.5 -> 0.00 | DS13: =DS10+DS11+DS12*0.5 -> 33.75 | DT13: =DT10+DT11+DT12*0.5 -> 28.375 | DU13: =DU10+DU11+DU12*0.5 -> 33.625 | DV13: =DV10+DV11+DV12*0.5 -> 25.75 | DW13: =DW10+DW11+DW12*0.5 -> 23.00 | DX13: =DX10+DX11+DX12*0.5 -> 0.00 | DY13: =DY10+DY11+DY12*0.5 -> 0.00 | DZ13: =DZ10+DZ11+DZ12*0.5 -> 40.625 | EA13: =EA10+EA11+EA12*0.5 -> 32.58 | EB13: =EB10+EB11+EB12*0.5 -> 25.65 | EC13: =EC10+EC11+EC12*0.5 -> 28.25 | ED13: =ED10+ED11+ED12*0.5 -> 31.855 | EE13: =EE10+EE11+EE12*0.5 -> 0.00 | EF13: =EF10+EF11+EF12*0.5 -> 0.00 | EG13: =EG10+EG11+EG12*0.5 -> 26.125 | EH13: =EH10+EH11+EH12*0.5 -> 28.25 | EI13: =EI10+EI11+EI12*0.5 -> 28.00 | EJ13: =EJ10+EJ11+EJ12*0.5 -> 26.625 | EK13: =EK10+EK11+EK12*0.5 -> 26.125 | EL13: =EL10+EL11+EL12*0.5 -> 0.00 | EM13: =EM10+EM11+EM12*0.5 -> 0.00 | EN13: =EN10+EN11+EN12*0.5 -> 27.00 | EO13: =EO10+EO11+EO12*0.5 -> 26.25 | EP13: =EP10+EP11+EP12*0.5 -> 26.50 | EQ13: =EQ10+EQ11+EQ12*0.5 -> 26.125 | ER13: =ER10+ER11+ER12*0.5 -> 25.50 | ES13: =ES10+ES11+ES12*0.5 -> 0.00 | ET13: =ET10+ET11+ET12*0.5 -> 0.00 | EU13: =EU10+EU11+EU12*0.5 -> 26.50 | EV13: =EV10+EV11+EV12*0.5 -> 27.625 | EW13: =EW10+EW11+EW12*0.5 -> 27.25 | EX13: =EX10+EX11+EX12*0.5 -> 26.125 | EY13: =EY10+EY11+EY12*0.5 -> 26.50 | EZ13: =EZ10+EZ11+EZ12*0.5 -> 0.00 | FA13: =FA10+FA11+FA12*0.5 -> 0.00 | FB13: =FB10+FB11+FB12*0.5 -> 19.75 | FC13: =FC10+FC11+FC12*0.5 -> 25.75 | FD13: =FD10+FD11+FD12*0.5 -> 26.50 | FE13: =FE10+FE11+FE12*0.5 -> 26.50 | FF13: =FF10+FF11+FF12*0.5 -> 26.375 | FG13: =FG10+FG11+FG12*0.5 -> 0.00 | FH13: =FH10+FH11+FH12*0.5 -> 0.00 | FI13: =FI10+FI11+FI12*0.5 -> 26.875 | FJ13: =FJ10+FJ11+FJ12*0.5 -> 37.25 | FK13: =FK10+FK11+FK12*0.5 -> 34.744999999999997 | FL13: =FL10+FL11+FL12*0.5 -> 27.25 | FM13: =FM10+FM11+FM12*0.5 -> 28.25 | FN13: =FN10+FN11+FN12*0.5 -> 0.00 | FO13: =FO10+FO11+FO12*0.5 -> 0.00 | FP13: =FP10+FP11+FP12*0.5 -> 37.50 | FQ13: =FQ10+FQ11+FQ12*0.5 -> 34.255000000000003 | FR13: =FR10+FR11+FR12*0.5 -> 35.93 | FS13: =FS10+FS11+FS12*0.5 -> 34.27 | FT13: =FT10+FT11+FT12*0.5 -> 33.75 | FU13: =FU10+FU11+FU12*0.5 -> 0.00 | FV13: =FV10+FV11+FV12*0.5 -> 0.00 | FW13: =FW10+FW11+FW12*0.5 -> 0.00 | FX13: =FX10+FX11+FX12*0.5 -> 35.00 | FY13: =FY10+FY11+FY12*0.5 -> 31.85 | FZ13: =FZ10+FZ11+FZ12*0.5 -> 32.00 | GA13: =GA10+GA11+GA12*0.5 -> 35.50 | GB13: =GB10+GB11+GB12*0.5 -> 0.00 | GC13: =GC10+GC11+GC12*0.5 -> 0.00 | GD13: =GD10+GD11+GD12*0.5 -> 44.125 | GE13: =GE10+GE11+GE12*0.5 -> 42.875 | GF13: =GF10+GF11+GF12*0.5 -> 27.17 | GG13: =GG10+GG11+GG12*0.5 -> 37.00 | GH13: =GH10+GH11+GH12*0.5 -> 26.375 | GI13: =GI10+GI11+GI12*0.5 -> 0.00 | GJ13: =GJ10+GJ11+GJ12*0.5 -> 0.00 | GK13: =GK10+GK11+GK12*0.5 -> 27.25 | GL13: =GL10+GL11+GL12*0.5 -> 34.50 | GM13: =GM10+GM11+GM12*0.5 -> 24.375 | GN13: =GN10+GN11+GN12*0.5 -> 38.50 | GO13: =GO10+GO11+GO12*0.5 -> 42.00 | GP13: =GP10+GP11+GP12*0.5 -> 0.00 | GQ13: =GQ10+GQ11+GQ12*0.5 -> 0.00 | GR13: =GR10+GR11+GR12*0.5 -> 25.50 | GS13: =GS10+GS11+GS12*0.5 -> 34.25 | GT13: =GT10+GT11+GT12*0.5 -> 32.00 | GU13: =GU10+GU11+GU12*0.5 -> 25.75 | GV13: =GV10+GV11+GV12*0.5 -> 25.875 | GW13: =GW10+GW11+GW12*0.5 -> 0.00 | GX13: =GX10+GX11+GX12*0.5 -> 0.00 | GY13: =GY10+GY11+GY12*0.5 -> 33.25 | GZ13: =GZ10+GZ11+GZ12*0.5 -> 23.75 | HA13: =HA10+HA11+HA12*0.5 -> 39.00 | HB13: =HB10+HB11+HB12*0.5 -> 36.875 | HC13: =HC10+HC11+HC12*0.5 -> 44.00 | HD13: =HD10+HD11+HD12*0.5 -> 0.00 | HE13: =HE10+HE11+HE12*0.5 -> 0.00 | HF13: =HF10+HF11+HF12*0.5 -> 20.875 | HG13: =HG10+HG11+HG12*0.5 -> 38.375 | HH13: =HH10+HH11+HH12*0.5 -> 36.00 | HI13: =HI10+HI11+HI12*0.5 -> 0.00 | HJ13: =HJ10+HJ11+HJ12*0.5 -> 33.375 | HK13: =HK10+HK11+HK12*0.5 -> 0.00 | HL13: =HL10+HL11+HL12*0.5 -> 0.00 | HM13: =HM10+HM11+HM12*0.5 -> 24.75 | HN13: =HN10+HN11+HN12*0.5 -> 16.75 | HO13: =HO10+HO11+HO12*0.5 -> 25.625 | HP13: =HP10+HP11+HP12*0.5 -> 26.25 | HQ13: =HQ10+HQ11+HQ12*0.5 -> 20.125 | HR13: =HR10+HR11+HR12*0.5 -> 0.00 | HS13: =HS10+HS11+HS12*0.5 -> 0.00 | HT13: =HT10+HT11+HT12*0.5 -> 28.625 | HU13: =HU10+HU11+HU12*0.5 -> 24.875 | HV13: =HV10+HV11+HV12*0.5 -> 26.75 | HW13: =HW10+HW11+HW12*0.5 -> 15.50 | HX13: =HX10+HX11+HX12*0.5 -> 15.75 | HY13: =HY10+HY11+HY12*0.5 -> 0.00 | HZ13: =HZ10+HZ11+HZ12*0.5 -> 0.00 | IA13: =IA10+IA11+IA12*0.5 -> 16.50 | IB13: =IB10+IB11+IB12*0.5 -> 16.50 | IC13: =IC10+IC11+IC12*0.5 -> 22.75 | ID13: =ID10+ID11+ID12*0.5 -> 22.375 | IE13: =IE10+IE11+IE12*0.5 -> 13.82 | IF13: =IF10+IF11+IF12*0.5 -> 0.00 | IG13: =IG10+IG11+IG12*0.5 -> 0.00 | IH13: =IH10+IH11+IH12*0.5 -> 9.50 | II13: =II10+II11+II12*0.5 -> 9.50 | IJ13: =IJ10+IJ11+IJ12*0.5 -> 9.50 | IK13: =IK10+IK11+IK12*0.5 -> 15.06 | IL13: =IL10+IL11+IL12*0.5 -> 11.00
A15: Railcars | B15: 0.00 | C15: 0.00 | D15: 4.00 | E15: 1.00 | F15: 0.00 | G15: 0.00 | H15: 1.00 | I15: 0.00 | J15: 0.00 | K15: 0.00 | L15: 7.00 | M15: 1.00 | N15: 0.00 | O15: 2.00 | P15: 0.00 | Q15: 0.00 | R15: 2.00 | S15: 3.00 | T15: 0.00 | U15: 6.00 | V15: 5.00 | W15: 0.00 | X15: 0.00 | Y15: 0.00 | Z15: 0.00 | AA15: 2.00 | AB15: 6.00 | AC15: 3.00 | AD15: 0.00 | AE15: 0.00 | AF15: 3.00 | AG15: 0.00 | AH15: 2.00 | AI15: 1.00 | AJ15: 1.00 | AK15: 0.00 | AL15: 0.00 | AM15: 2.00 | AN15: 1.00 | AO15: 0.00 | AP15: 3.00 | AQ15: 0.00 | AR15: 0.00 | AS15: 0.00 | AT15: 3.00 | AU15: 0.00 | AV15: 0.00 | AW15: 0.00 | AX15: 0.00 | AY15: 0.00 | AZ15: 0.00 | BA15: 3.00 | BB15: 3.00 | BC15: 0.00 | BD15: 0.00 | BE15: 2.00 | BF15: 0.00 | BG15: 0.00 | BH15: 3.00 | BI15: 3.00 | BJ15: 4.00 | BK15: 0.00 | BL15: 3.00 | BM15: 0.00 | BN15: 0.00 | BO15: 9.00 | BP15: 6.00 | BQ15: 4.00 | BR15: 0.00 | BS15: 5.00 | BT15: 0.00 | BU15: 0.00 | BV15: 0.00 | BW15: 6.00 | BX15: 4.00 | BY15: 2.00 | BZ15: 4.00 | CA15: 0.00 | CB15: 0.00 | CC15: 3.00 | CD15: 4.00 | CE15: 4.00 | CF15: 2.00 | CG15: 3.00 | CH15: 0.00 | CI15: 0.00 | CJ15: 5.00 | CK15: 4.00 | CL15: 2.00 | CM15: 2.00 | CN15: 1.00 | CO15: 0.00 | CP15: 0.00 | CQ15: 3.00 | CR15: 2.00 | CS15: 0.00 | CT15: 0.00 | CU15: 0.00 | CV15: 0.00 | CW15: 0.00 | CX15: 1.00 | CY15: 7.00 | CZ15: 5.00 | DA15: 1.00 | DB15: 2.00 | DC15: 0.00 | DD15: 0.00 | DE15: 3.00 | DF15: 2.00 | DG15: 3.00 | DH15: 3.00 | DI15: 5.00 | DJ15: 0.00 | DK15: 0.00 | DL15: 3.00 | DM15: 2.00 | DN15: 3.00 | DO15: 5.00 | DP15: 0.00 | DQ15: 0.00 | DR15: 0.00 | DS15: 1.00 | DT15: 3.00 | DU15: 3.00 | DV15: 2.00 | DW15: 3.00 | DX15: 0.00 | DY15: 0.00 | DZ15: 2.00 | EA15: 4.00 | EB15: 0.00 | EC15: 4.00 | ED15: 2.00 | EE15: 0.00 | EF15: 0.00 | EG15: 2.00 | EH15: 5.00 | EI15: 7.00 | EJ15: 4.00 | EK15: 4.00 | EL15: 0.00 | EM15: 0.00 | EN15: 2.00 | EO15: 3.00 | EP15: 4.00 | EQ15: 1.00 | ER15: 0.00 | ES15: 0.00 | ET15: 0.00 | EU15: 1.00 | EV15: 3.00 | EW15: 3.00 | EX15: 0.00 | EY15: 3.00 | EZ15: 0.00 | FA15: 0.00 | FB15: 3.00 | FC15: 5.00 | FD15: 3.00 | FE15: 2.00 | FF15: 3.00 | FG15: 0.00 | FH15: 0.00 | FI15: 3.00 | FJ15: 4.00 | FK15: 3.00 | FL15: 3.00 | FM15: 3.00 | FN15: 0.00 | FO15: 0.00 | FP15: 0.00 | FQ15: 2.00 | FR15: 1.00 | FS15: 2.00 | FT15: 0.00 | FU15: 0.00 | FV15: 0.00 | FW15: 0.00 | FX15: 3.00 | FY15: 2.00 | FZ15: 2.00 | GA15: 3.00 | GB15: 0.00 | GC15: 0.00 | GD15: 4.00 | GE15: 3.00 | GF15: 3.00 | GG15: 3.00 | GH15: 1.00 | GI15: 0.00 | GJ15: 0.00 | GK15: 2.00 | GL15: 3.00 | GM15: 3.00 | GN15: 3.00 | GO15: 3.00 | GP15: 0.00 | GQ15: 0.00 | GR15: 3.00 | GS15: 4.00 | GT15: 4.00 | GU15: 4.00 | GV15: 4.00 | GW15: 0.00 | GX15: 0.00 | GY15: 3.00 | GZ15: 3.00 | HA15: 2.00 | HB15: 2.00 | HC15: 0.00 | HD15: 0.00 | HE15: 0.00 | HF15: 0.00 | HG15: 6.00 | HH15: 1.00 | HI15: 0.00 | HJ15: 2.00 | HK15: 0.00 | HL15: 0.00 | HM15: 1.00 | HN15: 1.00 | HO15: 0.00 | HP15: 1.00 | HQ15: 1.00 | HR15: 0.00 | HS15: 0.00 | HT15: 0.00 | HU15: 0.00 | HV15: 0.00 | HW15: 0.00 | HX15: 0.00 | HY15: 0.00 | HZ15: 0.00 | IA15: 0.00 | IB15: 0.00 | IC15: 0.00 | ID15: 0.00 | IE15: 0.00 | IF15: 0.00 | IG15: 0.00 | IH15: 0.00 | II15: 0.00 | IJ15: 0.00 | IK15: 0.00 | IL15: 0.00
A16: Containers | B16: 0.00 | C16: 0.00 | D16: 3.00 | E16: 6.00 | F16: 1.00 | G16: 8.00 | H16: 0.00 | I16: 0.00 | J16: 0.00 | K16: 0.00 | L16: 7.00 | M16: 0.00 | N16: 5.00 | O16: 1.00 | P16: 0.00 | Q16: 0.00 | R16: 7.00 | S16: 5.00 | T16: 1.00 | U16: 0.00 | V16: 0.00 | W16: 0.00 | X16: 0.00 | Y16: 0.00 | Z16: 0.00 | AA16: 4.00 | AB16: 0.00 | AC16: 0.00 | AD16: 0.00 | AE16: 0.00 | AF16: 1.00 | AG16: 0.00 | AH16: 8.00 | AI16: 7.00 | AJ16: 2.00 | AK16: 0.00 | AL16: 0.00 | AM16: 4.00 | AN16: 6.00 | AO16: 7.00 | AP16: 1.00 | AQ16: 1.00 | AR16: 0.00 | AS16: 0.00 | AT16: 9.00 | AU16: 9.00 | AV16: 8.00 | AW16: 8.00 | AX16: 5.00 | AY16: 0.00 | AZ16: 0.00 | BA16: 6.00 | BB16: 5.00 | BC16: 3.00 | BD16: 4.00 | BE16: 3.00 | BF16: 0.00 | BG16: 0.00 | BH16: 3.00 | BI16: 0.00 | BJ16: 4.00 | BK16: 1.00 | BL16: 3.00 | BM16: 0.00 | BN16: 0.00 | BO16: 1.00 | BP16: 8.00 | BQ16: 3.00 | BR16: 0.00 | BS16: 4.00 | BT16: 0.00 | BU16: 0.00 | BV16: 0.00 | BW16: 1.00 | BX16: 2.00 | BY16: 0.00 | BZ16: 0.00 | CA16: 0.00 | CB16: 0.00 | CC16: 1.00 | CD16: 1.00 | CE16: 0.00 | CF16: 0.00 | CG16: 2.00 | CH16: 0.00 | CI16: 0.00 | CJ16: 0.00 | CK16: 1.00 | CL16: 0.00 | CM16: 0.00 | CN16: 1.00 | CO16: 0.00 | CP16: 0.00 | CQ16: 0.00 | CR16: 0.00 | CS16: 0.00 | CT16: 0.00 | CU16: 1.00 | CV16: 0.00 | CW16: 0.00 | CX16: 4.00 | CY16: 1.00 | CZ16: 2.00 | DA16: 0.00 | DB16: 0.00 | DC16: 0.00 | DD16: 0.00 | DE16: 4.00 | DF16: 4.00 | DG16: 2.00 | DH16: 0.00 | DI16: 1.00 | DJ16: 0.00 | DK16: 0.00 | DL16: 5.00 | DM16: 0.00 | DN16: 0.00 | DO16: 0.00 | DP16: 0.00 | DQ16: 0.00 | DR16: 0.00 | DS16: 2.00 | DT16: 0.00 | DU16: 0.00 | DV16: 0.00 | DW16: 0.00 | DX16: 0.00 | DY16: 0.00 | DZ16: 0.00 | EA16: 0.00 | EB16: 0.00 | EC16: 0.00 | ED16: 0.00 | EE16: 0.00 | EF16: 0.00 | EG16: 0.00 | EH16: 0.00 | EI16: 0.00 | EJ16: 0.00 | EK16: 0.00 | EL16: 0.00 | EM16: 0.00 | EN16: 1.00 | EO16: 0.00 | EP16: 1.00 | EQ16: 0.00 | ER16: 1.00 | ES16: 0.00 | ET16: 0.00 | EU16: 0.00 | EV16: 0.00 | EW16: 0.00 | EX16: 1.00 | EY16: 0.00 | EZ16: 0.00 | FA16: 0.00 | FB16: 2.00 | FC16: 2.00 | FD16: 0.00 | FE16: 0.00 | FF16: 0.00 | FG16: 0.00 | FH16: 0.00 | FI16: 1.00 | FJ16: 1.00 | FK16: 0.00 | FL16: 1.00 | FM16: 0.00 | FN16: 0.00 | FO16: 0.00 | FP16: 2.00 | FQ16: 0.00 | FR16: 1.00 | FS16: 0.00 | FT16: 0.00 | FU16: 0.00 | FV16: 0.00 | FW16: 0.00 | FX16: 0.00 | FY16: 0.00 | FZ16: 0.00 | GA16: 0.00 | GB16: 0.00 | GC16: 0.00 | GD16: 1.00 | GE16: 0.00 | GF16: 0.00 | GG16: 0.00 | GH16: 0.00 | GI16: 0.00 | GJ16: 0.00 | GK16: 0.00 | GL16: 0.00 | GM16: 0.00 | GN16: 0.00 | GO16: 0.00 | GP16: 0.00 | GQ16: 0.00 | GR16: 0.00 | GS16: 0.00 | GT16: 0.00 | GU16: 0.00 | GV16: 0.00 | GW16: 0.00 | GX16: 0.00 | GY16: 0.00 | GZ16: 0.00 | HA16: 0.00 | HB16: 0.00 | HC16: 0.00 | HD16: 0.00 | HE16: 0.00 | HF16: 1.00 | HG16: 0.00 | HH16: 0.00 | HI16: 0.00 | HJ16: 0.00 | HK16: 0.00 | HL16: 0.00 | HM16: 0.00 | HN16: 0.00 | HO16: 0.00 | HP16: 0.00 | HQ16: 0.00 | HR16: 0.00 | HS16: 0.00 | HT16: 0.00 | HU16: 0.00 | HV16: 0.00 | HW16: 0.00 | HX16: 0.00 | HY16: 0.00 | HZ16: 0.00 | IA16: 0.00 | IB16: 0.00 | IC16: 0.00 | ID16: 0.00 | IE16: 0.00 | IF16: 0.00 | IG16: 0.00 | IH16: 0.00 | II16: 0.00 | IJ16: 0.00 | IK16: 0.00 | IL16: 0.00
A17: Total Railcar Equiv | B17: =B15+B16/3 -> 0 | C17: =C15+C16/3 -> 0 | D17: =D15+D16/3 -> 5 | E17: =E15+E16/3 -> 3 | F17: =F15+F16/3 -> 0.33333333333333331 | G17: =G15+G16/3 -> 2.6666666666666665 | H17: =H15+H16/3 -> 1.00 | I17: =I15+I16/3 -> 0.00 | J17: =J15+J16/3 -> 0.00 | K17: =K15+K16/3 -> 0.00 | L17: =L15+L16/3 -> 9.3333333333333339 | M17: =M15+M16/3 -> 1.00 | N17: =N15+N16/3 -> 1.6666666666666667 | O17: =O15+O16/3 -> 2.3333333333333335 | P17: =P15+P16/3 -> 0.00 | Q17: =Q15+Q16/3 -> 0.00 | R17: =R15+R16/3 -> 4.3333333333333339 | S17: =S15+S16/3 -> 4.666666666666667 | T17: =T15+T16/3 -> 0.33333333333333331 | U17: =U15+U16/3 -> 6.00 | V17: =V15+V16/3 -> 5.00 | W17: =W15+W16/3 -> 0.00 | X17: =X15+X16/3 -> 0.00 | Y17: =Y15+Y16/3 -> 0.00 | Z17: =Z15+Z16/3 -> 0.00 | AA17: =AA15+AA16/3 -> 3.333333333333333 | AB17: =AB15+AB16/3 -> 6.00 | AC17: =AC15+AC16/3 -> 3.00 | AD17: =AD15+AD16/3 -> 0.00 | AE17: =AE15+AE16/3 -> 0.00 | AF17: =AF15+AF16/3 -> 3.3333333333333335 | AG17: =AG15+AG16/3 -> 0.00 | AH17: =AH15+AH16/3 -> 4.6666666666666661 | AI17: =AI15+AI16/3 -> 3.3333333333333335 | AJ17: =AJ15+AJ16/3 -> 1.6666666666666665 | AK17: =AK15+AK16/3 -> 0.00 | AL17: =AL15+AL16/3 -> 0.00 | AM17: =AM15+AM16/3 -> 3.333333333333333 | AN17: =AN15+AN16/3 -> 3.00 | AO17: =AO15+AO16/3 -> 2.3333333333333335 | AP17: =AP15+AP16/3 -> 3.3333333333333335 | AQ17: =AQ15+AQ16/3 -> 0.33333333333333331 | AR17: =AR15+AR16/3 -> 0.00 | AS17: =AS15+AS16/3 -> 0.00 | AT17: =AT15+AT16/3 -> 6.00 | AU17: =AU15+AU16/3 -> 3.00 | AV17: =AV15+AV16/3 -> 2.6666666666666665 | AW17: =AW15+AW16/3 -> 2.6666666666666665 | AX17: =AX15+AX16/3 -> 1.6666666666666667 | AY17: =AY15+AY16/3 -> 0.00 | AZ17: =AZ15+AZ16/3 -> 0.00 | BA17: =BA15+BA16/3 -> 5.00 | BB17: =BB15+BB16/3 -> 4.666666666666667 | BC17: =BC15+BC16/3 -> 1.00 | BD17: =BD15+BD16/3 -> 1.3333333333333333 | BE17: =BE15+BE16/3 -> 3.00 | BF17: =BF15+BF16/3 -> 0.00 | BG17: =BG15+BG16/3 -> 0.00 | BH17: =BH15+BH16/3 -> 4.00 | BI17: =BI15+BI16/3 -> 3.00 | BJ17: =BJ15+BJ16/3 -> 5.333333333333333 | BK17: =BK15+BK16/3 -> 0.33333333333333331 | BL17: =BL15+BL16/3 -> 4.00 | BM17: =BM15+BM16/3 -> 0.00 | BN17: =BN15+BN16/3 -> 0.00 | BO17: =BO15+BO16/3 -> 9.3333333333333339 | BP17: =BP15+BP16/3 -> 8.6666666666666661 | BQ17: =BQ15+BQ16/3 -> 5.00 | BR17: =BR15+BR16/3 -> 0.00 | BS17: =BS15+BS16/3 -> 6.333333333333333 | BT17: =BT15+BT16/3 -> 0.00 | BU17: =BU15+BU16/3 -> 0.00 | BV17: =BV15+BV16/3 -> 0.00 | BW17: =BW15+BW16/3 -> 6.333333333333333 | BX17: =BX15+BX16/3 -> 4.666666666666667 | BY17: =BY15+BY16/3 -> 2.00 | BZ17: =BZ15+BZ16/3 -> 4.00 | CA17: =CA15+CA16/3 -> 0.00 | CB17: =CB15+CB16/3 -> 0.00 | CC17: =CC15+CC16/3 -> 3.3333333333333335 | CD17: =CD15+CD16/3 -> 4.333333333333333 | CE17: =CE15+CE16/3 -> 4.00 | CF17: =CF15+CF16/3 -> 2.00 | CG17: =CG15+CG16/3 -> 3.6666666666666665 | CH17: =CH15+CH16/3 -> 0.00 | CI17: =CI15+CI16/3 -> 0.00 | CJ17: =CJ15+CJ16/3 -> 5.00 | CK17: =CK15+CK16/3 -> 4.333333333333333 | CL17: =CL15+CL16/3 -> 2.00 | CM17: =CM15+CM16/3 -> 2.00 | CN17: =CN15+CN16/3 -> 1.3333333333333333 | CO17: =CO15+CO16/3 -> 0.00 | CP17: =CP15+CP16/3 -> 0.00 | CQ17: =CQ15+CQ16/3 -> 3.00 | CR17: =CR15+CR16/3 -> 2.00 | CS17: =CS15+CS16/3 -> 0.00 | CT17: =CT15+CT16/3 -> 0.00 | CU17: =CU15+CU16/3 -> 0.33333333333333331 | CV17: =CV15+CV16/3 -> 0.00 | CW17: =CW15+CW16/3 -> 0.00 | CX17: =CX15+CX16/3 -> 2.333333333333333 | CY17: =CY15+CY16/3 -> 7.333333333333333 | CZ17: =CZ15+CZ16/3 -> 5.666666666666667 | DA17: =DA15+DA16/3 -> 1.00 | DB17: =DB15+DB16/3 -> 2.00 | DC17: =DC15+DC16/3 -> 0.00 | DD17: =DD15+DD16/3 -> 0.00 | DE17: =DE15+DE16/3 -> 4.333333333333333 | DF17: =DF15+DF16/3 -> 3.333333333333333 | DG17: =DG15+DG16/3 -> 3.6666666666666665 | DH17: =DH15+DH16/3 -> 3.00 | DI17: =DI15+DI16/3 -> 5.333333333333333 | DJ17: =DJ15+DJ16/3 -> 0.00 | DK17: =DK15+DK16/3 -> 0.00 | DL17: =DL15+DL16/3 -> 4.666666666666667 | DM17: =DM15+DM16/3 -> 2.00 | DN17: =DN15+DN16/3 -> 3.00 | DO17: =DO15+DO16/3 -> 5.00 | DP17: =DP15+DP16/3 -> 0.00 | DQ17: =DQ15+DQ16/3 -> 0.00 | DR17: =DR15+DR16/3 -> 0.00 | DS17: =DS15+DS16/3 -> 1.6666666666666665 | DT17: =DT15+DT16/3 -> 3.00 | DU17: =DU15+DU16/3 -> 3.00 | DV17: =DV15+DV16/3 -> 2.00 | DW17: =DW15+DW16/3 -> 3.00 | DX17: =DX15+DX16/3 -> 0.00 | DY17: =DY15+DY16/3 -> 0.00 | DZ17: =DZ15+DZ16/3 -> 2.00 | EA17: =EA15+EA16/3 -> 4.00 | EB17: =EB15+EB16/3 -> 0.00 | EC17: =EC15+EC16/3 -> 4.00 | ED17: =ED15+ED16/3 -> 2.00 | EE17: =EE15+EE16/3 -> 0.00 | EF17: =EF15+EF16/3 -> 0.00 | EG17: =EG15+EG16/3 -> 2.00 | EH17: =EH15+EH16/3 -> 5.00 | EI17: =EI15+EI16/3 -> 7.00 | EJ17: =EJ15+EJ16/3 -> 4.00 | EK17: =EK15+EK16/3 -> 4.00 | EL17: =EL15+EL16/3 -> 0.00 | EM17: =EM15+EM16/3 -> 0.00 | EN17: =EN15+EN16/3 -> 2.3333333333333335 | EO17: =EO15+EO16/3 -> 3.00 | EP17: =EP15+EP16/3 -> 4.333333333333333 | EQ17: =EQ15+EQ16/3 -> 1.00 | ER17: =ER15+ER16/3 -> 0.33333333333333331 | ES17: =ES15+ES16/3 -> 0.00 | ET17: =ET15+ET16/3 -> 0.00 | EU17: =EU15+EU16/3 -> 1.00 | EV17: =EV15+EV16/3 -> 3.00 | EW17: =EW15+EW16/3 -> 3.00 | EX17: =EX15+EX16/3 -> 0.33333333333333331 | EY17: =EY15+EY16/3 -> 3.00 | EZ17: =EZ15+EZ16/3 -> 0.00 | FA17: =FA15+FA16/3 -> 0.00 | FB17: =FB15+FB16/3 -> 3.6666666666666665 | FC17: =FC15+FC16/3 -> 5.666666666666667 | FD17: =FD15+FD16/3 -> 3.00 | FE17: =FE15+FE16/3 -> 2.00 | FF17: =FF15+FF16/3 -> 3.00 | FG17: =FG15+FG16/3 -> 0.00 | FH17: =FH15+FH16/3 -> 0.00 | FI17: =FI15+FI16/3 -> 3.3333333333333335 | FJ17: =FJ15+FJ16/3 -> 4.333333333333333 | FK17: =FK15+FK16/3 -> 3.00 | FL17: =FL15+FL16/3 -> 3.3333333333333335 | FM17: =FM15+FM16/3 -> 3.00 | FN17: =FN15+FN16/3 -> 0.00 | FO17: =FO15+FO16/3 -> 0.00 | FP17: =FP15+FP16/3 -> 0.66666666666666663 | FQ17: =FQ15+FQ16/3 -> 2.00 | FR17: =FR15+FR16/3 -> 1.3333333333333333 | FS17: =FS15+FS16/3 -> 2.00 | FT17: =FT15+FT16/3 -> 0.00 | FU17: =FU15+FU16/3 -> 0.00 | FV17: =FV15+FV16/3 -> 0.00 | FW17: =FW15+FW16/3 -> 0.00 | FX17: =FX15+FX16/3 -> 3.00 | FY17: =FY15+FY16/3 -> 2.00 | FZ17: =FZ15+FZ16/3 -> 2.00 | GA17: =GA15+GA16/3 -> 3.00 | GB17: =GB15+GB16/3 -> 0.00 | GC17: =GC15+GC16/3 -> 0.00 | GD17: =GD15+GD16/3 -> 4.333333333333333 | GE17: =GE15+GE16/3 -> 3.00 | GF17: =GF15+GF16/3 -> 3.00 | GG17: =GG15+GG16/3 -> 3.00 | GH17: =GH15+GH16/3 -> 1.00 | GI17: =GI15+GI16/3 -> 0.00 | GJ17: =GJ15+GJ16/3 -> 0.00 | GK17: =GK15+GK16/3 -> 2.00 | GL17: =GL15+GL16/3 -> 3.00 | GM17: =GM15+GM16/3 -> 3.00 | GN17: =GN15+GN16/3 -> 3.00 | GO17: =GO15+GO16/3 -> 3.00 | GP17: =GP15+GP16/3 -> 0.00 | GQ17: =GQ15+GQ16/3 -> 0.00 | GR17: =GR15+GR16/3 -> 3.00 | GS17: =GS15+GS16/3 -> 4.00 | GT17: =GT15+GT16/3 -> 4.00 | GU17: =GU15+GU16/3 -> 4.00 | GV17: =GV15+GV16/3 -> 4.00 | GW17: =GW15+GW16/3 -> 0.00 | GX17: =GX15+GX16/3 -> 0.00 | GY17: =GY15+GY16/3 -> 3.00 | GZ17: =GZ15+GZ16/3 -> 3.00 | HA17: =HA15+HA16/3 -> 2.00 | HB17: =HB15+HB16/3 -> 2.00 | HC17: =HC15+HC16/3 -> 0.00 | HD17: =HD15+HD16/3 -> 0.00 | HE17: =HE15+HE16/3 -> 0.00 | HF17: =HF15+HF16/3 -> 0.33333333333333331 | HG17: =HG15+HG16/3 -> 6.00 | HH17: =HH15+HH16/3 -> 1.00 | HI17: =HI15+HI16/3 -> 0.00 | HJ17: =HJ15+HJ16/3 -> 2.00 | HK17: =HK15+HK16/3 -> 0.00 | HL17: =HL15+HL16/3 -> 0.00 | HM17: =HM15+HM16/3 -> 1.00 | HN17: =HN15+HN16/3 -> 1.00 | HO17: =HO15+HO16/3 -> 0.00 | HP17: =HP15+HP16/3 -> 1.00 | HQ17: =HQ15+HQ16/3 -> 1.00 | HR17: =HR15+HR16/3 -> 0.00 | HS17: =HS15+HS16/3 -> 0.00 | HT17: =HT15+HT16/3 -> 0.00 | HU17: =HU15+HU16/3 -> 0.00 | HV17: =HV15+HV16/3 -> 0.00 | HW17: =HW15+HW16/3 -> 0.00 | HX17: =HX15+HX16/3 -> 0.00 | HY17: =HY15+HY16/3 -> 0.00 | HZ17: =HZ15+HZ16/3 -> 0.00 | IA17: =IA15+IA16/3 -> 0.00 | IB17: =IB15+IB16/3 -> 0.00 | IC17: =IC15+IC16/3 -> 0.00 | ID17: =ID15+ID16/3 -> 0.00 | IE17: =IE15+IE16/3 -> 0.00 | IF17: =IF15+IF16/3 -> 0.00 | IG17: =IG15+IG16/3 -> 0.00 | IH17: =IH15+IH16/3 -> 0.00 | II17: =II15+II16/3 -> 0.00 | IJ17: =IJ15+IJ16/3 -> 0.00 | IK17: =IK15+IK16/3 -> 0.00 | IL17: =IL15+IL16/3 -> 0.00
A19: Hours/RCE Daily | B19: =IF(ISERROR(B13/B17),0,B13/B17) -> 0 | C19: =IF(ISERROR(C13/C17),0,C13/C17) -> 0 | D19: =IF(ISERROR(D13/D17),0,D13/D17) -> 6.4 | E19: =IF(ISERROR(E13/E17),0,E13/E17) -> 12.133333333333333 | F19: =IF(ISERROR(F13/F17),0,F13/F17) -> 106.5 | G19: =IF(ISERROR(G13/G17),0,G13/G17) -> 12.46875 | H19: =IF(ISERROR(H13/H17),0,H13/H17) -> 36.40 | I19: =IF(ISERROR(I13/I17),0,I13/I17) -> 0.00 | J19: =IF(ISERROR(J13/J17),0,J13/J17) -> 0.00 | K19: =IF(ISERROR(K13/K17),0,K13/K17) -> 0.00 | L19: =IF(ISERROR(L13/L17),0,L13/L17) -> 3.703928571428571 | M19: =IF(ISERROR(M13/M17),0,M13/M17) -> 36.545000000000002 | N19: =IF(ISERROR(N13/N17),0,N13/N17) -> 23.475000000000001 | O19: =IF(ISERROR(O13/O17),0,O13/O17) -> 18.428571428571427 | P19: =IF(ISERROR(P13/P17),0,P13/P17) -> 0.00 | Q19: =IF(ISERROR(Q13/Q17),0,Q13/Q17) -> 0.00 | R19: =IF(ISERROR(R13/R17),0,R13/R17) -> 7.8992307692307673 | S19: =IF(ISERROR(S13/S17),0,S13/S17) -> 8.1653571428571414 | T19: =IF(ISERROR(T13/T17),0,T13/T17) -> 119.25 | U19: =IF(ISERROR(U13/U17),0,U13/U17) -> 5.45 | V19: =IF(ISERROR(V13/V17),0,V13/V17) -> 6.70 | W19: =IF(ISERROR(W13/W17),0,W13/W17) -> 0.00 | X19: =IF(ISERROR(X13/X17),0,X13/X17) -> 0.00 | Y19: =IF(ISERROR(Y13/Y17),0,Y13/Y17) -> 0.00 | Z19: =IF(ISERROR(Z13/Z17),0,Z13/Z17) -> 0.00 | AA19: =IF(ISERROR(AA13/AA17),0,AA13/AA17) -> 7.9124999999999996 | AB19: =IF(ISERROR(AB13/AB17),0,AB13/AB17) -> 4.208333333333333 | AC19: =IF(ISERROR(AC13/AC17),0,AC13/AC17) -> 8.00 | AD19: =IF(ISERROR(AD13/AD17),0,AD13/AD17) -> 0.00 | AE19: =IF(ISERROR(AE13/AE17),0,AE13/AE17) -> 0.00 | AF19: =IF(ISERROR(AF13/AF17),0,AF13/AF17) -> 6.375 | AG19: =IF(ISERROR(AG13/AG17),0,AG13/AG17) -> 0.00 | AH19: =IF(ISERROR(AH13/AH17),0,AH13/AH17) -> 7.4732142857142865 | AI19: =IF(ISERROR(AI13/AI17),0,AI13/AI17) -> 10.4625 | AJ19: =IF(ISERROR(AJ13/AJ17),0,AJ13/AJ17) -> 23.175000000000001 | AK19: =IF(ISERROR(AK13/AK17),0,AK13/AK17) -> 0.00 | AL19: =IF(ISERROR(AL13/AL17),0,AL13/AL17) -> 0.00 | AM19: =IF(ISERROR(AM13/AM17),0,AM13/AM17) -> 11.319000000000001 | AN19: =IF(ISERROR(AN13/AN17),0,AN13/AN17) -> 10.833333333333334 | AO19: =IF(ISERROR(AO13/AO17),0,AO13/AO17) -> 17.357142857142858 | AP19: =IF(ISERROR(AP13/AP17),0,AP13/AP17) -> 11.85 | AQ19: =IF(ISERROR(AQ13/AQ17),0,AQ13/AQ17) -> 94.125 | AR19: =IF(ISERROR(AR13/AR17),0,AR13/AR17) -> 0.00 | AS19: =IF(ISERROR(AS13/AS17),0,AS13/AS17) -> 0.00 | AT19: =IF(ISERROR(AT13/AT17),0,AT13/AT17) -> 5.791666666666667 | AU19: =IF(ISERROR(AU13/AU17),0,AU13/AU17) -> 12.916666666666666 | AV19: =IF(ISERROR(AV13/AV17),0,AV13/AV17) -> 14.203125 | AW19: =IF(ISERROR(AW13/AW17),0,AW13/AW17) -> 12.421875 | AX19: =IF(ISERROR(AX13/AX17),0,AX13/AX17) -> 26.85 | AY19: =IF(ISERROR(AY13/AY17),0,AY13/AY17) -> 0.00 | AZ19: =IF(ISERROR(AZ13/AZ17),0,AZ13/AZ17) -> 0.00 | BA19: =IF(ISERROR(BA13/BA17),0,BA13/BA17) -> 8.1159999999999997 | BB19: =IF(ISERROR(BB13/BB17),0,BB13/BB17) -> 8.8660714285714288 | BC19: =IF(ISERROR(BC13/BC17),0,BC13/BC17) -> 37.75 | BD19: =IF(ISERROR(BD13/BD17),0,BD13/BD17) -> 31.556249999999999 | BE19: =IF(ISERROR(BE13/BE17),0,BE13/BE17) -> 14.50 | BF19: =IF(ISERROR(BF13/BF17),0,BF13/BF17) -> 0.00 | BG19: =IF(ISERROR(BG13/BG17),0,BG13/BG17) -> 0.00 | BH19: =IF(ISERROR(BH13/BH17),0,BH13/BH17) -> 8.5425000000000004 | BI19: =IF(ISERROR(BI13/BI17),0,BI13/BI17) -> 11.785 | BJ19: =IF(ISERROR(BJ13/BJ17),0,BJ13/BJ17) -> 6.36 | BK19: =IF(ISERROR(BK13/BK17),0,BK13/BK17) -> 108.00 | BL19: =IF(ISERROR(BL13/BL17),0,BL13/BL17) -> 6.00 | BM19: =IF(ISERROR(BM13/BM17),0,BM13/BM17) -> 0.00 | BN19: =IF(ISERROR(BN13/BN17),0,BN13/BN17) -> 0.00 | BO19: =IF(ISERROR(BO13/BO17),0,BO13/BO17) -> 3.8758928571428566 | BP19: =IF(ISERROR(BP13/BP17),0,BP13/BP17) -> 4.0759615384615389 | BQ19: =IF(ISERROR(BQ13/BQ17),0,BQ13/BQ17) -> 10.49 | BR19: =IF(ISERROR(BR13/BR17),0,BR13/BR17) -> 0.00 | BS19: =IF(ISERROR(BS13/BS17),0,BS13/BS17) -> 5.4757894736842108 | BT19: =IF(ISERROR(BT13/BT17),0,BT13/BT17) -> 0.00 | BU19: =IF(ISERROR(BU13/BU17),0,BU13/BU17) -> 0.00 | BV19: =IF(ISERROR(BV13/BV17),0,BV13/BV17) -> 0.00 | BW19: =IF(ISERROR(BW13/BW17),0,BW13/BW17) -> 6.1144736842105267 | BX19: =IF(ISERROR(BX13/BX17),0,BX13/BX17) -> 7.2846428571428561 | BY19: =IF(ISERROR(BY13/BY17),0,BY13/BY17) -> 17.565000000000001 | BZ19: =IF(ISERROR(BZ13/BZ17),0,BZ13/BZ17) -> 8.7312499999999993 | CA19: =IF(ISERROR(CA13/CA17),0,CA13/CA17) -> 0.00 | CB19: =IF(ISERROR(CB13/CB17),0,CB13/CB17) -> 0.00 | CC19: =IF(ISERROR(CC13/CC17),0,CC13/CC17) -> 9.21 | CD19: =IF(ISERROR(CD13/CD17),0,CD13/CD17) -> 7.5103846153846163 | CE19: =IF(ISERROR(CE13/CE17),0,CE13/CE17) -> 8.3362499999999997 | CF19: =IF(ISERROR(CF13/CF17),0,CF13/CF17) -> 15.7125 | CG19: =IF(ISERROR(CG13/CG17),0,CG13/CG17) -> 7.3636363636363642 | CH19: =IF(ISERROR(CH13/CH17),0,CH13/CH17) -> 0.00 | CI19: =IF(ISERROR(CI13/CI17),0,CI13/CI17) -> 0.00 | CJ19: =IF(ISERROR(CJ13/CJ17),0,CJ13/CJ17) -> 5.35 | CK19: =IF(ISERROR(CK13/CK17),0,CK13/CK17) -> 5.5384615384615392 | CL19: =IF(ISERROR(CL13/CL17),0,CL13/CL17) -> 12.125 | CM19: =IF(ISERROR(CM13/CM17),0,CM13/CM17) -> 12.0625 | CN19: =IF(ISERROR(CN13/CN17),0,CN13/CN17) -> 18.1875 | CO19: =IF(ISERROR(CO13/CO17),0,CO13/CO17) -> 0.00 | CP19: =IF(ISERROR(CP13/CP17),0,CP13/CP17) -> 0.00 | CQ19: =IF(ISERROR(CQ13/CQ17),0,CQ13/CQ17) -> 10.00 | CR19: =IF(ISERROR(CR13/CR17),0,CR13/CR17) -> 12.20 | CS19: =IF(ISERROR(CS13/CS17),0,CS13/CS17) -> 0.00 | CT19: =IF(ISERROR(CT13/CT17),0,CT13/CT17) -> 0.00 | CU19: =IF(ISERROR(CU13/CU17),0,CU13/CU17) -> 61.50 | CV19: =IF(ISERROR(CV13/CV17),0,CV13/CV17) -> 0.00 | CW19: =IF(ISERROR(CW13/CW17),0,CW13/CW17) -> 0.00 | CX19: =IF(ISERROR(CX13/CX17),0,CX13/CX17) -> 10.821428571428573 | CY19: =IF(ISERROR(CY13/CY17),0,CY13/CY17) -> 3.4943181818181821 | CZ19: =IF(ISERROR(CZ13/CZ17),0,CZ13/CZ17) -> 4.5441176470588234 | DA19: =IF(ISERROR(DA13/DA17),0,DA13/DA17) -> 25.50 | DB19: =IF(ISERROR(DB13/DB17),0,DB13/DB17) -> 15.1875 | DC19: =IF(ISERROR(DC13/DC17),0,DC13/DC17) -> 0.00 | DD19: =IF(ISERROR(DD13/DD17),0,DD13/DD17) -> 0.00 | DE19: =IF(ISERROR(DE13/DE17),0,DE13/DE17) -> 7.5576923076923084 | DF19: =IF(ISERROR(DF13/DF17),0,DF13/DF17) -> 9.30 | DG19: =IF(ISERROR(DG13/DG17),0,DG13/DG17) -> 7.6363636363636367 | DH19: =IF(ISERROR(DH13/DH17),0,DH13/DH17) -> 7.958333333333333 | DI19: =IF(ISERROR(DI13/DI17),0,DI13/DI17) -> 2.90625 | DJ19: =IF(ISERROR(DJ13/DJ17),0,DJ13/DJ17) -> 0.00 | DK19: =IF(ISERROR(DK13/DK17),0,DK13/DK17) -> 0.00 | DL19: =IF(ISERROR(DL13/DL17),0,DL13/DL17) -> 5.7053571428571423 | DM19: =IF(ISERROR(DM13/DM17),0,DM13/DM17) -> 13.00 | DN19: =IF(ISERROR(DN13/DN17),0,DN13/DN17) -> 7.166666666666667 | DO19: =IF(ISERROR(DO13/DO17),0,DO13/DO17) -> 3.4249999999999998 | DP19: =IF(ISERROR(DP13/DP17),0,DP13/DP17) -> 0.00 | DQ19: =IF(ISERROR(DQ13/DQ17),0,DQ13/DQ17) -> 0.00 | DR19: =IF(ISERROR(DR13/DR17),0,DR13/DR17) -> 0.00 | DS19: =IF(ISERROR(DS13/DS17),0,DS13/DS17) -> 20.25 | DT19: =IF(ISERROR(DT13/DT17),0,DT13/DT17) -> 9.4583333333333339 | DU19: =IF(ISERROR(DU13/DU17),0,DU13/DU17) -> 11.208333333333334 | DV19: =IF(ISERROR(DV13/DV17),0,DV13/DV17) -> 12.875 | DW19: =IF(ISERROR(DW13/DW17),0,DW13/DW17) -> 7.666666666666667 | DX19: =IF(ISERROR(DX13/DX17),0,DX13/DX17) -> 0.00 | DY19: =IF(ISERROR(DY13/DY17),0,DY13/DY17) -> 0.00 | DZ19: =IF(ISERROR(DZ13/DZ17),0,DZ13/DZ17) -> 20.3125 | EA19: =IF(ISERROR(EA13/EA17),0,EA13/EA17) -> 8.1449999999999996 | EB19: =IF(ISERROR(EB13/EB17),0,EB13/EB17) -> 0.00 | EC19: =IF(ISERROR(EC13/EC17),0,EC13/EC17) -> 7.0625 | ED19: =IF(ISERROR(ED13/ED17),0,ED13/ED17) -> 15.9275 | EE19: =IF(ISERROR(EE13/EE17),0,EE13/EE17) -> 0.00 | EF19: =IF(ISERROR(EF13/EF17),0,EF13/EF17) -> 0.00 | EG19: =IF(ISERROR(EG13/EG17),0,EG13/EG17) -> 13.0625 | EH19: =IF(ISERROR(EH13/EH17),0,EH13/EH17) -> 5.65 | EI19: =IF(ISERROR(EI13/EI17),0,EI13/EI17) -> 4.00 | EJ19: =IF(ISERROR(EJ13/EJ17),0,EJ13/EJ17) -> 6.65625 | EK19: =IF(ISERROR(EK13/EK17),0,EK13/EK17) -> 6.53125 | EL19: =IF(ISERROR(EL13/EL17),0,EL13/EL17) -> 0.00 | EM19: =IF(ISERROR(EM13/EM17),0,EM13/EM17) -> 0.00 | EN19: =IF(ISERROR(EN13/EN17),0,EN13/EN17) -> 11.571428571428571 | EO19: =IF(ISERROR(EO13/EO17),0,EO13/EO17) -> 8.75 | EP19: =IF(ISERROR(EP13/EP17),0,EP13/EP17) -> 6.1153846153846159 | EQ19: =IF(ISERROR(EQ13/EQ17),0,EQ13/EQ17) -> 26.125 | ER19: =IF(ISERROR(ER13/ER17),0,ER13/ER17) -> 76.50 | ES19: =IF(ISERROR(ES13/ES17),0,ES13/ES17) -> 0.00 | ET19: =IF(ISERROR(ET13/ET17),0,ET13/ET17) -> 0.00 | EU19: =IF(ISERROR(EU13/EU17),0,EU13/EU17) -> 26.50 | EV19: =IF(ISERROR(EV13/EV17),0,EV13/EV17) -> 9.2083333333333339 | EW19: =IF(ISERROR(EW13/EW17),0,EW13/EW17) -> 9.0833333333333339 | EX19: =IF(ISERROR(EX13/EX17),0,EX13/EX17) -> 78.375 | EY19: =IF(ISERROR(EY13/EY17),0,EY13/EY17) -> 8.8333333333333339 | EZ19: =IF(ISERROR(EZ13/EZ17),0,EZ13/EZ17) -> 0.00 | FA19: =IF(ISERROR(FA13/FA17),0,FA13/FA17) -> 0.00 | FB19: =IF(ISERROR(FB13/FB17),0,FB13/FB17) -> 5.3863636363636367 | FC19: =IF(ISERROR(FC13/FC17),0,FC13/FC17) -> 4.5441176470588234 | FD19: =IF(ISERROR(FD13/FD17),0,FD13/FD17) -> 8.8333333333333339 | FE19: =IF(ISERROR(FE13/FE17),0,FE13/FE17) -> 13.25 | FF19: =IF(ISERROR(FF13/FF17),0,FF13/FF17) -> 8.7916666666666661 | FG19: =IF(ISERROR(FG13/FG17),0,FG13/FG17) -> 0.00 | FH19: =IF(ISERROR(FH13/FH17),0,FH13/FH17) -> 0.00 | FI19: =IF(ISERROR(FI13/FI17),0,FI13/FI17) -> 8.0625 | FJ19: =IF(ISERROR(FJ13/FJ17),0,FJ13/FJ17) -> 8.5961538461538467 | FK19: =IF(ISERROR(FK13/FK17),0,FK13/FK17) -> 11.581666666666665 | FL19: =IF(ISERROR(FL13/FL17),0,FL13/FL17) -> 8.1750000000000007 | FM19: =IF(ISERROR(FM13/FM17),0,FM13/FM17) -> 9.4166666666666661 | FN19: =IF(ISERROR(FN13/FN17),0,FN13/FN17) -> 0.00 | FO19: =IF(ISERROR(FO13/FO17),0,FO13/FO17) -> 0.00 | FP19: =IF(ISERROR(FP13/FP17),0,FP13/FP17) -> 56.25 | FQ19: =IF(ISERROR(FQ13/FQ17),0,FQ13/FQ17) -> 17.127500000000001 | FR19: =IF(ISERROR(FR13/FR17),0,FR13/FR17) -> 26.947500000000002 | FS19: =IF(ISERROR(FS13/FS17),0,FS13/FS17) -> 17.135000000000002 | FT19: =IF(ISERROR(FT13/FT17),0,FT13/FT17) -> 0.00 | FU19: =IF(ISERROR(FU13/FU17),0,FU13/FU17) -> 0.00 | FV19: =IF(ISERROR(FV13/FV17),0,FV13/FV17) -> 0.00 | FW19: =IF(ISERROR(FW13/FW17),0,FW13/FW17) -> 0.00 | FX19: =IF(ISERROR(FX13/FX17),0,FX13/FX17) -> 11.666666666666666 | FY19: =IF(ISERROR(FY13/FY17),0,FY13/FY17) -> 15.925000000000001 | FZ19: =IF(ISERROR(FZ13/FZ17),0,FZ13/FZ17) -> 16.00 | GA19: =IF(ISERROR(GA13/GA17),0,GA13/GA17) -> 11.833333333333334 | GB19: =IF(ISERROR(GB13/GB17),0,GB13/GB17) -> 0.00 | GC19: =IF(ISERROR(GC13/GC17),0,GC13/GC17) -> 0.00 | GD19: =IF(ISERROR(GD13/GD17),0,GD13/GD17) -> 10.182692307692308 | GE19: =IF(ISERROR(GE13/GE17),0,GE13/GE17) -> 14.291666666666666 | GF19: =IF(ISERROR(GF13/GF17),0,GF13/GF17) -> 9.0566666666666666 | GG19: =IF(ISERROR(GG13/GG17),0,GG13/GG17) -> 12.333333333333334 | GH19: =IF(ISERROR(GH13/GH17),0,GH13/GH17) -> 26.375 | GI19: =IF(ISERROR(GI13/GI17),0,GI13/GI17) -> 0.00 | GJ19: =IF(ISERROR(GJ13/GJ17),0,GJ13/GJ17) -> 0.00 | GK19: =IF(ISERROR(GK13/GK17),0,GK13/GK17) -> 13.625 | GL19: =IF(ISERROR(GL13/GL17),0,GL13/GL17) -> 11.50 | GM19: =IF(ISERROR(GM13/GM17),0,GM13/GM17) -> 8.125 | GN19: =IF(ISERROR(GN13/GN17),0,GN13/GN17) -> 12.833333333333334 | GO19: =IF(ISERROR(GO13/GO17),0,GO13/GO17) -> 14.00 | GP19: =IF(ISERROR(GP13/GP17),0,GP13/GP17) -> 0.00 | GQ19: =IF(ISERROR(GQ13/GQ17),0,GQ13/GQ17) -> 0.00 | GR19: =IF(ISERROR(GR13/GR17),0,GR13/GR17) -> 8.50 | GS19: =IF(ISERROR(GS13/GS17),0,GS13/GS17) -> 8.5625 | GT19: =IF(ISERROR(GT13/GT17),0,GT13/GT17) -> 8.00 | GU19: =IF(ISERROR(GU13/GU17),0,GU13/GU17) -> 6.4375 | GV19: =IF(ISERROR(GV13/GV17),0,GV13/GV17) -> 6.46875 | GW19: =IF(ISERROR(GW13/GW17),0,GW13/GW17) -> 0.00 | GX19: =IF(ISERROR(GX13/GX17),0,GX13/GX17) -> 0.00 | GY19: =IF(ISERROR(GY13/GY17),0,GY13/GY17) -> 11.083333333333334 | GZ19: =IF(ISERROR(GZ13/GZ17),0,GZ13/GZ17) -> 7.916666666666667 | HA19: =IF(ISERROR(HA13/HA17),0,HA13/HA17) -> 19.50 | HB19: =IF(ISERROR(HB13/HB17),0,HB13/HB17) -> 18.4375 | HC19: =IF(ISERROR(HC13/HC17),0,HC13/HC17) -> 0.00 | HD19: =IF(ISERROR(HD13/HD17),0,HD13/HD17) -> 0.00 | HE19: =IF(ISERROR(HE13/HE17),0,HE13/HE17) -> 0.00 | HF19: =IF(ISERROR(HF13/HF17),0,HF13/HF17) -> 62.625 | HG19: =IF(ISERROR(HG13/HG17),0,HG13/HG17) -> 6.395833333333333 | HH19: =IF(ISERROR(HH13/HH17),0,HH13/HH17) -> 36.00 | HI19: =IF(ISERROR(HI13/HI17),0,HI13/HI17) -> 0.00 | HJ19: =IF(ISERROR(HJ13/HJ17),0,HJ13/HJ17) -> 16.6875 | HK19: =IF(ISERROR(HK13/HK17),0,HK13/HK17) -> 0.00 | HL19: =IF(ISERROR(HL13/HL17),0,HL13/HL17) -> 0.00 | HM19: =IF(ISERROR(HM13/HM17),0,HM13/HM17) -> 24.75 | HN19: =IF(ISERROR(HN13/HN17),0,HN13/HN17) -> 16.75 | HO19: =IF(ISERROR(HO13/HO17),0,HO13/HO17) -> 0.00 | HP19: =IF(ISERROR(HP13/HP17),0,HP13/HP17) -> 26.25 | HQ19: =IF(ISERROR(HQ13/HQ17),0,HQ13/HQ17) -> 20.125 | HR19: =IF(ISERROR(HR13/HR17),0,HR13/HR17) -> 0.00 | HS19: =IF(ISERROR(HS13/HS17),0,HS13/HS17) -> 0.00 | HT19: =IF(ISERROR(HT13/HT17),0,HT13/HT17) -> 0.00 | HU19: =IF(ISERROR(HU13/HU17),0,HU13/HU17) -> 0.00 | HV19: =IF(ISERROR(HV13/HV17),0,HV13/HV17) -> 0.00 | HW19: =IF(ISERROR(HW13/HW17),0,HW13/HW17) -> 0.00 | HX19: =IF(ISERROR(HX13/HX17),0,HX13/HX17) -> 0.00 | HY19: =IF(ISERROR(HY13/HY17),0,HY13/HY17) -> 0.00 | HZ19: =IF(ISERROR(HZ13/HZ17),0,HZ13/HZ17) -> 0.00 | IA19: =IF(ISERROR(IA13/IA17),0,IA13/IA17) -> 0.00 | IB19: =IF(ISERROR(IB13/IB17),0,IB13/IB17) -> 0.00 | IC19: =IF(ISERROR(IC13/IC17),0,IC13/IC17) -> 0.00 | ID19: =IF(ISERROR(ID13/ID17),0,ID13/ID17) -> 0.00 | IE19: =IF(ISERROR(IE13/IE17),0,IE13/IE17) -> 0.00 | IF19: =IF(ISERROR(IF13/IF17),0,IF13/IF17) -> 0.00 | IG19: =IF(ISERROR(IG13/IG17),0,IG13/IG17) -> 0.00 | IH19: =IF(ISERROR(IH13/IH17),0,IH13/IH17) -> 0.00 | II19: =IF(ISERROR(II13/II17),0,II13/II17) -> 0.00 | IJ19: =IF(ISERROR(IJ13/IJ17),0,IJ13/IJ17) -> 0.00 | IK19: =IF(ISERROR(IK13/IK17),0,IK13/IK17) -> 0.00 | IL19: =IF(ISERROR(IL13/IL17),0,IL13/IL17) -> 0.00
A21: Total FTE Hours MTD | B21: =IF(DAY(B3)>1,B13+A21,B13) -> 0 | C21: =IF(DAY(C3)>1,C13+B21,C13) -> 0 | D21: =IF(DAY(D3)>1,D13+C21,D13) -> 32 | E21: =IF(DAY(E3)>1,E13+D21,E13) -> 68.4 | F21: =IF(DAY(F3)>1,F13+E21,F13) -> 103.9 | G21: =IF(DAY(G3)>1,G13+F21,G13) -> 137.15 | H21: =IF(DAY(H3)>1,H13+G21,H13) -> 173.55 | I21: =IF(DAY(I3)>1,I13+H21,I13) -> 173.55 | J21: =IF(DAY(J3)>1,J13+I21,J13) -> 173.55 | K21: =IF(DAY(K3)>1,K13+J21,K13) -> 206.405 | L21: =IF(DAY(L3)>1,L13+K21,L13) -> 240.97499999999999 | M21: =IF(DAY(M3)>1,M13+L21,M13) -> 277.52 | N21: =IF(DAY(N3)>1,N13+M21,N13) -> 316.64499999999998 | O21: =IF(DAY(O3)>1,O13+N21,O13) -> 359.64499999999998 | P21: =IF(DAY(P3)>1,P13+O21,P13) -> 359.64499999999998 | Q21: =IF(DAY(Q3)>1,Q13+P21,Q13) -> 359.64499999999998 | R21: =IF(DAY(R3)>1,R13+Q21,R13) -> 393.875 | S21: =IF(DAY(S3)>1,S13+R21,S13) -> 431.98 | T21: =IF(DAY(T3)>1,T13+S21,T13) -> 471.73 | U21: =IF(DAY(U3)>1,U13+T21,U13) -> 504.43 | V21: =IF(DAY(V3)>1,V13+U21,V13) -> 537.93 | W21: =IF(DAY(W3)>1,W13+V21,W13) -> 537.93 | X21: =IF(DAY(X3)>1,X13+W21,X13) -> 537.93 | Y21: =IF(DAY(Y3)>1,Y13+X21,Y13) -> 537.93 | Z21: =IF(DAY(Z3)>1,Z13+Y21,Z13) -> 537.93 | AA21: =IF(DAY(AA3)>1,AA13+Z21,AA13) -> 564.30499999999995 | AB21: =IF(DAY(AB3)>1,AB13+AA21,AB13) -> 589.55499999999995 | AC21: =IF(DAY(AC3)>1,AC13+AB21,AC13) -> 613.55499999999995 | AD21: =IF(DAY(AD3)>1,AD13+AC21,AD13) -> 613.55499999999995 | AE21: =IF(DAY(AE3)>1,AE13+AD21,AE13) -> 613.55499999999995 | AF21: =IF(DAY(AF3)>1,AF13+AE21,AF13) -> 634.80499999999995 | AG21: =IF(DAY(AG3)>1,AG13+AF21,AG13) -> 0.00 | AH21: =IF(DAY(AH3)>1,AH13+AG21,AH13) -> 34.875 | AI21: =IF(DAY(AI3)>1,AI13+AH21,AI13) -> 69.75 | AJ21: =IF(DAY(AJ3)>1,AJ13+AI21,AJ13) -> 108.375 | AK21: =IF(DAY(AK3)>1,AK13+AJ21,AK13) -> 108.375 | AL21: =IF(DAY(AL3)>1,AL13+AK21,AL13) -> 108.375 | AM21: =IF(DAY(AM3)>1,AM13+AL21,AM13) -> 146.10499999999999 | AN21: =IF(DAY(AN3)>1,AN13+AM21,AN13) -> 178.60499999999999 | AO21: =IF(DAY(AO3)>1,AO13+AN21,AO13) -> 219.10499999999999 | AP21: =IF(DAY(AP3)>1,AP13+AO21,AP13) -> 258.60500000000002 | AQ21: =IF(DAY(AQ3)>1,AQ13+AP21,AQ13) -> 289.98 | AR21: =IF(DAY(AR3)>1,AR13+AQ21,AR13) -> 289.98 | AS21: =IF(DAY(AS3)>1,AS13+AR21,AS13) -> 289.98 | AT21: =IF(DAY(AT3)>1,AT13+AS21,AT13) -> 324.73 | AU21: =IF(DAY(AU3)>1,AU13+AT21,AU13) -> 363.48 | AV21: =IF(DAY(AV3)>1,AV13+AU21,AV13) -> 401.35500000000002 | AW21: =IF(DAY(AW3)>1,AW13+AV21,AW13) -> 434.48 | AX21: =IF(DAY(AX3)>1,AX13+AW21,AX13) -> 479.23 | AY21: =IF(DAY(AY3)>1,AY13+AX21,AY13) -> 482.46 | AZ21: =IF(DAY(AZ3)>1,AZ13+AY21,AZ13) -> 482.46 | BA21: =IF(DAY(BA3)>1,BA13+AZ21,BA13) -> 523.04 | BB21: =IF(DAY(BB3)>1,BB13+BA21,BB13) -> 564.41499999999996 | BC21: =IF(DAY(BC3)>1,BC13+BB21,BC13) -> 602.16499999999996 | BD21: =IF(DAY(BD3)>1,BD13+BC21,BD13) -> 644.24 | BE21: =IF(DAY(BE3)>1,BE13+BD21,BE13) -> 687.74 | BF21: =IF(DAY(BF3)>1,BF13+BE21,BF13) -> 689.49 | BG21: =IF(DAY(BG3)>1,BG13+BF21,BG13) -> 689.49 | BH21: =IF(DAY(BH3)>1,BH13+BG21,BH13) -> 723.66 | BI21: =IF(DAY(BI3)>1,BI13+BH21,BI13) -> 759.01499999999999 | BJ21: =IF(DAY(BJ3)>1,BJ13+BI21,BJ13) -> 792.93499999999995 | BK21: =IF(DAY(BK3)>1,BK13+BJ21,BK13) -> 828.93499999999995 | BL21: =IF(DAY(BL3)>1,BL13+BK21,BL13) -> 24 | BM21: =IF(DAY(BM3)>1,BM13+BL21,BM13) -> 24 | BN21: =IF(DAY(BN3)>1,BN13+BM21,BN13) -> 24 | BO21: =IF(DAY(BO3)>1,BO13+BN21,BO13) -> 60.174999999999997 | BP21: =IF(DAY(BP3)>1,BP13+BO21,BP13) -> 95.5 | BQ21: =IF(DAY(BQ3)>1,BQ13+BP21,BQ13) -> 147.95 | BR21: =IF(DAY(BR3)>1,BR13+BQ21,BR13) -> 182.1 | BS21: =IF(DAY(BS3)>1,BS13+BR21,BS13) -> 216.78 | BT21: =IF(DAY(BT3)>1,BT13+BS21,BT13) -> 216.78 | BU21: =IF(DAY(BU3)>1,BU13+BT21,BU13) -> 216.78 | BV21: =IF(DAY(BV3)>1,BV13+BU21,BV13) -> 251.61 | BW21: =IF(DAY(BW3)>1,BW13+BV21,BW13) -> 290.33499999999998 | BX21: =IF(DAY(BX3)>1,BX13+BW21,BX13) -> 324.33 | BY21: =IF(DAY(BY3)>1,BY13+BX21,BY13) -> 359.46 | BZ21: =IF(DAY(BZ3)>1,BZ13+BY21,BZ13) -> 394.38499999999999 | CA21: =IF(DAY(CA3)>1,CA13+BZ21,CA13) -> 394.38499999999999 | CB21: =IF(DAY(CB3)>1,CB13+CA21,CB13) -> 394.38499999999999 | CC21: =IF(DAY(CC3)>1,CC13+CB21,CC13) -> 425.08499999999998 | CD21: =IF(DAY(CD3)>1,CD13+CC21,CD13) -> 457.63 | CE21: =IF(DAY(CE3)>1,CE13+CD21,CE13) -> 490.97500000000002 | CF21: =IF(DAY(CF3)>1,CF13+CE21,CF13) -> 522.4 | CG21: =IF(DAY(CG3)>1,CG13+CF21,CG13) -> 549.4 | CH21: =IF(DAY(CH3)>1,CH13+CG21,CH13) -> 549.4 | CI21: =IF(DAY(CI3)>1,CI13+CH21,CI13) -> 549.4 | CJ21: =IF(DAY(CJ3)>1,CJ13+CI21,CJ13) -> 576.15 | CK21: =IF(DAY(CK3)>1,CK13+CJ21,CK13) -> 600.15 | CL21: =IF(DAY(CL3)>1,CL13+CK21,CL13) -> 624.4 | CM21: =IF(DAY(CM3)>1,CM13+CL21,CM13) -> 648.52499999999998 | CN21: =IF(DAY(CN3)>1,CN13+CM21,CN13) -> 24.25 | CO21: =IF(DAY(CO3)>1,CO13+CN21,CO13) -> 24.25 | CP21: =IF(DAY(CP3)>1,CP13+CO21,CP13) -> 24.25 | CQ21: =IF(DAY(CQ3)>1,CQ13+CP21,CQ13) -> 54.25 | CR21: =IF(DAY(CR3)>1,CR13+CQ21,CR13) -> 78.65 | CS21: =IF(DAY(CS3)>1,CS13+CR21,CS13) -> 110.15 | CT21: =IF(DAY(CT3)>1,CT13+CS21,CT13) -> 133.77500000000001 | CU21: =IF(DAY(CU3)>1,CU13+CT21,CU13) -> 154.27500000000001 | CV21: =IF(DAY(CV3)>1,CV13+CU21,CV13) -> 154.27500000000001 | CW21: =IF(DAY(CW3)>1,CW13+CV21,CW13) -> 154.27500000000001 | CX21: =IF(DAY(CX3)>1,CX13+CW21,CX13) -> 179.52500000000001 | CY21: =IF(DAY(CY3)>1,CY13+CX21,CY13) -> 205.15 | CZ21: =IF(DAY(CZ3)>1,CZ13+CY21,CZ13) -> 230.9 | DA21: =IF(DAY(DA3)>1,DA13+CZ21,DA13) -> 256.4 | DB21: =IF(DAY(DB3)>1,DB13+DA21,DB13) -> 286.77499999999998 | DC21: =IF(DAY(DC3)>1,DC13+DB21,DC13) -> 286.77499999999998 | DD21: =IF(DAY(DD3)>1,DD13+DC21,DD13) -> 286.77499999999998 | DE21: =IF(DAY(DE3)>1,DE13+DD21,DE13) -> 319.52499999999998 | DF21: =IF(DAY(DF3)>1,DF13+DE21,DF13) -> 350.52499999999998 | DG21: =IF(DAY(DG3)>1,DG13+DF21,DG13) -> 378.52499999999998 | DH21: =IF(DAY(DH3)>1,DH13+DG21,DH13) -> 402.4 | DI21: =IF(DAY(DI3)>1,DI13+DH21,DI13) -> 417.9 | DJ21: =IF(DAY(DJ3)>1,DJ13+DI21,DJ13) -> 417.9 | DK21: =IF(DAY(DK3)>1,DK13+DJ21,DK13) -> 417.9 | DL21: =IF(DAY(DL3)>1,DL13+DK21,DL13) -> 444.52499999999998 | DM21: =IF(DAY(DM3)>1,DM13+DL21,DM13) -> 470.52499999999998 | DN21: =IF(DAY(DN3)>1,DN13+DM21,DN13) -> 492.02499999999998 | DO21: =IF(DAY(DO3)>1,DO13+DN21,DO13) -> 509.15 | DP21: =IF(DAY(DP3)>1,DP13+DO21,DP13) -> 509.15 | DQ21: =IF(DAY(DQ3)>1,DQ13+DP21,DQ13) -> 509.15 | DR21: =IF(DAY(DR3)>1,DR13+DQ21,DR13) -> 509.15 | DS21: =IF(DAY(DS3)>1,DS13+DR21,DS13) -> 33.75 | DT21: =IF(DAY(DT3)>1,DT13+DS21,DT13) -> 62.125 | DU21: =IF(DAY(DU3)>1,DU13+DT21,DU13) -> 95.75 | DV21: =IF(DAY(DV3)>1,DV13+DU21,DV13) -> 121.5 | DW21: =IF(DAY(DW3)>1,DW13+DV21,DW13) -> 144.5 | DX21: =IF(DAY(DX3)>1,DX13+DW21,DX13) -> 144.5 | DY21: =IF(DAY(DY3)>1,DY13+DX21,DY13) -> 144.5 | DZ21: =IF(DAY(DZ3)>1,DZ13+DY21,DZ13) -> 185.125 | EA21: =IF(DAY(EA3)>1,EA13+DZ21,EA13) -> 217.70500000000001 | EB21: =IF(DAY(EB3)>1,EB13+EA21,EB13) -> 243.35499999999999 | EC21: =IF(DAY(EC3)>1,EC13+EB21,EC13) -> 271.60500000000002 | ED21: =IF(DAY(ED3)>1,ED13+EC21,ED13) -> 303.46 | EE21: =IF(DAY(EE3)>1,EE13+ED21,EE13) -> 303.46 | EF21: =IF(DAY(EF3)>1,EF13+EE21,EF13) -> 303.46 | EG21: =IF(DAY(EG3)>1,EG13+EF21,EG13) -> 329.58499999999998 | EH21: =IF(DAY(EH3)>1,EH13+EG21,EH13) -> 357.83499999999998 | EI21: =IF(DAY(EI3)>1,EI13+EH21,EI13) -> 385.83499999999998 | EJ21: =IF(DAY(EJ3)>1,EJ13+EI21,EJ13) -> 412.46 | EK21: =IF(DAY(EK3)>1,EK13+EJ21,EK13) -> 438.58499999999998 | EL21: =IF(DAY(EL3)>1,EL13+EK21,EL13) -> 438.58499999999998 | EM21: =IF(DAY(EM3)>1,EM13+EL21,EM13) -> 438.58499999999998 | EN21: =IF(DAY(EN3)>1,EN13+EM21,EN13) -> 465.58499999999998 | EO21: =IF(DAY(EO3)>1,EO13+EN21,EO13) -> 491.83499999999998 | EP21: =IF(DAY(EP3)>1,EP13+EO21,EP13) -> 518.33500000000004 | EQ21: =IF(DAY(EQ3)>1,EQ13+EP21,EQ13) -> 544.46 | ER21: =IF(DAY(ER3)>1,ER13+EQ21,ER13) -> 569.96 | ES21: =IF(DAY(ES3)>1,ES13+ER21,ES13) -> 569.96 | ET21: =IF(DAY(ET3)>1,ET13+ES21,ET13) -> 569.96 | EU21: =IF(DAY(EU3)>1,EU13+ET21,EU13) -> 596.46 | EV21: =IF(DAY(EV3)>1,EV13+EU21,EV13) -> 624.08500000000004 | EW21: =IF(DAY(EW3)>1,EW13+EV21,EW13) -> 27.25 | EX21: =IF(DAY(EX3)>1,EX13+EW21,EX13) -> 53.375 | EY21: =IF(DAY(EY3)>1,EY13+EX21,EY13) -> 79.875 | EZ21: =IF(DAY(EZ3)>1,EZ13+EY21,EZ13) -> 79.875 | FA21: =IF(DAY(FA3)>1,FA13+EZ21,FA13) -> 79.875 | FB21: =IF(DAY(FB3)>1,FB13+FA21,FB13) -> 99.625 | FC21: =IF(DAY(FC3)>1,FC13+FB21,FC13) -> 125.375 | FD21: =IF(DAY(FD3)>1,FD13+FC21,FD13) -> 151.875 | FE21: =IF(DAY(FE3)>1,FE13+FD21,FE13) -> 178.375 | FF21: =IF(DAY(FF3)>1,FF13+FE21,FF13) -> 204.75 | FG21: =IF(DAY(FG3)>1,FG13+FF21,FG13) -> 204.75 | FH21: =IF(DAY(FH3)>1,FH13+FG21,FH13) -> 204.75 | FI21: =IF(DAY(FI3)>1,FI13+FH21,FI13) -> 231.625 | FJ21: =IF(DAY(FJ3)>1,FJ13+FI21,FJ13) -> 268.875 | FK21: =IF(DAY(FK3)>1,FK13+FJ21,FK13) -> 303.62 | FL21: =IF(DAY(FL3)>1,FL13+FK21,FL13) -> 330.87 | FM21: =IF(DAY(FM3)>1,FM13+FL21,FM13) -> 359.12 | FN21: =IF(DAY(FN3)>1,FN13+FM21,FN13) -> 359.12 | FO21: =IF(DAY(FO3)>1,FO13+FN21,FO13) -> 359.12 | FP21: =IF(DAY(FP3)>1,FP13+FO21,FP13) -> 396.62 | FQ21: =IF(DAY(FQ3)>1,FQ13+FP21,FQ13) -> 430.875 | FR21: =IF(DAY(FR3)>1,FR13+FQ21,FR13) -> 466.80500000000001 | FS21: =IF(DAY(FS3)>1,FS13+FR21,FS13) -> 501.07499999999999 | FT21: =IF(DAY(FT3)>1,FT13+FS21,FT13) -> 534.82500000000005 | FU21: =IF(DAY(FU3)>1,FU13+FT21,FU13) -> 534.82500000000005 | FV21: =IF(DAY(FV3)>1,FV13+FU21,FV13) -> 534.82500000000005 | FW21: =IF(DAY(FW3)>1,FW13+FV21,FW13) -> 534.82500000000005 | FX21: =IF(DAY(FX3)>1,FX13+FW21,FX13) -> 569.82500000000005 | FY21: =IF(DAY(FY3)>1,FY13+FX21,FY13) -> 601.67499999999995 | FZ21: =IF(DAY(FZ3)>1,FZ13+FY21,FZ13) -> 633.67499999999995 | GA21: =IF(DAY(GA3)>1,GA13+FZ21,GA13) -> 669.17499999999995 | GB21: =IF(DAY(GB3)>1,GB13+GA21,GB13) -> 0 | GC21: =IF(DAY(GC3)>1,GC13+GB21,GC13) -> 0 | GD21: =IF(DAY(GD3)>1,GD13+GC21,GD13) -> 44.125 | GE21: =IF(DAY(GE3)>1,GE13+GD21,GE13) -> 87 | GF21: =IF(DAY(GF3)>1,GF13+GE21,GF13) -> 114.17 | GG21: =IF(DAY(GG3)>1,GG13+GF21,GG13) -> 151.17 | GH21: =IF(DAY(GH3)>1,GH13+GG21,GH13) -> 177.54499999999999 | GI21: =IF(DAY(GI3)>1,GI13+GH21,GI13) -> 177.54499999999999 | GJ21: =IF(DAY(GJ3)>1,GJ13+GI21,GJ13) -> 177.54499999999999 | GK21: =IF(DAY(GK3)>1,GK13+GJ21,GK13) -> 204.79499999999999 | GL21: =IF(DAY(GL3)>1,GL13+GK21,GL13) -> 239.29499999999999 | GM21: =IF(DAY(GM3)>1,GM13+GL21,GM13) -> 263.67 | GN21: =IF(DAY(GN3)>1,GN13+GM21,GN13) -> 302.17 | GO21: =IF(DAY(GO3)>1,GO13+GN21,GO13) -> 344.17 | GP21: =IF(DAY(GP3)>1,GP13+GO21,GP13) -> 344.17 | GQ21: =IF(DAY(GQ3)>1,GQ13+GP21,GQ13) -> 344.17 | GR21: =IF(DAY(GR3)>1,GR13+GQ21,GR13) -> 369.67 | GS21: =IF(DAY(GS3)>1,GS13+GR21,GS13) -> 403.92 | GT21: =IF(DAY(GT3)>1,GT13+GS21,GT13) -> 435.92 | GU21: =IF(DAY(GU3)>1,GU13+GT21,GU13) -> 461.67 | GV21: =IF(DAY(GV3)>1,GV13+GU21,GV13) -> 487.54500000000002 | GW21: =IF(DAY(GW3)>1,GW13+GV21,GW13) -> 487.54500000000002 | GX21: =IF(DAY(GX3)>1,GX13+GW21,GX13) -> 487.54500000000002 | GY21: =IF(DAY(GY3)>1,GY13+GX21,GY13) -> 520.79499999999996 | GZ21: =IF(DAY(GZ3)>1,GZ13+GY21,GZ13) -> 544.54499999999996 | HA21: =IF(DAY(HA3)>1,HA13+GZ21,HA13) -> 583.54499999999996 | HB21: =IF(DAY(HB3)>1,HB13+HA21,HB13) -> 620.42 | HC21: =IF(DAY(HC3)>1,HC13+HB21,HC13) -> 664.42 | HD21: =IF(DAY(HD3)>1,HD13+HC21,HD13) -> 664.42 | HE21: =IF(DAY(HE3)>1,HE13+HD21,HE13) -> 664.42 | HF21: =IF(DAY(HF3)>1,HF13+HE21,HF13) -> 20.875 | HG21: =IF(DAY(HG3)>1,HG13+HF21,HG13) -> 59.25 | HH21: =IF(DAY(HH3)>1,HH13+HG21,HH13) -> 95.25 | HI21: =IF(DAY(HI3)>1,HI13+HH21,HI13) -> 95.25 | HJ21: =IF(DAY(HJ3)>1,HJ13+HI21,HJ13) -> 128.625 | HK21: =IF(DAY(HK3)>1,HK13+HJ21,HK13) -> 128.625 | HL21: =IF(DAY(HL3)>1,HL13+HK21,HL13) -> 128.625 | HM21: =IF(DAY(HM3)>1,HM13+HL21,HM13) -> 153.375 | HN21: =IF(DAY(HN3)>1,HN13+HM21,HN13) -> 170.125 | HO21: =IF(DAY(HO3)>1,HO13+HN21,HO13) -> 195.75 | HP21: =IF(DAY(HP3)>1,HP13+HO21,HP13) -> 222 | HQ21: =IF(DAY(HQ3)>1,HQ13+HP21,HQ13) -> 242.125 | HR21: =IF(DAY(HR3)>1,HR13+HQ21,HR13) -> 242.125 | HS21: =IF(DAY(HS3)>1,HS13+HR21,HS13) -> 242.125 | HT21: =IF(DAY(HT3)>1,HT13+HS21,HT13) -> 270.75 | HU21: =IF(DAY(HU3)>1,HU13+HT21,HU13) -> 295.625 | HV21: =IF(DAY(HV3)>1,HV13+HU21,HV13) -> 322.375 | HW21: =IF(DAY(HW3)>1,HW13+HV21,HW13) -> 337.875 | HX21: =IF(DAY(HX3)>1,HX13+HW21,HX13) -> 353.625 | HY21: =IF(DAY(HY3)>1,HY13+HX21,HY13) -> 353.625 | HZ21: =IF(DAY(HZ3)>1,HZ13+HY21,HZ13) -> 353.625 | IA21: =IF(DAY(IA3)>1,IA13+HZ21,IA13) -> 370.125 | IB21: =IF(DAY(IB3)>1,IB13+IA21,IB13) -> 386.625 | IC21: =IF(DAY(IC3)>1,IC13+IB21,IC13) -> 409.375 | ID21: =IF(DAY(ID3)>1,ID13+IC21,ID13) -> 431.75 | IE21: =IF(DAY(IE3)>1,IE13+ID21,IE13) -> 445.57 | IF21: =IF(DAY(IF3)>1,IF13+IE21,IF13) -> 445.57 | IG21: =IF(DAY(IG3)>1,IG13+IF21,IG13) -> 445.57 | IH21: =IF(DAY(IH3)>1,IH13+IG21,IH13) -> 455.07 | II21: =IF(DAY(II3)>1,II13+IH21,II13) -> 464.57 | IJ21: =IF(DAY(IJ3)>1,IJ13+II21,IJ13) -> 474.07 | IK21: =IF(DAY(IK3)>1,IK13+IJ21,IK13) -> 15.06 | IL21: =IF(DAY(IL3)>1,IL13+IK21,IL13) -> 26.06
A22: Total RCE MTD | B22: =IF(DAY(B3)>1,B17+A22,B17) -> 0 | C22: =IF(DAY(C3)>1,C17+B22,C17) -> 0 | D22: =IF(DAY(D3)>1,D17+C22,D17) -> 5 | E22: =IF(DAY(E3)>1,E17+D22,E17) -> 8 | F22: =IF(DAY(F3)>1,F17+E22,F17) -> 8.3333333333333339 | G22: =IF(DAY(G3)>1,G17+F22,G17) -> 11 | H22: =IF(DAY(H3)>1,H17+G22,H17) -> 12.00 | I22: =IF(DAY(I3)>1,I17+H22,I17) -> 12.00 | J22: =IF(DAY(J3)>1,J17+I22,J17) -> 12.00 | K22: =IF(DAY(K3)>1,K17+J22,K17) -> 12.00 | L22: =IF(DAY(L3)>1,L17+K22,L17) -> 21.333333333333336 | M22: =IF(DAY(M3)>1,M17+L22,M17) -> 22.333333333333336 | N22: =IF(DAY(N3)>1,N17+M22,N17) -> 24.00 | O22: =IF(DAY(O3)>1,O17+N22,O17) -> 26.333333333333336 | P22: =IF(DAY(P3)>1,P17+O22,P17) -> 26.333333333333336 | Q22: =IF(DAY(Q3)>1,Q17+P22,Q17) -> 26.333333333333336 | R22: =IF(DAY(R3)>1,R17+Q22,R17) -> 30.666666666666671 | S22: =IF(DAY(S3)>1,S17+R22,S17) -> 35.333333333333336 | T22: =IF(DAY(T3)>1,T17+S22,T17) -> 35.666666666666671 | U22: =IF(DAY(U3)>1,U17+T22,U17) -> 41.666666666666671 | V22: =IF(DAY(V3)>1,V17+U22,V17) -> 46.666666666666671 | W22: =IF(DAY(W3)>1,W17+V22,W17) -> 46.666666666666671 | X22: =IF(DAY(X3)>1,X17+W22,X17) -> 46.666666666666671 | Y22: =IF(DAY(Y3)>1,Y17+X22,Y17) -> 46.666666666666671 | Z22: =IF(DAY(Z3)>1,Z17+Y22,Z17) -> 46.666666666666671 | AA22: =IF(DAY(AA3)>1,AA17+Z22,AA17) -> 50.00 | AB22: =IF(DAY(AB3)>1,AB17+AA22,AB17) -> 56.00 | AC22: =IF(DAY(AC3)>1,AC17+AB22,AC17) -> 59.00 | AD22: =IF(DAY(AD3)>1,AD17+AC22,AD17) -> 59.00 | AE22: =IF(DAY(AE3)>1,AE17+AD22,AE17) -> 59.00 | AF22: =IF(DAY(AF3)>1,AF17+AE22,AF17) -> 62.333333333333343 | AG22: =IF(DAY(AG3)>1,AG17+AF22,AG17) -> 0.00 | AH22: =IF(DAY(AH3)>1,AH17+AG22,AH17) -> 4.6666666666666661 | AI22: =IF(DAY(AI3)>1,AI17+AH22,AI17) -> 8 | AJ22: =IF(DAY(AJ3)>1,AJ17+AI22,AJ17) -> 9.6666666666666661 | AK22: =IF(DAY(AK3)>1,AK17+AJ22,AK17) -> 9.6666666666666661 | AL22: =IF(DAY(AL3)>1,AL17+AK22,AL17) -> 9.6666666666666661 | AM22: =IF(DAY(AM3)>1,AM17+AL22,AM17) -> 13 | AN22: =IF(DAY(AN3)>1,AN17+AM22,AN17) -> 16 | AO22: =IF(DAY(AO3)>1,AO17+AN22,AO17) -> 18.333333333333332 | AP22: =IF(DAY(AP3)>1,AP17+AO22,AP17) -> 21.666666666666664 | AQ22: =IF(DAY(AQ3)>1,AQ17+AP22,AQ17) -> 22 | AR22: =IF(DAY(AR3)>1,AR17+AQ22,AR17) -> 22 | AS22: =IF(DAY(AS3)>1,AS17+AR22,AS17) -> 22 | AT22: =IF(DAY(AT3)>1,AT17+AS22,AT17) -> 28 | AU22: =IF(DAY(AU3)>1,AU17+AT22,AU17) -> 31 | AV22: =IF(DAY(AV3)>1,AV17+AU22,AV17) -> 33.666666666666664 | AW22: =IF(DAY(AW3)>1,AW17+AV22,AW17) -> 36.333333333333329 | AX22: =IF(DAY(AX3)>1,AX17+AW22,AX17) -> 38 | AY22: =IF(DAY(AY3)>1,AY17+AX22,AY17) -> 38 | AZ22: =IF(DAY(AZ3)>1,AZ17+AY22,AZ17) -> 38 | BA22: =IF(DAY(BA3)>1,BA17+AZ22,BA17) -> 43 | BB22: =IF(DAY(BB3)>1,BB17+BA22,BB17) -> 47.666666666666657 | BC22: =IF(DAY(BC3)>1,BC17+BB22,BC17) -> 48.666666666666657 | BD22: =IF(DAY(BD3)>1,BD17+BC22,BD17) -> 50 | BE22: =IF(DAY(BE3)>1,BE17+BD22,BE17) -> 53 | BF22: =IF(DAY(BF3)>1,BF17+BE22,BF17) -> 53 | BG22: =IF(DAY(BG3)>1,BG17+BF22,BG17) -> 53 | BH22: =IF(DAY(BH3)>1,BH17+BG22,BH17) -> 57 | BI22: =IF(DAY(BI3)>1,BI17+BH22,BI17) -> 60 | BJ22: =IF(DAY(BJ3)>1,BJ17+BI22,BJ17) -> 65.333333333333329 | BK22: =IF(DAY(BK3)>1,BK17+BJ22,BK17) -> 65.666666666666657 | BL22: =IF(DAY(BL3)>1,BL17+BK22,BL17) -> 4 | BM22: =IF(DAY(BM3)>1,BM17+BL22,BM17) -> 4 | BN22: =IF(DAY(BN3)>1,BN17+BM22,BN17) -> 4 | BO22: =IF(DAY(BO3)>1,BO17+BN22,BO17) -> 13.333333333333334 | BP22: =IF(DAY(BP3)>1,BP17+BO22,BP17) -> 22 | BQ22: =IF(DAY(BQ3)>1,BQ17+BP22,BQ17) -> 27 | BR22: =IF(DAY(BR3)>1,BR17+BQ22,BR17) -> 27 | BS22: =IF(DAY(BS3)>1,BS17+BR22,BS17) -> 33.333333333333336 | BT22: =IF(DAY(BT3)>1,BT17+BS22,BT17) -> 33.333333333333336 | BU22: =IF(DAY(BU3)>1,BU17+BT22,BU17) -> 33.333333333333336 | BV22: =IF(DAY(BV3)>1,BV17+BU22,BV17) -> 33.333333333333336 | BW22: =IF(DAY(BW3)>1,BW17+BV22,BW17) -> 39.666666666666671 | BX22: =IF(DAY(BX3)>1,BX17+BW22,BX17) -> 44.333333333333336 | BY22: =IF(DAY(BY3)>1,BY17+BX22,BY17) -> 46.333333333333336 | BZ22: =IF(DAY(BZ3)>1,BZ17+BY22,BZ17) -> 50.333333333333336 | CA22: =IF(DAY(CA3)>1,CA17+BZ22,CA17) -> 50.333333333333336 | CB22: =IF(DAY(CB3)>1,CB17+CA22,CB17) -> 50.333333333333336 | CC22: =IF(DAY(CC3)>1,CC17+CB22,CC17) -> 53.666666666666671 | CD22: =IF(DAY(CD3)>1,CD17+CC22,CD17) -> 58 | CE22: =IF(DAY(CE3)>1,CE17+CD22,CE17) -> 62 | CF22: =IF(DAY(CF3)>1,CF17+CE22,CF17) -> 64 | CG22: =IF(DAY(CG3)>1,CG17+CF22,CG17) -> 67.666666666666671 | CH22: =IF(DAY(CH3)>1,CH17+CG22,CH17) -> 67.666666666666671 | CI22: =IF(DAY(CI3)>1,CI17+CH22,CI17) -> 67.666666666666671 | CJ22: =IF(DAY(CJ3)>1,CJ17+CI22,CJ17) -> 72.666666666666671 | CK22: =IF(DAY(CK3)>1,CK17+CJ22,CK17) -> 77 | CL22: =IF(DAY(CL3)>1,CL17+CK22,CL17) -> 79 | CM22: =IF(DAY(CM3)>1,CM17+CL22,CM17) -> 81 | CN22: =IF(DAY(CN3)>1,CN17+CM22,CN17) -> 1.3333333333333333 | CO22: =IF(DAY(CO3)>1,CO17+CN22,CO17) -> 1.3333333333333333 | CP22: =IF(DAY(CP3)>1,CP17+CO22,CP17) -> 1.3333333333333333 | CQ22: =IF(DAY(CQ3)>1,CQ17+CP22,CQ17) -> 4.333333333333333 | CR22: =IF(DAY(CR3)>1,CR17+CQ22,CR17) -> 6.333333333333333 | CS22: =IF(DAY(CS3)>1,CS17+CR22,CS17) -> 6.333333333333333 | CT22: =IF(DAY(CT3)>1,CT17+CS22,CT17) -> 6.333333333333333 | CU22: =IF(DAY(CU3)>1,CU17+CT22,CU17) -> 6.6666666666666661 | CV22: =IF(DAY(CV3)>1,CV17+CU22,CV17) -> 6.6666666666666661 | CW22: =IF(DAY(CW3)>1,CW17+CV22,CW17) -> 6.6666666666666661 | CX22: =IF(DAY(CX3)>1,CX17+CW22,CX17) -> 9 | CY22: =IF(DAY(CY3)>1,CY17+CX22,CY17) -> 16.333333333333332 | CZ22: =IF(DAY(CZ3)>1,CZ17+CY22,CZ17) -> 22 | DA22: =IF(DAY(DA3)>1,DA17+CZ22,DA17) -> 23 | DB22: =IF(DAY(DB3)>1,DB17+DA22,DB17) -> 25 | DC22: =IF(DAY(DC3)>1,DC17+DB22,DC17) -> 25 | DD22: =IF(DAY(DD3)>1,DD17+DC22,DD17) -> 25 | DE22: =IF(DAY(DE3)>1,DE17+DD22,DE17) -> 29.333333333333332 | DF22: =IF(DAY(DF3)>1,DF17+DE22,DF17) -> 32.666666666666664 | DG22: =IF(DAY(DG3)>1,DG17+DF22,DG17) -> 36.333333333333329 | DH22: =IF(DAY(DH3)>1,DH17+DG22,DH17) -> 39.333333333333329 | DI22: =IF(DAY(DI3)>1,DI17+DH22,DI17) -> 44.666666666666664 | DJ22: =IF(DAY(DJ3)>1,DJ17+DI22,DJ17) -> 44.666666666666664 | DK22: =IF(DAY(DK3)>1,DK17+DJ22,DK17) -> 44.666666666666664 | DL22: =IF(DAY(DL3)>1,DL17+DK22,DL17) -> 49.333333333333329 | DM22: =IF(DAY(DM3)>1,DM17+DL22,DM17) -> 51.333333333333329 | DN22: =IF(DAY(DN3)>1,DN17+DM22,DN17) -> 54.333333333333329 | DO22: =IF(DAY(DO3)>1,DO17+DN22,DO17) -> 59.333333333333329 | DP22: =IF(DAY(DP3)>1,DP17+DO22,DP17) -> 59.333333333333329 | DQ22: =IF(DAY(DQ3)>1,DQ17+DP22,DQ17) -> 59.333333333333329 | DR22: =IF(DAY(DR3)>1,DR17+DQ22,DR17) -> 59.333333333333329 | DS22: =IF(DAY(DS3)>1,DS17+DR22,DS17) -> 1.6666666666666665 | DT22: =IF(DAY(DT3)>1,DT17+DS22,DT17) -> 4.6666666666666661 | DU22: =IF(DAY(DU3)>1,DU17+DT22,DU17) -> 7.6666666666666661 | DV22: =IF(DAY(DV3)>1,DV17+DU22,DV17) -> 9.6666666666666661 | DW22: =IF(DAY(DW3)>1,DW17+DV22,DW17) -> 12.666666666666666 | DX22: =IF(DAY(DX3)>1,DX17+DW22,DX17) -> 12.666666666666666 | DY22: =IF(DAY(DY3)>1,DY17+DX22,DY17) -> 12.666666666666666 | DZ22: =IF(DAY(DZ3)>1,DZ17+DY22,DZ17) -> 14.666666666666666 | EA22: =IF(DAY(EA3)>1,EA17+DZ22,EA17) -> 18.666666666666664 | EB22: =IF(DAY(EB3)>1,EB17+EA22,EB17) -> 18.666666666666664 | EC22: =IF(DAY(EC3)>1,EC17+EB22,EC17) -> 22.666666666666664 | ED22: =IF(DAY(ED3)>1,ED17+EC22,ED17) -> 24.666666666666664 | EE22: =IF(DAY(EE3)>1,EE17+ED22,EE17) -> 24.666666666666664 | EF22: =IF(DAY(EF3)>1,EF17+EE22,EF17) -> 24.666666666666664 | EG22: =IF(DAY(EG3)>1,EG17+EF22,EG17) -> 26.666666666666664 | EH22: =IF(DAY(EH3)>1,EH17+EG22,EH17) -> 31.666666666666664 | EI22: =IF(DAY(EI3)>1,EI17+EH22,EI17) -> 38.666666666666664 | EJ22: =IF(DAY(EJ3)>1,EJ17+EI22,EJ17) -> 42.666666666666664 | EK22: =IF(DAY(EK3)>1,EK17+EJ22,EK17) -> 46.666666666666664 | EL22: =IF(DAY(EL3)>1,EL17+EK22,EL17) -> 46.666666666666664 | EM22: =IF(DAY(EM3)>1,EM17+EL22,EM17) -> 46.666666666666664 | EN22: =IF(DAY(EN3)>1,EN17+EM22,EN17) -> 49 | EO22: =IF(DAY(EO3)>1,EO17+EN22,EO17) -> 52 | EP22: =IF(DAY(EP3)>1,EP17+EO22,EP17) -> 56.333333333333336 | EQ22: =IF(DAY(EQ3)>1,EQ17+EP22,EQ17) -> 57.333333333333336 | ER22: =IF(DAY(ER3)>1,ER17+EQ22,ER17) -> 57.666666666666671 | ES22: =IF(DAY(ES3)>1,ES17+ER22,ES17) -> 57.666666666666671 | ET22: =IF(DAY(ET3)>1,ET17+ES22,ET17) -> 57.666666666666671 | EU22: =IF(DAY(EU3)>1,EU17+ET22,EU17) -> 58.666666666666671 | EV22: =IF(DAY(EV3)>1,EV17+EU22,EV17) -> 61.666666666666671 | EW22: =IF(DAY(EW3)>1,EW17+EV22,EW17) -> 3 | EX22: =IF(DAY(EX3)>1,EX17+EW22,EX17) -> 3.3333333333333335 | EY22: =IF(DAY(EY3)>1,EY17+EX22,EY17) -> 6.3333333333333339 | EZ22: =IF(DAY(EZ3)>1,EZ17+EY22,EZ17) -> 6.3333333333333339 | FA22: =IF(DAY(FA3)>1,FA17+EZ22,FA17) -> 6.3333333333333339 | FB22: =IF(DAY(FB3)>1,FB17+FA22,FB17) -> 10 | FC22: =IF(DAY(FC3)>1,FC17+FB22,FC17) -> 15.666666666666668 | FD22: =IF(DAY(FD3)>1,FD17+FC22,FD17) -> 18.666666666666668 | FE22: =IF(DAY(FE3)>1,FE17+FD22,FE17) -> 20.666666666666668 | FF22: =IF(DAY(FF3)>1,FF17+FE22,FF17) -> 23.666666666666668 | FG22: =IF(DAY(FG3)>1,FG17+FF22,FG17) -> 23.666666666666668 | FH22: =IF(DAY(FH3)>1,FH17+FG22,FH17) -> 23.666666666666668 | FI22: =IF(DAY(FI3)>1,FI17+FH22,FI17) -> 27 | FJ22: =IF(DAY(FJ3)>1,FJ17+FI22,FJ17) -> 31.333333333333332 | FK22: =IF(DAY(FK3)>1,FK17+FJ22,FK17) -> 34.333333333333329 | FL22: =IF(DAY(FL3)>1,FL17+FK22,FL17) -> 37.666666666666664 | FM22: =IF(DAY(FM3)>1,FM17+FL22,FM17) -> 40.666666666666664 | FN22: =IF(DAY(FN3)>1,FN17+FM22,FN17) -> 40.666666666666664 | FO22: =IF(DAY(FO3)>1,FO17+FN22,FO17) -> 40.666666666666664 | FP22: =IF(DAY(FP3)>1,FP17+FO22,FP17) -> 41.333333333333329 | FQ22: =IF(DAY(FQ3)>1,FQ17+FP22,FQ17) -> 43.333333333333329 | FR22: =IF(DAY(FR3)>1,FR17+FQ22,FR17) -> 44.666666666666664 | FS22: =IF(DAY(FS3)>1,FS17+FR22,FS17) -> 46.666666666666664 | FT22: =IF(DAY(FT3)>1,FT17+FS22,FT17) -> 46.666666666666664 | FU22: =IF(DAY(FU3)>1,FU17+FT22,FU17) -> 46.666666666666664 | FV22: =IF(DAY(FV3)>1,FV17+FU22,FV17) -> 46.666666666666664 | FW22: =IF(DAY(FW3)>1,FW17+FV22,FW17) -> 46.666666666666664 | FX22: =IF(DAY(FX3)>1,FX17+FW22,FX17) -> 49.666666666666664 | FY22: =IF(DAY(FY3)>1,FY17+FX22,FY17) -> 51.666666666666664 | FZ22: =IF(DAY(FZ3)>1,FZ17+FY22,FZ17) -> 53.666666666666664 | GA22: =IF(DAY(GA3)>1,GA17+FZ22,GA17) -> 56.666666666666664 | GB22: =IF(DAY(GB3)>1,GB17+GA22,GB17) -> 0 | GC22: =IF(DAY(GC3)>1,GC17+GB22,GC17) -> 0 | GD22: =IF(DAY(GD3)>1,GD17+GC22,GD17) -> 4.333333333333333 | GE22: =IF(DAY(GE3)>1,GE17+GD22,GE17) -> 7.333333333333333 | GF22: =IF(DAY(GF3)>1,GF17+GE22,GF17) -> 10.333333333333332 | GG22: =IF(DAY(GG3)>1,GG17+GF22,GG17) -> 13.333333333333332 | GH22: =IF(DAY(GH3)>1,GH17+GG22,GH17) -> 14.333333333333332 | GI22: =IF(DAY(GI3)>1,GI17+GH22,GI17) -> 14.333333333333332 | GJ22: =IF(DAY(GJ3)>1,GJ17+GI22,GJ17) -> 14.333333333333332 | GK22: =IF(DAY(GK3)>1,GK17+GJ22,GK17) -> 16.333333333333332 | GL22: =IF(DAY(GL3)>1,GL17+GK22,GL17) -> 19.333333333333332 | GM22: =IF(DAY(GM3)>1,GM17+GL22,GM17) -> 22.333333333333332 | GN22: =IF(DAY(GN3)>1,GN17+GM22,GN17) -> 25.333333333333332 | GO22: =IF(DAY(GO3)>1,GO17+GN22,GO17) -> 28.333333333333332 | GP22: =IF(DAY(GP3)>1,GP17+GO22,GP17) -> 28.333333333333332 | GQ22: =IF(DAY(GQ3)>1,GQ17+GP22,GQ17) -> 28.333333333333332 | GR22: =IF(DAY(GR3)>1,GR17+GQ22,GR17) -> 31.333333333333332 | GS22: =IF(DAY(GS3)>1,GS17+GR22,GS17) -> 35.333333333333329 | GT22: =IF(DAY(GT3)>1,GT17+GS22,GT17) -> 39.333333333333329 | GU22: =IF(DAY(GU3)>1,GU17+GT22,GU17) -> 43.333333333333329 | GV22: =IF(DAY(GV3)>1,GV17+GU22,GV17) -> 47.333333333333329 | GW22: =IF(DAY(GW3)>1,GW17+GV22,GW17) -> 47.333333333333329 | GX22: =IF(DAY(GX3)>1,GX17+GW22,GX17) -> 47.333333333333329 | GY22: =IF(DAY(GY3)>1,GY17+GX22,GY17) -> 50.333333333333329 | GZ22: =IF(DAY(GZ3)>1,GZ17+GY22,GZ17) -> 53.333333333333329 | HA22: =IF(DAY(HA3)>1,HA17+GZ22,HA17) -> 55.333333333333329 | HB22: =IF(DAY(HB3)>1,HB17+HA22,HB17) -> 57.333333333333329 | HC22: =IF(DAY(HC3)>1,HC17+HB22,HC17) -> 57.333333333333329 | HD22: =IF(DAY(HD3)>1,HD17+HC22,HD17) -> 57.333333333333329 | HE22: =IF(DAY(HE3)>1,HE17+HD22,HE17) -> 57.333333333333329 | HF22: =IF(DAY(HF3)>1,HF17+HE22,HF17) -> 0.33333333333333331 | HG22: =IF(DAY(HG3)>1,HG17+HF22,HG17) -> 6.333333333333333 | HH22: =IF(DAY(HH3)>1,HH17+HG22,HH17) -> 7.333333333333333 | HI22: =IF(DAY(HI3)>1,HI17+HH22,HI17) -> 7.333333333333333 | HJ22: =IF(DAY(HJ3)>1,HJ17+HI22,HJ17) -> 9.3333333333333321 | HK22: =IF(DAY(HK3)>1,HK17+HJ22,HK17) -> 9.3333333333333321 | HL22: =IF(DAY(HL3)>1,HL17+HK22,HL17) -> 9.3333333333333321 | HM22: =IF(DAY(HM3)>1,HM17+HL22,HM17) -> 10.333333333333332 | HN22: =IF(DAY(HN3)>1,HN17+HM22,HN17) -> 11.333333333333332 | HO22: =IF(DAY(HO3)>1,HO17+HN22,HO17) -> 11.333333333333332 | HP22: =IF(DAY(HP3)>1,HP17+HO22,HP17) -> 12.333333333333332 | HQ22: =IF(DAY(HQ3)>1,HQ17+HP22,HQ17) -> 13.333333333333332 | HR22: =IF(DAY(HR3)>1,HR17+HQ22,HR17) -> 13.333333333333332 | HS22: =IF(DAY(HS3)>1,HS17+HR22,HS17) -> 13.333333333333332 | HT22: =IF(DAY(HT3)>1,HT17+HS22,HT17) -> 13.333333333333332 | HU22: =IF(DAY(HU3)>1,HU17+HT22,HU17) -> 13.333333333333332 | HV22: =IF(DAY(HV3)>1,HV17+HU22,HV17) -> 13.333333333333332 | HW22: =IF(DAY(HW3)>1,HW17+HV22,HW17) -> 13.333333333333332 | HX22: =IF(DAY(HX3)>1,HX17+HW22,HX17) -> 13.333333333333332 | HY22: =IF(DAY(HY3)>1,HY17+HX22,HY17) -> 13.333333333333332 | HZ22: =IF(DAY(HZ3)>1,HZ17+HY22,HZ17) -> 13.333333333333332 | IA22: =IF(DAY(IA3)>1,IA17+HZ22,IA17) -> 13.333333333333332 | IB22: =IF(DAY(IB3)>1,IB17+IA22,IB17) -> 13.333333333333332 | IC22: =IF(DAY(IC3)>1,IC17+IB22,IC17) -> 13.333333333333332 | ID22: =IF(DAY(ID3)>1,ID17+IC22,ID17) -> 13.333333333333332 | IE22: =IF(DAY(IE3)>1,IE17+ID22,IE17) -> 13.333333333333332 | IF22: =IF(DAY(IF3)>1,IF17+IE22,IF17) -> 13.333333333333332 | IG22: =IF(DAY(IG3)>1,IG17+IF22,IG17) -> 13.333333333333332 | IH22: =IF(DAY(IH3)>1,IH17+IG22,IH17) -> 13.333333333333332 | II22: =IF(DAY(II3)>1,II17+IH22,II17) -> 13.333333333333332 | IJ22: =IF(DAY(IJ3)>1,IJ17+II22,IJ17) -> 13.333333333333332 | IK22: =IF(DAY(IK3)>1,IK17+IJ22,IK17) -> 0 | IL22: =IF(DAY(IL3)>1,IL17+IK22,IL17) -> 0
A24: Hours Balance MTD | B24: =B8-B21 -> 0.0 | C24: =C8-C21 -> 0.0 | D24: =D8-D21 -> 0.5 | E24: =E8-E21 -> -3.4000000000000057 | F24: =F8-F21 -> -6.4000000000000057 | G24: =G8-G21 -> -7.1500000000000057 | H24: =H8-H21 -> -11.05 | I24: =I8-I21 -> -11.05 | J24: =J8-J21 -> -11.05 | K24: =K8-K21 -> -11.404999999999999 | L24: =L8-L21 -> -13.475 | M24: =M8-M21 -> -17.52 | N24: =N8-N21 -> -24.145 | O24: =O8-O21 -> -34.645000000000003 | P24: =P8-P21 -> -34.645000000000003 | Q24: =Q8-Q21 -> -34.645000000000003 | R24: =R8-R21 -> -36.375 | S24: =S8-S21 -> -41.98 | T24: =T8-T21 -> -49.23 | U24: =U8-U21 -> -49.43 | V24: =V8-V21 -> -50.430000000000064 | W24: =W8-W21 -> -50.430000000000064 | X24: =X8-X21 -> -50.430000000000064 | Y24: =Y8-Y21 -> -17.930000000000064 | Z24: =Z8-Z21 -> 14.569999999999936 | AA24: =AA8-AA21 -> 20.694999999999936 | AB24: =AB8-AB21 -> 27.944999999999936 | AC24: =AC8-AC21 -> 36.444999999999936 | AD24: =AD8-AD21 -> 36.444999999999936 | AE24: =AE8-AE21 -> 36.444999999999936 | AF24: =AF8-AF21 -> 47.694999999999936 | AG24: =AG8-AG21 -> 32.0 | AH24: =AH8-AH21 -> 29.125 | AI24: =AI8-AI21 -> 26.25 | AJ24: =AJ8-AJ21 -> 19.625 | AK24: =AK8-AK21 -> 19.625 | AL24: =AL8-AL21 -> 19.625 | AM24: =AM8-AM21 -> 13.895 | AN24: =AN8-AN21 -> 13.395 | AO24: =AO8-AO21 -> 4.8950000000000102 | AP24: =AP8-AP21 -> -2.6050000000000182 | AQ24: =AQ8-AQ21 -> -1.9800000000000182 | AR24: =AR8-AR21 -> -1.9800000000000182 | AS24: =AS8-AS21 -> -1.9800000000000182 | AT24: =AT8-AT21 -> -4.7300000000000182 | AU24: =AU8-AU21 -> -11.48 | AV24: =AV8-AV21 -> -17.355 | AW24: =AW8-AW21 -> -18.48 | AX24: =AX8-AX21 -> -31.23 | AY24: =AY8-AY21 -> -34.46 | AZ24: =AZ8-AZ21 -> -34.46 | BA24: =BA8-BA21 -> -43.040000000000077 | BB24: =BB8-BB21 -> -52.415000000000077 | BC24: =BC8-BC21 -> -58.165000000000077 | BD24: =BD8-BD21 -> -68.240000000000123 | BE24: =BE8-BE21 -> -79.740000000000123 | BF24: =BF8-BF21 -> -81.490000000000123 | BG24: =BG8-BG21 -> -81.490000000000123 | BH24: =BH8-BH21 -> -83.660000000000082 | BI24: =BI8-BI21 -> -87.0150000000001 | BJ24: =BJ8-BJ21 -> -88.935000000000059 | BK24: =BK8-BK21 -> -92.935000000000059 | BL24: =BL8-BL21 -> 0.0 | BM24: =BM8-BM21 -> 0.0 | BN24: =BN8-BN21 -> 0.0 | BO24: =BO8-BO21 -> -12.175000000000001 | BP24: =BP8-BP21 -> -23.5 | BQ24: =BQ8-BQ21 -> -51.95 | BR24: =BR8-BR21 -> -62.1 | BS24: =BS8-BS21 -> -72.78 | BT24: =BT8-BT21 -> -72.78 | BU24: =BU8-BU21 -> -72.78 | BV24: =BV8-BV21 -> -83.61 | BW24: =BW8-BW21 -> -98.334999999999994 | BX24: =BX8-BX21 -> -108.33 | BY24: =BY8-BY21 -> -119.46 | BZ24: =BZ8-BZ21 -> -130.38499999999999 | CA24: =CA8-CA21 -> -130.38499999999999 | CB24: =CB8-CB21 -> -130.38499999999999 | CC24: =CC8-CC21 -> -137.08500000000001 | CD24: =CD8-CD21 -> -145.63 | CE24: =CE8-CE21 -> -154.97499999999999 | CF24: =CF8-CF21 -> -162.4 | CG24: =CG8-CG21 -> -165.4 | CH24: =CH8-CH21 -> -165.4 | CI24: =CI8-CI21 -> -165.4 | CJ24: =CJ8-CJ21 -> -168.15 | CK24: =CK8-CK21 -> -168.15 | CL24: =CL8-CL21 -> -168.4 | CM24: =CM8-CM21 -> -168.52500000000001 | CN24: =CN8-CN21 -> -0.25 | CO24: =CO8-CO21 -> -0.25 | CP24: =CP8-CP21 -> -0.25 | CQ24: =CQ8-CQ21 -> -6.25 | CR24: =CR8-CR21 -> -6.6500000000000057 | CS24: =CS8-CS21 -> -14.15 | CT24: =CT8-CT21 -> -13.775 | CU24: =CU8-CU21 -> -10.275 | CV24: =CV8-CV21 -> -10.275 | CW24: =CW8-CW21 -> -10.275 | CX24: =CX8-CX21 -> -11.525 | CY24: =CY8-CY21 -> -13.15 | CZ24: =CZ8-CZ21 -> -14.9 | DA24: =DA8-DA21 -> -16.4 | DB24: =DB8-DB21 -> -22.774999999999999 | DC24: =DC8-DC21 -> -22.774999999999999 | DD24: =DD8-DD21 -> -22.774999999999999 | DE24: =DE8-DE21 -> -31.524999999999999 | DF24: =DF8-DF21 -> -38.524999999999999 | DG24: =DG8-DG21 -> -42.524999999999999 | DH24: =DH8-DH21 -> -42.4 | DI24: =DI8-DI21 -> -33.9 | DJ24: =DJ8-DJ21 -> -33.9 | DK24: =DK8-DK21 -> -33.9 | DL24: =DL8-DL21 -> -36.524999999999999 | DM24: =DM8-DM21 -> -38.524999999999999 | DN24: =DN8-DN21 -> -36.024999999999999 | DO24: =DO8-DO21 -> -29.15 | DP24: =DP8-DP21 -> -5.1499999999999773 | DQ24: =DQ8-DQ21 -> -5.1499999999999773 | DR24: =DR8-DR21 -> -5.1499999999999773 | DS24: =DS8-DS21 -> -9.75 | DT24: =DT8-DT21 -> -14.125 | DU24: =DU8-DU21 -> -23.75 | DV24: =DV8-DV21 -> -25.5 | DW24: =DW8-DW21 -> -24.5 | DX24: =DX8-DX21 -> -24.5 | DY24: =DY8-DY21 -> -24.5 | DZ24: =DZ8-DZ21 -> -41.125 | EA24: =EA8-EA21 -> -49.704999999999998 | EB24: =EB8-EB21 -> -51.354999999999997 | EC24: =EC8-EC21 -> -55.604999999999997 | ED24: =ED8-ED21 -> -63.46 | EE24: =EE8-EE21 -> -63.46 | EF24: =EF8-EF21 -> -63.46 | EG24: =EG8-EG21 -> -65.584999999999994 | EH24: =EH8-EH21 -> -69.834999999999994 | EI24: =EI8-EI21 -> -73.834999999999994 | EJ24: =EJ8-EJ21 -> -76.46 | EK24: =EK8-EK21 -> -78.584999999999994 | EL24: =EL8-EL21 -> -78.584999999999994 | EM24: =EM8-EM21 -> -78.584999999999994 | EN24: =EN8-EN21 -> -81.584999999999994 | EO24: =EO8-EO21 -> -83.834999999999994 | EP24: =EP8-EP21 -> -86.334999999999994 | EQ24: =EQ8-EQ21 -> -88.46 | ER24: =ER8-ER21 -> -89.96 | ES24: =ES8-ES21 -> -89.96 | ET24: =ET8-ET21 -> -89.96 | EU24: =EU8-EU21 -> -92.46 | EV24: =EV8-EV21 -> -96.084999999999994 | EW24: =EW8-EW21 -> -3.25 | EX24: =EX8-EX21 -> -5.375 | EY24: =EY8-EY21 -> -7.875 | EZ24: =EZ8-EZ21 -> -7.875 | FA24: =FA8-FA21 -> -7.875 | FB24: =FB8-FB21 -> -3.625 | FC24: =FC8-FC21 -> -5.375 | FD24: =FD8-FD21 -> -7.875 | FE24: =FE8-FE21 -> -10.375 | FF24: =FF8-FF21 -> -12.75 | FG24: =FG8-FG21 -> -12.75 | FH24: =FH8-FH21 -> -12.75 | FI24: =FI8-FI21 -> -15.625 | FJ24: =FJ8-FJ21 -> -28.875 | FK24: =FK8-FK21 -> -39.62 | FL24: =FL8-FL21 -> -42.87 | FM24: =FM8-FM21 -> -47.12 | FN24: =FN8-FN21 -> -47.12 | FO24: =FO8-FO21 -> -47.12 | FP24: =FP8-FP21 -> -60.62 | FQ24: =FQ8-FQ21 -> -70.875 | FR24: =FR8-FR21 -> -82.805000000000007 | FS24: =FS8-FS21 -> -93.075000000000003 | FT24: =FT8-FT21 -> -102.825 | FU24: =FU8-FU21 -> -102.825 | FV24: =FV8-FV21 -> -102.825 | FW24: =FW8-FW21 -> -78.825000000000003 | FX24: =FX8-FX21 -> -89.825000000000003 | FY24: =FY8-FY21 -> -97.675000000000068 | FZ24: =FZ8-FZ21 -> -105.675 | GA24: =GA8-GA21 -> -117.175 | GB24: =GB8-GB21 -> 0.0 | GC24: =GC8-GC21 -> 0.0 | GD24: =GD8-GD21 -> -20.125 | GE24: =GE8-GE21 -> -39.0 | GF24: =GF8-GF21 -> -42.17 | GG24: =GG8-GG21 -> -55.17 | GH24: =GH8-GH21 -> -57.545000000000002 | GI24: =GI8-GI21 -> -57.545000000000002 | GJ24: =GJ8-GJ21 -> -57.545000000000002 | GK24: =GK8-GK21 -> -60.795000000000002 | GL24: =GL8-GL21 -> -71.295000000000002 | GM24: =GM8-GM21 -> -71.67 | GN24: =GN8-GN21 -> -86.17 | GO24: =GO8-GO21 -> -104.17 | GP24: =GP8-GP21 -> -104.17 | GQ24: =GQ8-GQ21 -> -104.17 | GR24: =GR8-GR21 -> -105.67 | GS24: =GS8-GS21 -> -115.92 | GT24: =GT8-GT21 -> -123.92 | GU24: =GU8-GU21 -> -125.67 | GV24: =GV8-GV21 -> -127.545 | GW24: =GW8-GW21 -> -127.545 | GX24: =GX8-GX21 -> -127.545 | GY24: =GY8-GY21 -> -136.79499999999999 | GZ24: =GZ8-GZ21 -> -136.54499999999999 | HA24: =HA8-HA21 -> -151.54499999999999 | HB24: =HB8-HB21 -> -164.42 | HC24: =HC8-HC21 -> -184.42 | HD24: =HD8-HD21 -> -184.42 | HE24: =HE8-HE21 -> -184.42 | HF24: =HF8-HF21 -> 3.125 | HG24: =HG8-HG21 -> -11.25 | HH24: =HH8-HH21 -> -23.25 | HI24: =HI8-HI21 -> 0.75 | HJ24: =HJ8-HJ21 -> -8.625 | HK24: =HK8-HK21 -> -8.625 | HL24: =HL8-HL21 -> -8.625 | HM24: =HM8-HM21 -> -9.375 | HN24: =HN8-HN21 -> -2.125 | HO24: =HO8-HO21 -> -3.75 | HP24: =HP8-HP21 -> -6.0 | HQ24: =HQ8-HQ21 -> -2.125 | HR24: =HR8-HR21 -> -2.125 | HS24: =HS8-HS21 -> -2.125 | HT24: =HT8-HT21 -> -6.75 | HU24: =HU8-HU21 -> -7.625 | HV24: =HV8-HV21 -> -10.375 | HW24: =HW8-HW21 -> -1.875 | HX24: =HX8-HX21 -> 6.375 | HY24: =HY8-HY21 -> 6.375 | HZ24: =HZ8-HZ21 -> 6.375 | IA24: =IA8-IA21 -> 13.875 | IB24: =IB8-IB21 -> 21.375 | IC24: =IC8-IC21 -> 22.625 | ID24: =ID8-ID21 -> 24.25 | IE24: =IE8-IE21 -> 34.43 | IF24: =IF8-IF21 -> 34.43 | IG24: =IG8-IG21 -> 34.43 | IH24: =IH8-IH21 -> 48.93 | II24: =II8-II21 -> 63.43 | IJ24: =IJ8-IJ21 -> 77.93 | IK24: =IK8-IK21 -> 8.94 | IL24: =IL8-IL21 -> 21.94
A25: Hours/RCE MTD | B25: =IF(ISERROR(B21/B22),0,B21/B22) -> 0.0 | C25: =IF(ISERROR(C21/C22),0,C21/C22) -> 0.0 | D25: =IF(ISERROR(D21/D22),0,D21/D22) -> 6.4 | E25: =IF(ISERROR(E21/E22),0,E21/E22) -> 8.55 | F25: =IF(ISERROR(F21/F22),0,F21/F22) -> 12.468 | G25: =IF(ISERROR(G21/G22),0,G21/G22) -> 12.468181818181819 | H25: =IF(ISERROR(H21/H22),0,H21/H22) -> 14.4625 | I25: =IF(ISERROR(I21/I22),0,I21/I22) -> 14.4625 | J25: =IF(ISERROR(J21/J22),0,J21/J22) -> 14.4625 | K25: =IF(ISERROR(K21/K22),0,K21/K22) -> 17.200416666666666 | L25: =IF(ISERROR(L21/L22),0,L21/L22) -> 11.295703124999999 | M25: =IF(ISERROR(M21/M22),0,M21/M22) -> 12.426268656716415 | N25: =IF(ISERROR(N21/N22),0,N21/N22) -> 13.193541666666665 | O25: =IF(ISERROR(O21/O22),0,O21/O22) -> 13.657405063291137 | P25: =IF(ISERROR(P21/P22),0,P21/P22) -> 13.657405063291137 | Q25: =IF(ISERROR(Q21/Q22),0,Q21/Q22) -> 13.657405063291137 | R25: =IF(ISERROR(R21/R22),0,R21/R22) -> 12.84375 | S25: =IF(ISERROR(S21/S22),0,S21/S22) -> 12.225849056603773 | T25: =IF(ISERROR(T21/T22),0,T21/T22) -> 13.226074766355138 | U25: =IF(ISERROR(U21/U22),0,U21/U22) -> 12.106319999999998 | V25: =IF(ISERROR(V21/V22),0,V21/V22) -> 11.527071428571428 | W25: =IF(ISERROR(W21/W22),0,W21/W22) -> 11.527071428571428 | X25: =IF(ISERROR(X21/X22),0,X21/X22) -> 11.527071428571428 | Y25: =IF(ISERROR(Y21/Y22),0,Y21/Y22) -> 11.527071428571428 | Z25: =IF(ISERROR(Z21/Z22),0,Z21/Z22) -> 11.527071428571428 | AA25: =IF(ISERROR(AA21/AA22),0,AA21/AA22) -> 11.286099999999999 | AB25: =IF(ISERROR(AB21/AB22),0,AB21/AB22) -> 10.527767857142857 | AC25: =IF(ISERROR(AC21/AC22),0,AC21/AC22) -> 10.399237288135593 | AD25: =IF(ISERROR(AD21/AD22),0,AD21/AD22) -> 10.399237288135593 | AE25: =IF(ISERROR(AE21/AE22),0,AE21/AE22) -> 10.399237288135593 | AF25: =IF(ISERROR(AF21/AF22),0,AF21/AF22) -> 10.18403743315508 | AG25: =IF(ISERROR(AG21/AG22),0,AG21/AG22) -> 0.0 | AH25: =IF(ISERROR(AH21/AH22),0,AH21/AH22) -> 7.4732142857142865 | AI25: =IF(ISERROR(AI21/AI22),0,AI21/AI22) -> 8.71875 | AJ25: =IF(ISERROR(AJ21/AJ22),0,AJ21/AJ22) -> 11.211206896551724 | AK25: =IF(ISERROR(AK21/AK22),0,AK21/AK22) -> 11.211206896551724 | AL25: =IF(ISERROR(AL21/AL22),0,AL21/AL22) -> 11.211206896551724 | AM25: =IF(ISERROR(AM21/AM22),0,AM21/AM22) -> 11.238846153846152 | AN25: =IF(ISERROR(AN21/AN22),0,AN21/AN22) -> 11.162812499999999 | AO25: =IF(ISERROR(AO21/AO22),0,AO21/AO22) -> 11.951181818181819 | AP25: =IF(ISERROR(AP21/AP22),0,AP21/AP22) -> 11.935615384615387 | AQ25: =IF(ISERROR(AQ21/AQ22),0,AQ21/AQ22) -> 13.180909090909093 | AR25: =IF(ISERROR(AR21/AR22),0,AR21/AR22) -> 13.180909090909093 | AS25: =IF(ISERROR(AS21/AS22),0,AS21/AS22) -> 13.180909090909093 | AT25: =IF(ISERROR(AT21/AT22),0,AT21/AT22) -> 11.5975 | AU25: =IF(ISERROR(AU21/AU22),0,AU21/AU22) -> 11.725161290322582 | AV25: =IF(ISERROR(AV21/AV22),0,AV21/AV22) -> 11.921435643564358 | AW25: =IF(ISERROR(AW21/AW22),0,AW21/AW22) -> 11.958165137614682 | AX25: =IF(ISERROR(AX21/AX22),0,AX21/AX22) -> 12.611315789473688 | AY25: =IF(ISERROR(AY21/AY22),0,AY21/AY22) -> 12.696315789473687 | AZ25: =IF(ISERROR(AZ21/AZ22),0,AZ21/AZ22) -> 12.696315789473687 | BA25: =IF(ISERROR(BA21/BA22),0,BA21/BA22) -> 12.163720930232563 | BB25: =IF(ISERROR(BB21/BB22),0,BB21/BB22) -> 11.84087412587413 | BC25: =IF(ISERROR(BC21/BC22),0,BC21/BC22) -> 12.373253424657538 | BD25: =IF(ISERROR(BD21/BD22),0,BD21/BD22) -> 12.884800000000004 | BE25: =IF(ISERROR(BE21/BE22),0,BE21/BE22) -> 12.976226415094343 | BF25: =IF(ISERROR(BF21/BF22),0,BF21/BF22) -> 13.009245283018872 | BG25: =IF(ISERROR(BG21/BG22),0,BG21/BG22) -> 13.009245283018872 | BH25: =IF(ISERROR(BH21/BH22),0,BH21/BH22) -> 12.695789473684213 | BI25: =IF(ISERROR(BI21/BI22),0,BI21/BI22) -> 12.650250000000003 | BJ25: =IF(ISERROR(BJ21/BJ22),0,BJ21/BJ22) -> 12.136760204081634 | BK25: =IF(ISERROR(BK21/BK22),0,BK21/BK22) -> 12.623375634517769 | BL25: =IF(ISERROR(BL21/BL22),0,BL21/BL22) -> 6.0 | BM25: =IF(ISERROR(BM21/BM22),0,BM21/BM22) -> 6.0 | BN25: =IF(ISERROR(BN21/BN22),0,BN21/BN22) -> 6.0 | BO25: =IF(ISERROR(BO21/BO22),0,BO21/BO22) -> 4.5131249999999996 | BP25: =IF(ISERROR(BP21/BP22),0,BP21/BP22) -> 4.3409090909090908 | BQ25: =IF(ISERROR(BQ21/BQ22),0,BQ21/BQ22) -> 5.4796296296296294 | BR25: =IF(ISERROR(BR21/BR22),0,BR21/BR22) -> 6.7444444444444445 | BS25: =IF(ISERROR(BS21/BS22),0,BS21/BS22) -> 6.5033999999999992 | BT25: =IF(ISERROR(BT21/BT22),0,BT21/BT22) -> 6.5033999999999992 | BU25: =IF(ISERROR(BU21/BU22),0,BU21/BU22) -> 6.5033999999999992 | BV25: =IF(ISERROR(BV21/BV22),0,BV21/BV22) -> 7.5483000000000002 | BW25: =IF(ISERROR(BW21/BW22),0,BW21/BW22) -> 7.3193697478991595 | BX25: =IF(ISERROR(BX21/BX22),0,BX21/BX22) -> 7.3157142857142858 | BY25: =IF(ISERROR(BY21/BY22),0,BY21/BY22) -> 7.7581294964028782 | BZ25: =IF(ISERROR(BZ21/BZ22),0,BZ21/BZ22) -> 7.8354635761589408 | CA25: =IF(ISERROR(CA21/CA22),0,CA21/CA22) -> 7.8354635761589408 | CB25: =IF(ISERROR(CB21/CB22),0,CB21/CB22) -> 7.8354635761589408 | CC25: =IF(ISERROR(CC21/CC22),0,CC21/CC22) -> 7.9208385093167699 | CD25: =IF(ISERROR(CD21/CD22),0,CD21/CD22) -> 7.8901724137931035 | CE25: =IF(ISERROR(CE21/CE22),0,CE21/CE22) -> 7.9189516129032249 | CF25: =IF(ISERROR(CF21/CF22),0,CF21/CF22) -> 8.1624999999999996 | CG25: =IF(ISERROR(CG21/CG22),0,CG21/CG22) -> 8.1192118226600982 | CH25: =IF(ISERROR(CH21/CH22),0,CH21/CH22) -> 8.1192118226600982 | CI25: =IF(ISERROR(CI21/CI22),0,CI21/CI22) -> 8.1192118226600982 | CJ25: =IF(ISERROR(CJ21/CJ22),0,CJ21/CJ22) -> 7.928669724770641 | CK25: =IF(ISERROR(CK21/CK22),0,CK21/CK22) -> 7.7941558441558438 | CL25: =IF(ISERROR(CL21/CL22),0,CL21/CL22) -> 7.9037974683544299 | CM25: =IF(ISERROR(CM21/CM22),0,CM21/CM22) -> 8.0064814814814813 | CN25: =IF(ISERROR(CN21/CN22),0,CN21/CN22) -> 18.1875 | CO25: =IF(ISERROR(CO21/CO22),0,CO21/CO22) -> 18.1875 | CP25: =IF(ISERROR(CP21/CP22),0,CP21/CP22) -> 18.1875 | CQ25: =IF(ISERROR(CQ21/CQ22),0,CQ21/CQ22) -> 12.51923076923077 | CR25: =IF(ISERROR(CR21/CR22),0,CR21/CR22) -> 12.418421052631581 | CS25: =IF(ISERROR(CS21/CS22),0,CS21/CS22) -> 17.392105263157898 | CT25: =IF(ISERROR(CT21/CT22),0,CT21/CT22) -> 21.122368421052634 | CU25: =IF(ISERROR(CU21/CU22),0,CU21/CU22) -> 23.141249999999999 | CV25: =IF(ISERROR(CV21/CV22),0,CV21/CV22) -> 23.141249999999999 | CW25: =IF(ISERROR(CW21/CW22),0,CW21/CW22) -> 23.141249999999999 | CX25: =IF(ISERROR(CX21/CX22),0,CX21/CX22) -> 19.947222222222223 | CY25: =IF(ISERROR(CY21/CY22),0,CY21/CY22) -> 12.560204081632655 | CZ25: =IF(ISERROR(CZ21/CZ22),0,CZ21/CZ22) -> 10.495454545454546 | DA25: =IF(ISERROR(DA21/DA22),0,DA21/DA22) -> 11.14782608695652 | DB25: =IF(ISERROR(DB21/DB22),0,DB21/DB22) -> 11.470999999999998 | DC25: =IF(ISERROR(DC21/DC22),0,DC21/DC22) -> 11.470999999999998 | DD25: =IF(ISERROR(DD21/DD22),0,DD21/DD22) -> 11.470999999999998 | DE25: =IF(ISERROR(DE21/DE22),0,DE21/DE22) -> 10.892897727272727 | DF25: =IF(ISERROR(DF21/DF22),0,DF21/DF22) -> 10.730357142857143 | DG25: =IF(ISERROR(DG21/DG22),0,DG21/DG22) -> 10.418119266055047 | DH25: =IF(ISERROR(DH21/DH22),0,DH21/DH22) -> 10.230508474576272 | DI25: =IF(ISERROR(DI21/DI22),0,DI21/DI22) -> 9.3559701492537322 | DJ25: =IF(ISERROR(DJ21/DJ22),0,DJ21/DJ22) -> 9.3559701492537322 | DK25: =IF(ISERROR(DK21/DK22),0,DK21/DK22) -> 9.3559701492537322 | DL25: =IF(ISERROR(DL21/DL22),0,DL21/DL22) -> 9.0106418918918916 | DM25: =IF(ISERROR(DM21/DM22),0,DM21/DM22) -> 9.1660714285714295 | DN25: =IF(ISERROR(DN21/DN22),0,DN21/DN22) -> 9.0556748466257666 | DO25: =IF(ISERROR(DO21/DO22),0,DO21/DO22) -> 8.5811797752808996 | DP25: =IF(ISERROR(DP21/DP22),0,DP21/DP22) -> 8.5811797752808996 | DQ25: =IF(ISERROR(DQ21/DQ22),0,DQ21/DQ22) -> 8.5811797752808996 | DR25: =IF(ISERROR(DR21/DR22),0,DR21/DR22) -> 8.5811797752808996 | DS25: =IF(ISERROR(DS21/DS22),0,DS21/DS22) -> 20.25 | DT25: =IF(ISERROR(DT21/DT22),0,DT21/DT22) -> 13.3125 | DU25: =IF(ISERROR(DU21/DU22),0,DU21/DU22) -> 12.489130434782609 | DV25: =IF(ISERROR(DV21/DV22),0,DV21/DV22) -> 12.568965517241381 | DW25: =IF(ISERROR(DW21/DW22),0,DW21/DW22) -> 11.407894736842106 | DX25: =IF(ISERROR(DX21/DX22),0,DX21/DX22) -> 11.407894736842106 | DY25: =IF(ISERROR(DY21/DY22),0,DY21/DY22) -> 11.407894736842106 | DZ25: =IF(ISERROR(DZ21/DZ22),0,DZ21/DZ22) -> 12.622159090909092 | EA25: =IF(ISERROR(EA21/EA22),0,EA21/EA22) -> 11.662767857142859 | EB25: =IF(ISERROR(EB21/EB22),0,EB21/EB22) -> 13.036875 | EC25: =IF(ISERROR(EC21/EC22),0,EC21/EC22) -> 11.982573529411766 | ED25: =IF(ISERROR(ED21/ED22),0,ED21/ED22) -> 12.302432432432434 | EE25: =IF(ISERROR(EE21/EE22),0,EE21/EE22) -> 12.302432432432434 | EF25: =IF(ISERROR(EF21/EF22),0,EF21/EF22) -> 12.302432432432434 | EG25: =IF(ISERROR(EG21/EG22),0,EG21/EG22) -> 12.359437500000002 | EH25: =IF(ISERROR(EH21/EH22),0,EH21/EH22) -> 11.30005263157895 | EI25: =IF(ISERROR(EI21/EI22),0,EI21/EI22) -> 9.9784913793103467 | EJ25: =IF(ISERROR(EJ21/EJ22),0,EJ21/EJ22) -> 9.6670312500000009 | EK25: =IF(ISERROR(EK21/EK22),0,EK21/EK22) -> 9.3982500000000009 | EL25: =IF(ISERROR(EL21/EL22),0,EL21/EL22) -> 9.3982500000000009 | EM25: =IF(ISERROR(EM21/EM22),0,EM21/EM22) -> 9.3982500000000009 | EN25: =IF(ISERROR(EN21/EN22),0,EN21/EN22) -> 9.5017346938775518 | EO25: =IF(ISERROR(EO21/EO22),0,EO21/EO22) -> 9.4583653846153855 | EP25: =IF(ISERROR(EP21/EP22),0,EP21/EP22) -> 9.2012130177514795 | EQ25: =IF(ISERROR(EQ21/EQ22),0,EQ21/EQ22) -> 9.4963953488372095 | ER25: =IF(ISERROR(ER21/ER22),0,ER21/ER22) -> 9.8836994219653178 | ES25: =IF(ISERROR(ES21/ES22),0,ES21/ES22) -> 9.8836994219653178 | ET25: =IF(ISERROR(ET21/ET22),0,ET21/ET22) -> 9.8836994219653178 | EU25: =IF(ISERROR(EU21/EU22),0,EU21/EU22) -> 10.166931818181817 | EV25: =IF(ISERROR(EV21/EV22),0,EV21/EV22) -> 10.120297297297297 | EW25: =IF(ISERROR(EW21/EW22),0,EW21/EW22) -> 9.0833333333333339 | EX25: =IF(ISERROR(EX21/EX22),0,EX21/EX22) -> 16.012499999999999 | EY25: =IF(ISERROR(EY21/EY22),0,EY21/EY22) -> 12.611842105263158 | EZ25: =IF(ISERROR(EZ21/EZ22),0,EZ21/EZ22) -> 12.611842105263158 | FA25: =IF(ISERROR(FA21/FA22),0,FA21/FA22) -> 12.611842105263158 | FB25: =IF(ISERROR(FB21/FB22),0,FB21/FB22) -> 9.9625000000000004 | FC25: =IF(ISERROR(FC21/FC22),0,FC21/FC22) -> 8.0026595744680851 | FD25: =IF(ISERROR(FD21/FD22),0,FD21/FD22) -> 8.1361607142857135 | FE25: =IF(ISERROR(FE21/FE22),0,FE21/FE22) -> 8.631048387096774 | FF25: =IF(ISERROR(FF21/FF22),0,FF21/FF22) -> 8.6514084507042242 | FG25: =IF(ISERROR(FG21/FG22),0,FG21/FG22) -> 8.6514084507042242 | FH25: =IF(ISERROR(FH21/FH22),0,FH21/FH22) -> 8.6514084507042242 | FI25: =IF(ISERROR(FI21/FI22),0,FI21/FI22) -> 8.5787037037037042 | FJ25: =IF(ISERROR(FJ21/FJ22),0,FJ21/FJ22) -> 8.5811170212765955 | FK25: =IF(ISERROR(FK21/FK22),0,FK21/FK22) -> 8.8433009708737877 | FL25: =IF(ISERROR(FL21/FL22),0,FL21/FL22) -> 8.7841592920353992 | FM25: =IF(ISERROR(FM21/FM22),0,FM21/FM22) -> 8.8308196721311489 | FN25: =IF(ISERROR(FN21/FN22),0,FN21/FN22) -> 8.8308196721311489 | FO25: =IF(ISERROR(FO21/FO22),0,FO21/FO22) -> 8.8308196721311489 | FP25: =IF(ISERROR(FP21/FP22),0,FP21/FP22) -> 9.5956451612903244 | FQ25: =IF(ISERROR(FQ21/FQ22),0,FQ21/FQ22) -> 9.9432692307692321 | FR25: =IF(ISERROR(FR21/FR22),0,FR21/FR22) -> 10.450858208955225 | FS25: =IF(ISERROR(FS21/FS22),0,FS21/FS22) -> 10.737321428571429 | FT25: =IF(ISERROR(FT21/FT22),0,FT21/FT22) -> 11.460535714285715 | FU25: =IF(ISERROR(FU21/FU22),0,FU21/FU22) -> 11.460535714285715 | FV25: =IF(ISERROR(FV21/FV22),0,FV21/FV22) -> 11.460535714285715 | FW25: =IF(ISERROR(FW21/FW22),0,FW21/FW22) -> 11.460535714285715 | FX25: =IF(ISERROR(FX21/FX22),0,FX21/FX22) -> 11.47298657718121 | FY25: =IF(ISERROR(FY21/FY22),0,FY21/FY22) -> 11.645322580645162 | FZ25: =IF(ISERROR(FZ21/FZ22),0,FZ21/FZ22) -> 11.807608695652176 | GA25: =IF(ISERROR(GA21/GA22),0,GA21/GA22) -> 11.808970588235296 | GB25: =IF(ISERROR(GB21/GB22),0,GB21/GB22) -> 0.0 | GC25: =IF(ISERROR(GC21/GC22),0,GC21/GC22) -> 0.0 | GD25: =IF(ISERROR(GD21/GD22),0,GD21/GD22) -> 10.182692307692308 | GE25: =IF(ISERROR(GE21/GE22),0,GE21/GE22) -> 11.863636363636363 | GF25: =IF(ISERROR(GF21/GF22),0,GF21/GF22) -> 11.048709677419357 | GG25: =IF(ISERROR(GG21/GG22),0,GG21/GG22) -> 11.337750000000002 | GH25: =IF(ISERROR(GH21/GH22),0,GH21/GH22) -> 12.386860465116282 | GI25: =IF(ISERROR(GI21/GI22),0,GI21/GI22) -> 12.386860465116282 | GJ25: =IF(ISERROR(GJ21/GJ22),0,GJ21/GJ22) -> 12.386860465116282 | GK25: =IF(ISERROR(GK21/GK22),0,GK21/GK22) -> 12.538469387755104 | GL25: =IF(ISERROR(GL21/GL22),0,GL21/GL22) -> 12.377327586206897 | GM25: =IF(ISERROR(GM21/GM22),0,GM21/GM22) -> 11.806119402985075 | GN25: =IF(ISERROR(GN21/GN22),0,GN21/GN22) -> 11.927763157894738 | GO25: =IF(ISERROR(GO21/GO22),0,GO21/GO22) -> 12.147176470588237 | GP25: =IF(ISERROR(GP21/GP22),0,GP21/GP22) -> 12.147176470588237 | GQ25: =IF(ISERROR(GQ21/GQ22),0,GQ21/GQ22) -> 12.147176470588237 | GR25: =IF(ISERROR(GR21/GR22),0,GR21/GR22) -> 11.797978723404256 | GS25: =IF(ISERROR(GS21/GS22),0,GS21/GS22) -> 11.431698113207549 | GT25: =IF(ISERROR(GT21/GT22),0,GT21/GT22) -> 11.082711864406781 | GU25: =IF(ISERROR(GU21/GU22),0,GU21/GU22) -> 10.653923076923078 | GV25: =IF(ISERROR(GV21/GV22),0,GV21/GV22) -> 10.300246478873241 | GW25: =IF(ISERROR(GW21/GW22),0,GW21/GW22) -> 10.300246478873241 | GX25: =IF(ISERROR(GX21/GX22),0,GX21/GX22) -> 10.300246478873241 | GY25: =IF(ISERROR(GY21/GY22),0,GY21/GY22) -> 10.346920529801327 | GZ25: =IF(ISERROR(GZ21/GZ22),0,GZ21/GZ22) -> 10.210218750000003 | HA25: =IF(ISERROR(HA21/HA22),0,HA21/HA22) -> 10.545993975903617 | HB25: =IF(ISERROR(HB21/HB22),0,HB21/HB22) -> 10.821279069767444 | HC25: =IF(ISERROR(HC21/HC22),0,HC21/HC22) -> 11.58872093023256 | HD25: =IF(ISERROR(HD21/HD22),0,HD21/HD22) -> 11.58872093023256 | HE25: =IF(ISERROR(HE21/HE22),0,HE21/HE22) -> 11.58872093023256 | HF25: =IF(ISERROR(HF21/HF22),0,HF21/HF22) -> 62.625 | HG25: =IF(ISERROR(HG21/HG22),0,HG21/HG22) -> 9.3552631578947381 | HH25: =IF(ISERROR(HH21/HH22),0,HH21/HH22) -> 12.988636363636363 | HI25: =IF(ISERROR(HI21/HI22),0,HI21/HI22) -> 12.988636363636363 | HJ25: =IF(ISERROR(HJ21/HJ22),0,HJ21/HJ22) -> 13.78125 | HK25: =IF(ISERROR(HK21/HK22),0,HK21/HK22) -> 13.78125 | HL25: =IF(ISERROR(HL21/HL22),0,HL21/HL22) -> 13.78125 | HM25: =IF(ISERROR(HM21/HM22),0,HM21/HM22) -> 14.842741935483872 | HN25: =IF(ISERROR(HN21/HN22),0,HN21/HN22) -> 15.011029411764708 | HO25: =IF(ISERROR(HO21/HO22),0,HO21/HO22) -> 17.272058823529413 | HP25: =IF(ISERROR(HP21/HP22),0,HP21/HP22) -> 18.0 | HQ25: =IF(ISERROR(HQ21/HQ22),0,HQ21/HQ22) -> 18.159375000000001 | HR25: =IF(ISERROR(HR21/HR22),0,HR21/HR22) -> 18.159375000000001 | HS25: =IF(ISERROR(HS21/HS22),0,HS21/HS22) -> 18.159375000000001 | HT25: =IF(ISERROR(HT21/HT22),0,HT21/HT22) -> 20.306249999999999 | HU25: =IF(ISERROR(HU21/HU22),0,HU21/HU22) -> 22.171875 | HV25: =IF(ISERROR(HV21/HV22),0,HV21/HV22) -> 24.178125000000001 | HW25: =IF(ISERROR(HW21/HW22),0,HW21/HW22) -> 25.340624999999999 | HX25: =IF(ISERROR(HX21/HX22),0,HX21/HX22) -> 26.521875000000001 | HY25: =IF(ISERROR(HY21/HY22),0,HY21/HY22) -> 26.521875000000001 | HZ25: =IF(ISERROR(HZ21/HZ22),0,HZ21/HZ22) -> 26.521875000000001 | IA25: =IF(ISERROR(IA21/IA22),0,IA21/IA22) -> 27.759374999999999 | IB25: =IF(ISERROR(IB21/IB22),0,IB21/IB22) -> 28.996874999999999 | IC25: =IF(ISERROR(IC21/IC22),0,IC21/IC22) -> 30.703125 | ID25: =IF(ISERROR(ID21/ID22),0,ID21/ID22) -> 32.381250000000001 | IE25: =IF(ISERROR(IE21/IE22),0,IE21/IE22) -> 33.417750000000005 | IF25: =IF(ISERROR(IF21/IF22),0,IF21/IF22) -> 33.417750000000005 | IG25: =IF(ISERROR(IG21/IG22),0,IG21/IG22) -> 33.417750000000005 | IH25: =IF(ISERROR(IH21/IH22),0,IH21/IH22) -> 34.130250000000004 | II25: =IF(ISERROR(II21/II22),0,II21/II22) -> 34.842750000000002 | IJ25: =IF(ISERROR(IJ21/IJ22),0,IJ21/IJ22) -> 35.555250000000001 | IK25: =IF(ISERROR(IK21/IK22),0,IK21/IK22) -> 0.0 | IL25: =IF(ISERROR(IL21/IL22),0,IL21/IL22) -> 0.0
A27: DRIVERS
AG28: =AG2 -> Tue | AH28: =AH2 -> Wed | AI28: =AI2 -> Thur | AJ28: =AJ2 -> Fri | AK28: =AK2 -> Sat | AL28: =AL2 -> Sun | AM28: =AM2 -> Mon | AN28: =AN2 -> Tue | AO28: =AO2 -> Wed | AP28: =AP2 -> Thur | AQ28: =AQ2 -> Fri | AR28: =AR2 -> Sat | AS28: =AS2 -> Sun | AT28: =AT2 -> Mon | AU28: =AU2 -> Tue | AV28: =AV2 -> Wed | AW28: =AW2 -> Thur | AX28: =AX2 -> Fri | AY28: =AY2 -> Sat | AZ28: =AZ2 -> Sun | BA28: =BA2 -> Mon | BB28: =BB2 -> Tue | BC28: =BC2 -> Wed | BD28: =BD2 -> Thur | BE28: =BE2 -> Fri | BF28: =BF2 -> Sat | BG28: =BG2 -> Sun | BH28: =BH2 -> Mon | BI28: =BI2 -> Tue | BJ28: =BJ2 -> Wed | BK28: =BK2 -> Thur | BL28: =BL2 -> Fri | BM28: =BM2 -> Sat | BN28: =BN2 -> Sun | BO28: =BO2 -> Mon | BP28: =BP2 -> Tue | BQ28: =BQ2 -> Wed | BR28: =BR2 -> Thur | BS28: =BS2 -> Fri | BT28: =BT2 -> Sat | BU28: =BU2 -> Sun | BV28: =BV2 -> Mon | BW28: =BW2 -> Tue | BX28: =BX2 -> Wed | BY28: =BY2 -> Thur | BZ28: =BZ2 -> Fri | CA28: =CA2 -> Sat | CB28: =CB2 -> Sun | CC28: =CC2 -> Mon | CD28: =CD2 -> Tue | CE28: =CE2 -> Wed | CF28: =CF2 -> Thur | CG28: =CG2 -> Fri | CH28: =CH2 -> Sat | CI28: =CI2 -> Sun | CJ28: =CJ2 -> Mon | CK28: =CK2 -> Tue | CL28: =CL2 -> Wed | CM28: =CM2 -> Thur | CN28: =CN2 -> Fri | CO28: =CO2 -> Sat | CP28: =CP2 -> Sun | CQ28: =CQ2 -> Mon | CR28: =CR2 -> Tue | CS28: =CS2 -> Wed | CT28: =CT2 -> Thur | CU28: =CU2 -> Fri | CV28: =CV2 -> Sat | CW28: =CW2 -> Sun | CX28: =CX2 -> Mon | CY28: =CY2 -> Tue | CZ28: =CZ2 -> Wed | DA28: =DA2 -> Thur | DB28: =DB2 -> Fri | DC28: =DC2 -> Sat | DD28: =DD2 -> Sun | DE28: =DE2 -> Mon | DF28: =DF2 -> Tue | DG28: =DG2 -> Wed | DH28: =DH2 -> Thur | DI28: =DI2 -> Fri | DJ28: =DJ2 -> Sat | DK28: =DK2 -> Sun | DL28: =DL2 -> Mon | DM28: =DM2 -> Tue | DN28: =DN2 -> Wed | DO28: =DO2 -> Thur | DP28: =DP2 -> Fri | DQ28: =DQ2 -> Sat | DR28: =DR2 -> Sun | DS28: =DS2 -> Mon | DT28: =DT2 -> Tue | DU28: =DU2 -> Wed | DV28: =DV2 -> Thur | DW28: =DW2 -> Fri | DX28: =DX2 -> Sat | DY28: =DY2 -> Sun | DZ28: =DZ2 -> Mon | EA28: =EA2 -> Tue | EB28: =EB2 -> Wed | EC28: =EC2 -> Thur | ED28: =ED2 -> Fri | EE28: =EE2 -> Sat | EF28: =EF2 -> Sun | EG28: =EG2 -> Mon | EH28: =EH2 -> Tue | EI28: =EI2 -> Wed | EJ28: =EJ2 -> Thur | EK28: =EK2 -> Fri | EL28: =EL2 -> Sat | EM28: =EM2 -> Sun | EN28: =EN2 -> Mon | EO28: =EO2 -> Tue | EP28: =EP2 -> Wed | EQ28: =EQ2 -> Thur | ER28: =ER2 -> Fri | ES28: =ES2 -> Sat | ET28: =ET2 -> Sun | EU28: =EU2 -> Mon | EV28: =EV2 -> Tue | EW28: =EW2 -> Wed | EX28: =EX2 -> Thur | EY28: =EY2 -> Fri | EZ28: =EZ2 -> Sat | FA28: =FA2 -> Sun | FB28: =FB2 -> Mon | FC28: =FC2 -> Tue | FD28: =FD2 -> Wed | FE28: =FE2 -> Thur | FF28: =FF2 -> Fri | FG28: =FG2 -> Sat | FH28: =FH2 -> Sun | FI28: =FI2 -> Mon | FJ28: =FJ2 -> Tue | FK28: =FK2 -> Wed | FL28: =FL2 -> Thur | FM28: =FM2 -> Fri | FN28: =FN2 -> Sat | FO28: =FO2 -> Sun | FP28: =FP2 -> Mon | FQ28: =FQ2 -> Tue | FR28: =FR2 -> Wed | FS28: =FS2 -> Thur | FT28: =FT2 -> Fri | FU28: =FU2 -> Sat | FV28: =FV2 -> Sun | FW28: =FW2 -> Mon | FX28: =FX2 -> Tue | FY28: =FY2 -> Wed | FZ28: =FZ2 -> Thur | GA28: =GA2 -> Fri | GB28: =GB2 -> Sat | GC28: =GC2 -> Sun | GD28: =GD2 -> Mon | GE28: =GE2 -> Tue | GF28: =GF2 -> Wed | GG28: =GG2 -> Thur | GH28: =GH2 -> Fri | GI28: =GI2 -> Sat | GJ28: =GJ2 -> Sun | GK28: =GK2 -> Mon | GL28: =GL2 -> Tue | GM28: =GM2 -> Wed | GN28: =GN2 -> Thur | GO28: =GO2 -> Fri | GP28: =GP2 -> Sat | GQ28: =GQ2 -> Sun | GR28: =GR2 -> Mon | GS28: =GS2 -> Tue | GT28: =GT2 -> Wed | GU28: =GU2 -> Thur | GV28: =GV2 -> Fri | GW28: =GW2 -> Sat | GX28: =GX2 -> Sun | GY28: =GY2 -> Mon | GZ28: =GZ2 -> Tue | HA28: =HA2 -> Wed | HB28: =HB2 -> Thur | HC28: =HC2 -> Fri | HD28: =HD2 -> Sat | HE28: =HE2 -> Sun | HF28: =HF2 -> Mon | HG28: =HG2 -> Tue | HH28: =HH2 -> Wed | HI28: =HI2 -> Thur | HJ28: =HJ2 -> Fri | HK28: =HK2 -> Sat | HL28: =HL2 -> Sun | HM28: =HM2 -> Mon | HN28: =HN2 -> Tue | HO28: =HO2 -> Wed | HP28: =HP2 -> Thur | HQ28: =HQ2 -> Fri | HR28: =HR2 -> Sat | HS28: =HS2 -> Sun | HT28: =HT2 -> Mon | HU28: =HU2 -> Tue | HV28: =HV2 -> Wed | HW28: =HW2 -> Thur | HX28: =HX2 -> Fri | HY28: =HY2 -> Sat | HZ28: =HZ2 -> Sun | IA28: =IA2 -> Mon | IB28: =IB2 -> Tue | IC28: =IC2 -> Wed | ID28: =ID2 -> Thur | IE28: =IE2 -> Fri | IF28: =IF2 -> Sat | IG28: =IG2 -> Sun | IH28: =IH2 -> Mon | II28: =II2 -> Tue | IJ28: =IJ2 -> Wed | IK28: =IK2 -> Thur | IL28: =IL2 -> Fri
AG29: =AG3 -> 37257 | AH29: =AH3 -> 37258 | AI29: =AI3 -> 37259 | AJ29: =AJ3 -> 37260 | AK29: =AK3 -> 37261 | AL29: =AL3 -> 37262 | AM29: =AM3 -> 37263 | AN29: =AN3 -> 37264 | AO29: =AO3 -> 37265 | AP29: =AP3 -> 37266 | AQ29: =AQ3 -> 37267 | AR29: =AR3 -> 37268 | AS29: =AS3 -> 37269 | AT29: =AT3 -> 37270 | AU29: =AU3 -> 37271 | AV29: =AV3 -> 37272 | AW29: =AW3 -> 37273 | AX29: =AX3 -> 37274 | AY29: =AY3 -> 37275 | AZ29: =AZ3 -> 37276 | BA29: =BA3 -> 37277 | BB29: =BB3 -> 37278 | BC29: =BC3 -> 37279 | BD29: =BD3 -> 37280 | BE29: =BE3 -> 37281 | BF29: =BF3 -> 37282 | BG29: =BG3 -> 37283 | BH29: =BH3 -> 37284 | BI29: =BI3 -> 37285 | BJ29: =BJ3 -> 37286 | BK29: =BK3 -> 37287 | BL29: =BL3 -> 37288 | BM29: =BM3 -> 37289 | BN29: =BN3 -> 37290 | BO29: =BO3 -> 37291 | BP29: =BP3 -> 37292 | BQ29: =BQ3 -> 37293 | BR29: =BR3 -> 37294 | BS29: =BS3 -> 37295 | BT29: =BT3 -> 37296 | BU29: =BU3 -> 37297 | BV29: =BV3 -> 37298 | BW29: =BW3 -> 37299 | BX29: =BX3 -> 37300 | BY29: =BY3 -> 37301 | BZ29: =BZ3 -> 37302 | CA29: =CA3 -> 37303 | CB29: =CB3 -> 37304 | CC29: =CC3 -> 37305 | CD29: =CD3 -> 37306 | CE29: =CE3 -> 37307 | CF29: =CF3 -> 37308 | CG29: =CG3 -> 37309 | CH29: =CH3 -> 37310 | CI29: =CI3 -> 37311 | CJ29: =CJ3 -> 37312 | CK29: =CK3 -> 37313 | CL29: =CL3 -> 37314 | CM29: =CM3 -> 37315 | CN29: =CN3 -> 37316 | CO29: =CO3 -> 37317 | CP29: =CP3 -> 37318 | CQ29: =CQ3 -> 37319 | CR29: =CR3 -> 37320 | CS29: =CS3 -> 37321 | CT29: =CT3 -> 37322 | CU29: =CU3 -> 37323 | CV29: =CV3 -> 37324 | CW29: =CW3 -> 37325 | CX29: =CX3 -> 37326 | CY29: =CY3 -> 37327 | CZ29: =CZ3 -> 37328 | DA29: =DA3 -> 37329 | DB29: =DB3 -> 37330 | DC29: =DC3 -> 37331 | DD29: =DD3 -> 37332 | DE29: =DE3 -> 37333 | DF29: =DF3 -> 37334 | DG29: =DG3 -> 37335 | DH29: =DH3 -> 37336 | DI29: =DI3 -> 37337 | DJ29: =DJ3 -> 37338 | DK29: =DK3 -> 37339 | DL29: =DL3 -> 37340 | DM29: =DM3 -> 37341 | DN29: =DN3 -> 37342 | DO29: =DO3 -> 37343 | DP29: =DP3 -> 37344 | DQ29: =DQ3 -> 37345 | DR29: =DR3 -> 37346 | DS29: =DS3 -> 37347 | DT29: =DT3 -> 37348 | DU29: =DU3 -> 37349 | DV29: =DV3 -> 37350 | DW29: =DW3 -> 37351 | DX29: =DX3 -> 37352 | DY29: =DY3 -> 37353 | DZ29: =DZ3 -> 37354 | EA29: =EA3 -> 37355 | EB29: =EB3 -> 37356 | EC29: =EC3 -> 37357 | ED29: =ED3 -> 37358 | EE29: =EE3 -> 37359 | EF29: =EF3 -> 37360 | EG29: =EG3 -> 37361 | EH29: =EH3 -> 37362 | EI29: =EI3 -> 37363 | EJ29: =EJ3 -> 37364 | EK29: =EK3 -> 37365 | EL29: =EL3 -> 37366 | EM29: =EM3 -> 37367 | EN29: =EN3 -> 37368 | EO29: =EO3 -> 37369 | EP29: =EP3 -> 37370 | EQ29: =EQ3 -> 37371 | ER29: =ER3 -> 37372 | ES29: =ES3 -> 37373 | ET29: =ET3 -> 37374 | EU29: =EU3 -> 37375 | EV29: =EV3 -> 37376 | EW29: =EW3 -> 37377 | EX29: =EX3 -> 37378 | EY29: =EY3 -> 37379 | EZ29: =EZ3 -> 37380 | FA29: =FA3 -> 37381 | FB29: =FB3 -> 37382 | FC29: =FC3 -> 37383 | FD29: =FD3 -> 37384 | FE29: =FE3 -> 37385 | FF29: =FF3 -> 37386 | FG29: =FG3 -> 37387 | FH29: =FH3 -> 37388 | FI29: =FI3 -> 37389 | FJ29: =FJ3 -> 37390 | FK29: =FK3 -> 37391 | FL29: =FL3 -> 37392 | FM29: =FM3 -> 37393 | FN29: =FN3 -> 37394 | FO29: =FO3 -> 37395 | FP29: =FP3 -> 37396 | FQ29: =FQ3 -> 37397 | FR29: =FR3 -> 37398 | FS29: =FS3 -> 37399 | FT29: =FT3 -> 37400 | FU29: =FU3 -> 37401 | FV29: =FV3 -> 37402 | FW29: =FW3 -> 37403 | FX29: =FX3 -> 37404 | FY29: =FY3 -> 37405 | FZ29: =FZ3 -> 37406 | GA29: =GA3 -> 37407 | GB29: =GB3 -> 37408 | GC29: =GC3 -> 37409 | GD29: =GD3 -> 37410 | GE29: =GE3 -> 37411 | GF29: =GF3 -> 37412 | GG29: =GG3 -> 37413 | GH29: =GH3 -> 37414 | GI29: =GI3 -> 37415 | GJ29: =GJ3 -> 37416 | GK29: =GK3 -> 37417 | GL29: =GL3 -> 37418 | GM29: =GM3 -> 37419 | GN29: =GN3 -> 37420 | GO29: =GO3 -> 37421 | GP29: =GP3 -> 37422 | GQ29: =GQ3 -> 37423 | GR29: =GR3 -> 37424 | GS29: =GS3 -> 37425 | GT29: =GT3 -> 37426 | GU29: =GU3 -> 37427 | GV29: =GV3 -> 37428 | GW29: =GW3 -> 37429 | GX29: =GX3 -> 37430 | GY29: =GY3 -> 37431 | GZ29: =GZ3 -> 37432 | HA29: =HA3 -> 37433 | HB29: =HB3 -> 37434 | HC29: =HC3 -> 37435 | HD29: =HD3 -> 37436 | HE29: =HE3 -> 37437 | HF29: =HF3 -> 37438 | HG29: =HG3 -> 37439 | HH29: =HH3 -> 37440 | HI29: =HI3 -> 37441 | HJ29: =HJ3 -> 37442 | HK29: =HK3 -> 37443 | HL29: =HL3 -> 37444 | HM29: =HM3 -> 37445 | HN29: =HN3 -> 37446 | HO29: =HO3 -> 37447 | HP29: =HP3 -> 37448 | HQ29: =HQ3 -> 37449 | HR29: =HR3 -> 37450 | HS29: =HS3 -> 37451 | HT29: =HT3 -> 37452 | HU29: =HU3 -> 37453 | HV29: =HV3 -> 37454 | HW29: =HW3 -> 37455 | HX29: =HX3 -> 37456 | HY29: =HY3 -> 37457 | HZ29: =HZ3 -> 37458 | IA29: =IA3 -> 37459 | IB29: =IB3 -> 37460 | IC29: =IC3 -> 37461 | ID29: =ID3 -> 37462 | IE29: =IE3 -> 37463 | IF29: =IF3 -> 37464 | IG29: =IG3 -> 37465 | IH29: =IH3 -> 37466 | II29: =II3 -> 37467 | IJ29: =IJ3 -> 37468 | IK29: =IK3 -> 37469 | IL29: =IL3 -> 37470
A31: # of Drivers Budgeted | AG31: 4 | AH31: 4 | AI31: 4 | AJ31: 4 | AK31: 4 | AL31: 4 | AM31: 4 | AN31: 4 | AO31: 4 | AP31: 4 | AQ31: 4 | AR31: 4 | AS31: 4 | AT31: 4 | AU31: 4 | AV31: 4 | AW31: 4 | AX31: 4 | AY31: 4 | AZ31: 4 | BA31: 4 | BB31: 4 | BC31: 4 | BD31: 4 | BE31: 4 | BF31: 4 | BG31: 4 | BH31: 4 | BI31: 4 | BJ31: 4 | BK31: 4 | BL31: 4 | BM31: 4 | BN31: 4 | BO31: 4 | BP31: 4 | BQ31: 4 | BR31: 4 | BS31: 4 | BT31: 4 | BU31: 4 | BV31: 4 | BW31: 4 | BX31: 4 | BY31: 4 | BZ31: 4 | CA31: 4 | CB31: 4 | CC31: 4 | CD31: 4 | CE31: 4 | CF31: 4 | CG31: 4 | CH31: 4 | CI31: 4 | CJ31: 4 | CK31: 4 | CL31: 4 | CM31: 4 | CN31: 4 | CO31: 4 | CP31: 4 | CQ31: 4 | CR31: 4 | CS31: 4 | CT31: 4 | CU31: 4 | CV31: 4 | CW31: 4 | CX31: 4 | CY31: 4 | CZ31: 4 | DA31: 4 | DB31: 4 | DC31: 4 | DD31: 4 | DE31: 4 | DF31: 4 | DG31: 4 | DH31: 4 | DI31: 4 | DJ31: 4 | DK31: 4 | DL31: 4 | DM31: 4 | DN31: 4 | DO31: 4 | DP31: 4 | DQ31: 4 | DR31: 4 | DS31: 4 | DT31: 4 | DU31: 4 | DV31: 4 | DW31: 4 | DX31: 4 | DY31: 4 | DZ31: 4 | EA31: 4 | EB31: 4 | EC31: 4 | ED31: 4 | EE31: 4 | EF31: 4 | EG31: 4 | EH31: 4 | EI31: 4 | EJ31: 4 | EK31: 4 | EL31: 4 | EM31: 4 | EN31: 4 | EO31: 4 | EP31: 4 | EQ31: 4 | ER31: 4 | ES31: 4 | ET31: 4 | EU31: 4 | EV31: 4 | EW31: 1 | EX31: 1 | EY31: 1 | EZ31: 1 | FA31: 1 | FB31: 1 | FC31: 1 | FD31: 1 | FE31: 1 | FF31: 1 | FG31: 1 | FH31: 1 | FI31: 1 | FJ31: 1 | FK31: 1 | FL31: 1 | FM31: 1 | FN31: 1 | FO31: 1 | FP31: 1 | FQ31: 1 | FR31: 1 | FS31: 1 | FT31: 1 | FU31: 1 | FV31: 1 | FW31: 1 | FX31: 1 | FY31: 1 | FZ31: 1 | GA31: 1 | GB31: 1 | GC31: 1 | GD31: 1 | GE31: 1 | GF31: 1 | GG31: 1 | GH31: 1 | GI31: 1 | GJ31: 1 | GK31: 1 | GL31: 1 | GM31: 1 | GN31: 1 | GO31: 1 | GP31: 1 | GQ31: 1 | GR31: 1 | GS31: 1 | GT31: 1 | GU31: 1 | GV31: 1 | GW31: 1 | GX31: 1 | GY31: 1 | GZ31: 1 | HA31: 1 | HB31: 1 | HC31: 1 | HD31: 1 | HE31: 1 | HF31: 1 | HG31: 1 | HH31: 1 | HI31: 1 | HJ31: 1 | HK31: 1 | HL31: 1 | HM31: 1 | HN31: 1 | HO31: 1 | HP31: 1 | HQ31: 1 | HR31: 1 | HS31: 1 | HT31: 1 | HU31: 1 | HV31: 1 | HW31: 1 | HX31: 1 | HY31: 1 | HZ31: 1 | IA31: 1 | IB31: 1 | IC31: 1 | ID31: 1 | IE31: 1 | IF31: 1 | IG31: 1 | IH31: 1 | II31: 1 | IJ31: 1 | IK31: 1 | IL31: 1
A32: daily OT hours per driver | BK32: 2.00 | BL32: 2.00 | BM32: 2.00 | BN32: 2.00 | BO32: 2.00 | BP32: 2.00 | BQ32: 2.00 | BR32: 2.00 | BS32: 2.00 | BT32: 2.00 | BU32: 2.00 | BV32: 2.00 | BW32: 2.00 | BX32: 2.00 | BY32: 2.00 | BZ32: 2.00 | CA32: 2.00 | CB32: 2.00 | CC32: 2.00 | CD32: 2.00 | CE32: 2.00 | CF32: 2.00 | CG32: 2.00 | CH32: 2.00 | CI32: 2.00 | CJ32: 2.00 | CK32: 2.00 | CL32: 2.00 | CM32: 2.00 | CN32: 2.00 | CO32: 2.00 | CP32: 2.00 | CQ32: 2.00 | CR32: 2.00 | CS32: 2.00 | CT32: 2.00 | CU32: 2.00 | CV32: 2.00 | CW32: 2.00 | CX32: 2.00 | CY32: 2.00 | CZ32: 2.00 | DA32: 2.00 | DB32: 2.00 | DC32: 2.00 | DD32: 2.00 | DE32: 2.00 | DF32: 2.00 | DG32: 2.00 | DH32: 2.00 | DI32: 2.00 | DJ32: 2.00 | DK32: 2.00 | DL32: 2.00 | DM32: 2.00 | DN32: 2.00 | DO32: 2.00 | DP32: 2.00 | DQ32: 2.00 | DR32: 2.00 | DS32: 2.00 | DT32: 2.00 | DU32: 2.00 | DV32: 2.00 | DW32: 2.00 | DX32: 2.00 | DY32: 2.00 | DZ32: 2.00 | EA32: 2.00 | EB32: 2.00 | EC32: 2.00 | ED32: 2.00 | EE32: 2.00 | EF32: 2.00 | EG32: 2.00 | EH32: 2.00 | EI32: 2.00 | EJ32: 2.00 | EK32: 2.00 | EL32: 2.00 | EM32: 2.00 | EN32: 2.00 | EO32: 2.00 | EP32: 2.00 | EQ32: 2.00 | ER32: 2.00 | ES32: 2.00 | ET32: 2.00 | EU32: 2.00 | EV32: 2.00 | EW32: 2.00 | EX32: 2.00 | EY32: 2.00 | EZ32: 2.00 | FA32: 2.00 | FB32: 2.00 | FC32: 2.00 | FD32: 2.00 | FE32: 2.00 | FF32: 2.00 | FG32: 2.00 | FH32: 2.00 | FI32: 2.00 | FJ32: 2.00 | FK32: 2.00 | FL32: 2.00 | FM32: 2.00 | FN32: 2.00 | FO32: 2.00 | FP32: 2.00 | FQ32: 2.00 | FR32: 2.00 | FS32: 2.00 | FT32: 2.00 | FU32: 2.00 | FV32: 2.00 | FW32: 2.00 | FX32: 2.00 | FY32: 2.00 | FZ32: 2.00 | GA32: 2.00 | GB32: 2.00 | GC32: 2.00 | GD32: 2.00 | GE32: 2.00 | GF32: 2.00 | GG32: 2.00 | GH32: 2.00 | GI32: 2.00 | GJ32: 2.00 | GK32: 2.00 | GL32: 2.00 | GM32: 2.00 | GN32: 2.00 | GO32: 2.00 | GP32: 2.00 | GQ32: 2.00 | GR32: 2.00 | GS32: 2.00 | GT32: 2.00 | GU32: 2.00 | GV32: 2.00 | GW32: 2.00 | GX32: 2.00 | GY32: 2.00 | GZ32: 2.00 | HA32: 2.00 | HB32: 2.00 | HC32: 2.00 | HD32: 2.00 | HE32: 2.00 | HF32: 2.00 | HG32: 2.00 | HH32: 2.00 | HI32: 2.00 | HJ32: 2.00 | HK32: 2.00 | HL32: 2.00 | HM32: 2.00 | HN32: 2.00 | HO32: 2.00 | HP32: 2.00 | HQ32: 2.00 | HR32: 2.00 | HS32: 2.00 | HT32: 2.00 | HU32: 2.00 | HV32: 2.00 | HW32: 2.00 | HX32: 2.00 | HY32: 2.00 | HZ32: 2.00 | IA32: 2.00 | IB32: 2.00 | IC32: 2.00 | ID32: 2.00 | IE32: 2.00 | IF32: 2.00 | IG32: 2.00 | IH32: 2.00 | II32: 2.00 | IJ32: 2.00 | IK32: 2.00 | IL32: 2.00
A33: Budgeted OT Hours MTD | AG33: =IF(WEEKDAY(AG$29,2)<6,2*AG31,0)+IF(DAY(AG$29)>1,AF$33,0) -> 8.0 | AH33: =IF(WEEKDAY(AH$29,2)<6,2*AH31,0)+IF(DAY(AH$29)>1,AG$33,0) -> 16.0 | AI33: =IF(WEEKDAY(AI$29,2)<6,2*AI31,0)+IF(DAY(AI$29)>1,AH$33,0) -> 24.0 | AJ33: =IF(WEEKDAY(AJ$29,2)<6,2*AJ31,0)+IF(DAY(AJ$29)>1,AI$33,0) -> 32.0 | AK33: =IF(WEEKDAY(AK$29,2)<6,2*AK31,0)+IF(DAY(AK$29)>1,AJ$33,0) -> 32.0 | AL33: =IF(WEEKDAY(AL$29,2)<6,2*AL31,0)+IF(DAY(AL$29)>1,AK$33,0) -> 32.0 | AM33: =IF(WEEKDAY(AM$29,2)<6,2*AM31,0)+IF(DAY(AM$29)>1,AL$33,0) -> 40.0 | AN33: =IF(WEEKDAY(AN$29,2)<6,2*AN31,0)+IF(DAY(AN$29)>1,AM$33,0) -> 48.0 | AO33: =IF(WEEKDAY(AO$29,2)<6,2*AO31,0)+IF(DAY(AO$29)>1,AN$33,0) -> 56.0 | AP33: =IF(WEEKDAY(AP$29,2)<6,2*AP31,0)+IF(DAY(AP$29)>1,AO$33,0) -> 64.0 | AQ33: =IF(WEEKDAY(AQ$29,2)<6,2*AQ31,0)+IF(DAY(AQ$29)>1,AP$33,0) -> 72.0 | AR33: =IF(WEEKDAY(AR$29,2)<6,2*AR31,0)+IF(DAY(AR$29)>1,AQ$33,0) -> 72.0 | AS33: =IF(WEEKDAY(AS$29,2)<6,2*AS31,0)+IF(DAY(AS$29)>1,AR$33,0) -> 72.0 | AT33: =IF(WEEKDAY(AT$29,2)<6,2*AT31,0)+IF(DAY(AT$29)>1,AS$33,0) -> 80.0 | AU33: =IF(WEEKDAY(AU$29,2)<6,2*AU31,0)+IF(DAY(AU$29)>1,AT$33,0) -> 88.0 | AV33: =IF(WEEKDAY(AV$29,2)<6,2*AV31,0)+IF(DAY(AV$29)>1,AU$33,0) -> 96.0 | AW33: =IF(WEEKDAY(AW$29,2)<6,2*AW31,0)+IF(DAY(AW$29)>1,AV$33,0) -> 104.0 | AX33: =IF(WEEKDAY(AX$29,2)<6,2*AX31,0)+IF(DAY(AX$29)>1,AW$33,0) -> 112.0 | AY33: =IF(WEEKDAY(AY$29,2)<6,2*AY31,0)+IF(DAY(AY$29)>1,AX$33,0) -> 112.0 | AZ33: =IF(WEEKDAY(AZ$29,2)<6,2*AZ31,0)+IF(DAY(AZ$29)>1,AY$33,0) -> 112.0 | BA33: =IF(WEEKDAY(BA$29,2)<6,2*BA31,0)+IF(DAY(BA$29)>1,AZ$33,0) -> 120.0 | BB33: =IF(WEEKDAY(BB$29,2)<6,2*BB31,0)+IF(DAY(BB$29)>1,BA$33,0) -> 128.0 | BC33: =IF(WEEKDAY(BC$29,2)<6,2*BC31,0)+IF(DAY(BC$29)>1,BB$33,0) -> 136.0 | BD33: =IF(WEEKDAY(BD$29,2)<6,2*BD31,0)+IF(DAY(BD$29)>1,BC$33,0) -> 144.0 | BE33: =IF(WEEKDAY(BE$29,2)<6,2*BE31,0)+IF(DAY(BE$29)>1,BD$33,0) -> 152.0 | BF33: =IF(WEEKDAY(BF$29,2)<6,2*BF31,0)+IF(DAY(BF$29)>1,BE$33,0) -> 152.0 | BG33: =IF(WEEKDAY(BG$29,2)<6,2*BG31,0)+IF(DAY(BG$29)>1,BF$33,0) -> 152.0 | BH33: =IF(WEEKDAY(BH$29,2)<6,2*BH31,0)+IF(DAY(BH$29)>1,BG$33,0) -> 160.0 | BI33: =IF(WEEKDAY(BI$29,2)<6,2*BI31,0)+IF(DAY(BI$29)>1,BH$33,0) -> 168.0 | BJ33: =IF(WEEKDAY(BJ$29,2)<6,2*BJ31,0)+IF(DAY(BJ$29)>1,BI$33,0) -> 176.0 | BK33: =IF(WEEKDAY(BK$29,2)<6,2*BK31,0)+IF(DAY(BK$29)>1,BJ$33,0) -> 184.0 | BL33: =IF(OR(BL$2="sat",BL$2="sun"),0,BL31*BL32)+IF(DAY(BL$3)=1,0,BK33) -> 8.0 | BM33: =IF(OR(BM$2="sat",BM$2="sun"),0,BM31*BM32)+IF(DAY(BM$3)=1,0,BL33) -> 8.0 | BN33: =IF(OR(BN$2="sat",BN$2="sun"),0,BN31*BN32)+IF(DAY(BN$3)=1,0,BM33) -> 8.0 | BO33: =IF(OR(BO$2="sat",BO$2="sun"),0,BO31*BO32)+IF(DAY(BO$3)=1,0,BN33) -> 16.0 | BP33: =IF(OR(BP$2="sat",BP$2="sun"),0,BP31*BP32)+IF(DAY(BP$3)=1,0,BO33) -> 24.0 | BQ33: =IF(OR(BQ$2="sat",BQ$2="sun"),0,BQ31*BQ32)+IF(DAY(BQ$3)=1,0,BP33) -> 32.0 | BR33: =IF(OR(BR$2="sat",BR$2="sun"),0,BR31*BR32)+IF(DAY(BR$3)=1,0,BQ33) -> 40.0 | BS33: =IF(OR(BS$2="sat",BS$2="sun"),0,BS31*BS32)+IF(DAY(BS$3)=1,0,BR33) -> 48.0 | BT33: =IF(OR(BT$2="sat",BT$2="sun"),0,BT31*BT32)+IF(DAY(BT$3)=1,0,BS33) -> 48.0 | BU33: =IF(OR(BU$2="sat",BU$2="sun"),0,BU31*BU32)+IF(DAY(BU$3)=1,0,BT33) -> 48.0 | BV33: =IF(OR(BV$2="sat",BV$2="sun"),0,BV31*BV32)+IF(DAY(BV$3)=1,0,BU33) -> 56.0 | BW33: =IF(OR(BW$2="sat",BW$2="sun"),0,BW31*BW32)+IF(DAY(BW$3)=1,0,BV33) -> 64.0 | BX33: =IF(OR(BX$2="sat",BX$2="sun"),0,BX31*BX32)+IF(DAY(BX$3)=1,0,BW33) -> 72.0 | BY33: =IF(OR(BY$2="sat",BY$2="sun"),0,BY31*BY32)+IF(DAY(BY$3)=1,0,BX33) -> 80.0 | BZ33: =IF(OR(BZ$2="sat",BZ$2="sun"),0,BZ31*BZ32)+IF(DAY(BZ$3)=1,0,BY33) -> 88.0 | CA33: =IF(OR(CA$2="sat",CA$2="sun"),0,CA31*CA32)+IF(DAY(CA$3)=1,0,BZ33) -> 88.0 | CB33: =IF(OR(CB$2="sat",CB$2="sun"),0,CB31*CB32)+IF(DAY(CB$3)=1,0,CA33) -> 88.0 | CC33: =IF(OR(CC$2="sat",CC$2="sun"),0,CC31*CC32)+IF(DAY(CC$3)=1,0,CB33) -> 96.0 | CD33: =IF(OR(CD$2="sat",CD$2="sun"),0,CD31*CD32)+IF(DAY(CD$3)=1,0,CC33) -> 104.0 | CE33: =IF(OR(CE$2="sat",CE$2="sun"),0,CE31*CE32)+IF(DAY(CE$3)=1,0,CD33) -> 112.0 | CF33: =IF(OR(CF$2="sat",CF$2="sun"),0,CF31*CF32)+IF(DAY(CF$3)=1,0,CE33) -> 120.0 | CG33: =IF(OR(CG$2="sat",CG$2="sun"),0,CG31*CG32)+IF(DAY(CG$3)=1,0,CF33) -> 128.0 | CH33: =IF(OR(CH$2="sat",CH$2="sun"),0,CH31*CH32)+IF(DAY(CH$3)=1,0,CG33) -> 128.0 | CI33: =IF(OR(CI$2="sat",CI$2="sun"),0,CI31*CI32)+IF(DAY(CI$3)=1,0,CH33) -> 128.0 | CJ33: =IF(OR(CJ$2="sat",CJ$2="sun"),0,CJ31*CJ32)+IF(DAY(CJ$3)=1,0,CI33) -> 136.0 | CK33: =IF(OR(CK$2="sat",CK$2="sun"),0,CK31*CK32)+IF(DAY(CK$3)=1,0,CJ33) -> 144.0 | CL33: =IF(OR(CL$2="sat",CL$2="sun"),0,CL31*CL32)+IF(DAY(CL$3)=1,0,CK33) -> 152.0 | CM33: =IF(OR(CM$2="sat",CM$2="sun"),0,CM31*CM32)+IF(DAY(CM$3)=1,0,CL33) -> 160.0 | CN33: =IF(OR(CN$2="sat",CN$2="sun"),0,CN31*CN32)+IF(DAY(CN$3)=1,0,CM33) -> 8.0 | CO33: =IF(OR(CO$2="sat",CO$2="sun"),0,CO31*CO32)+IF(DAY(CO$3)=1,0,CN33) -> 8.0 | CP33: =IF(OR(CP$2="sat",CP$2="sun"),0,CP31*CP32)+IF(DAY(CP$3)=1,0,CO33) -> 8.0 | CQ33: =IF(OR(CQ$2="sat",CQ$2="sun"),0,CQ31*CQ32)+IF(DAY(CQ$3)=1,0,CP33) -> 16.0 | CR33: =IF(OR(CR$2="sat",CR$2="sun"),0,CR31*CR32)+IF(DAY(CR$3)=1,0,CQ33) -> 24.0 | CS33: =IF(OR(CS$2="sat",CS$2="sun"),0,CS31*CS32)+IF(DAY(CS$3)=1,0,CR33) -> 32.0 | CT33: =IF(OR(CT$2="sat",CT$2="sun"),0,CT31*CT32)+IF(DAY(CT$3)=1,0,CS33) -> 40.0 | CU33: =IF(OR(CU$2="sat",CU$2="sun"),0,CU31*CU32)+IF(DAY(CU$3)=1,0,CT33) -> 48.0 | CV33: =IF(OR(CV$2="sat",CV$2="sun"),0,CV31*CV32)+IF(DAY(CV$3)=1,0,CU33) -> 48.0 | CW33: =IF(OR(CW$2="sat",CW$2="sun"),0,CW31*CW32)+IF(DAY(CW$3)=1,0,CV33) -> 48.0 | CX33: =IF(OR(CX$2="sat",CX$2="sun"),0,CX31*CX32)+IF(DAY(CX$3)=1,0,CW33) -> 56.0 | CY33: =IF(OR(CY$2="sat",CY$2="sun"),0,CY31*CY32)+IF(DAY(CY$3)=1,0,CX33) -> 64.0 | CZ33: =IF(OR(CZ$2="sat",CZ$2="sun"),0,CZ31*CZ32)+IF(DAY(CZ$3)=1,0,CY33) -> 72.0 | DA33: =IF(OR(DA$2="sat",DA$2="sun"),0,DA31*DA32)+IF(DAY(DA$3)=1,0,CZ33) -> 80.0 | DB33: =IF(OR(DB$2="sat",DB$2="sun"),0,DB31*DB32)+IF(DAY(DB$3)=1,0,DA33) -> 88.0 | DC33: =IF(OR(DC$2="sat",DC$2="sun"),0,DC31*DC32)+IF(DAY(DC$3)=1,0,DB33) -> 88.0 | DD33: =IF(OR(DD$2="sat",DD$2="sun"),0,DD31*DD32)+IF(DAY(DD$3)=1,0,DC33) -> 88.0 | DE33: =IF(OR(DE$2="sat",DE$2="sun"),0,DE31*DE32)+IF(DAY(DE$3)=1,0,DD33) -> 96.0 | DF33: =IF(OR(DF$2="sat",DF$2="sun"),0,DF31*DF32)+IF(DAY(DF$3)=1,0,DE33) -> 104.0 | DG33: =IF(OR(DG$2="sat",DG$2="sun"),0,DG31*DG32)+IF(DAY(DG$3)=1,0,DF33) -> 112.0 | DH33: =IF(OR(DH$2="sat",DH$2="sun"),0,DH31*DH32)+IF(DAY(DH$3)=1,0,DG33) -> 120.0 | DI33: =IF(OR(DI$2="sat",DI$2="sun"),0,DI31*DI32)+IF(DAY(DI$3)=1,0,DH33) -> 128.0 | DJ33: =IF(OR(DJ$2="sat",DJ$2="sun"),0,DJ31*DJ32)+IF(DAY(DJ$3)=1,0,DI33) -> 128.0 | DK33: =IF(OR(DK$2="sat",DK$2="sun"),0,DK31*DK32)+IF(DAY(DK$3)=1,0,DJ33) -> 128.0 | DL33: =IF(OR(DL$2="sat",DL$2="sun"),0,DL31*DL32)+IF(DAY(DL$3)=1,0,DK33) -> 136.0 | DM33: =IF(OR(DM$2="sat",DM$2="sun"),0,DM31*DM32)+IF(DAY(DM$3)=1,0,DL33) -> 144.0 | DN33: =IF(OR(DN$2="sat",DN$2="sun"),0,DN31*DN32)+IF(DAY(DN$3)=1,0,DM33) -> 152.0 | DO33: =IF(OR(DO$2="sat",DO$2="sun"),0,DO31*DO32)+IF(DAY(DO$3)=1,0,DN33) -> 160.0 | DP33: =IF(OR(DP$2="sat",DP$2="sun"),0,DP31*DP32)+IF(DAY(DP$3)=1,0,DO33) -> 168.0 | DQ33: =IF(OR(DQ$2="sat",DQ$2="sun"),0,DQ31*DQ32)+IF(DAY(DQ$3)=1,0,DP33) -> 168.0 | DR33: =IF(OR(DR$2="sat",DR$2="sun"),0,DR31*DR32)+IF(DAY(DR$3)=1,0,DQ33) -> 168.0 | DS33: =IF(OR(DS$2="sat",DS$2="sun"),0,DS31*DS32)+IF(DAY(DS$3)=1,0,DR33) -> 8.0 | DT33: =IF(OR(DT$2="sat",DT$2="sun"),0,DT31*DT32)+IF(DAY(DT$3)=1,0,DS33) -> 16.0 | DU33: =IF(OR(DU$2="sat",DU$2="sun"),0,DU31*DU32)+IF(DAY(DU$3)=1,0,DT33) -> 24.0 | DV33: =IF(OR(DV$2="sat",DV$2="sun"),0,DV31*DV32)+IF(DAY(DV$3)=1,0,DU33) -> 32.0 | DW33: =IF(OR(DW$2="sat",DW$2="sun"),0,DW31*DW32)+IF(DAY(DW$3)=1,0,DV33) -> 40.0 | DX33: =IF(OR(DX$2="sat",DX$2="sun"),0,DX31*DX32)+IF(DAY(DX$3)=1,0,DW33) -> 40.0 | DY33: =IF(OR(DY$2="sat",DY$2="sun"),0,DY31*DY32)+IF(DAY(DY$3)=1,0,DX33) -> 40.0 | DZ33: =IF(OR(DZ$2="sat",DZ$2="sun"),0,DZ31*DZ32)+IF(DAY(DZ$3)=1,0,DY33) -> 48.0 | EA33: =IF(OR(EA$2="sat",EA$2="sun"),0,EA31*EA32)+IF(DAY(EA$3)=1,0,DZ33) -> 56.0 | EB33: =IF(OR(EB$2="sat",EB$2="sun"),0,EB31*EB32)+IF(DAY(EB$3)=1,0,EA33) -> 64.0 | EC33: =IF(OR(EC$2="sat",EC$2="sun"),0,EC31*EC32)+IF(DAY(EC$3)=1,0,EB33) -> 72.0 | ED33: =IF(OR(ED$2="sat",ED$2="sun"),0,ED31*ED32)+IF(DAY(ED$3)=1,0,EC33) -> 80.0 | EE33: =IF(OR(EE$2="sat",EE$2="sun"),0,EE31*EE32)+IF(DAY(EE$3)=1,0,ED33) -> 80.0 | EF33: =IF(OR(EF$2="sat",EF$2="sun"),0,EF31*EF32)+IF(DAY(EF$3)=1,0,EE33) -> 80.0 | EG33: =IF(OR(EG$2="sat",EG$2="sun"),0,EG31*EG32)+IF(DAY(EG$3)=1,0,EF33) -> 88.0 | EH33: =IF(OR(EH$2="sat",EH$2="sun"),0,EH31*EH32)+IF(DAY(EH$3)=1,0,EG33) -> 96.0 | EI33: =IF(OR(EI$2="sat",EI$2="sun"),0,EI31*EI32)+IF(DAY(EI$3)=1,0,EH33) -> 104.0 | EJ33: =IF(OR(EJ$2="sat",EJ$2="sun"),0,EJ31*EJ32)+IF(DAY(EJ$3)=1,0,EI33) -> 112.0 | EK33: =IF(OR(EK$2="sat",EK$2="sun"),0,EK31*EK32)+IF(DAY(EK$3)=1,0,EJ33) -> 120.0 | EL33: =IF(OR(EL$2="sat",EL$2="sun"),0,EL31*EL32)+IF(DAY(EL$3)=1,0,EK33) -> 120.0 | EM33: =IF(OR(EM$2="sat",EM$2="sun"),0,EM31*EM32)+IF(DAY(EM$3)=1,0,EL33) -> 120.0 | EN33: =IF(OR(EN$2="sat",EN$2="sun"),0,EN31*EN32)+IF(DAY(EN$3)=1,0,EM33) -> 128.0 | EO33: =IF(OR(EO$2="sat",EO$2="sun"),0,EO31*EO32)+IF(DAY(EO$3)=1,0,EN33) -> 136.0 | EP33: =IF(OR(EP$2="sat",EP$2="sun"),0,EP31*EP32)+IF(DAY(EP$3)=1,0,EO33) -> 144.0 | EQ33: =IF(OR(EQ$2="sat",EQ$2="sun"),0,EQ31*EQ32)+IF(DAY(EQ$3)=1,0,EP33) -> 152.0 | ER33: =IF(OR(ER$2="sat",ER$2="sun"),0,ER31*ER32)+IF(DAY(ER$3)=1,0,EQ33) -> 160.0 | ES33: =IF(OR(ES$2="sat",ES$2="sun"),0,ES31*ES32)+IF(DAY(ES$3)=1,0,ER33) -> 160.0 | ET33: =IF(OR(ET$2="sat",ET$2="sun"),0,ET31*ET32)+IF(DAY(ET$3)=1,0,ES33) -> 160.0 | EU33: =IF(OR(EU$2="sat",EU$2="sun"),0,EU31*EU32)+IF(DAY(EU$3)=1,0,ET33) -> 168.0 | EV33: =IF(OR(EV$2="sat",EV$2="sun"),0,EV31*EV32)+IF(DAY(EV$3)=1,0,EU33) -> 176.0 | EW33: =IF(OR(EW$2="sat",EW$2="sun"),0,EW31*EW32)+IF(DAY(EW$3)=1,0,EV33) -> 2.0 | EX33: =IF(OR(EX$2="sat",EX$2="sun"),0,EX31*EX32)+IF(DAY(EX$3)=1,0,EW33) -> 4.0 | EY33: =IF(OR(EY$2="sat",EY$2="sun"),0,EY31*EY32)+IF(DAY(EY$3)=1,0,EX33) -> 6.0 | EZ33: =IF(OR(EZ$2="sat",EZ$2="sun"),0,EZ31*EZ32)+IF(DAY(EZ$3)=1,0,EY33) -> 6.0 | FA33: =IF(OR(FA$2="sat",FA$2="sun"),0,FA31*FA32)+IF(DAY(FA$3)=1,0,EZ33) -> 6.0 | FB33: =IF(OR(FB$2="sat",FB$2="sun"),0,FB31*FB32)+IF(DAY(FB$3)=1,0,FA33) -> 8.0 | FC33: =IF(OR(FC$2="sat",FC$2="sun"),0,FC31*FC32)+IF(DAY(FC$3)=1,0,FB33) -> 10.0 | FD33: =IF(OR(FD$2="sat",FD$2="sun"),0,FD31*FD32)+IF(DAY(FD$3)=1,0,FC33) -> 12.0 | FE33: =IF(OR(FE$2="sat",FE$2="sun"),0,FE31*FE32)+IF(DAY(FE$3)=1,0,FD33) -> 14.0 | FF33: =IF(OR(FF$2="sat",FF$2="sun"),0,FF31*FF32)+IF(DAY(FF$3)=1,0,FE33) -> 16.0 | FG33: =IF(OR(FG$2="sat",FG$2="sun"),0,FG31*FG32)+IF(DAY(FG$3)=1,0,FF33) -> 16.0 | FH33: =IF(OR(FH$2="sat",FH$2="sun"),0,FH31*FH32)+IF(DAY(FH$3)=1,0,FG33) -> 16.0 | FI33: =IF(OR(FI$2="sat",FI$2="sun"),0,FI31*FI32)+IF(DAY(FI$3)=1,0,FH33) -> 18.0 | FJ33: =IF(OR(FJ$2="sat",FJ$2="sun"),0,FJ31*FJ32)+IF(DAY(FJ$3)=1,0,FI33) -> 20.0 | FK33: =IF(OR(FK$2="sat",FK$2="sun"),0,FK31*FK32)+IF(DAY(FK$3)=1,0,FJ33) -> 22.0 | FL33: =IF(OR(FL$2="sat",FL$2="sun"),0,FL31*FL32)+IF(DAY(FL$3)=1,0,FK33) -> 24.0 | FM33: =IF(OR(FM$2="sat",FM$2="sun"),0,FM31*FM32)+IF(DAY(FM$3)=1,0,FL33) -> 26.0 | FN33: =IF(OR(FN$2="sat",FN$2="sun"),0,FN31*FN32)+IF(DAY(FN$3)=1,0,FM33) -> 26.0 | FO33: =IF(OR(FO$2="sat",FO$2="sun"),0,FO31*FO32)+IF(DAY(FO$3)=1,0,FN33) -> 26.0 | FP33: =IF(OR(FP$2="sat",FP$2="sun"),0,FP31*FP32)+IF(DAY(FP$3)=1,0,FO33) -> 28.0 | FQ33: =IF(OR(FQ$2="sat",FQ$2="sun"),0,FQ31*FQ32)+IF(DAY(FQ$3)=1,0,FP33) -> 30.0 | FR33: =IF(OR(FR$2="sat",FR$2="sun"),0,FR31*FR32)+IF(DAY(FR$3)=1,0,FQ33) -> 32.0 | FS33: =IF(OR(FS$2="sat",FS$2="sun"),0,FS31*FS32)+IF(DAY(FS$3)=1,0,FR33) -> 34.0 | FT33: =IF(OR(FT$2="sat",FT$2="sun"),0,FT31*FT32)+IF(DAY(FT$3)=1,0,FS33) -> 36.0 | FU33: =IF(OR(FU$2="sat",FU$2="sun"),0,FU31*FU32)+IF(DAY(FU$3)=1,0,FT33) -> 36.0 | FV33: =IF(OR(FV$2="sat",FV$2="sun"),0,FV31*FV32)+IF(DAY(FV$3)=1,0,FU33) -> 36.0 | FW33: =IF(OR(FW$2="sat",FW$2="sun"),0,FW31*FW32)+IF(DAY(FW$3)=1,0,FV33) -> 38.0 | FX33: =IF(OR(FX$2="sat",FX$2="sun"),0,FX31*FX32)+IF(DAY(FX$3)=1,0,FW33) -> 40.0 | FY33: =IF(OR(FY$2="sat",FY$2="sun"),0,FY31*FY32)+IF(DAY(FY$3)=1,0,FX33) -> 42.0 | FZ33: =IF(OR(FZ$2="sat",FZ$2="sun"),0,FZ31*FZ32)+IF(DAY(FZ$3)=1,0,FY33) -> 44.0 | GA33: =IF(OR(GA$2="sat",GA$2="sun"),0,GA31*GA32)+IF(DAY(GA$3)=1,0,FZ33) -> 46.0 | GB33: =IF(OR(GB$2="sat",GB$2="sun"),0,GB31*GB32)+IF(DAY(GB$3)=1,0,GA33) -> 0.0 | GC33: =IF(OR(GC$2="sat",GC$2="sun"),0,GC31*GC32)+IF(DAY(GC$3)=1,0,GB33) -> 0.0 | GD33: =IF(OR(GD$2="sat",GD$2="sun"),0,GD31*GD32)+IF(DAY(GD$3)=1,0,GC33) -> 2.0 | GE33: =IF(OR(GE$2="sat",GE$2="sun"),0,GE31*GE32)+IF(DAY(GE$3)=1,0,GD33) -> 4.0 | GF33: =IF(OR(GF$2="sat",GF$2="sun"),0,GF31*GF32)+IF(DAY(GF$3)=1,0,GE33) -> 6.0 | GG33: =IF(OR(GG$2="sat",GG$2="sun"),0,GG31*GG32)+IF(DAY(GG$3)=1,0,GF33) -> 8.0 | GH33: =IF(OR(GH$2="sat",GH$2="sun"),0,GH31*GH32)+IF(DAY(GH$3)=1,0,GG33) -> 10.0 | GI33: =IF(OR(GI$2="sat",GI$2="sun"),0,GI31*GI32)+IF(DAY(GI$3)=1,0,GH33) -> 10.0 | GJ33: =IF(OR(GJ$2="sat",GJ$2="sun"),0,GJ31*GJ32)+IF(DAY(GJ$3)=1,0,GI33) -> 10.0 | GK33: =IF(OR(GK$2="sat",GK$2="sun"),0,GK31*GK32)+IF(DAY(GK$3)=1,0,GJ33) -> 12.0 | GL33: =IF(OR(GL$2="sat",GL$2="sun"),0,GL31*GL32)+IF(DAY(GL$3)=1,0,GK33) -> 14.0 | GM33: =IF(OR(GM$2="sat",GM$2="sun"),0,GM31*GM32)+IF(DAY(GM$3)=1,0,GL33) -> 16.0 | GN33: =IF(OR(GN$2="sat",GN$2="sun"),0,GN31*GN32)+IF(DAY(GN$3)=1,0,GM33) -> 18.0 | GO33: =IF(OR(GO$2="sat",GO$2="sun"),0,GO31*GO32)+IF(DAY(GO$3)=1,0,GN33) -> 20.0 | GP33: =IF(OR(GP$2="sat",GP$2="sun"),0,GP31*GP32)+IF(DAY(GP$3)=1,0,GO33) -> 20.0 | GQ33: =IF(OR(GQ$2="sat",GQ$2="sun"),0,GQ31*GQ32)+IF(DAY(GQ$3)=1,0,GP33) -> 20.0 | GR33: =IF(OR(GR$2="sat",GR$2="sun"),0,GR31*GR32)+IF(DAY(GR$3)=1,0,GQ33) -> 22.0 | GS33: =IF(OR(GS$2="sat",GS$2="sun"),0,GS31*GS32)+IF(DAY(GS$3)=1,0,GR33) -> 24.0 | GT33: =IF(OR(GT$2="sat",GT$2="sun"),0,GT31*GT32)+IF(DAY(GT$3)=1,0,GS33) -> 26.0 | GU33: =IF(OR(GU$2="sat",GU$2="sun"),0,GU31*GU32)+IF(DAY(GU$3)=1,0,GT33) -> 28.0 | GV33: =IF(OR(GV$2="sat",GV$2="sun"),0,GV31*GV32)+IF(DAY(GV$3)=1,0,GU33) -> 30.0 | GW33: =IF(OR(GW$2="sat",GW$2="sun"),0,GW31*GW32)+IF(DAY(GW$3)=1,0,GV33) -> 30.0 | GX33: =IF(OR(GX$2="sat",GX$2="sun"),0,GX31*GX32)+IF(DAY(GX$3)=1,0,GW33) -> 30.0 | GY33: =IF(OR(GY$2="sat",GY$2="sun"),0,GY31*GY32)+IF(DAY(GY$3)=1,0,GX33) -> 32.0 | GZ33: =IF(OR(GZ$2="sat",GZ$2="sun"),0,GZ31*GZ32)+IF(DAY(GZ$3)=1,0,GY33) -> 34.0 | HA33: =IF(OR(HA$2="sat",HA$2="sun"),0,HA31*HA32)+IF(DAY(HA$3)=1,0,GZ33) -> 36.0 | HB33: =IF(OR(HB$2="sat",HB$2="sun"),0,HB31*HB32)+IF(DAY(HB$3)=1,0,HA33) -> 38.0 | HC33: =IF(OR(HC$2="sat",HC$2="sun"),0,HC31*HC32)+IF(DAY(HC$3)=1,0,HB33) -> 40.0 | HD33: =IF(OR(HD$2="sat",HD$2="sun"),0,HD31*HD32)+IF(DAY(HD$3)=1,0,HC33) -> 40.0 | HE33: =IF(OR(HE$2="sat",HE$2="sun"),0,HE31*HE32)+IF(DAY(HE$3)=1,0,HD33) -> 40.0 | HF33: =IF(OR(HF$2="sat",HF$2="sun"),0,HF31*HF32)+IF(DAY(HF$3)=1,0,HE33) -> 2.0 | HG33: =IF(OR(HG$2="sat",HG$2="sun"),0,HG31*HG32)+IF(DAY(HG$3)=1,0,HF33) -> 4.0 | HH33: =IF(OR(HH$2="sat",HH$2="sun"),0,HH31*HH32)+IF(DAY(HH$3)=1,0,HG33) -> 6.0 | HI33: =IF(OR(HI$2="sat",HI$2="sun"),0,HI31*HI32)+IF(DAY(HI$3)=1,0,HH33) -> 8.0 | HJ33: =IF(OR(HJ$2="sat",HJ$2="sun"),0,HJ31*HJ32)+IF(DAY(HJ$3)=1,0,HI33) -> 10.0 | HK33: =IF(OR(HK$2="sat",HK$2="sun"),0,HK31*HK32)+IF(DAY(HK$3)=1,0,HJ33) -> 10.0 | HL33: =IF(OR(HL$2="sat",HL$2="sun"),0,HL31*HL32)+IF(DAY(HL$3)=1,0,HK33) -> 10.0 | HM33: =IF(OR(HM$2="sat",HM$2="sun"),0,HM31*HM32)+IF(DAY(HM$3)=1,0,HL33) -> 12.0 | HN33: =IF(OR(HN$2="sat",HN$2="sun"),0,HN31*HN32)+IF(DAY(HN$3)=1,0,HM33) -> 14.0 | HO33: =IF(OR(HO$2="sat",HO$2="sun"),0,HO31*HO32)+IF(DAY(HO$3)=1,0,HN33) -> 16.0 | HP33: =IF(OR(HP$2="sat",HP$2="sun"),0,HP31*HP32)+IF(DAY(HP$3)=1,0,HO33) -> 18.0 | HQ33: =IF(OR(HQ$2="sat",HQ$2="sun"),0,HQ31*HQ32)+IF(DAY(HQ$3)=1,0,HP33) -> 20.0 | HR33: =IF(OR(HR$2="sat",HR$2="sun"),0,HR31*HR32)+IF(DAY(HR$3)=1,0,HQ33) -> 20.0 | HS33: =IF(OR(HS$2="sat",HS$2="sun"),0,HS31*HS32)+IF(DAY(HS$3)=1,0,HR33) -> 20.0 | HT33: =IF(OR(HT$2="sat",HT$2="sun"),0,HT31*HT32)+IF(DAY(HT$3)=1,0,HS33) -> 22.0 | HU33: =IF(OR(HU$2="sat",HU$2="sun"),0,HU31*HU32)+IF(DAY(HU$3)=1,0,HT33) -> 24.0 | HV33: =IF(OR(HV$2="sat",HV$2="sun"),0,HV31*HV32)+IF(DAY(HV$3)=1,0,HU33) -> 26.0 | HW33: =IF(OR(HW$2="sat",HW$2="sun"),0,HW31*HW32)+IF(DAY(HW$3)=1,0,HV33) -> 28.0 | HX33: =IF(OR(HX$2="sat",HX$2="sun"),0,HX31*HX32)+IF(DAY(HX$3)=1,0,HW33) -> 30.0 | HY33: =IF(OR(HY$2="sat",HY$2="sun"),0,HY31*HY32)+IF(DAY(HY$3)=1,0,HX33) -> 30.0 | HZ33: =IF(OR(HZ$2="sat",HZ$2="sun"),0,HZ31*HZ32)+IF(DAY(HZ$3)=1,0,HY33) -> 30.0 | IA33: =IF(OR(IA$2="sat",IA$2="sun"),0,IA31*IA32)+IF(DAY(IA$3)=1,0,HZ33) -> 32.0 | IB33: =IF(OR(IB$2="sat",IB$2="sun"),0,IB31*IB32)+IF(DAY(IB$3)=1,0,IA33) -> 34.0 | IC33: =IF(OR(IC$2="sat",IC$2="sun"),0,IC31*IC32)+IF(DAY(IC$3)=1,0,IB33) -> 36.0 | ID33: =IF(OR(ID$2="sat",ID$2="sun"),0,ID31*ID32)+IF(DAY(ID$3)=1,0,IC33) -> 38.0 | IE33: =IF(OR(IE$2="sat",IE$2="sun"),0,IE31*IE32)+IF(DAY(IE$3)=1,0,ID33) -> 40.0 | IF33: =IF(OR(IF$2="sat",IF$2="sun"),0,IF31*IF32)+IF(DAY(IF$3)=1,0,IE33) -> 40.0 | IG33: =IF(OR(IG$2="sat",IG$2="sun"),0,IG31*IG32)+IF(DAY(IG$3)=1,0,IF33) -> 40.0 | IH33: =IF(OR(IH$2="sat",IH$2="sun"),0,IH31*IH32)+IF(DAY(IH$3)=1,0,IG33) -> 42.0 | II33: =IF(OR(II$2="sat",II$2="sun"),0,II31*II32)+IF(DAY(II$3)=1,0,IH33) -> 44.0 | IJ33: =IF(OR(IJ$2="sat",IJ$2="sun"),0,IJ31*IJ32)+IF(DAY(IJ$3)=1,0,II33) -> 46.0 | IK33: =IF(OR(IK$2="sat",IK$2="sun"),0,IK31*IK32)+IF(DAY(IK$3)=1,0,IJ33) -> 2.0 | IL33: =IF(OR(IL$2="sat",IL$2="sun"),0,IL31*IL32)+IF(DAY(IL$3)=1,0,IK33) -> 4.0
A35: Total OT Hours MTD | AG35: =IF(DAY(AG3)=1,AG36,AG36+AF35) -> 0.00 | AH35: =IF(DAY(AH3)=1,AH36,AH36+AG35) -> 0.00 | AI35: =IF(DAY(AI3)=1,AI36,AI36+AH35) -> 0.00 | AJ35: =IF(DAY(AJ3)=1,AJ36,AJ36+AI35) -> 0.00 | AK35: =IF(DAY(AK3)=1,AK36,AK36+AJ35) -> 0.00 | AL35: =IF(DAY(AL3)=1,AL36,AL36+AK35) -> 0.00 | AM35: =IF(DAY(AM3)=1,AM36,AM36+AL35) -> 00.82 | AN35: =IF(DAY(AN3)=1,AN36,AN36+AM35) -> 1.64 | AO35: =IF(DAY(AO3)=1,AO36,AO36+AN35) -> 2.46 | AP35: =IF(DAY(AP3)=1,AP36,AP36+AO35) -> 3.28 | AQ35: =IF(DAY(AQ3)=1,AQ36,AQ36+AP35) -> 4.10 | AR35: =IF(DAY(AR3)=1,AR36,AR36+AQ35) -> 4.10 | AS35: =IF(DAY(AS3)=1,AS36,AS36+AR35) -> 4.10 | AT35: =IF(DAY(AT3)=1,AT36,AT36+AS35) -> 9.44 | AU35: =IF(DAY(AU3)=1,AU36,AU36+AT35) -> 14.78 | AV35: =IF(DAY(AV3)=1,AV36,AV36+AU35) -> 20.12 | AW35: =IF(DAY(AW3)=1,AW36,AW36+AV35) -> 25.46 | AX35: =IF(DAY(AX3)=1,AX36,AX36+AW35) -> 30.80 | AY35: =IF(DAY(AY3)=1,AY36,AY36+AX35) -> 30.80 | AZ35: =IF(DAY(AZ3)=1,AZ36,AZ36+AY35) -> 30.80 | BA35: =IF(DAY(BA3)=1,BA36,BA36+AZ35) -> 34.96 | BB35: =IF(DAY(BB3)=1,BB36,BB36+BA35) -> 39.12 | BC35: =IF(DAY(BC3)=1,BC36,BC36+BB35) -> 43.28 | BD35: =IF(DAY(BD3)=1,BD36,BD36+BC35) -> 47.44 | BE35: =IF(DAY(BE3)=1,BE36,BE36+BD35) -> 51.60 | BF35: =IF(DAY(BF3)=1,BF36,BF36+BE35) -> 51.60 | BG35: =IF(DAY(BG3)=1,BG36,BG36+BF35) -> 51.60 | BH35: =IF(DAY(BH3)=1,BH36,BH36+BG35) -> 52.14 | BI35: =IF(DAY(BI3)=1,BI36,BI36+BH35) -> 52.68 | BJ35: =IF(DAY(BJ3)=1,BJ36,BJ36+BI35) -> 53.22 | BK35: =IF(DAY(BK3)=1,BK36,BK36+BJ35) -> 53.76 | BL35: =IF(DAY(BL3)=1,BL36,BL36+BK35) -> 00.54 | BM35: =IF(DAY(BM3)=1,BM36,BM36+BL35) -> 00.54 | BN35: =IF(DAY(BN3)=1,BN36,BN36+BM35) -> 00.54 | BO35: =IF(DAY(BO3)=1,BO36,BO36+BN35) -> 2.68 | BP35: =IF(DAY(BP3)=1,BP36,BP36+BO35) -> 4.82 | BQ35: =IF(DAY(BQ3)=1,BQ36,BQ36+BP35) -> 6.96 | BR35: =IF(DAY(BR3)=1,BR36,BR36+BQ35) -> 9.10 | BS35: =IF(DAY(BS3)=1,BS36,BS36+BR35) -> 11.24 | BT35: =IF(DAY(BT3)=1,BT36,BT36+BS35) -> 11.24 | BU35: =IF(DAY(BU3)=1,BU36,BU36+BT35) -> 11.24 | BV35: =IF(DAY(BV3)=1,BV36,BV36+BU35) -> 18.36 | BW35: =IF(DAY(BW3)=1,BW36,BW36+BV35) -> 25.48 | BX35: =IF(DAY(BX3)=1,BX36,BX36+BW35) -> 32.60 | BY35: =IF(DAY(BY3)=1,BY36,BY36+BX35) -> 39.72 | BZ35: =IF(DAY(BZ3)=1,BZ36,BZ36+BY35) -> 46.84 | CA35: =IF(DAY(CA3)=1,CA36,CA36+BZ35) -> 46.84 | CB35: =IF(DAY(CB3)=1,CB36,CB36+CA35) -> 46.84 | CC35: =IF(DAY(CC3)=1,CC36,CC36+CB35) -> 47.96 | CD35: =IF(DAY(CD3)=1,CD36,CD36+CC35) -> 49.08 | CE35: =IF(DAY(CE3)=1,CE36,CE36+CD35) -> 50.20 | CF35: =IF(DAY(CF3)=1,CF36,CF36+CE35) -> 51.32 | CG35: =IF(DAY(CG3)=1,CG36,CG36+CF35) -> 52.44 | CH35: =IF(DAY(CH3)=1,CH36,CH36+CG35) -> 52.44 | CI35: =IF(DAY(CI3)=1,CI36,CI36+CH35) -> 52.44 | CJ35: =IF(DAY(CJ3)=1,CJ36,CJ36+CI35) -> 52.88 | CK35: =IF(DAY(CK3)=1,CK36,CK36+CJ35) -> 53.32 | CL35: =IF(DAY(CL3)=1,CL36,CL36+CK35) -> 53.76 | CM35: =IF(DAY(CM3)=1,CM36,CM36+CL35) -> 54.20 | CN35: =IF(DAY(CN3)=1,CN36,CN36+CM35) -> 00.44 | CO35: =IF(DAY(CO3)=1,CO36,CO36+CN35) -> 00.44 | CP35: =IF(DAY(CP3)=1,CP36,CP36+CO35) -> 00.44 | CQ35: =IF(DAY(CQ3)=1,CQ36,CQ36+CP35) -> 3.58 | CR35: =IF(DAY(CR3)=1,CR36,CR36+CQ35) -> 6.72 | CS35: =IF(DAY(CS3)=1,CS36,CS36+CR35) -> 9.86 | CT35: =IF(DAY(CT3)=1,CT36,CT36+CS35) -> 13.00 | CU35: =IF(DAY(CU3)=1,CU36,CU36+CT35) -> 16.14 | CV35: =IF(DAY(CV3)=1,CV36,CV36+CU35) -> 16.14 | CW35: =IF(DAY(CW3)=1,CW36,CW36+CV35) -> 16.14 | CX35: =IF(DAY(CX3)=1,CX36,CX36+CW35) -> 17.64 | CY35: =IF(DAY(CY3)=1,CY36,CY36+CX35) -> 19.14 | CZ35: =IF(DAY(CZ3)=1,CZ36,CZ36+CY35) -> 20.64 | DA35: =IF(DAY(DA3)=1,DA36,DA36+CZ35) -> 22.14 | DB35: =IF(DAY(DB3)=1,DB36,DB36+DA35) -> 23.64 | DC35: =IF(DAY(DC3)=1,DC36,DC36+DB35) -> 23.64 | DD35: =IF(DAY(DD3)=1,DD36,DD36+DC35) -> 23.64 | DE35: =IF(DAY(DE3)=1,DE36,DE36+DD35) -> 27.06 | DF35: =IF(DAY(DF3)=1,DF36,DF36+DE35) -> 30.48 | DG35: =IF(DAY(DG3)=1,DG36,DG36+DF35) -> 33.90 | DH35: =IF(DAY(DH3)=1,DH36,DH36+DG35) -> 37.32 | DI35: =IF(DAY(DI3)=1,DI36,DI36+DH35) -> 40.74 | DJ35: =IF(DAY(DJ3)=1,DJ36,DJ36+DI35) -> 40.74 | DK35: =IF(DAY(DK3)=1,DK36,DK36+DJ35) -> 40.74 | DL35: =IF(DAY(DL3)=1,DL36,DL36+DK35) -> 41.78 | DM35: =IF(DAY(DM3)=1,DM36,DM36+DL35) -> 42.82 | DN35: =IF(DAY(DN3)=1,DN36,DN36+DM35) -> 43.86 | DO35: =IF(DAY(DO3)=1,DO36,DO36+DN35) -> 44.90 | DP35: =IF(DAY(DP3)=1,DP36,DP36+DO35) -> 45.94 | DQ35: =IF(DAY(DQ3)=1,DQ36,DQ36+DP35) -> 45.94 | DR35: =IF(DAY(DR3)=1,DR36,DR36+DQ35) -> 45.94 | DS35: =IF(DAY(DS3)=1,DS36,DS36+DR35) -> 2.40 | DT35: =IF(DAY(DT3)=1,DT36,DT36+DS35) -> 4.80 | DU35: =IF(DAY(DU3)=1,DU36,DU36+DT35) -> 7.20 | DV35: =IF(DAY(DV3)=1,DV36,DV36+DU35) -> 9.60 | DW35: =IF(DAY(DW3)=1,DW36,DW36+DV35) -> 12.00 | DX35: =IF(DAY(DX3)=1,DX36,DX36+DW35) -> 12.00 | DY35: =IF(DAY(DY3)=1,DY36,DY36+DX35) -> 12.00 | DZ35: =IF(DAY(DZ3)=1,DZ36,DZ36+DY35) -> 12.00 | EA35: =IF(DAY(EA3)=1,EA36,EA36+DZ35) -> 12.00 | EB35: =IF(DAY(EB3)=1,EB36,EB36+EA35) -> 12.00 | EC35: =IF(DAY(EC3)=1,EC36,EC36+EB35) -> 12.00 | ED35: =IF(DAY(ED3)=1,ED36,ED36+EC35) -> 12.00 | EE35: =IF(DAY(EE3)=1,EE36,EE36+ED35) -> 12.00 | EF35: =IF(DAY(EF3)=1,EF36,EF36+EE35) -> 12.00 | EG35: =IF(DAY(EG3)=1,EG36,EG36+EF35) -> 12.00 | EH35: =IF(DAY(EH3)=1,EH36,EH36+EG35) -> 12.00 | EI35: =IF(DAY(EI3)=1,EI36,EI36+EH35) -> 12.00 | EJ35: =IF(DAY(EJ3)=1,EJ36,EJ36+EI35) -> 12.00 | EK35: =IF(DAY(EK3)=1,EK36,EK36+EJ35) -> 12.00 | EL35: =IF(DAY(EL3)=1,EL36,EL36+EK35) -> 12.00 | EM35: =IF(DAY(EM3)=1,EM36,EM36+EL35) -> 12.00 | EN35: =IF(DAY(EN3)=1,EN36,EN36+EM35) -> 12.00 | EO35: =IF(DAY(EO3)=1,EO36,EO36+EN35) -> 12.00 | EP35: =IF(DAY(EP3)=1,EP36,EP36+EO35) -> 12.00 | EQ35: =IF(DAY(EQ3)=1,EQ36,EQ36+EP35) -> 12.00 | ER35: =IF(DAY(ER3)=1,ER36,ER36+EQ35) -> 12.00 | ES35: =IF(DAY(ES3)=1,ES36,ES36+ER35) -> 12.00 | ET35: =IF(DAY(ET3)=1,ET36,ET36+ES35) -> 12.00 | EU35: =IF(DAY(EU3)=1,EU36,EU36+ET35) -> 12.00 | EV35: =IF(DAY(EV3)=1,EV36,EV36+EU35) -> 12.00 | EW35: =IF(DAY(EW3)=1,EW36,EW36+EV35) -> 0.00 | EX35: =IF(DAY(EX3)=1,EX36,EX36+EW35) -> 0.00 | EY35: =IF(DAY(EY3)=1,EY36,EY36+EX35) -> 0.00 | EZ35: =IF(DAY(EZ3)=1,EZ36,EZ36+EY35) -> 0.00 | FA35: =IF(DAY(FA3)=1,FA36,FA36+EZ35) -> 0.00 | FB35: =IF(DAY(FB3)=1,FB36,FB36+FA35) -> 0.00 | FC35: =IF(DAY(FC3)=1,FC36,FC36+FB35) -> 0.00 | FD35: =IF(DAY(FD3)=1,FD36,FD36+FC35) -> 0.00 | FE35: =IF(DAY(FE3)=1,FE36,FE36+FD35) -> 0.00 | FF35: =IF(DAY(FF3)=1,FF36,FF36+FE35) -> 0.00 | FG35: =IF(DAY(FG3)=1,FG36,FG36+FF35) -> 0.00 | FH35: =IF(DAY(FH3)=1,FH36,FH36+FG35) -> 0.00 | FI35: =IF(DAY(FI3)=1,FI36,FI36+FH35) -> 00.55 | FJ35: =IF(DAY(FJ3)=1,FJ36,FJ36+FI35) -> 1.10 | FK35: =IF(DAY(FK3)=1,FK36,FK36+FJ35) -> 1.65 | FL35: =IF(DAY(FL3)=1,FL36,FL36+FK35) -> 2.20 | FM35: =IF(DAY(FM3)=1,FM36,FM36+FL35) -> 2.75 | FN35: =IF(DAY(FN3)=1,FN36,FN36+FM35) -> 2.75 | FO35: =IF(DAY(FO3)=1,FO36,FO36+FN35) -> 2.75 | FP35: =IF(DAY(FP3)=1,FP36,FP36+FO35) -> 10.25 | FQ35: =IF(DAY(FQ3)=1,FQ36,FQ36+FP35) -> 17.75 | FR35: =IF(DAY(FR3)=1,FR36,FR36+FQ35) -> 25.25 | FS35: =IF(DAY(FS3)=1,FS36,FS36+FR35) -> 32.75 | FT35: =IF(DAY(FT3)=1,FT36,FT36+FS35) -> 40.25 | FU35: =IF(DAY(FU3)=1,FU36,FU36+FT35) -> 40.25 | FV35: =IF(DAY(FV3)=1,FV36,FV36+FU35) -> 40.25 | FW35: =IF(DAY(FW3)=1,FW36,FW36+FV35) -> 42.19 | FX35: =IF(DAY(FX3)=1,FX36,FX36+FW35) -> 44.13 | FY35: =IF(DAY(FY3)=1,FY36,FY36+FX35) -> 46.07 | FZ35: =IF(DAY(FZ3)=1,FZ36,FZ36+FY35) -> 48.01 | GA35: =IF(DAY(GA3)=1,GA36,GA36+FZ35) -> 49.95 | GB35: =IF(DAY(GB3)=1,GB36,GB36+GA35) -> 0.00 | GC35: =IF(DAY(GC3)=1,GC36,GC36+GB35) -> 0.00 | GD35: =IF(DAY(GD3)=1,GD36,GD36+GC35) -> 3.84 | GE35: =IF(DAY(GE3)=1,GE36,GE36+GD35) -> 7.68 | GF35: =IF(DAY(GF3)=1,GF36,GF36+GE35) -> 11.52 | GG35: =IF(DAY(GG3)=1,GG36,GG36+GF35) -> 15.36 | GH35: =IF(DAY(GH3)=1,GH36,GH36+GG35) -> 19.20 | GI35: =IF(DAY(GI3)=1,GI36,GI36+GH35) -> 19.20 | GJ35: =IF(DAY(GJ3)=1,GJ36,GJ36+GI35) -> 19.20 | GK35: =IF(DAY(GK3)=1,GK36,GK36+GJ35) -> 21.74 | GL35: =IF(DAY(GL3)=1,GL36,GL36+GK35) -> 24.28 | GM35: =IF(DAY(GM3)=1,GM36,GM36+GL35) -> 26.82 | GN35: =IF(DAY(GN3)=1,GN36,GN36+GM35) -> 29.36 | GO35: =IF(DAY(GO3)=1,GO36,GO36+GN35) -> 31.90 | GP35: =IF(DAY(GP3)=1,GP36,GP36+GO35) -> 31.90 | GQ35: =IF(DAY(GQ3)=1,GQ36,GQ36+GP35) -> 31.90 | GR35: =IF(DAY(GR3)=1,GR36,GR36+GQ35) -> 34.10 | GS35: =IF(DAY(GS3)=1,GS36,GS36+GR35) -> 36.30 | GT35: =IF(DAY(GT3)=1,GT36,GT36+GS35) -> 38.50 | GU35: =IF(DAY(GU3)=1,GU36,GU36+GT35) -> 40.70 | GV35: =IF(DAY(GV3)=1,GV36,GV36+GU35) -> 42.90 | GW35: =IF(DAY(GW3)=1,GW36,GW36+GV35) -> 42.90 | GX35: =IF(DAY(GX3)=1,GX36,GX36+GW35) -> 42.90 | GY35: =IF(DAY(GY3)=1,GY36,GY36+GX35) -> 47.20 | GZ35: =IF(DAY(GZ3)=1,GZ36,GZ36+GY35) -> 51.50 | HA35: =IF(DAY(HA3)=1,HA36,HA36+GZ35) -> 55.80 | HB35: =IF(DAY(HB3)=1,HB36,HB36+HA35) -> 60.10 | HC35: =IF(DAY(HC3)=1,HC36,HC36+HB35) -> 64.40 | HD35: =IF(DAY(HD3)=1,HD36,HD36+HC35) -> 64.40 | HE35: =IF(DAY(HE3)=1,HE36,HE36+HD35) -> 64.40 | HF35: =IF(DAY(HF3)=1,HF36,HF36+HE35) -> 00.9 | HG35: =IF(DAY(HG3)=1,HG36,HG36+HF35) -> 1.80 | HH35: =IF(DAY(HH3)=1,HH36,HH36+HG35) -> 2.70 | HI35: =IF(DAY(HI3)=1,HI36,HI36+HH35) -> 3.60 | HJ35: =IF(DAY(HJ3)=1,HJ36,HJ36+HI35) -> 4.50 | HK35: =IF(DAY(HK3)=1,HK36,HK36+HJ35) -> 4.50 | HL35: =IF(DAY(HL3)=1,HL36,HL36+HK35) -> 4.50 | HM35: =IF(DAY(HM3)=1,HM36,HM36+HL35) -> 4.50 | HN35: =IF(DAY(HN3)=1,HN36,HN36+HM35) -> 4.50 | HO35: =IF(DAY(HO3)=1,HO36,HO36+HN35) -> 4.50 | HP35: =IF(DAY(HP3)=1,HP36,HP36+HO35) -> 4.50 | HQ35: =IF(DAY(HQ3)=1,HQ36,HQ36+HP35) -> 4.50 | HR35: =IF(DAY(HR3)=1,HR36,HR36+HQ35) -> 4.50 | HS35: =IF(DAY(HS3)=1,HS36,HS36+HR35) -> 4.50 | HT35: =IF(DAY(HT3)=1,HT36,HT36+HS35) -> 4.50 | HU35: =IF(DAY(HU3)=1,HU36,HU36+HT35) -> 4.50 | HV35: =IF(DAY(HV3)=1,HV36,HV36+HU35) -> 4.50 | HW35: =IF(DAY(HW3)=1,HW36,HW36+HV35) -> 4.50 | HX35: =IF(DAY(HX3)=1,HX36,HX36+HW35) -> 4.50 | HY35: =IF(DAY(HY3)=1,HY36,HY36+HX35) -> 4.50 | HZ35: =IF(DAY(HZ3)=1,HZ36,HZ36+HY35) -> 4.50 | IA35: =IF(DAY(IA3)=1,IA36,IA36+HZ35) -> 4.50 | IB35: =IF(DAY(IB3)=1,IB36,IB36+IA35) -> 4.50 | IC35: =IF(DAY(IC3)=1,IC36,IC36+IB35) -> 4.50 | ID35: =IF(DAY(ID3)=1,ID36,ID36+IC35) -> 4.50 | IE35: =IF(DAY(IE3)=1,IE36,IE36+ID35) -> 4.50 | IF35: =IF(DAY(IF3)=1,IF36,IF36+IE35) -> 4.50 | IG35: =IF(DAY(IG3)=1,IG36,IG36+IF35) -> 4.50 | IH35: =IF(DAY(IH3)=1,IH36,IH36+IG35) -> 4.50 | II35: =IF(DAY(II3)=1,II36,II36+IH35) -> 4.50 | IJ35: =IF(DAY(IJ3)=1,IJ36,IJ36+II35) -> 4.50 | IK35: =IF(DAY(IK3)=1,IK36,IK36+IJ35) -> 0.00 | IL35: =IF(DAY(IL3)=1,IL36,IL36+IK35) -> 0.00
A36: Total OT Hours[2] | AG36: 0.00 | AH36: 0.00 | AI36: 0.00 | AJ36: 0.00 | AK36: 0.00 | AL36: 0.00 | AM36: 00.82 | AN36: 00.82 | AO36: 00.82 | AP36: 00.82 | AQ36: 00.82 | AR36: 0.00 | AS36: 0.00 | AT36: 5.34 | AU36: 5.34 | AV36: 5.34 | AW36: 5.34 | AX36: 5.34 | AY36: 0.00 | AZ36: 0.00 | BA36: 4.16 | BB36: 4.16 | BC36: 4.16 | BD36: 4.16 | BE36: 4.16 | BF36: 0.00 | BG36: 0.00 | BH36: 00.54 | BI36: 00.54 | BJ36: 00.54 | BK36: 00.54 | BL36: 00.54 | BM36: 0.00 | BN36: 0.00 | BO36: 2.14 | BP36: 2.14 | BQ36: 2.14 | BR36: 2.14 | BS36: 2.14 | BT36: 0.00 | BU36: 0.00 | BV36: 7.12 | BW36: 7.12 | BX36: 7.12 | BY36: 7.12 | BZ36: 7.12 | CA36: 0.00 | CB36: 0.00 | CC36: 1.12 | CD36: 1.12 | CE36: 1.12 | CF36: 1.12 | CG36: 1.12 | CH36: 0 | CI36: 0 | CJ36: 00.44 | CK36: 00.44 | CL36: 00.44 | CM36: 00.44 | CN36: 00.44 | CO36: 0 | CP36: 0 | CQ36: 3.14 | CR36: 3.14 | CS36: 3.14 | CT36: 3.14 | CU36: 3.14 | CV36: 0 | CW36: 0 | CX36: 1.5 | CY36: 1.5 | CZ36: 1.5 | DA36: 1.5 | DB36: 1.5 | DC36: 0 | DD36: 0 | DE36: 3.42 | DF36: 3.42 | DG36: 3.42 | DH36: 3.42 | DI36: 3.42 | DJ36: 0 | DK36: 0 | DL36: 1.04 | DM36: 1.04 | DN36: 1.04 | DO36: 1.04 | DP36: 1.04 | DQ36: 0 | DR36: 0 | DS36: 2.4 | DT36: 2.4 | DU36: 2.4 | DV36: 2.4 | DW36: 2.4 | DX36: 0 | DY36: 0 | DZ36: 0 | EA36: 0 | EB36: 0 | EC36: 0 | ED36: 0 | EE36: 0 | EF36: 0 | EG36: 0 | EH36: 0 | EI36: 0 | EJ36: 0 | EK36: 0 | EL36: 0 | EM36: 0 | EN36: 0 | EO36: 0 | EP36: 0 | EQ36: 0 | ER36: 0 | ES36: 0 | ET36: 0 | EU36: 0 | EV36: 0 | EW36: 0 | EX36: 0 | EY36: 0 | EZ36: 0 | FA36: 0 | FB36: 0 | FC36: 0 | FD36: 0 | FE36: 0 | FF36: 0 | FG36: 0 | FH36: 0 | FI36: 00.55 | FJ36: 00.55 | FK36: 00.55 | FL36: 00.55 | FM36: 00.55 | FN36: 0 | FO36: 0 | FP36: 7.5 | FQ36: 7.5 | FR36: 7.5 | FS36: 7.5 | FT36: 7.5 | FU36: 0 | FV36: 0 | FW36: 1.94 | FX36: 1.94 | FY36: 1.94 | FZ36: 1.94 | GA36: 1.94 | GB36: 0 | GC36: 0 | GD36: 3.84 | GE36: 3.84 | GF36: 3.84 | GG36: 3.84 | GH36: 3.84 | GI36: 0 | GJ36: 0 | GK36: 2.54 | GL36: 2.54 | GM36: 2.54 | GN36: 2.54 | GO36: 2.54 | GP36: 0 | GQ36: 0 | GR36: 2.2 | GS36: 2.2 | GT36: 2.2 | GU36: 2.2 | GV36: 2.2 | GW36: 0 | GX36: 0 | GY36: 4.3 | GZ36: 4.3 | HA36: 4.3 | HB36: 4.3 | HC36: 4.3 | HD36: 0 | HE36: 0 | HF36: 00.9 | HG36: 00.9 | HH36: 00.9 | HI36: 00.9 | HJ36: 00.9 | HK36: 0 | HL36: 0 | HM36: 0 | HN36: 0 | HO36: 0 | HP36: 0 | HQ36: 0 | HR36: 0 | HS36: 0 | HT36: 0 | HU36: 0 | HV36: 0 | HW36: 0 | HX36: 0 | HY36: 0 | HZ36: 0 | IA36: 0 | IB36: 0 | IC36: 0 | ID36: 0 | IE36: 0 | IF36: 0 | IG36: 0 | IH36: 0 | II36: 0 | IJ36: 0 | IK36: 0 | IL36: 0
A37: Average Weekly OT Hours per Driver | AG37: =IF(AG1="Fri",AG36*5/AG31,"") ->  | AH37: =IF(AH1="Fri",AH36*5/AH31,"") ->  | AI37: =IF(AI1="Fri",AI36*5/AI31,"") ->  | AJ37: =IF(AJ1="Fri",AJ36*5/AJ31,"") ->  | AK37: =IF(AK1="Fri",AK36*5/AK31,"") ->  | AL37: =IF(AL1="Fri",AL36*5/AL31,"") ->  | AM37: =IF(AM1="Fri",AM36*5/AM31,"") ->  | AN37: =IF(AN1="Fri",AN36*5/AN31,"") ->  | AO37: =IF(AO1="Fri",AO36*5/AO31,"") ->  | AP37: =IF(AP1="Fri",AP36*5/AP31,"") ->  | AQ37: =IF(AQ1="Fri",AQ36*5/AQ31,"") ->  | AR37: =IF(AR1="Fri",AR36*5/AR31,"") ->  | AS37: =IF(AS1="Fri",AS36*5/AS31,"") ->  | AT37: =IF(AT1="Fri",AT36*5/AT31,"") ->  | AU37: =IF(AU1="Fri",AU36*5/AU31,"") ->  | AV37: =IF(AV1="Fri",AV36*5/AV31,"") ->  | AW37: =IF(AW1="Fri",AW36*5/AW31,"") ->  | AX37: =IF(AX1="Fri",AX36*5/AX31,"") ->  | AY37: =IF(AY1="Fri",AY36*5/AY31,"") ->  | AZ37: =IF(AZ1="Fri",AZ36*5/AZ31,"") ->  | BA37: =IF(BA1="Fri",BA36*5/BA31,"") ->  | BB37: =IF(BB1="Fri",BB36*5/BB31,"") ->  | BC37: =IF(BC1="Fri",BC36*5/BC31,"") ->  | BD37: =IF(BD1="Fri",BD36*5/BD31,"") ->  | BE37: =IF(BE1="Fri",BE36*5/BE31,"") ->  | BF37: =IF(BF1="Fri",BF36*5/BF31,"") ->  | BG37: =IF(BG1="Fri",BG36*5/BG31,"") ->  | BH37: =IF(BH1="Fri",BH36*5/BH31,"") ->  | BI37: =IF(BI1="Fri",BI36*5/BI31,"") ->  | BJ37: =IF(BJ1="Fri",BJ36*5/BJ31,"") ->  | BK37: =IF(BK1="Fri",BK36*5/BK31,"") ->  | BL37: =IF(BL2="Fri",BL36*5/BL31,"") -> 0.67500000000000004 | BM37: =IF(BM2="Fri",BM36*5/BM31,"") ->  | BN37: =IF(BN2="Fri",BN36*5/BN31,"") ->  | BO37: =IF(BO2="Fri",BO36*5/BO31,"") ->  | BP37: =IF(BP2="Fri",BP36*5/BP31,"") ->  | BQ37: =IF(BQ2="Fri",BQ36*5/BQ31,"") ->  | BR37: =IF(BR2="Fri",BR36*5/BR31,"") ->  | BS37: =IF(BS2="Fri",BS36*5/BS31,"") -> 2.6749999999999998 | BT37: =IF(BT2="Fri",BT36*5/BT31,"") ->  | BU37: =IF(BU2="Fri",BU36*5/BU31,"") ->  | BV37: =IF(BV2="Fri",BV36*5/BV31,"") ->  | BW37: =IF(BW2="Fri",BW36*5/BW31,"") ->  | BX37: =IF(BX2="Fri",BX36*5/BX31,"") ->  | BY37: =IF(BY2="Fri",BY36*5/BY31,"") ->  | BZ37: =IF(BZ2="Fri",BZ36*5/BZ31,"") -> 8.90 | CA37: =IF(CA2="Fri",CA36*5/CA31,"") ->  | CB37: =IF(CB2="Fri",CB36*5/CB31,"") ->  | CC37: =IF(CC2="Fri",CC36*5/CC31,"") ->  | CD37: =IF(CD2="Fri",CD36*5/CD31,"") ->  | CE37: =IF(CE2="Fri",CE36*5/CE31,"") ->  | CF37: =IF(CF2="Fri",CF36*5/CF31,"") ->  | CG37: =IF(CG2="Fri",CG36*5/CG31,"") -> 1.40 | CH37: =IF(CH2="Fri",CH36*5/CH31,"") ->  | CI37: =IF(CI2="Fri",CI36*5/CI31,"") ->  | CJ37: =IF(CJ2="Fri",CJ36*5/CJ31,"") ->  | CK37: =IF(CK2="Fri",CK36*5/CK31,"") ->  | CL37: =IF(CL2="Fri",CL36*5/CL31,"") ->  | CM37: =IF(CM2="Fri",CM36*5/CM31,"") ->  | CN37: =IF(CN2="Fri",CN36*5/CN31,"") -> 00.55 | CO37: =IF(CO2="Fri",CO36*5/CO31,"") ->  | CP37: =IF(CP2="Fri",CP36*5/CP31,"") ->  | CQ37: =IF(CQ2="Fri",CQ36*5/CQ31,"") ->  | CR37: =IF(CR2="Fri",CR36*5/CR31,"") ->  | CS37: =IF(CS2="Fri",CS36*5/CS31,"") ->  | CT37: =IF(CT2="Fri",CT36*5/CT31,"") ->  | CU37: =IF(CU2="Fri",CU36*5/CU31,"") -> 3.9249999999999998 | CV37: =IF(CV2="Fri",CV36*5/CV31,"") ->  | CW37: =IF(CW2="Fri",CW36*5/CW31,"") ->  | CX37: =IF(CX2="Fri",CX36*5/CX31,"") ->  | CY37: =IF(CY2="Fri",CY36*5/CY31,"") ->  | CZ37: =IF(CZ2="Fri",CZ36*5/CZ31,"") ->  | DA37: =IF(DA2="Fri",DA36*5/DA31,"") ->  | DB37: =IF(DB2="Fri",DB36*5/DB31,"") -> 1.875 | DC37: =IF(DC2="Fri",DC36*5/DC31,"") ->  | DD37: =IF(DD2="Fri",DD36*5/DD31,"") ->  | DE37: =IF(DE2="Fri",DE36*5/DE31,"") ->  | DF37: =IF(DF2="Fri",DF36*5/DF31,"") ->  | DG37: =IF(DG2="Fri",DG36*5/DG31,"") ->  | DH37: =IF(DH2="Fri",DH36*5/DH31,"") ->  | DI37: =IF(DI2="Fri",DI36*5/DI31,"") -> 4.2750000000000004 | DJ37: =IF(DJ2="Fri",DJ36*5/DJ31,"") ->  | DK37: =IF(DK2="Fri",DK36*5/DK31,"") ->  | DL37: =IF(DL2="Fri",DL36*5/DL31,"") ->  | DM37: =IF(DM2="Fri",DM36*5/DM31,"") ->  | DN37: =IF(DN2="Fri",DN36*5/DN31,"") ->  | DO37: =IF(DO2="Fri",DO36*5/DO31,"") ->  | DP37: =IF(DP2="Fri",DP36*5/DP31,"") -> 1.30 | DQ37: =IF(DQ2="Fri",DQ36*5/DQ31,"") ->  | DR37: =IF(DR2="Fri",DR36*5/DR31,"") ->  | DS37: =IF(DS2="Fri",DS36*5/DS31,"") ->  | DT37: =IF(DT2="Fri",DT36*5/DT31,"") ->  | DU37: =IF(DU2="Fri",DU36*5/DU31,"") ->  | DV37: =IF(DV2="Fri",DV36*5/DV31,"") ->  | DW37: =IF(DW2="Fri",DW36*5/DW31,"") -> 3.00 | DX37: =IF(DX2="Fri",DX36*5/DX31,"") ->  | DY37: =IF(DY2="Fri",DY36*5/DY31,"") ->  | DZ37: =IF(DZ2="Fri",DZ36*5/DZ31,"") ->  | EA37: =IF(EA2="Fri",EA36*5/EA31,"") ->  | EB37: =IF(EB2="Fri",EB36*5/EB31,"") ->  | EC37: =IF(EC2="Fri",EC36*5/EC31,"") ->  | ED37: =IF(ED2="Fri",ED36*5/ED31,"") -> 0.00 | EE37: =IF(EE2="Fri",EE36*5/EE31,"") ->  | EF37: =IF(EF2="Fri",EF36*5/EF31,"") ->  | EG37: =IF(EG2="Fri",EG36*5/EG31,"") ->  | EH37: =IF(EH2="Fri",EH36*5/EH31,"") ->  | EI37: =IF(EI2="Fri",EI36*5/EI31,"") ->  | EJ37: =IF(EJ2="Fri",EJ36*5/EJ31,"") ->  | EK37: =IF(EK2="Fri",EK36*5/EK31,"") -> 0.00 | EL37: =IF(EL2="Fri",EL36*5/EL31,"") ->  | EM37: =IF(EM2="Fri",EM36*5/EM31,"") ->  | EN37: =IF(EN2="Fri",EN36*5/EN31,"") ->  | EO37: =IF(EO2="Fri",EO36*5/EO31,"") ->  | EP37: =IF(EP2="Fri",EP36*5/EP31,"") ->  | EQ37: =IF(EQ2="Fri",EQ36*5/EQ31,"") ->  | ER37: =IF(ER2="Fri",ER36*5/ER31,"") -> 0.00 | ES37: =IF(ES2="Fri",ES36*5/ES31,"") ->  | ET37: =IF(ET2="Fri",ET36*5/ET31,"") ->  | EU37: =IF(EU2="Fri",EU36*5/EU31,"") ->  | EV37: =IF(EV2="Fri",EV36*5/EV31,"") ->  | EW37: =IF(EW2="Fri",EW36*5/EW31,"") ->  | EX37: =IF(EX2="Fri",EX36*5/EX31,"") ->  | EY37: =IF(EY2="Fri",EY36*5/EY31,"") -> 0.00 | EZ37: =IF(EZ2="Fri",EZ36*5/EZ31,"") ->  | FA37: =IF(FA2="Fri",FA36*5/FA31,"") ->  | FB37: =IF(FB2="Fri",FB36*5/FB31,"") ->  | FC37: =IF(FC2="Fri",FC36*5/FC31,"") ->  | FD37: =IF(FD2="Fri",FD36*5/FD31,"") ->  | FE37: =IF(FE2="Fri",FE36*5/FE31,"") ->  | FF37: =IF(FF2="Fri",FF36*5/FF31,"") -> 0.00 | FG37: =IF(FG2="Fri",FG36*5/FG31,"") ->  | FH37: =IF(FH2="Fri",FH36*5/FH31,"") ->  | FI37: =IF(FI2="Fri",FI36*5/FI31,"") ->  | FJ37: =IF(FJ2="Fri",FJ36*5/FJ31,"") ->  | FK37: =IF(FK2="Fri",FK36*5/FK31,"") ->  | FL37: =IF(FL2="Fri",FL36*5/FL31,"") ->  | FM37: =IF(FM2="Fri",FM36*5/FM31,"") -> 2.75 | FN37: =IF(FN2="Fri",FN36*5/FN31,"") ->  | FO37: =IF(FO2="Fri",FO36*5/FO31,"") ->  | FP37: =IF(FP2="Fri",FP36*5/FP31,"") ->  | FQ37: =IF(FQ2="Fri",FQ36*5/FQ31,"") ->  | FR37: =IF(FR2="Fri",FR36*5/FR31,"") ->  | FS37: =IF(FS2="Fri",FS36*5/FS31,"") ->  | FT37: =IF(FT2="Fri",FT36*5/FT31,"") -> 37.50 | FU37: =IF(FU2="Fri",FU36*5/FU31,"") ->  | FV37: =IF(FV2="Fri",FV36*5/FV31,"") ->  | FW37: =IF(FW2="Fri",FW36*5/FW31,"") ->  | FX37: =IF(FX2="Fri",FX36*5/FX31,"") ->  | FY37: =IF(FY2="Fri",FY36*5/FY31,"") ->  | FZ37: =IF(FZ2="Fri",FZ36*5/FZ31,"") ->  | GA37: =IF(GA2="Fri",GA36*5/GA31,"") -> 9.70 | GB37: =IF(GB2="Fri",GB36*5/GB31,"") ->  | GC37: =IF(GC2="Fri",GC36*5/GC31,"") ->  | GD37: =IF(GD2="Fri",GD36*5/GD31,"") ->  | GE37: =IF(GE2="Fri",GE36*5/GE31,"") ->  | GF37: =IF(GF2="Fri",GF36*5/GF31,"") ->  | GG37: =IF(GG2="Fri",GG36*5/GG31,"") ->  | GH37: =IF(GH2="Fri",GH36*5/GH31,"") -> 19.20 | GI37: =IF(GI2="Fri",GI36*5/GI31,"") ->  | GJ37: =IF(GJ2="Fri",GJ36*5/GJ31,"") ->  | GK37: =IF(GK2="Fri",GK36*5/GK31,"") ->  | GL37: =IF(GL2="Fri",GL36*5/GL31,"") ->  | GM37: =IF(GM2="Fri",GM36*5/GM31,"") ->  | GN37: =IF(GN2="Fri",GN36*5/GN31,"") ->  | GO37: =IF(GO2="Fri",GO36*5/GO31,"") -> 12.70 | GP37: =IF(GP2="Fri",GP36*5/GP31,"") ->  | GQ37: =IF(GQ2="Fri",GQ36*5/GQ31,"") ->  | GR37: =IF(GR2="Fri",GR36*5/GR31,"") ->  | GS37: =IF(GS2="Fri",GS36*5/GS31,"") ->  | GT37: =IF(GT2="Fri",GT36*5/GT31,"") ->  | GU37: =IF(GU2="Fri",GU36*5/GU31,"") ->  | GV37: =IF(GV2="Fri",GV36*5/GV31,"") -> 11.00 | GW37: =IF(GW2="Fri",GW36*5/GW31,"") ->  | GX37: =IF(GX2="Fri",GX36*5/GX31,"") ->  | GY37: =IF(GY2="Fri",GY36*5/GY31,"") ->  | GZ37: =IF(GZ2="Fri",GZ36*5/GZ31,"") ->  | HA37: =IF(HA2="Fri",HA36*5/HA31,"") ->  | HB37: =IF(HB2="Fri",HB36*5/HB31,"") ->  | HC37: =IF(HC2="Fri",HC36*5/HC31,"") -> 21.50 | HD37: =IF(HD2="Fri",HD36*5/HD31,"") ->  | HE37: =IF(HE2="Fri",HE36*5/HE31,"") ->  | HF37: =IF(HF2="Fri",HF36*5/HF31,"") ->  | HG37: =IF(HG2="Fri",HG36*5/HG31,"") ->  | HH37: =IF(HH2="Fri",HH36*5/HH31,"") ->  | HI37: =IF(HI2="Fri",HI36*5/HI31,"") ->  | HJ37: =IF(HJ2="Fri",HJ36*5/HJ31,"") -> 4.50 | HK37: =IF(HK2="Fri",HK36*5/HK31,"") ->  | HL37: =IF(HL2="Fri",HL36*5/HL31,"") ->  | HM37: =IF(HM2="Fri",HM36*5/HM31,"") ->  | HN37: =IF(HN2="Fri",HN36*5/HN31,"") ->  | HO37: =IF(HO2="Fri",HO36*5/HO31,"") ->  | HP37: =IF(HP2="Fri",HP36*5/HP31,"") ->  | HQ37: =IF(HQ2="Fri",HQ36*5/HQ31,"") -> 0.00 | HR37: =IF(HR2="Fri",HR36*5/HR31,"") ->  | HS37: =IF(HS2="Fri",HS36*5/HS31,"") ->  | HT37: =IF(HT2="Fri",HT36*5/HT31,"") ->  | HU37: =IF(HU2="Fri",HU36*5/HU31,"") ->  | HV37: =IF(HV2="Fri",HV36*5/HV31,"") ->  | HW37: =IF(HW2="Fri",HW36*5/HW31,"") ->  | HX37: =IF(HX2="Fri",HX36*5/HX31,"") -> 0.00 | HY37: =IF(HY2="Fri",HY36*5/HY31,"") ->  | HZ37: =IF(HZ2="Fri",HZ36*5/HZ31,"") ->  | IA37: =IF(IA2="Fri",IA36*5/IA31,"") ->  | IB37: =IF(IB2="Fri",IB36*5/IB31,"") ->  | IC37: =IF(IC2="Fri",IC36*5/IC31,"") ->  | ID37: =IF(ID2="Fri",ID36*5/ID31,"") ->  | IE37: =IF(IE2="Fri",IE36*5/IE31,"") -> 0.00 | IF37: =IF(IF2="Fri",IF36*5/IF31,"") ->  | IG37: =IF(IG2="Fri",IG36*5/IG31,"") ->  | IH37: =IF(IH2="Fri",IH36*5/IH31,"") ->  | II37: =IF(II2="Fri",II36*5/II31,"") ->  | IJ37: =IF(IJ2="Fri",IJ36*5/IJ31,"") ->  | IK37: =IF(IK2="Fri",IK36*5/IK31,"") ->  | IL37: =IF(IL2="Fri",IL36*5/IL31,"") -> 0.00
A38: Average Monthly OT Hours per Driver | AG38: =AG35/AG31 -> 0.00 | AH38: =AH35/AH31 -> 0.00 | AI38: =AI35/AI31 -> 0.00 | AJ38: =AJ35/AJ31 -> 0.00 | AK38: =AK35/AK31 -> 0.00 | AL38: =AL35/AL31 -> 0.00 | AM38: =AM35/AM31 -> 0.20499999999999999 | AN38: =AN35/AN31 -> 00.41 | AO38: =AO35/AO31 -> 0.61499999999999999 | AP38: =AP35/AP31 -> 00.82 | AQ38: =AQ35/AQ31 -> 1.0249999999999999 | AR38: =AR35/AR31 -> 1.0249999999999999 | AS38: =AS35/AS31 -> 1.0249999999999999 | AT38: =AT35/AT31 -> 2.36 | AU38: =AU35/AU31 -> 3.6949999999999998 | AV38: =AV35/AV31 -> 5.03 | AW38: =AW35/AW31 -> 6.3650000000000002 | AX38: =AX35/AX31 -> 7.70 | AY38: =AY35/AY31 -> 7.70 | AZ38: =AZ35/AZ31 -> 7.70 | BA38: =BA35/BA31 -> 8.74 | BB38: =BB35/BB31 -> 9.78 | BC38: =BC35/BC31 -> 10.82 | BD38: =BD35/BD31 -> 11.86 | BE38: =BE35/BE31 -> 12.90 | BF38: =BF35/BF31 -> 12.90 | BG38: =BG35/BG31 -> 12.90 | BH38: =BH35/BH31 -> 13.035 | BI38: =BI35/BI31 -> 13.17 | BJ38: =BJ35/BJ31 -> 13.305 | BK38: =BK35/BK31 -> 13.44 | BL38: =BL35/BL31 -> 0.13500000000000001 | BM38: =BM35/BM31 -> 0.13500000000000001 | BN38: =BN35/BN31 -> 0.13500000000000001 | BO38: =BO35/BO31 -> 00.67 | BP38: =BP35/BP31 -> 1.2050000000000001 | BQ38: =BQ35/BQ31 -> 1.74 | BR38: =BR35/BR31 -> 2.2749999999999999 | BS38: =BS35/BS31 -> 2.81 | BT38: =BT35/BT31 -> 2.81 | BU38: =BU35/BU31 -> 2.81 | BV38: =BV35/BV31 -> 4.59 | BW38: =BW35/BW31 -> 6.37 | BX38: =BX35/BX31 -> 8.15 | BY38: =BY35/BY31 -> 9.93 | BZ38: =BZ35/BZ31 -> 11.71 | CA38: =CA35/CA31 -> 11.71 | CB38: =CB35/CB31 -> 11.71 | CC38: =CC35/CC31 -> 11.99 | CD38: =CD35/CD31 -> 12.27 | CE38: =CE35/CE31 -> 12.55 | CF38: =CF35/CF31 -> 12.83 | CG38: =CG35/CG31 -> 13.11 | CH38: =CH35/CH31 -> 13.11 | CI38: =CI35/CI31 -> 13.11 | CJ38: =CJ35/CJ31 -> 13.22 | CK38: =CK35/CK31 -> 13.33 | CL38: =CL35/CL31 -> 13.44 | CM38: =CM35/CM31 -> 13.55 | CN38: =CN35/CN31 -> 00.11 | CO38: =CO35/CO31 -> 00.11 | CP38: =CP35/CP31 -> 00.11 | CQ38: =CQ35/CQ31 -> 0.89500000000000002 | CR38: =CR35/CR31 -> 1.68 | CS38: =CS35/CS31 -> 2.4649999999999999 | CT38: =CT35/CT31 -> 3.25 | CU38: =CU35/CU31 -> 4.0350000000000001 | CV38: =CV35/CV31 -> 4.0350000000000001 | CW38: =CW35/CW31 -> 4.0350000000000001 | CX38: =CX35/CX31 -> 4.41 | CY38: =CY35/CY31 -> 4.7850000000000001 | CZ38: =CZ35/CZ31 -> 5.16 | DA38: =DA35/DA31 -> 5.5350000000000001 | DB38: =DB35/DB31 -> 5.91 | DC38: =DC35/DC31 -> 5.91 | DD38: =DD35/DD31 -> 5.91 | DE38: =DE35/DE31 -> 6.7649999999999997 | DF38: =DF35/DF31 -> 7.62 | DG38: =DG35/DG31 -> 8.4749999999999996 | DH38: =DH35/DH31 -> 9.33 | DI38: =DI35/DI31 -> 10.185 | DJ38: =DJ35/DJ31 -> 10.185 | DK38: =DK35/DK31 -> 10.185 | DL38: =DL35/DL31 -> 10.445 | DM38: =DM35/DM31 -> 10.705 | DN38: =DN35/DN31 -> 10.965 | DO38: =DO35/DO31 -> 11.225 | DP38: =DP35/DP31 -> 11.484999999999999 | DQ38: =DQ35/DQ31 -> 11.484999999999999 | DR38: =DR35/DR31 -> 11.484999999999999 | DS38: =DS35/DS31 -> 00.6 | DT38: =DT35/DT31 -> 1.20 | DU38: =DU35/DU31 -> 1.80 | DV38: =DV35/DV31 -> 2.40 | DW38: =DW35/DW31 -> 3.00 | DX38: =DX35/DX31 -> 3.00 | DY38: =DY35/DY31 -> 3.00 | DZ38: =DZ35/DZ31 -> 3.00 | EA38: =EA35/EA31 -> 3.00 | EB38: =EB35/EB31 -> 3.00 | EC38: =EC35/EC31 -> 3.00 | ED38: =ED35/ED31 -> 3.00 | EE38: =EE35/EE31 -> 3.00 | EF38: =EF35/EF31 -> 3.00 | EG38: =EG35/EG31 -> 3.00 | EH38: =EH35/EH31 -> 3.00 | EI38: =EI35/EI31 -> 3.00 | EJ38: =EJ35/EJ31 -> 3.00 | EK38: =EK35/EK31 -> 3.00 | EL38: =EL35/EL31 -> 3.00 | EM38: =EM35/EM31 -> 3.00 | EN38: =EN35/EN31 -> 3.00 | EO38: =EO35/EO31 -> 3.00 | EP38: =EP35/EP31 -> 3.00 | EQ38: =EQ35/EQ31 -> 3.00 | ER38: =ER35/ER31 -> 3.00 | ES38: =ES35/ES31 -> 3.00 | ET38: =ET35/ET31 -> 3.00 | EU38: =EU35/EU31 -> 3.00 | EV38: =EV35/EV31 -> 3.00 | EW38: =EW35/EW31 -> 0.00 | EX38: =EX35/EX31 -> 0.00 | EY38: =EY35/EY31 -> 0.00 | EZ38: =EZ35/EZ31 -> 0.00 | FA38: =FA35/FA31 -> 0.00 | FB38: =FB35/FB31 -> 0.00 | FC38: =FC35/FC31 -> 0.00 | FD38: =FD35/FD31 -> 0.00 | FE38: =FE35/FE31 -> 0.00 | FF38: =FF35/FF31 -> 0.00 | FG38: =FG35/FG31 -> 0.00 | FH38: =FH35/FH31 -> 0.00 | FI38: =FI35/FI31 -> 00.55 | FJ38: =FJ35/FJ31 -> 1.10 | FK38: =FK35/FK31 -> 1.65 | FL38: =FL35/FL31 -> 2.20 | FM38: =FM35/FM31 -> 2.75 | FN38: =FN35/FN31 -> 2.75 | FO38: =FO35/FO31 -> 2.75 | FP38: =FP35/FP31 -> 10.25 | FQ38: =FQ35/FQ31 -> 17.75 | FR38: =FR35/FR31 -> 25.25 | FS38: =FS35/FS31 -> 32.75 | FT38: =FT35/FT31 -> 40.25 | FU38: =FU35/FU31 -> 40.25 | FV38: =FV35/FV31 -> 40.25 | FW38: =FW35/FW31 -> 42.19 | FX38: =FX35/FX31 -> 44.13 | FY38: =FY35/FY31 -> 46.07 | FZ38: =FZ35/FZ31 -> 48.01 | GA38: =GA35/GA31 -> 49.95 | GB38: =GB35/GB31 -> 0.00 | GC38: =GC35/GC31 -> 0.00 | GD38: =GD35/GD31 -> 3.84 | GE38: =GE35/GE31 -> 7.68 | GF38: =GF35/GF31 -> 11.52 | GG38: =GG35/GG31 -> 15.36 | GH38: =GH35/GH31 -> 19.20 | GI38: =GI35/GI31 -> 19.20 | GJ38: =GJ35/GJ31 -> 19.20 | GK38: =GK35/GK31 -> 21.74 | GL38: =GL35/GL31 -> 24.28 | GM38: =GM35/GM31 -> 26.82 | GN38: =GN35/GN31 -> 29.36 | GO38: =GO35/GO31 -> 31.90 | GP38: =GP35/GP31 -> 31.90 | GQ38: =GQ35/GQ31 -> 31.90 | GR38: =GR35/GR31 -> 34.10 | GS38: =GS35/GS31 -> 36.30 | GT38: =GT35/GT31 -> 38.50 | GU38: =GU35/GU31 -> 40.70 | GV38: =GV35/GV31 -> 42.90 | GW38: =GW35/GW31 -> 42.90 | GX38: =GX35/GX31 -> 42.90 | GY38: =GY35/GY31 -> 47.20 | GZ38: =GZ35/GZ31 -> 51.50 | HA38: =HA35/HA31 -> 55.80 | HB38: =HB35/HB31 -> 60.10 | HC38: =HC35/HC31 -> 64.40 | HD38: =HD35/HD31 -> 64.40 | HE38: =HE35/HE31 -> 64.40 | HF38: =HF35/HF31 -> 00.9 | HG38: =HG35/HG31 -> 1.80 | HH38: =HH35/HH31 -> 2.70 | HI38: =HI35/HI31 -> 3.60 | HJ38: =HJ35/HJ31 -> 4.50 | HK38: =HK35/HK31 -> 4.50 | HL38: =HL35/HL31 -> 4.50 | HM38: =HM35/HM31 -> 4.50 | HN38: =HN35/HN31 -> 4.50 | HO38: =HO35/HO31 -> 4.50 | HP38: =HP35/HP31 -> 4.50 | HQ38: =HQ35/HQ31 -> 4.50 | HR38: =HR35/HR31 -> 4.50 | HS38: =HS35/HS31 -> 4.50 | HT38: =HT35/HT31 -> 4.50 | HU38: =HU35/HU31 -> 4.50 | HV38: =HV35/HV31 -> 4.50 | HW38: =HW35/HW31 -> 4.50 | HX38: =HX35/HX31 -> 4.50 | HY38: =HY35/HY31 -> 4.50 | HZ38: =HZ35/HZ31 -> 4.50 | IA38: =IA35/IA31 -> 4.50 | IB38: =IB35/IB31 -> 4.50 | IC38: =IC35/IC31 -> 4.50 | ID38: =ID35/ID31 -> 4.50 | IE38: =IE35/IE31 -> 4.50 | IF38: =IF35/IF31 -> 4.50 | IG38: =IG35/IG31 -> 4.50 | IH38: =IH35/IH31 -> 4.50 | II38: =II35/II31 -> 4.50 | IJ38: =IJ35/IJ31 -> 4.50 | IK38: =IK35/IK31 -> 0.00 | IL38: =IL35/IL31 -> 0.00
A41: Hours Balance MTD | AG41: =AG33-AG35 -> 8.0 | AH41: =AH33-AH35 -> 16.0 | AI41: =AI33-AI35 -> 24.0 | AJ41: =AJ33-AJ35 -> 32.0 | AK41: =AK33-AK35 -> 32.0 | AL41: =AL33-AL35 -> 32.0 | AM41: =AM33-AM35 -> 39.18 | AN41: =AN33-AN35 -> 46.36 | AO41: =AO33-AO35 -> 53.54 | AP41: =AP33-AP35 -> 60.72 | AQ41: =AQ33-AQ35 -> 67.9 | AR41: =AR33-AR35 -> 67.9 | AS41: =AS33-AS35 -> 67.9 | AT41: =AT33-AT35 -> 70.56 | AU41: =AU33-AU35 -> 73.22 | AV41: =AV33-AV35 -> 75.88 | AW41: =AW33-AW35 -> 78.54 | AX41: =AX33-AX35 -> 81.2 | AY41: =AY33-AY35 -> 81.2 | AZ41: =AZ33-AZ35 -> 81.2 | BA41: =BA33-BA35 -> 85.04 | BB41: =BB33-BB35 -> 88.88 | BC41: =BC33-BC35 -> 92.72 | BD41: =BD33-BD35 -> 96.56 | BE41: =BE33-BE35 -> 100.4 | BF41: =BF33-BF35 -> 100.4 | BG41: =BG33-BG35 -> 100.4 | BH41: =BH33-BH35 -> 107.86 | BI41: =BI33-BI35 -> 115.32 | BJ41: =BJ33-BJ35 -> 122.78 | BK41: =BK33-BK35 -> 130.24 | BL41: =BL33-BL35 -> 7.46 | BM41: =BM33-BM35 -> 7.46 | BN41: =BN33-BN35 -> 7.46 | BO41: =BO33-BO35 -> 13.32 | BP41: =BP33-BP35 -> 19.18 | BQ41: =BQ33-BQ35 -> 25.04 | BR41: =BR33-BR35 -> 30.9 | BS41: =BS33-BS35 -> 36.76 | BT41: =BT33-BT35 -> 36.76 | BU41: =BU33-BU35 -> 36.76 | BV41: =BV33-BV35 -> 37.64 | BW41: =BW33-BW35 -> 38.52 | BX41: =BX33-BX35 -> 39.4 | BY41: =BY33-BY35 -> 40.28 | BZ41: =BZ33-BZ35 -> 41.16 | CA41: =CA33-CA35 -> 41.16 | CB41: =CB33-CB35 -> 41.16 | CC41: =CC33-CC35 -> 48.04 | CD41: =CD33-CD35 -> 54.92 | CE41: =CE33-CE35 -> 61.8 | CF41: =CF33-CF35 -> 68.68 | CG41: =CG33-CG35 -> 75.56 | CH41: =CH33-CH35 -> 75.56 | CI41: =CI33-CI35 -> 75.56 | CJ41: =CJ33-CJ35 -> 83.12 | CK41: =CK33-CK35 -> 90.68 | CL41: =CL33-CL35 -> 98.24 | CM41: =CM33-CM35 -> 105.8 | CN41: =CN33-CN35 -> 7.56 | CO41: =CO33-CO35 -> 7.56 | CP41: =CP33-CP35 -> 7.56 | CQ41: =CQ33-CQ35 -> 12.42 | CR41: =CR33-CR35 -> 17.28 | CS41: =CS33-CS35 -> 22.14 | CT41: =CT33-CT35 -> 27.0 | CU41: =CU33-CU35 -> 31.86 | CV41: =CV33-CV35 -> 31.86 | CW41: =CW33-CW35 -> 31.86 | CX41: =CX33-CX35 -> 38.36 | CY41: =CY33-CY35 -> 44.86 | CZ41: =CZ33-CZ35 -> 51.36 | DA41: =DA33-DA35 -> 57.86 | DB41: =DB33-DB35 -> 64.36 | DC41: =DC33-DC35 -> 64.36 | DD41: =DD33-DD35 -> 64.36 | DE41: =DE33-DE35 -> 68.94 | DF41: =DF33-DF35 -> 73.52 | DG41: =DG33-DG35 -> 78.1 | DH41: =DH33-DH35 -> 82.68 | DI41: =DI33-DI35 -> 87.26 | DJ41: =DJ33-DJ35 -> 87.26 | DK41: =DK33-DK35 -> 87.26 | DL41: =DL33-DL35 -> 94.22 | DM41: =DM33-DM35 -> 101.18 | DN41: =DN33-DN35 -> 108.14 | DO41: =DO33-DO35 -> 115.1 | DP41: =DP33-DP35 -> 122.06 | DQ41: =DQ33-DQ35 -> 122.06 | DR41: =DR33-DR35 -> 122.06 | DS41: =DS33-DS35 -> 5.6 | DT41: =DT33-DT35 -> 11.2 | DU41: =DU33-DU35 -> 16.8 | DV41: =DV33-DV35 -> 22.4 | DW41: =DW33-DW35 -> 28.0 | DX41: =DX33-DX35 -> 28.0 | DY41: =DY33-DY35 -> 28.0 | DZ41: =DZ33-DZ35 -> 36.0 | EA41: =EA33-EA35 -> 44.0 | EB41: =EB33-EB35 -> 52.0 | EC41: =EC33-EC35 -> 60.0 | ED41: =ED33-ED35 -> 68.0 | EE41: =EE33-EE35 -> 68.0 | EF41: =EF33-EF35 -> 68.0 | EG41: =EG33-EG35 -> 76.0 | EH41: =EH33-EH35 -> 84.0 | EI41: =EI33-EI35 -> 92.0 | EJ41: =EJ33-EJ35 -> 100.0 | EK41: =EK33-EK35 -> 108.0 | EL41: =EL33-EL35 -> 108.0 | EM41: =EM33-EM35 -> 108.0 | EN41: =EN33-EN35 -> 116.0 | EO41: =EO33-EO35 -> 124.0 | EP41: =EP33-EP35 -> 132.0 | EQ41: =EQ33-EQ35 -> 140.0 | ER41: =ER33-ER35 -> 148.0 | ES41: =ES33-ES35 -> 148.0 | ET41: =ET33-ET35 -> 148.0 | EU41: =EU33-EU35 -> 156.0 | EV41: =EV33-EV35 -> 164.0 | EW41: =EW33-EW35 -> 2.0 | EX41: =EX33-EX35 -> 4.0 | EY41: =EY33-EY35 -> 6.0 | EZ41: =EZ33-EZ35 -> 6.0 | FA41: =FA33-FA35 -> 6.0 | FB41: =FB33-FB35 -> 8.0 | FC41: =FC33-FC35 -> 10.0 | FD41: =FD33-FD35 -> 12.0 | FE41: =FE33-FE35 -> 14.0 | FF41: =FF33-FF35 -> 16.0 | FG41: =FG33-FG35 -> 16.0 | FH41: =FH33-FH35 -> 16.0 | FI41: =FI33-FI35 -> 17.45 | FJ41: =FJ33-FJ35 -> 18.9 | FK41: =FK33-FK35 -> 20.35 | FL41: =FL33-FL35 -> 21.8 | FM41: =FM33-FM35 -> 23.25 | FN41: =FN33-FN35 -> 23.25 | FO41: =FO33-FO35 -> 23.25 | FP41: =FP33-FP35 -> 17.75 | FQ41: =FQ33-FQ35 -> 12.25 | FR41: =FR33-FR35 -> 6.75 | FS41: =FS33-FS35 -> 1.25 | FT41: =FT33-FT35 -> -4.25 | FU41: =FU33-FU35 -> -4.25 | FV41: =FV33-FV35 -> -4.25 | FW41: =FW33-FW35 -> -4.19 | FX41: =FX33-FX35 -> -4.13 | FY41: =FY33-FY35 -> -4.0699999999999932 | FZ41: =FZ33-FZ35 -> -4.0099999999999909 | GA41: =GA33-GA35 -> -3.9499999999999886 | GB41: =GB33-GB35 -> 0.0 | GC41: =GC33-GC35 -> 0.0 | GD41: =GD33-GD35 -> -1.84 | GE41: =GE33-GE35 -> -3.68 | GF41: =GF33-GF35 -> -5.52 | GG41: =GG33-GG35 -> -7.36 | GH41: =GH33-GH35 -> -9.2 | GI41: =GI33-GI35 -> -9.2 | GJ41: =GJ33-GJ35 -> -9.2 | GK41: =GK33-GK35 -> -9.74 | GL41: =GL33-GL35 -> -10.28 | GM41: =GM33-GM35 -> -10.82 | GN41: =GN33-GN35 -> -11.36 | GO41: =GO33-GO35 -> -11.9 | GP41: =GP33-GP35 -> -11.9 | GQ41: =GQ33-GQ35 -> -11.9 | GR41: =GR33-GR35 -> -12.1 | GS41: =GS33-GS35 -> -12.3 | GT41: =GT33-GT35 -> -12.5 | GU41: =GU33-GU35 -> -12.7 | GV41: =GV33-GV35 -> -12.9 | GW41: =GW33-GW35 -> -12.9 | GX41: =GX33-GX35 -> -12.9 | GY41: =GY33-GY35 -> -15.2 | GZ41: =GZ33-GZ35 -> -17.5 | HA41: =HA33-HA35 -> -19.8 | HB41: =HB33-HB35 -> -22.1 | HC41: =HC33-HC35 -> -24.4 | HD41: =HD33-HD35 -> -24.4 | HE41: =HE33-HE35 -> -24.4 | HF41: =HF33-HF35 -> 1.1 | HG41: =HG33-HG35 -> 2.2 | HH41: =HH33-HH35 -> 3.3 | HI41: =HI33-HI35 -> 4.4 | HJ41: =HJ33-HJ35 -> 5.5 | HK41: =HK33-HK35 -> 5.5 | HL41: =HL33-HL35 -> 5.5 | HM41: =HM33-HM35 -> 7.5 | HN41: =HN33-HN35 -> 9.5 | HO41: =HO33-HO35 -> 11.5 | HP41: =HP33-HP35 -> 13.5 | HQ41: =HQ33-HQ35 -> 15.5 | HR41: =HR33-HR35 -> 15.5 | HS41: =HS33-HS35 -> 15.5 | HT41: =HT33-HT35 -> 17.5 | HU41: =HU33-HU35 -> 19.5 | HV41: =HV33-HV35 -> 21.5 | HW41: =HW33-HW35 -> 23.5 | HX41: =HX33-HX35 -> 25.5 | HY41: =HY33-HY35 -> 25.5 | HZ41: =HZ33-HZ35 -> 25.5 | IA41: =IA33-IA35 -> 27.5 | IB41: =IB33-IB35 -> 29.5 | IC41: =IC33-IC35 -> 31.5 | ID41: =ID33-ID35 -> 33.5 | IE41: =IE33-IE35 -> 35.5 | IF41: =IF33-IF35 -> 35.5 | IG41: =IG33-IG35 -> 35.5 | IH41: =IH33-IH35 -> 37.5 | II41: =II33-II35 -> 39.5 | IJ41: =IJ33-IJ35 -> 41.5 | IK41: =IK33-IK35 -> 2.0 | IL41: =IL33-IL35 -> 4.0
A44: Color Key
A45: Data Required
A46: Less than 20 hours
A47: Negative hours
A48: Hours/Car < 8.5
A49: New Driver Needed