B2: T600 TYPE I | C2: T600 STANDARD
B3: T600 TYPE II | C3: T600 W/ HEADACHE RACK & SLIDLING 5TH WHEEL
B4: T600 TYPE III | C4: T600 SLEEPER
B5: T800 TYPE IV | C5: T800 SUPER LIGHT
B6: T800 TYPE V | C6: T800 SUPER LIGHT W/ LONG WHEEL BASE & HEADACHE RACK
B7: CAT TYPE VI | C7: CAT W/ HEADACHE RACK & LONG WHEEL BASE
B8: CAT TYPE VII | C8: CAT W/ HEADACHE RACK & LONG WHEEL BASE & SLIDING 5TH WHEEL
B10: TRUCKS EMPTY WEIGHT
B11: T600 TYPE I | C11: T600 TYPE II | D11: T600 TYPE III | E11: T800 TYPE IV | F11: T800 TYPE V | G11: CAT TYPE VI | H11: CAT TYPE VII
B12: 15720 | C12: 15880 | D12: 15880 | E12: 12180 | F12: 12540 | G12: 14600 | H12: 14820
B14: TRAILERS EMPTY WEIGHT
B15: 44 WIL | C15: 48 WIL | D15: 42 UTL | E15: 48UTL | F15: FRUHAUF | G15: GREATDANE | H15: MAX CAPACITY
B16: 8020 | C16: 9040 | D16: 9960 | E16: 10820 | F16: 12380 | G16: 16000 | H16: 80000
B18: COMBINED EMPTY WEIGHT
B19: T600 TYPE I | C19: T600 TYPE II | D19: T600 TYPE III | E19: T800 TYPE IV | F19: T800 TYPE V | G19: CAT TYPE VI | H19: CAT TYPE VII
A20: 44WIL | B20: =B16+B12 -> 23740 | C20: =C12+B16 -> 23900 | D20: =D12+B16 -> 23900 | E20: =E12+B16 -> 20200 | F20: =F12+B16 -> 20560 | G20: =G12+B16 -> 22620 | H20: =H12+B16 -> 22840
A21: 48WIL | B21: =B12+C16 -> 24760 | C21: =C12+C16 -> 24920 | D21: =D12+C16 -> 24920 | E21: =E12+C16 -> 21220 | F21: =F12+C16 -> 21580 | G21: =G12+C16 -> 23640 | H21: =H12+C16 -> 23860
A22: 42 UTL | B22: =B12+D16 -> 25680 | C22: =C12+D16 -> 25840 | D22: =D12+D16 -> 25840 | E22: =E12+D16 -> 22140 | F22: =F12+D16 -> 22500 | G22: =G12+D16 -> 24560 | H22: =H12+D16 -> 24780
A23: 48 UTL | B23: =B12+E16 -> 26540 | C23: =C12+E16 -> 26700 | D23: =D12+E16 -> 26700 | E23: =E12+E16 -> 23000 | F23: =F12+E16 -> 23360 | G23: =G12+E16 -> 25420 | H23: =H12+E16 -> 25640
A24: FRU | B24: =B12+F16 -> 28100 | C24: =C12+F16 -> 28260 | D24: =D12+F16 -> 28260 | E24: =E12+F16 -> 24560 | F24: =F12+F16 -> 24920 | G24: =G12+F16 -> 26980 | H24: =H12+F16 -> 27200
A25: GREAT | B25: =B12+G16 -> 31720 | C25: =C12+G16 -> 31880 | D25: =D12+G16 -> 31880 | E25: =E12+G16 -> 28180 | F25: =F12+G16 -> 28540 | G25: =G12+G16 -> 30600 | H25: =H12+G16 -> 30820
B27: MAX HAULING CAPACITY
B28: T600 TYPE I | C28: T600 TYPE II | D28: T600 TYPE III | E28: T800 TYPE IV | F28: T800 TYPE V | G28: CAT TYPE VI | H28: CAT TYPE VII
A29: 44WIL | B29: =$H$16-B20 -> 56260 | C29: =$H$16-C20 -> 56100 | D29: =$H$16-D20 -> 56100 | E29: =$H$16-E20 -> 59800 | F29: =$H$16-F20 -> 59440 | G29: =$H$16-G20 -> 57380 | H29: =$H$16-H20 -> 57160
A30: 48WIL | B30: =$H$16-B21 -> 55240 | C30: =$H$16-C21 -> 55080 | D30: =$H$16-D21 -> 55080 | E30: =$H$16-E21 -> 58780 | F30: =$H$16-F21 -> 58420 | G30: =$H$16-G21 -> 56360 | H30: =$H$16-H21 -> 56140
A31: 42 UTL | B31: =$H$16-B22 -> 54320 | C31: =$H$16-C22 -> 54160 | D31: =$H$16-D22 -> 54160 | E31: =$H$16-E22 -> 57860 | F31: =$H$16-F22 -> 57500 | G31: =$H$16-G22 -> 55440 | H31: =$H$16-H22 -> 55220
A32: 48 UTL | B32: =$H$16-B23 -> 53460 | C32: =$H$16-C23 -> 53300 | D32: =$H$16-D23 -> 53300 | E32: =$H$16-E23 -> 57000 | F32: =$H$16-F23 -> 56640 | G32: =$H$16-G23 -> 54580 | H32: =$H$16-H23 -> 54360
A33: FRU | B33: =$H$16-B24 -> 51900 | C33: =$H$16-C24 -> 51740 | D33: =$H$16-D24 -> 51740 | E33: =$H$16-E24 -> 55440 | F33: =$H$16-F24 -> 55080 | G33: =$H$16-G24 -> 53020 | H33: =$H$16-H24 -> 52800
A34: GREAT | B34: =$H$16-B25 -> 48280 | C34: =$H$16-C25 -> 48120 | D34: =$H$16-D25 -> 48120 | E34: =$H$16-E25 -> 51820 | F34: =$H$16-F25 -> 51460 | G34: =$H$16-G25 -> 49400 | H34: =$H$16-H25 -> 49180
B36: TRUCK LISTS BY TYPE
B37: T600 TYPE I | C37: T600 TYPE II | D37: T600 TYPE III | E37: T800 TYPE IV | F37: T800 TYPE V | G37: CAT TYPE VI | H37: CAT TYPE VII
B38: 355 | C38: 373 | D38: 388 | E38: 6022 | F38: 6009 | G38: 384 | H38: 387
B39: 361 | C39: 382 | D39: 389 | E39: 6015 | F39: 6010 | G39: 385
B40: 368 | C40: 374 | D40: 390 | E40: 6016 | F40: 6011 | G40: 386
B41: 369 | C41: 375 | E41: 6020 | F41: 6012
B42: 370 | C42: 379 | E42: 6021 | F42: 6013
C43: 380 | E43: 6004
C44: 376 | E44: 6005
C45: 367 | E45: 6003
C46: 383 | E46: 6019
C47: 381 | E47: 6017
C48: 378