A1: Goal Tons | B1: 35 | C1: 37.5 | D1: 40 | E1: 42.5
A2: Working Day
A3: 1 | B3: =B$1*1000/$A$23*$A3 -> 1666.6666666666667 | C3: =C$1*1000/$A$23*$A3 -> 1785.7142857142858 | D3: =D$1*1000/$A$23*$A3 -> 1904.7619047619048 | E3: =E$1*1000/$A$23*$A3 -> 2023.8095238095239
A4: 2 | B4: =B$1*1000/$A$23*$A4 -> 3333.3333333333335 | C4: =C$1*1000/$A$23*$A4 -> 3571.4285714285716 | D4: =D$1*1000/$A$23*$A4 -> 3809.5238095238096 | E4: =E$1*1000/$A$23*$A4 -> 4047.6190476190477
A5: 3 | B5: =B$1*1000/$A$23*$A5 -> 5000 | C5: =C$1*1000/$A$23*$A5 -> 5357.1428571428569 | D5: =D$1*1000/$A$23*$A5 -> 5714.2857142857147 | E5: =E$1*1000/$A$23*$A5 -> 6071.4285714285716
A6: 4 | B6: =B$1*1000/$A$23*$A6 -> 6666.666666666667 | C6: =C$1*1000/$A$23*$A6 -> 7142.8571428571431 | D6: =D$1*1000/$A$23*$A6 -> 7619.0476190476193 | E6: =E$1*1000/$A$23*$A6 -> 8095.2380952380954
A7: 5 | B7: =B$1*1000/$A$23*$A7 -> 8333.3333333333339 | C7: =C$1*1000/$A$23*$A7 -> 8928.5714285714294 | D7: =D$1*1000/$A$23*$A7 -> 9523.8095238095248 | E7: =E$1*1000/$A$23*$A7 -> 10119.047619047618
A8: 6 | B8: =B$1*1000/$A$23*$A8 -> 10000 | C8: =C$1*1000/$A$23*$A8 -> 10714.285714285714 | D8: =D$1*1000/$A$23*$A8 -> 11428.571428571429 | E8: =E$1*1000/$A$23*$A8 -> 12142.857142857143
A9: 7 | B9: =B$1*1000/$A$23*$A9 -> 11666.666666666668 | C9: =C$1*1000/$A$23*$A9 -> 12500 | D9: =D$1*1000/$A$23*$A9 -> 13333.333333333334 | E9: =E$1*1000/$A$23*$A9 -> 14166.666666666668
A10: 8 | B10: =B$1*1000/$A$23*$A10 -> 13333.333333333334 | C10: =C$1*1000/$A$23*$A10 -> 14285.714285714286 | D10: =D$1*1000/$A$23*$A10 -> 15238.095238095239 | E10: =E$1*1000/$A$23*$A10 -> 16190.476190476191
A11: 9 | B11: =B$1*1000/$A$23*$A11 -> 15000 | C11: =C$1*1000/$A$23*$A11 -> 16071.428571428572 | D11: =D$1*1000/$A$23*$A11 -> 17142.857142857145 | E11: =E$1*1000/$A$23*$A11 -> 18214.285714285714
A12: 10 | B12: =B$1*1000/$A$23*$A12 -> 16666.666666666668 | C12: =C$1*1000/$A$23*$A12 -> 17857.142857142859 | D12: =D$1*1000/$A$23*$A12 -> 19047.61904761905 | E12: =E$1*1000/$A$23*$A12 -> 20238.095238095237
A13: 11 | B13: =B$1*1000/$A$23*$A13 -> 18333.333333333336 | C13: =C$1*1000/$A$23*$A13 -> 19642.857142857145 | D13: =D$1*1000/$A$23*$A13 -> 20952.380952380954 | E13: =E$1*1000/$A$23*$A13 -> 22261.904761904763
A14: 12 | B14: =B$1*1000/$A$23*$A14 -> 20000 | C14: =C$1*1000/$A$23*$A14 -> 21428.571428571428 | D14: =D$1*1000/$A$23*$A14 -> 22857.142857142859 | E14: =E$1*1000/$A$23*$A14 -> 24285.714285714286
A15: 13 | B15: =B$1*1000/$A$23*$A15 -> 21666.666666666668 | C15: =C$1*1000/$A$23*$A15 -> 23214.285714285714 | D15: =D$1*1000/$A$23*$A15 -> 24761.904761904763 | E15: =E$1*1000/$A$23*$A15 -> 26309.523809523809
A16: 14 | B16: =B$1*1000/$A$23*$A16 -> 23333.333333333336 | C16: =C$1*1000/$A$23*$A16 -> 25000 | D16: =D$1*1000/$A$23*$A16 -> 26666.666666666668 | E16: =E$1*1000/$A$23*$A16 -> 28333.333333333336
A17: 15 | B17: =B$1*1000/$A$23*$A17 -> 25000 | C17: =C$1*1000/$A$23*$A17 -> 26785.714285714286 | D17: =D$1*1000/$A$23*$A17 -> 28571.428571428572 | E17: =E$1*1000/$A$23*$A17 -> 30357.142857142859
A18: 16 | B18: =B$1*1000/$A$23*$A18 -> 26666.666666666668 | C18: =C$1*1000/$A$23*$A18 -> 28571.428571428572 | D18: =D$1*1000/$A$23*$A18 -> 30476.190476190477 | E18: =E$1*1000/$A$23*$A18 -> 32380.952380952382
A19: 17 | B19: =B$1*1000/$A$23*$A19 -> 28333.333333333336 | C19: =C$1*1000/$A$23*$A19 -> 30357.142857142859 | D19: =D$1*1000/$A$23*$A19 -> 32380.952380952382 | E19: =E$1*1000/$A$23*$A19 -> 34404.761904761908
A20: 18 | B20: =B$1*1000/$A$23*$A20 -> 30000 | C20: =C$1*1000/$A$23*$A20 -> 32142.857142857145 | D20: =D$1*1000/$A$23*$A20 -> 34285.71428571429 | E20: =E$1*1000/$A$23*$A20 -> 36428.571428571428
A21: 19 | B21: =B$1*1000/$A$23*$A21 -> 31666.666666666668 | C21: =C$1*1000/$A$23*$A21 -> 33928.571428571428 | D21: =D$1*1000/$A$23*$A21 -> 36190.476190476191 | E21: =E$1*1000/$A$23*$A21 -> 38452.380952380954
A22: 20 | B22: =B$1*1000/$A$23*$A22 -> 33333.333333333336 | C22: =C$1*1000/$A$23*$A22 -> 35714.285714285717 | D22: =D$1*1000/$A$23*$A22 -> 38095.238095238099 | E22: =E$1*1000/$A$23*$A22 -> 40476.190476190473
A23: 21 | B23: =B$1*1000/$A$23*$A23 -> 35000 | C23: =C$1*1000/$A$23*$A23 -> 37500 | D23: =D$1*1000/$A$23*$A23 -> 40000 | E23: =E$1*1000/$A$23*$A23 -> 42500